key,source_text,target_text
item.alexsmobs.echolocator,Echolocator,エコロケーター
item.alexsmobs.elastic_tendon,Elastic Tendon,弾力のある腱
item.alexsmobs.emu_egg,Emu Egg,エミューの卵
item.alexsmobs.emu_feather,Emu Feather,エミューの羽
item.alexsmobs.emu_leggings,Outback Leggings,アウトバックレギンス
item.alexsmobs.emu_leggings.desc,Chance to avoid projectile damage,飛翔物からのダメージを防ぐことがある
item.alexsmobs.enderiophage_rocket,Enderiophage Rocket,エンダリオファージのロケット
item.alexsmobs.endolocator,Endolocator,エンドロケーター
item.alexsmobs.falconry_glove,Falconry Glove,鷹匠のグローブ
item.alexsmobs.falconry_glove_hand,This is not a Falconry Glove,鷹匠のグローブじゃないよ
item.alexsmobs.falconry_glove_inventory,This is not a Falconry Glove,鷹匠のグローブじゃないよ
item.alexsmobs.falconry_hood,Falconry Hood,鷹匠のフード
item.alexsmobs.farseer_arm,Farseer Arm,ファーシーアの腕
item.alexsmobs.fedora,Fedora,中折帽子
item.alexsmobs.fish_bones,Fish Bones,魚の骨
item.alexsmobs.fish_oil,Fish Oil,魚油
item.alexsmobs.flying_fish,Flying Fish,トビウオ
item.alexsmobs.flying_fish_boots,Flying Fish Boots,トビウオのブーツ
item.alexsmobs.flying_fish_boots.desc,Enables gliding by jumping out of water,水面から飛び出て滑空できる
item.alexsmobs.flying_fish_bucket,Bucket of Flying Fish,トビウオ入りバケツ
item.alexsmobs.frilled_shark_bucket,Bucket of Frilled Shark,ラブカ入りバケツ
item.alexsmobs.frontier_cap,Frontiersman's Cap,辺境開拓者の帽子
item.alexsmobs.frontier_cap.desc,+0.1 Speed while Sneaking,スニーク時移動速度+0.1
item.alexsmobs.froststalker_helmet,Froststalker Helmet,フロストストーカーのヘルメット
item.alexsmobs.froststalker_helmet.desc,Froststalkers follow the horn,フロストストーカーは角を追いかける
item.alexsmobs.froststalker_horn,Froststalker Horn,フロストストーカーの角
item.alexsmobs.gazelle_horn,Gazelle Horn,ガゼルの角
item.alexsmobs.ghostly_pickaxe,Ghostly Pickaxe,幽霊のツルハシ
item.alexsmobs.gongylidia,Gongylidia,アリタケ
item.alexsmobs.guster_eye,Guster Eye,ガスターの目
item.alexsmobs.halo,Halo,ハロ
item.alexsmobs.hemolymph_blaster,Hemolymph Blaster,血リンパブラスター
item.alexsmobs.hemolymph_sac,Hemolymph Sac,血リンパのう
item.alexsmobs.insulated_with_fur,Insulated from Snow,雪の冷たさから守る
item.alexsmobs.kangaroo_burger,Kangaroo Burger,カンガルーバーガー
item.alexsmobs.kangaroo_hide,Kangaroo Hide,カンガルーの皮
item.alexsmobs.kangaroo_meat,Kangaroo Meat,カンガルー肉
item.alexsmobs.komodo_spit,Komodo Dragon Spit,コモドドラゴンのつば
item.alexsmobs.komodo_spit_bottle,Komodo Dragon Spit Bottle,コモドドラゴンのつば入り瓶
item.alexsmobs.large_catfish_bucket,Bucket of Large Catfish,大きいナマズ入りバケツ
item.alexsmobs.lava_bottle,Lava Bottle,溶岩入り瓶
item.alexsmobs.leafcutter_ant_pupa,Leafcutter Ant Pupa,ハキリアリのさなぎ
item.alexsmobs.lobster_bucket,Bucket of Lobster,ロブスター入りバケツ
item.alexsmobs.lobster_tail,Lobster Tail,ロブスターの尻尾
item.alexsmobs.lost_tentacle,Lost Tentacle,失われた触手
item.alexsmobs.maggot,Maggot,ウジ
item.alexsmobs.maraca,Maraca,マラカス
item.alexsmobs.medium_catfish_bucket,Bucket of Medium Catfish,中くらいのナマズ入りバケツ
item.alexsmobs.mimic_octopus_bucket,Bucket of Mimic Octopus,ミミックオクトパス入りバケツ
item.alexsmobs.mimicream,Mimicream,ミミクリーム
item.alexsmobs.moose_antler,Moose Antler,ヘラジカの角
item.alexsmobs.moose_headgear,Antler Headdress,角の頭飾り
item.alexsmobs.moose_ribs,Raw Moose Ribs,生のヘラジカのリブ肉
item.alexsmobs.mosquito_larva,Crimson Mosquito Larva,真紅モスキートの幼虫
item.alexsmobs.mosquito_proboscis,Crimson Mosquito Proboscis,真紅モスキートの口吻
item.alexsmobs.mosquito_repellent_stew,Mosquito Repellent Stew,蚊よけシチュー
item.alexsmobs.mudskipper_bucket,Bucket of Mudskipper,トビハゼ入りバケツ
item.alexsmobs.mungal_spores,Mungal Spores,マンガル胞子
item.alexsmobs.music_disc_daze,Music Disc,レコード
item.alexsmobs.music_disc_thime,Music Disc,レコード
item.alexsmobs.mysterious_worm,Mysterious Worm,ミステリアスワーム
item.alexsmobs.novelty_hat,Novelty Hat,変わった帽子
item.alexsmobs.novelty_hat.desc,He was number one!,彼がナンバーワンだった！
item.alexsmobs.pigshoes,Ancient Hogshoes,古びたタスクリンの蹄鉄
item.alexsmobs.platypus_bucket,Bucket of Platypus,カモノハシ入りバケツ
item.alexsmobs.pocket_sand,Pocket of Sand,ポケット入りの砂
item.alexsmobs.poison_bottle,Poisonous Essence,毒入り瓶
item.alexsmobs.potted_flutter,Potted Flutter,植えられたフラッター
item.alexsmobs.pupfish_locator,Strange Fish Finder,不思議な魚群探知機
item.alexsmobs.raccoon_tail,Raccoon Tail,アライグマの尻尾
item.alexsmobs.rainbow_jelly,Rainbow Jelly,レインボーゼリー
item.alexsmobs.rattlesnake_rattle,Rattlesnake Rattle,ガラガラヘビの尻尾
item.alexsmobs.raw_catfish,Raw Catfish,生のナマズ
item.alexsmobs.roadrunner_boots,Roadrunner Boots,ロードランナーのブーツ
item.alexsmobs.roadrunner_boots.desc,+0.1 Speed on Sand,砂の上で移動速度+0.1
item.alexsmobs.roadrunner_feather,Roadrunner Feather,ロードランナーの羽
item.alexsmobs.rocky_chestplate,Rock Shell Chestplate,岩の甲羅のチェストプレート
item.alexsmobs.rocky_chestplate.desc,Enables rolling by sprinting,ダッシュすると地面を転がる
item.alexsmobs.rocky_shell,Rocky Shell,岩の甲羅
item.alexsmobs.serrated_shark_tooth,Serrated Shark Tooth,ギザギザなサメの歯
item.alexsmobs.shark_tooth,Shark Tooth,サメの歯
item.alexsmobs.shark_tooth_arrow,Shark Tooth Arrow,サメの歯の矢
item.alexsmobs.shattered_dimensional_carver,Shattered Dimensional Carver,砕け散った次元のナイフ
item.alexsmobs.shed_snake_skin,Shed Snake Skin,ヘビの抜け殻
item.alexsmobs.shield_of_the_deep,Shield Of The Deep,深淵の盾
item.alexsmobs.shrimp_fried_rice,Shrimp-Fried Rice,エビチャーハン
item.alexsmobs.skelewag_sword,Skelewag Skull,スケルワグの頭蓋骨
item.alexsmobs.skelewag_sword_hand,Skelewag Skull,スケルワグの頭蓋骨
item.alexsmobs.skelewag_sword_inventory,Skelewag Skull,スケルワグの頭蓋骨
item.alexsmobs.skreecher_soul,Skreecher Soul,スクリーチャーの魂
item.alexsmobs.small_catfish_bucket,Bucket of Small Catfish,小さいナマズ入りバケツ
item.alexsmobs.sombrero,Sombrero,ソンブレロ
item.alexsmobs.sombrero.special_desc,Worn in a Goofy Fashion,間抜けなファッションで着こなそう
item.alexsmobs.sopa_de_macaco,Sopa De Macaco,サルのスープ
item.alexsmobs.soul_heart,Soul Heart,ソウルハート
item.alexsmobs.spawn_egg_alligator_snapping_turtle,Alligator Snapping Turtle Spawn Egg,ワニガメのスポーンエッグ
item.alexsmobs.spawn_egg_anaconda,Anaconda Spawn Egg,アナコンダのスポーンエッグ
item.alexsmobs.spawn_egg_anteater,Anteater Spawn Egg,アリクイのスポーンエッグ
item.alexsmobs.spawn_egg_bald_eagle,Bald Eagle Spawn Egg,ハクトウワシのスポーンエッグ
item.alexsmobs.spawn_egg_banana_slug,Banana Slug Spawn Egg,バナナナメクジのスポーンエッグ
item.alexsmobs.spawn_egg_bison,Bison Spawn Egg,バイソンのスポーンエッグ
item.alexsmobs.spawn_egg_blobfish,Blobfish Spawn Egg,ニュウドウカジカのスポーンエッグ
item.alexsmobs.spawn_egg_blue_jay,Blue Jay Spawn Egg,アオカケスのスポーンエッグ
item.alexsmobs.spawn_egg_bone_serpent,Bone Serpent Spawn Egg,ボーンサーペントのスポーンエッグ
item.alexsmobs.spawn_egg_bunfungus,Bunfungus Spawn Egg,バンファンガスのスポーンエッグ
item.alexsmobs.spawn_egg_cachalot_whale,Cachalot Whale Spawn Egg,マッコウクジラのスポーンエッグ
item.alexsmobs.spawn_egg_caiman,Caiman Spawn Egg,カイマンのスポーンエッグ
item.alexsmobs.spawn_egg_capuchin_monkey,Capuchin Monkey Spawn Egg,オマキザルのスポーンエッグ
item.alexsmobs.spawn_egg_catfish,Catfish Spawn Egg,ナマズのスポーンエッグ
item.alexsmobs.spawn_egg_centipede,Cave Centipede Spawn Egg,洞窟ムカデのスポーンエッグ
item.alexsmobs.spawn_egg_cockroach,Cockroach Spawn Egg,ゴキブリのスポーンエッグ
item.alexsmobs.spawn_egg_comb_jelly,Comb Jelly Spawn Egg,クシクラゲのスポーンエッグ
item.alexsmobs.spawn_egg_cosmaw,Cosmaw Spawn Egg,コスモーのスポーンエッグ
item.alexsmobs.spawn_egg_cosmic_cod,Cosmic Cod Spawn Egg,コズミックダラのスポーンエッグ
item.alexsmobs.spawn_egg_crimson_mosquito,Crimson Mosquito Spawn Egg,真紅モスキートのスポーンエッグ
item.alexsmobs.spawn_egg_crocodile,Crocodile Spawn Egg,クロコダイルのスポーンエッグ
item.alexsmobs.spawn_egg_crow,Crow Spawn Egg,カラスのスポーンエッグ
item.alexsmobs.spawn_egg_devils_hole_pupfish,Devil's Hole Pupfish Spawn Egg,デビルズホールパプフィッシュのスポーンエッグ
item.alexsmobs.spawn_egg_dropbear,Dropbear Spawn Egg,ドロップベアのスポーンエッグ
item.alexsmobs.spawn_egg_elephant,Elephant Spawn Egg,ゾウのスポーンエッグ
item.alexsmobs.spawn_egg_emu,Emu Spawn Egg,エミューのスポーンエッグ
item.alexsmobs.spawn_egg_endergrade,Endergrade Spawn Egg,エンダーグレイドのスポーンエッグ
item.alexsmobs.spawn_egg_enderiophage,Enderiophage Spawn Egg,エンダリオファージのスポーンエッグ
item.alexsmobs.spawn_egg_farseer,Farseer Spawn Egg,ファーシーアのスポーンエッグ
item.alexsmobs.spawn_egg_flutter,Flutter Spawn Egg,フラッターのスポーンエッグ
item.alexsmobs.spawn_egg_fly,Fly Spawn Egg,ハエのスポーンエッグ
item.alexsmobs.spawn_egg_flying_fish,Flying Fish Spawn Egg,トビウオのスポーンエッグ
item.alexsmobs.spawn_egg_frilled_shark,Frilled Shark Spawn Egg,ラブカのスポーンエッグ
item.alexsmobs.spawn_egg_froststalker,Froststalker Spawn Egg,フロストストーカーのスポーンエッグ
item.alexsmobs.spawn_egg_gazelle,Gazelle Spawn Egg,ガゼルのスポーンエッグ
item.alexsmobs.spawn_egg_gelada_monkey,Gelada Monkey Spawn Egg,ゲラダヒヒのスポーンエッグ
item.alexsmobs.spawn_egg_giant_squid,Giant Squid Spawn Egg,ダイオウイカのスポーンエッグ
item.alexsmobs.spawn_egg_gorilla,Gorilla Spawn Egg,ゴリラのスポーンエッグ
item.alexsmobs.spawn_egg_grizzly_bear,Grizzly Bear Spawn Egg,グリズリーのスポーンエッグ
item.alexsmobs.spawn_egg_guster,Guster Spawn Egg,ガスターのスポーンエッグ
item.alexsmobs.spawn_egg_hammerhead_shark,Hammerhead Shark Spawn Egg,シュモクザメのスポーンエッグ
item.alexsmobs.spawn_egg_hummingbird,Hummingbird Spawn Egg,ハチドリのスポーンエッグ
item.alexsmobs.spawn_egg_jerboa,Jerboa Spawn Egg,トビネズミのスポーンエッグ
item.alexsmobs.spawn_egg_kangaroo,Kangaroo Spawn Egg,カンガルーのスポーンエッグ
item.alexsmobs.spawn_egg_komodo_dragon,Komodo Dragon Spawn Egg,コモドドラゴンのスポーンエッグ
item.alexsmobs.spawn_egg_laviathan,Laviathan Spawn Egg,ラヴァイアサンのスポーンエッグ
item.alexsmobs.spawn_egg_leafcutter_ant,Leafcutter Ant Spawn Egg,ハキリアリのスポーンエッグ
item.alexsmobs.spawn_egg_lobster,Lobster Spawn Egg,ロブスターのスポーンエッグ
item.alexsmobs.spawn_egg_maned_wolf,Maned Wolf Spawn Egg,タテガミオオカミのスポーンエッグ
item.alexsmobs.spawn_egg_mantis_shrimp,Mantis Shrimp Spawn Egg,シャコのスポーンエッグ
item.alexsmobs.spawn_egg_mimic_octopus,Mimic Octopus Spawn Egg,ミミックオクトパスのスポーンエッグ
item.alexsmobs.spawn_egg_mimicube,Mimicube Spawn Egg,ミミキューブのスポーンエッグ
item.alexsmobs.spawn_egg_moose,Moose Spawn Egg,ヘラジカのスポーンエッグ
item.alexsmobs.spawn_egg_mudskipper,Mudskipper Spawn Egg,トビハゼのスポーンエッグ
item.alexsmobs.spawn_egg_mungus,Mungus Spawn Egg,マンガスのスポーンエッグ
item.alexsmobs.spawn_egg_murmur,Murmur Spawn Egg,ろくろ首のスポーンエッグ
item.alexsmobs.spawn_egg_orca,Orca Spawn Egg,シャチのスポーンエッグ
item.alexsmobs.spawn_egg_platypus,Platypus Spawn Egg,カモノハシのスポーンエッグ
item.alexsmobs.spawn_egg_potoo,Potoo Spawn Egg,タチヨタカのスポーンエッグ
item.alexsmobs.spawn_egg_raccoon,Raccoon Spawn Egg,アライグマのスポーンエッグ
item.alexsmobs.spawn_egg_rain_frog,Rain Frog Spawn Egg,アメフクラガエルのスポーンエッグ
item.alexsmobs.spawn_egg_rattlesnake,Rattlesnake Spawn Egg,ガラガラヘビのスポーンエッグ
item.alexsmobs.spawn_egg_rhinoceros,Rhinoceros Spawn Egg,サイのスポーンエッグ
item.alexsmobs.spawn_egg_roadrunner,Roadrunner Spawn Egg,ロードランナーのスポーンエッグ
item.alexsmobs.spawn_egg_rocky_roller,Rocky Roller Spawn Egg,ロッキーローラーのスポーンエッグ
item.alexsmobs.spawn_egg_seagull,Seagull Spawn Egg,カモメのスポーンエッグ
item.alexsmobs.spawn_egg_seal,Seal Spawn Egg,アザラシのスポーンエッグ
item.alexsmobs.spawn_egg_shoebill,Shoebill Spawn Egg,ハシビロコウのスポーンエッグ
item.alexsmobs.spawn_egg_skelewag,Skelewag Spawn Egg,スケルワグのスポーンエッグ
item.alexsmobs.spawn_egg_skreecher,Skreecher Spawn Egg,スクリーチャーのスポーンエッグ
item.alexsmobs.spawn_egg_skunk,Skunk Spawn Egg,スカンクのスポーンエッグ
item.alexsmobs.spawn_egg_snow_leopard,Snow Leopard Spawn Egg,ユキヒョウのスポーンエッグ
item.alexsmobs.spawn_egg_soul_vulture,Soul Vulture Spawn Egg,ソウルバルチャーのスポーンエッグ
item.alexsmobs.spawn_egg_spectre,Spectre Spawn Egg,スペクターのスポーンエッグ
item.alexsmobs.spawn_egg_straddler,Straddler Spawn Egg,ストラドラーのスポーンエッグ
item.alexsmobs.spawn_egg_stradpole,Stradpole Spawn Egg,ストラドポールのスポーンエッグ
item.alexsmobs.spawn_egg_sugar_glider,Sugar Glider Spawn Egg,フクロモモンガのスポーンエッグ
item.alexsmobs.spawn_egg_sunbird,Sunbird Spawn Egg,タイヨウチョウのスポーンエッグ
item.alexsmobs.spawn_egg_tarantula_hawk,Tarantula Hawk Spawn Egg,オオベッコウバチのスポーンエッグ
item.alexsmobs.spawn_egg_tasmanian_devil,Tasmanian Devil Spawn Egg,タスマニアデビルのスポーンエッグ
item.alexsmobs.spawn_egg_terrapin,Terrapin Spawn Egg,テラピンのスポーンエッグ
item.alexsmobs.spawn_egg_tiger,Tiger Spawn Egg,トラのスポーンエッグ
item.alexsmobs.spawn_egg_toucan,Toucan Spawn Egg,オオハシのスポーンエッグ
item.alexsmobs.spawn_egg_triops,Triops Spawn Egg,カブトエビのスポーンエッグ
item.alexsmobs.spawn_egg_tusklin,Tusklin Spawn Egg,タスクリンのスポーンエッグ
item.alexsmobs.spawn_egg_underminer,Underminer Spawn Egg,アンダーマイナーのスポーンエッグ
item.alexsmobs.spawn_egg_void_worm,Void Worm Spawn Egg,ヴォイドワームのスポーンエッグ
item.alexsmobs.spawn_egg_warped_mosco,Warped Mosco Spawn Egg,歪んだモスコのスポーンエッグ
item.alexsmobs.spawn_egg_warped_toad,Warped Toad Spawn Egg,歪んだトードのスポーンエッグ
item.alexsmobs.spiked_scute,Spiked Scute,とげとげの鱗
item.alexsmobs.spiked_turtle_shell,Spiked Turtle Shell,とげとげのカメの甲羅
item.alexsmobs.squid_grapple,Grappling Squok,グラップリングスクイック
item.alexsmobs.squid_grapple.desc,Detach tentacles by Sneaking,スニークで触手を切り離す
item.alexsmobs.stink_bottle,Stink in a Bottle,悪臭入り瓶
item.alexsmobs.stink_empty_inventory,Stink Ray,悪臭砲
item.alexsmobs.stink_ray,Stink Ray,悪臭砲
item.alexsmobs.stink_ray_empty_hand,Stink Ray,悪臭砲
item.alexsmobs.stink_ray_hand,Stink Ray,悪臭砲
item.alexsmobs.stink_ray_inventory,Stink Ray,悪臭砲
item.alexsmobs.straddle_helmet,Straddlite Tack,ストラドライトのタック
item.alexsmobs.straddle_saddle,Straddlite Saddle,ストラドライトの鞍
item.alexsmobs.straddleboard,Straddleboard,ストラドルボード
item.alexsmobs.straddlite,Straddlite,ストラドライト
item.alexsmobs.stradpole_bucket,Bucket of Stradpole,ストラドポール入りバケツ
item.alexsmobs.tarantula_hawk_elytra,Tarantula Hawk Elytra,オオベッコウバチのエリトラ
item.alexsmobs.tarantula_hawk_wing,Tarantula Hawk Wing,オオベッコウバチの羽
item.alexsmobs.tarantula_hawk_wing_fragment,Tattered Tarantula Hawk Wing,ボロボロのオオベッコウバチの羽
item.alexsmobs.tendon_whip,Tendon Whip,腱のムチ
item.alexsmobs.terrapin_bucket,Bucket of Terrapin,テラピン入りバケツ
item.alexsmobs.triops_bucket,Bucket of Triops,カブトエビ入りバケツ
item.alexsmobs.unsettling_kimono,Unsettling Kimono,落ち着かない着物
item.alexsmobs.unsettling_kimono.desc,Most Undead creatures become neutral,ほとんどのアンデッドが中立になる
item.alexsmobs.vine_lasso,Vine Lasso,投げ縄
item.alexsmobs.vine_lasso_hand,This is not a Vine Lasso,ツタ投げ縄じゃないよ
item.alexsmobs.vine_lasso_inventory,This is not a Vine Lasso,ツタ投げ縄じゃないよ
item.alexsmobs.void_worm_eye,Void Worm Eye,ヴォイドワームの目
item.alexsmobs.void_worm_mandible,Void Worm Mandible,ヴォイドワームの大顎
item.alexsmobs.warped_mixture,Warped Mixture,歪んだ混合物
item.alexsmobs.warped_muscle,Warped Muscle,ねじ曲がった筋肉
item.minecraft.lingering_potion.effect.bug_pheromones,Lingering Potion of Bug Pheromones,昆虫フェロモンの残留ポーション
item.minecraft.lingering_potion.effect.clinging,Lingering Potion of Clinging,粘着の残留ポーション
item.minecraft.lingering_potion.effect.knockback_resistance,Lingering Potion of Knockback Resistance,ノックバック耐性の残留ポーション
item.minecraft.lingering_potion.effect.lava_vision,Lingering Potion of Lava Vision,溶岩透視の残留ポーション
item.minecraft.lingering_potion.effect.long_bug_pheromones,Lingering Potion of Bug Pheromones,昆虫フェロモンの残留ポーション
item.minecraft.lingering_potion.effect.long_clinging,Lingering Potion of Clinging,粘着の残留ポーション
item.minecraft.lingering_potion.effect.long_knockback_resistance,Lingering Potion of Knockback Resistance,ノックバック耐性の残留ポーション
item.minecraft.lingering_potion.effect.long_lava_vision,Lingering Potion of Lava Vision,溶岩透視の残留ポーション
item.minecraft.lingering_potion.effect.long_poison_resistance,Lingering Potion of Poison Resistance,毒耐性の残留ポーション
item.minecraft.lingering_potion.effect.long_soulsteal,Lingering Potion of Soulsteal,魂盗みの残留ポーション
item.minecraft.lingering_potion.effect.poison_resistance,Lingering Potion of Poison Resistance,毒耐性の残留ポーション
item.minecraft.lingering_potion.effect.soulsteal,Lingering Potion of Soulsteal,魂盗みの残留ポーション
item.minecraft.lingering_potion.effect.speed_iii,Lingering Potion of Swiftness,素早い移動を続けるポーション
item.minecraft.lingering_potion.effect.strong_knockback_resistance,Lingering Potion of Knockback Resistance,ノックバック耐性の残留ポーション
item.minecraft.lingering_potion.effect.strong_soulsteal,Lingering Potion of Soulsteal,魂盗みの残留ポーション
item.minecraft.potion.effect.bug_pheromones,Potion of Bug Pheromones,昆虫フェロモンのポーション
item.minecraft.potion.effect.clinging,Potion of Clinging,粘着のポーション
item.minecraft.potion.effect.knockback_resistance,Potion of Knockback Resistance,ノックバック耐性のポーション
item.minecraft.potion.effect.lava_vision,Potion of Lava Vision,溶岩透視のポーション
item.minecraft.potion.effect.long_bug_pheromones,Potion of Bug Pheromones,昆虫フェロモンのポーション
item.minecraft.potion.effect.long_clinging,Potion of Clinging,粘着のポーション
item.minecraft.potion.effect.long_knockback_resistance,Potion of Knockback Resistance,ノックバック耐性のポーション
item.minecraft.potion.effect.long_lava_vision,Potion of Lava Vision,溶岩透視のポーション
item.minecraft.potion.effect.long_poison_resistance,Potion of Poison Resistance,毒耐性のポーション
item.minecraft.potion.effect.long_soulsteal,Potion of Soulsteal,魂盗みのポーション
item.minecraft.potion.effect.poison_resistance,Potion of Poison Resistance,毒耐性のポーション
item.minecraft.potion.effect.soulsteal,Potion of Soulsteal,魂盗みのポーション
item.minecraft.potion.effect.speed_iii,Potion of Swiftness,素早く動くポーション
item.minecraft.potion.effect.strong_knockback_resistance,Potion of Knockback Resistance,ノックバック耐性のポーション
item.minecraft.potion.effect.strong_soulsteal,Potion of Soulsteal,魂盗みのポーション
item.minecraft.splash_potion.effect.bug_pheromones,Splash Potion of Bug Pheromones,昆虫フェロモンのスプラッシュポーション
item.minecraft.splash_potion.effect.clinging,Splash Potion of Clinging,粘着のスプラッシュポーション
item.minecraft.splash_potion.effect.knockback_resistance,Splash Potion of Knockback Resistance,ノックバック耐性のスプラッシュポーション
item.minecraft.splash_potion.effect.lava_vision,Splash Potion of Lava Vision,溶岩透視のスプラッシュポーション
item.minecraft.splash_potion.effect.long_bug_pheromones,Splash Potion of Bug Pheromones,昆虫フェロモンのスプラッシュポーション
item.minecraft.splash_potion.effect.long_clinging,Splash Potion of Clinging,粘着のスプラッシュポーション
item.minecraft.splash_potion.effect.long_knockback_resistance,Splash Potion of Knockback Resistance,ノックバック耐性のスプラッシュポーション
item.minecraft.splash_potion.effect.long_lava_vision,Splash Potion of Lava Vision,溶岩透視のスプラッシュポーション
item.minecraft.splash_potion.effect.long_poison_resistance,Splash Potion of Poison Resistance,毒耐性のスプラッシュポーション
item.minecraft.splash_potion.effect.long_soulsteal,Splash Potion of Soulsteal,魂盗みのスプラッシュポーション
item.minecraft.splash_potion.effect.poison_resistance,Splash Potion of Poison Resistance,毒耐性のスプラッシュポーション
item.minecraft.splash_potion.effect.soulsteal,Splash Potion of Soulsteal,魂盗みのスプラッシュポーション
item.minecraft.splash_potion.effect.speed_iii,Splash Potion of Swiftness,俊敏のスプラッシュポーション III
item.minecraft.splash_potion.effect.strong_knockback_resistance,Splash Potion of Knockback Resistance,ノックバック耐性のスプラッシュポーション
item.minecraft.splash_potion.effect.strong_soulsteal,Splash Potion of Soulsteal,魂盗みのスプラッシュポーション
item.minecraft.tipped_arrow.effect.bug_pheromones,Arrow of Bug Pheromones,昆虫フェロモンの矢
item.minecraft.tipped_arrow.effect.clinging,Arrow of Clinging,粘着の矢
item.minecraft.tipped_arrow.effect.knockback_resistance,Arrow of Knockback Resistance,ノックバック耐性の矢
item.minecraft.tipped_arrow.effect.lava_vision,Arrow of Lava Vision,溶岩透視の矢
item.minecraft.tipped_arrow.effect.long_bug_pheromones,Arrow of Bug Pheromones,昆虫フェロモンの矢
item.minecraft.tipped_arrow.effect.long_clinging,Arrow of Clinging,粘着の矢
item.minecraft.tipped_arrow.effect.long_knockback_resistance,Arrow of Knockback Resistance,ノックバック耐性の矢
item.minecraft.tipped_arrow.effect.long_lava_vision,Arrow of Lava Vision,溶岩透視の矢
item.minecraft.tipped_arrow.effect.long_poison_resistance,Arrow of Poison Resistance,毒耐性の矢
item.minecraft.tipped_arrow.effect.long_soulsteal,Arrow of Soulsteal,魂盗みの矢
item.minecraft.tipped_arrow.effect.poison_resistance,Arrow of Poison Resistance,毒耐性の矢
item.minecraft.tipped_arrow.effect.soulsteal,Arrow of Soulsteal,魂盗みの矢
item.minecraft.tipped_arrow.effect.speed_iii,Arrow of Swiftness,俊敏の矢 III
item.minecraft.tipped_arrow.effect.strong_knockback_resistance,Arrow of Knockback Resistance,ノックバック耐性の矢
item.minecraft.tipped_arrow.effect.strong_soulsteal,Arrow of Soulsteal,魂盗みの矢
advancements.alexsmobs.sopa_de_macaco.title,Uma Delicia,美味しい
alexsmobs.sound.subtitle.la_cucaracha,¡La Cucaracha!,¡ラ・クカラチャ！
item.alexsmobs.music_disc_daze.desc,LudoCrypt - Daze,
item.alexsmobs.music_disc_thime.desc,LudoCrypt - Thime,
item.alexsmobs.tab_icon,Alex's Mobs,
itemGroup.alexsmobs,Alex's Mobs,
