key,source_text,target_text
itemGroup.compactmachines3,Compact Machines 3,コンパクトマシン3
generator.compactsky,Compact Sky,コンパクト・スカイ
tile.compactmachines3.machine.tiny.name,Tiny Compact Machine,小型コンパクトマシン
tile.compactmachines3.machine.small.name,Small Compact Machine,小型コンパクトマシン
tile.compactmachines3.machine.normal.name,Normal Compact Machine,標準コンパクトマシン
tile.compactmachines3.machine.large.name,Large Compact Machine,大型コンパクトマシン
tile.compactmachines3.machine.giant.name,Giant Compact Machine,巨大コンパクトマシン
tile.compactmachines3.machine.maximum.name,Maximum Compact Machine,最大コンパクトマシン
tile.compactmachines3.tunnel.name,Tunnel,トンネル
tile.compactmachines3.redstonetunnel.name,Redstone Tunnel,レッドストーントンネル
tile.compactmachines3.wallbreakable.name,Compact Machine Wall,コンパクトマシン壁
tile.compactmachines3.wall.name,Solid Compact Machine Wall,ソリッドコンパクトマシン壁
tile.compactmachines3.fieldprojector.name,Miniaturization Field Projector,ミニチュア化フィールドプロジェクター
item.compactmachines3.psd.name,Personal Shrinking Device,個人用シュリンカー
item.compactmachines3.tunneltool.name,Tunnel,トンネル
item.compactmachines3.redstonetunneltool.name,Redstone Tunnel,レッドストーントンネル
item.compactmachines3.psd.spawnpoint_set,Entry point set!,エントリーポイント設定！
hint.compactmachines3.missing_opposite_projector,Missing opposite field projector! It is required to determine the field size!,対向フィールドプロジェクターがありません！フィールドサイズを決定するために必要です！
hint.compactmachines3.missing_projector_at,"Missing field projector at %d,%d,%d","プロジェクターのフィールドが% d,% d,% dで欠落しています"
hint.compactmachines3.currently_crafting,Currently crafting: %s (progress: %s%%),現在クラフト中: %s (進行状況: %s%%)
hint.compactmachines3.no_recipe_found,No valid recipe found,有効なレシピが見つかりません
hint.compactmachines3.found_recipe_for,Recipe for: %s,レシピ: %s
hint.compactmachines3.invalid_block_in_field,"Invalid block in field area @ %d,%d,%d: %s","フィールド領域内に無効なブロック @ %d,%d,%d: %s"
hint.compactmachines3.cant_sleep_here,You can not sleep in the Compact Machines dimension,コンパクトマシンディメンションでは眠れません
hint.compactmachines3.bed_position_set,Respawn position set to this Machine,復帰位置をこのマシンに設定します。
hint.compactmachines3.not_permitted_to_enter,You do not have permission to enter this machine,このマシンに入る権限がありません。
hint.compactmachines3.skyworld.no_block_breaking,You can not break any blocks in the Compact Hub!,コンパクトハブ内ではブロックを破壊できません！
hint.compactmachines3.skyworld.no_block_placing,You can not place any blocks in the Compact Hub!,コンパクトハブ内ではブロックを設置できません！
hint.compactmachines3.skyworld.only_one_machine_claim,You can only claim a single Compact Machine in the hub!,コンパクトマシンはハブで1台しか取得できません！
top.compactmachines3.currently_crafting,Crafting:,クラフト:
top.compactmachines3.found_recipe_for,Recipe for:,レシピ: 
tooltip.compactmachines3.machine.coords,Machine:,機械:
tooltip.compactmachines3.machine.coords.unused,Unused,未使用
tooltip.compactmachines3.machine.schema,Schema:,スキーマ:
tooltip.compactmachines3.machine.stopitsoaryn,Feedbackloop detected,フィードバックループが検出されました
tooltip.compactmachines3.hold_shift.hint,Hold shift for details.,詳細を見るにはShiftキーを押してください。
tooltip.compactmachines3.psd.hint,Used as ingame documentation and to enter Compact Machines.,ゲーム内ドキュメントとして使用し、Compact Machinesを起動します。
tooltip.compactmachines3.fieldprojector.hint,Place 4 opposite of each other to create a Miniaturization Crafting field. Right click to get hints where the next projector needs to be!,4つを互いに向かい合わせて配置し、小型化クラフトフィールドを生成します。右クリックで次のプロジェクターを配置する位置のヒントを表示します！
tooltip.compactmachines3.tunneltool.hint,Used to connect Wall blocks with outside Compact Machine faces.,壁ブロックを外部Compact Machineフェイスと接続するために使用します。
tooltip.compactmachines3.redstonetunneltool.hint,Used to transfer redstone signals between wall blocks and outside Compact Machine faces.,壁ブロックと外部コンパクトマシンフェイス間でレッドストーン信号を転送するために使用されます。
tooltip.compactmachines3.wall.hint,Warning! Unbreakable for non-creative players!,警告！非クリエイティブプレイヤーには壊せません！
tooltip.compactmachines3.machine.hint,A %s provides a %s room.,「%s」は「%s」の部屋を提供します。
tooltip.compactmachines3.lockforotherplayers.checkbox,Lock for other players,他プレイヤー用ロック
tooltip.compactmachines3.jei.crafting_trigger,Throw this into the miniaturization field to start the crafting process.,このアイテムをミニチュア化フィールドに投げてクラフトプロセスを開始します。
tooltip.compactmachines3.jei.shape,Use these to build the multiblock,これらを使ってマルチブロックを構築してください
compactmachines3.jei.category.multiblock_miniaturization,Multiblock Miniaturization,マルチブロックミニチュアライゼーション
enumfacing.side,Side: %s,側面: %s
enumfacing.up,Up,上
enumfacing.down,Down,下
enumfacing.north,North,北
enumfacing.south,South,南
enumfacing.west,West,西
enumfacing.east,East,東
commands.compactmachines3.usage,"/compactmachines3 [subcommand, leave empty for list of commands]",/compactmachines3 [サブコマンド、空欄でコマンド一覧]
commands.compactmachines3.available,Available sub-commands:,利用可能なサブコマンド:
commands.compactmachines3.denied,You do not have the permission to use this command.,このコマンドを使用する権限がありません。
commands.compactmachines3.schema.description,Save/load the contents of machines,機械の内容を保存/読み込み
commands.compactmachines3.schema.save.usage,/compactmachines3 schema save <name>,
commands.compactmachines3.schema.save.description,Saves the machine you are in to disk,現在いるマシンをディスクに保存します
commands.compactmachines3.schema.save.exception.not_in_machine_dimension,You must be in the machine dimension for this command to work.,このコマンドを実行するには機械ディメンションにいる必要があります。
commands.compactmachines3.schema.save.exception.invalid_file,Could not open file for writing! Schema is not saved!,書き込み用にファイルを開けませんでした！スキーマが保存されていません！
commands.compactmachines3.schema.save.exception.not_serializable,Could not serialize machine! Schema is not saved!,マシンをシリアライズできませんでした！スキーマが保存されていません！
commands.compactmachines3.schema.save.success,Wrote schema to file: %s,スキーマをファイルに書き込みました: %s
commands.compactmachines3.schema.load.usage,/compactmachines3 schema load <name>,
commands.compactmachines3.schema.load.description,Generates the specified schema in the room you are standing in,現在立っている部屋で指定されたスキーマを生成します
commands.compactmachines3.schema.load.exception.not_in_machine_dimension,You must be in the machine dimension for this command to work.,このコマンドを実行するには機械ディメンションにいる必要があります。
commands.compactmachines3.schema.load.exception.unknown_schema,No schema with that name exists!,その名前のスキーマは存在しません！
commands.compactmachines3.schema.load.exception.machine_size_does_not_match,The size of the machine does not match the schema!,機械のサイズがスキーマと一致しません！
commands.compactmachines3.schema.load.machine_schema_set_to,Machine set to schema: %s,マシンがスキーマ: %s に設定されました。
commands.compactmachines3.schema.set.usage,/compactmachines3 schema set <name>,
commands.compactmachines3.schema.set.description,Sets the specified schema to the Compact Machine block you are looking at,指定されたスキーマを、見ているコンパクトマシンブロックに設定します
commands.compactmachines3.schema.set.exception.unknown_schema,No schema with that name exists!,その名前のスキーマは存在しません！
commands.compactmachines3.schema.set.exception.look_at_compact_machine,You need to look at a Compact Machine block!,コンパクトマシンブロックを見る必要があります！
commands.compactmachines3.schema.set.exception.machine_size_does_not_match,The size of the machine does not match the schema!,機械のサイズがスキーマと一致しません！
commands.compactmachines3.schema.set.exception.machine_is_already_in_use,Machine is already in use. Place a new machine!,マシンはすでに使用中です。新しいマシンを置いてください！
commands.compactmachines3.schema.set.machine_schema_set_to,Machine set to schema: %s,マシンがスキーマ: %s に設定されました。
commands.compactmachines3.schema.reload-files.usage,/compactmachines3 schema reload-files,
commands.compactmachines3.schema.reload-files.description,Reloads all the stored schema files from disk and from the jar,ディスクおよびjarからすべての保存済みスキーマファイルを再読み込みします
commands.compactmachines3.recipe.description,Stuff related to Multiblock Miniaturization recipes,マルチブロックミニチュア化レシピに関連する項目
commands.compactmachines3.recipe.unpack-defaults.usage,/compactmachines3 recipe unpack-defaults [force],
commands.compactmachines3.recipe.unpack-defaults.description,"Extract the default recipes from the .jar to the config folder. Append ""force"" to overwrite existing files.",デフォルトレシピを.jarから設定フォルダに抽出します。既存ファイルを上書きするには「force」を追加してください。
commands.compactmachines3.recipe.copy-shape.usage,/compactmachines3 recipe copy-shape,
commands.compactmachines3.recipe.copy-shape.description,Copies the crafting shape of the projector you are looking at into your clipboard,見ているプロジェクターのクラフト形状をクリップボードにコピーします
commands.compactmachines3.recipe.copy-shape.exception.not_looking_at_projector,You are not looking at a Field Projector,あなたが見ているのはフィールドプロジェクターではありません
commands.compactmachines3.recipe.copy-shape.success,Copied shape to clipboard!,形状をクリップボードにコピーしました！
commands.compactmachines3.recipe.copy-item.usage,/compactmachines3 recipe copy-item [catalyst|target],
commands.compactmachines3.recipe.copy-item.description,Copies the stack in your main hand to the clipboard,メインハンドのスタックをクリップボードへコピーします
commands.compactmachines3.recipe.copy-item.exception.missing_type,You need to specify whether you want to get the JSON for a catalyst or for the target stack,カタリスト用かターゲットスタック用か、JSON を取得したいか指定する必要があります。
commands.compactmachines3.recipe.copy-item.exception.missing_item,You need to hold something in your hand for this command to work!,このコマンドを実行するには、手に何かを持っている必要があります！
commands.compactmachines3.recipe.copy-item.success,Copied item to clipboard!,アイテムをクリップボードにコピーしました！
commands.compactmachines3.recipe.generate.usage,/compactmachines3 recipe generate <recipe-name>,
commands.compactmachines3.recipe.generate.description,Generates the given recipe in world. Warning: Replaces all blocks in area!,指定されたレシピをワールドに生成します。警告：領域内のすべてのブロックが置き換えられます！
commands.compactmachines3.recipe.generate.exception.not_looking_at_block,You are not looking at a block where the Recipe will be built.,レシピが作成されるブロックを見ていません。
commands.compactmachines3.recipe.generate.exception.unknown_recipe,The given recipe does not seem to exist.,指定されたレシピは存在しないようです
commands.compactmachines3.recipe.generate.exception.missing_machine_recipe,You need to specify a recipe name (use tab completion!),レシピ名を指定する必要があります（タブ補完を使用してください）
commands.compactmachines3.machines.description,Commands to recover lost/broken machines,失われた/壊れたマシンを回復するコマンド
commands.compactmachines3.machines.give.usage,/compactmachines3 machines give <id>,
commands.compactmachines3.machines.give.description,Gives the player a corresponding cube. WARNING: This breaks Machines if they already exist in the world!,プレイヤーに対応するキューブを付与します。警告：既に世界に存在するマシンの場合、破損する可能性があります！
commands.compactmachines3.machines.give.warning,WARNING: This breaks Machines if they already exist in the world!,⚠️ 既にワールド内に存在する機械を破壊します！
commands.compactmachines3.machines.view.usage,/compactmachines3 machines view [<id>],
commands.compactmachines3.machines.view.description,Opens a GUI allowing inspectation of all existing Compact Machines,既存のコンパクトマシンすべてを検査できるGUIを開きます。
commands.compactmachines3.machines.clear.usage,/compactmachines3 machines clear [<id>],
commands.compactmachines3.machines.clear.description,Sets all blocks inside the given machine to air.,指定された機械内のすべてのブロックを空気に置き換える。
gui.compactmachines3.psd.welcome.welcome,Compact Machines 3 allows you to build complex machine contraptions within a single block!,Compact Machines 3では、1つのブロック内で複雑な機械構造物を作成できます！
gui.compactmachines3.psd.welcome.chapters,Available chapters:,利用可能な章:
gui.compactmachines3.psd.machines.label,Compact Machines,コンパクトマシン
gui.compactmachines3.psd.machines.text,"Compact Machines are the core mechanic of this mod. They allow you to build large rooms in a single block space connected to the outside world.\nThey come in various sizes ranging from 3x3x3 to 13x13x13.\nYou can use Tunnels to connect the outside block faces with any of the inside walls to transport items, fluids etc.\nYou can enter a Compact Machine by right-clicking it with a Personal Shrinking Device.\nPlease use JEI to look up crafting recipes.","コンパクトマシンはこのmodの中核的なメカニクスです。単一ブロックのスペースに大規模なルームを構築でき、外の世界に接続できます。
サイズは3x3x3から13x13x13までの様々な大きさがあります。
トンネルを使用して、外側のブロック面を内側の壁に接続し、アイテムや流体などを輸送できます。
パーソナルシュリンキングデバイスを持ってコンパクトマシンを右クリックして入ることができます。
JEIを使用してクラフトレシピを確認してください。"
gui.compactmachines3.psd.tunnels.label,Tunnels,トンネル
gui.compactmachines3.psd.redstone_tunnels.label,Redstone Tunnels,レッドストーントンネル
gui.compactmachines3.psd.redstone_tunnels.text,"These can be used to transfer redstone signals between the machine and the world it is placed in. In comparison to normal Tunnels they are not bidirectional, but need to be configured to be either In- or Output. Press the button in the top right corner to toggle between modes (red=in, green=out).\nYou can use these to either enable/disable redstone based systems inside your machines or to build complicated redstone circuits inside a single block.","これらはマシンと配置された世界の間でレッドストーン信号を転送するために使用できます。通常のトンネルとは異なり、双方向ではなく、入力または出力に設定する必要があります。右上隅のボタンを押してモード間を切り替えます（赤=入力、緑=出力）。
これらを使用して、マシン内のレッドストーンベースシステムを有効/無効にするか、単一ブロック内で複雑なレッドストーン回路を構築できます。"
gui.compactmachines3.psd.crafting.label,Miniaturization Crafting,ミニチュアライゼーションクラフト
gui.compactmachines3.psd.crafting.text,"To craft Compact Machines you will need to set up a miniaturization crafting structure.\nGrab 4 Miniaturization Field Projectors and place them opposite of each other, with 7, 11 or 15 spaces between them. All of them need to face the center.\nOnce placed correctly they will start emitting a miniaturization field. Build a recipe like specified in JEI and throw the catalyst item inside the field to start the crafting process.","コンパクトマシンをクラフトするには、ミニチュア化クラフト構造をセットアップする必要があります。
ミニチュア化フィールドプロジェクター4つを取り出し、互いに反対に配置します。プロジェクター間に7、11、または15スペースを確保します。すべてが中央を向いている必要があります。
正しく配置されると、ミニチュア化フィールドの放射を開始します。JEIで指定されたとおりにレシピを構築し、カタリストアイテムをフィールド内に投げてクラフトプロセスを開始します。"
gui.compactmachines3.compactsky.whitelist,Whitelist,白リスト
gui.compactmachines3.compactsky.preview,Preview,プレビュー
gui.compactmachines3.compactsky.enter,Enter machine,マシンに投入
gui.compactmachines3.compactsky.rename,Rename,名前変更
gui.compactmachines3.compactsky.configuration.startLocked,Start machines in locked state,マシンをロックされた状態で開始
gui.compactmachines3.compactsky.configuration.givePSD,Give players a Shrinking Device on first spawn,プレイヤーに最初のスポーン時に縮小デバイスを与えます。
gui.compactmachines3.compactsky.configuration.voidDimensions,Use void dimensions,虚空次元を使用
gui.compactmachines3.compactsky.configuration.schema,Schema,スキーマ
gui.compactmachines3.compactsky.configuration.close,Done,完了
gui.compactmachines3.compactsky.configuration.label.MachineSize,Machine Size,機械サイズ
gui.compactmachines3.compactsky.configuration.label.Description,Description,説明
gui.compactmachines3.compactsky.configuration.warning.PleaseSpecifyADescription,Please specify a description in the schemas .json file!,schemas .json ファイルに説明を書いてください！
gui.compactmachines3.compactsky.configuration.small,16 Players,16人
gui.compactmachines3.compactsky.configuration.medium,64 Players,64人
gui.compactmachines3.compactsky.configuration.large,256 Players,256人
gui.compactmachines3.psd.tunnels.text,"Tunnels are used to connect inside wall faces to outside block faces. Only one connection for each outside face, this means a total of 6 tunnels per machine.\nRight click a Compact Machine Wall with a Tunnel Tool to place a tunnel. Right click it again to cycle through the outside faces it is connected to.\nTunnels are using the Forge Capability system to ""connect"" the two blocks. Other mods need to use this system for tunnels to work properly. This is the case for most storage, but rarely for multiblock systems, so expect some pipes etc to not work as expected.",
