key,source_text,target_text
block.cyclic.dark_glass_connected.guide,"Self-connecting textures. Unlike regular glass, does not let light pass through.Oh, and it's also immune explosions, including those caused by the Wither.",自己接続テクスチャです。通常のガラスと異なり、光を透さない暗黒ガラスです。爆発およびウィザーによる爆発を含めて爆発に免疫があります。
block.cyclic.ender_item_shelf.guide,"Stores 5 slots items.  Use any normal Wrench to toggle display mode, or a Rotation Tool to rotate its facing direction ",5スロットのアイテムを保存します。  通常のレンチを使用して表示モードを切り替えるか、回転ツールを使用して向きを回転させます
block.cyclic.ender_shelf.guide,"Stores 5 stacks of enchanted books. This also counts as a bookshelf for Enchanting tables. A Each shelf accepts books with exactly 1 enchantment on them, slots that you can right click on to insert or withdraw a Enchanted Book from storage.  Use any normal Wrench to toggle display mode, or a Rotation Tool to rotate its facing direction ",5スタックの魔法にかかった本を保存します。 これはまたエンチャントテーブルの本棚として数えられます。 各シェルフは正確に1つのエンチャントが施された本を受け入れ、右クリックして魔法にかかった本を挿入または引き出すことができるスロットがあります。  通常のレンチを使用して表示モードを切り替えるか、回転ツールを使用して向きを回転させます
block.cyclic.eye_redstone,Ender Eye Block,エンダーアイブロック
block.cyclic.eye_teleport,Ender Pearl Block,エンダーパールブロック
block.cyclic.fan.guide,"The Fan is a configurable machine designed to push players, mobs, items and other entities.Right-click on a fan to configure its range and speed.",ファンは、プレイヤー、モブ、アイテムおよびその他のエンティティを押すように設計された設定可能なマシンです。ファンを右クリックして、その範囲と速度を設定します。
block.cyclic.fisher.guide,Place in water and give it a fishing rod and it will automatically catch fish.Caught fish will be dropped in the world and need to be picked up manually or by other machines.,水に設置し、釣竿を与えると、自動的に魚を釣ります。釣られた魚は世界にドロップされ、手動またはその他のマシンで拾う必要があります。
block.cyclic.flint_block,Flint Block,Flintブロック
block.cyclic.flint_block.guide,Crafting material compressed from nine flint,9つの火打石から圧縮されたクラフト材料
block.cyclic.flower_absalon_tulip,Absalon Tulip,アブサロンチューリップ
block.cyclic.flower_absalon_tulip.guide,"May spawn in the following biome Categories: river, plains, taiga, underground, mesa, jungle",以下のバイオームカテゴリに出現する可能性があります：河川、平原、タイガ、地下、メサ、ジャングル
block.cyclic.flower_absalon_tulip.tooltip,A forgotten legacy,忘れられた遺産
block.cyclic.flower_cyan.guide,"A lost legacy from a lost version of Minecraft.  Spawns alone in biome categories: forest, plains, taiga, extreme hills).  ",失われたMinecraftのバージョンからの失われた遺産。  バイオムカテゴリー内で単独で生成: 森、平原、タイガ、極端な丘)。
block.cyclic.flower_lime_carnation,Lime Carnation,黄緑カーネーション
block.cyclic.flower_lime_carnation.guide,"May spawn in the following biome Categories: river, beach, ocean, icy, extreme hills, jungle",以下のバイオームカテゴリに出現する可能性があります：河川、ビーチ、海洋、氷、エクストリーム・ヒル、ジャングル
block.cyclic.flower_lime_carnation.tooltip,A hidden legacy,隠された遺産
block.cyclic.flower_purple_tulip,Purple Tulip,紫のチューリップ
block.cyclic.flower_purple_tulip.guide,"May spawn in the following biome Categories: river, savanna, underground, mesa, forest, mushroom",以下のバイオームカテゴリに出現する可能性があります：河川、サバンナ、地下、メサ、森林、キノコ
block.cyclic.flower_purple_tulip.tooltip,A rare legacy,稀な遺産
block.cyclic.generator_solar,Solar Panel Generator,ソーラーパネルジェネレーター
block.cyclic.generator_solar.guide,"WHen these blocks can see they skylight during the day, they will generate small amounts of energy",これらのブロックが昼間に空光を見ることができるとき、少量のエネルギーを生成します
block.cyclic.generator_solar.tooltip,Generate power with sunlight,日光でパワーを生成
block.cyclic.glass_connected,Smooth Glass,つるつるガラス
block.cyclic.glass_connected.guide,"Connected textures, similar to compressed glass",圧縮ガラスと同様に、接続されたテクスチャ
block.cyclic.glass_connected.tooltip,Polished connected clear glass,磨かれた接続された透明ガラス
block.cyclic.gold_bars,Gold Bars,金の棒
block.cyclic.gold_bars.guide,Gold Bars,金の棒
block.cyclic.gold_chain,Gold Chain,金のチェーン
block.cyclic.gold_chain.guide,Gold Chain,金のチェーン
block.cyclic.gold_lantern,Gold Lantern,金のランタン
block.cyclic.gold_lantern.guide,Gold Lantern has light level 14,金のランタンの光レベルは14
block.cyclic.gold_soul_lantern,Gold Soul Lantern,金の魂のランタン
block.cyclic.gold_soul_lantern.guide,Gold Soul Lantern has light level 15,金の魂のランタンの光レベルは15
block.cyclic.hopper.guide,Moves items one per tick with similar logic to regular hoppers.  Is disabled with redstone.  Collects only from the area directly above the hopper,通常のホッパーと同様のロジックで、ティック当たり1つのアイテムを移動します。レッドストーンで無効になります。ホッパーの直上の領域からのみ収集します
block.cyclic.hopper_fluid.guide,Moves fluids one bucket per tick with similar logic to regular hoppers.  Is disabled with redstone.  Collects only from the area directly above the hopper,通常のホッパーと同様のロジックで、ティック当たり1バケットの流体を移動します。レッドストーンで無効になります。ホッパーの直上の領域からのみ収集します
block.cyclic.hopper_gold.guide,Moves items 64 per tick with similar logic to regular hoppers.  Is disabled with redstone.  Collects only from the area directly above the hopper,通常のホッパーと同様のロジックで、ティック当たり64個のアイテムを移動します。レッドストーンで無効になります。ホッパーの直上の領域からのみ収集します
block.cyclic.magnet_block,Magnet Block,マグネットブロック
block.cyclic.magnet_block.guide,Attracts nearby items on the ground.  Interact to toggle on and off.  Intended to help with early game automation,近くの地面のアイテムを引き付けます。相互作用してオン/オフを切り替えます。ゲーム初期の自動化を支援することを目的としています
block.cyclic.magnet_block.tooltip,Pulls in nearby items,近くのアイテムを引き寄せる
block.cyclic.miner.guide,Mines a configurable area in front of the Miner. Will attempt to mine with any tool you provide it.  See Blockstate Data Card,鉱夫の前の設定可能な領域を鉱山します。提供するツールで採掘しようとします。ブロック状態データカードを参照してください
block.cyclic.netherite_bars,Netherite Bars,ネザライト製の棒
block.cyclic.netherite_bars.guide,Netherite Bars,ネザライト製の棒
block.cyclic.netherite_chain,Netherite Chain,ネザライト製の鎖
block.cyclic.netherite_chain.guide,Netherite Chain,ネザライト製の鎖
block.cyclic.netherite_lantern,Netherite Lantern,ネザライトのランタン
block.cyclic.netherite_lantern.guide,Netherite Lantern has light level 15,ネザライト製のランタンの光レベルは15
block.cyclic.netherite_pressure_plate,Netherite Pressure Plate,ネザライト製の圧力板
block.cyclic.netherite_pressure_plate.guide,Netherite Pressure Plate produces redstone signal when stepped on,ネザライト製の圧力板は、踏まれたときにレッドストーン信号を生成します
block.cyclic.no_soliciting,No Soliciting Altar,勧誘禁止祭壇
block.cyclic.no_soliciting.guide,"Nearby natural spawns of the specified mob types (bats, traders, trader llamas) will not spawn.  Only runs when blockstate is lit, interact to disable.",指定されたモブタイプ(コウモリ、商人、商人ラマ)の近くの自然なスポーンは出現しません。ブロック状態が点灯しているときのみ実行され、相互作用して無効にします。
block.cyclic.no_soliciting.tooltip,Prevent spawns of some harmless annoying creatures,いくつかの無害な迷惑生物の出現を防ぐ
block.cyclic.obsidian_pressure_plate,Obsidian Pressure Plate,黒曜石の感圧板
block.cyclic.obsidian_pressure_plate.guide,Obsidian Pressure Plate produces redstone signal when players step on it,黒曜石の圧力板は、プレイヤーが踏むとレッドストーン信号を生成します
block.cyclic.peace_candle,Peace Candle,平和のろうそく
block.cyclic.peace_candle.guide,Prevents natural hostile mob spawns in a large radius including above and below (see config for values).  Interact to light or disable.,大きな半径内で敵対的なモブの自然な出現を防ぎます(コンフィグ値を参照)。相互作用して点灯または無効にします。
block.cyclic.peace_candle.tooltip,Prevents nearby hostile mob spawns,近くの敵対的なモブの出現を防ぐ
block.cyclic.peat_baked.guide,"Saturated Peat Deposits form over time when Dry Peat Bog is placed next to water. Once harvested, it can be smelted to create fuel for the Generator.",飽和したピート堆積物は、乾燥したピート沼地が水の隣に配置されたときに時間とともに形成されます。収穫後、ジェネレーターの燃料を作成するためにそれを製錬できます。
block.cyclic.peat_farm.guide,"The Peat Farm takes water and Dry Peat Bog as its inputs and automatically builds a 15x15 Peat Bog farm surrounding itself.When Dry Peat Bog becomes saturated, the Peat Farm will automatically harvest it and place more Dry Peat Bog in its place.",ピート農場は、水と乾燥したピート沼地を入力として取得し、自動的に自分の周りに15×15ピート沼地農場を構築します。乾燥したピート沼地が飽和すると、ピート農場は自動的にそれを収穫し、その場所にはより多くの乾燥したピート沼地を配置します。
block.cyclic.peat_unbaked.guide,"Dry Peat Bog, when placed next to water, will slowly turn into a Saturated Peat Deposit, which can be smelted to create fuel for the Generator.",水の隣に配置された場合、乾いたピート沼地はゆっくりと飽和したピート堆積物に変わり、ジェネレーターの燃料を作成するために製錬できます。
block.cyclic.pipe.guide,"Types of cables can be used to transport fluids, items, or energy between machines. They can be configured using a Cable Wrench.",ケーブルの種類は、流体、アイテム、またはエネルギーをマシン間で輸送するために使用できます。ケーブルレンチを使用して構成できます。
block.cyclic.scaffold_fragile.tooltip,Angel placement in mid-air; Decays over time,空中に設置可能；時間経過で崩壊
block.cyclic.scaffold_responsive.tooltip,Angel placement in mid-air; Breaks itself all in a line when you break the adjacent one,空中のどこでも設置可能；隣接するブロックを壊すと一列に破壊される
block.cyclic.screen.guide,"Like a slightly advanced computerized sign, used to project text into the world.Projected text may extend beyond the edges of the screen.",やや高度なコンピュータ化された看板のような機械で、テキストを世界に投影するために使用されます。投影されたテキストはスクリーンの端を超える可能性があります。
block.cyclic.soundproofing.guide,"Place to reduce the volume of nearby sounds in the world.  Multiple blocks stack together, and can be placed in close proximity for a stronger effect.  Break block or use redstone power to disable.  Config file has a setting for the radius.",配置して世界の近くの音量を低減します。複数のブロックは一緒に積み重ねることができ、より強い効果のため近接して配置できます。ブロックを破壊するか、レッドストーン信号を使用して無効化します。設定ファイルに半径の設定があります。
block.cyclic.soundproofing.tooltip,Muffles nearby sound when unpowered,パワーがない時に近くの音を消音します
block.cyclic.sponge_lava,Lava Sponge,溶岩スポンジ
block.cyclic.sponge_lava.guide,"Place and wait for some time to let it soak up nearby lava.  Source lava is not recoverable, it is deleted by the sponge",配置して、時間を置いて周囲の溶岩を吸収させます。ソース溶岩は回収不可能で、スポンジで削除されます
block.cyclic.sponge_lava.tooltip,Eats up nearby lava source blocks,近くの溶岩ソースブロックを吸収します
block.cyclic.sponge_milk,Potion Sponge,ポーション吸収器
block.cyclic.sponge_milk.guide,When placed it will clear potions from creatures and players in the area.  Break and replace to trigger again,配置時に、その地域の生き物やプレイヤーからポーションをクリアします。破壊して再度配置するとトリガーされます
block.cyclic.sponge_milk.tooltip,When placed it clears all potions from nearby entities,配置時に近くのエンティティのすべてのポーションをクリア
block.cyclic.tank.guide,"The Fluid Storage Tank is the big brother of the Cask, able to store more fluid in a single block.",流体貯蔵タンクは樽の大きな兄弟で、単一ブロックでより多くの流体を貯蔵できます。
block.cyclic.teleport,Teleportation Platform,テレポーテーションプラットフォーム
block.cyclic.teleport.guide,Place and feed with energy.  Use a GPS Location device to track a target destination for the teleport.  Crouch to use,配置してエネルギーを供給します。GPSロケーションデバイスを使用してテレポートの目的地を追跡します。スニークして使用します
block.cyclic.teleport.tooltip,Teleport player using energy,エネルギーを使用してプレイヤーをテレポート
block.cyclic.uncrafter.guide,This will lookup and reverse any vanilla 2x2 or 3x3 recipe.  May not work with specialized modded recipes / machine recipes.,これはバニラの2x2または3x3レシピを検索して逆転させます。特殊なModded化されたレシピ/マシンレシピでは機能しないことがあります。
block.cyclic.user.entities.false,Block interactions only,ブロック相互作用のみ
block.cyclic.user.entities.true,Entity interactions only,エンティティ相互作用のみ
block.cyclic.user.hand,Checked means Attack interaction (left click),チェックされている場合は攻撃相互作用(左クリック)
block.cyclic.user.type.false,Use item interaction (right click),アイテム使用相互作用(右クリック)
block.cyclic.user.type.true,Hit attack target (left click),攻撃ターゲット(左クリック)
block.cyclic.water_candle.guide,"The Water Candle can be lit by a player to increase the rate at which mobs naturally spawn nearby.For the candle to work, mobs must be able to spawn naturally in its vicinity.In most cases, this means it must be dark enough to spawn mobs!",水のろうそくはプレイヤーが点灯させて、近くでモブが自然にスポーンする速度を上げるために使用されます。ろうそくが機能するには、モブがその近くで自然にスポーンできる必要があります。ほとんどの場合、これはモブをスポーンさせるのに十分な暗さである必要があります！
block.cyclic.water_candle.tooltip,Increases mob spawns while lit,点灯時のモブスポーンを増加
block.cyclic.waxed_redstone,Waxed Redstone,ワックスレッドストーン
block.cyclic.waxed_redstone.guide,Uses max 15 redstone power similar to a Redstone block. Facing state based on where you face when item is used. Only one face of the block is powered,レッドストーンブロックのような最大15レッドストーン信号を使用。アイテム使用時に向く方向に基づくファイシング状態。ブロックのフェースは1面だけがパワー
block.cyclic.waxed_redstone.tooltip,Redstone Block limited to one facing side,1側面に限定されたレッドストーンブロック
block.cyclic.wireless_receiver.guide,"The Wireless Redstone Transmitter and Receiver allow you to transmit redstone signals between distant points.Place a Wireless Receiver in the world and use a GPS Marker on it to store its coordinates. Then insert the GPS Marker into a Redstone Transmitter.Anytime the Transmitter receives a redstone signal, it will cause all linked Receivers to receive the same signal.",無線レッドストーン送信器と受信器により、遠くのポイント間でレッドストーン信号を伝送できます。世界に無線受信器を配置し、GPSマーカーを使用してその座標を保存します。次にGPSマーカーをレッドストーン送信器に挿入します。送信器がレッドストーン信号を受け取るたびに、すべてのリンクされた受信器が同じ信号を受け取ります。
block.cyclic.wireless_redstone.guide,"The Wireless Redstone Transmitter and Receiver allow you to transmit redstone signals between distant points.Place a Wireless Receiver in the world and use a GPS Marker on it to store its coordinates. Then insert the GPS Marker into a Redstone Transmitter.Anytime the Transmitter receives a redstone signal, it will cause all linked Receivers to receive the same signal.",無線レッドストーン送信器と受信器により、遠くのポイント間でレッドストーン信号を伝送できます。世界に無線受信器を配置し、GPSマーカーを使用してその座標を保存します。次にGPSマーカーをレッドストーン送信器に挿入します。送信器がレッドストーン信号を受け取るたびに、すべてのリンクされた受信器が同じ信号を受け取ります。
block.cyclic.wireless_transmitter.guide,"The Wireless Redstone Transmitter and Receiver allow you to transmit redstone signals between distant points.Place a Wireless Receiver in the world and use a GPS Marker on it to store its coordinates. Then insert the GPS Marker into a Redstone Transmitter.Anytime the Transmitter receives a redstone signal, it will cause all linked Receivers to receive the same signal.",無線レッドストーン送信器と受信器により、遠くのポイント間でレッドストーン信号を伝送できます。世界に無線受信器を配置し、GPSマーカーを使用してその座標を保存します。次にGPSマーカーをレッドストーン送信器に挿入します。送信器がレッドストーン信号を受け取るたびに、すべてのリンクされた受信器が同じ信号を受け取ります。
curios.identifier.quiver,Quiver,矢筒
cyclic.gui.uncrafter.config,Blocked by config,設定によりブロックされています
cyclic.gui.uncrafter.norecipe,No recipe,レシピがありません
cyclic.gui.uncrafter.noroom,Output blocked,出力がブロックされています
cyclic.screen.xp,XP,経験値
effect.cyclic.antigravity,Anti-gravity,アンチグラビティ
effect.cyclic.antigravity.description,"You partially resist the force of gravity.  Low levels feel like the moon, higher levels get dangerous",あなたは重力の力に部分的に抵抗します。低レベルは月のような感じがし、高レベルは危険になります
effect.cyclic.attack_range,Attack Range,攻撃範囲
effect.cyclic.blind,Blindness,視力喪失
effect.cyclic.bounce,Bouncing,バウンシング
effect.cyclic.butter,Butterfingers,バターフィンガー
effect.cyclic.flight,Flight,飛行
effect.cyclic.flight.description,Players can fly using this effect,このエフェクトで飛行できるようになります
effect.cyclic.frost_walker,Frost Walker,氷の歩行者
effect.cyclic.gravity,Gravity,重力
effect.cyclic.gravity.description,Increases the force of gravity you feel,受ける重力の力が増加します
effect.cyclic.hunger,Hunger,飢餓
effect.cyclic.levitation,Levitation,浮遊
effect.cyclic.magnetic,Magnetism,磁力
effect.cyclic.reach_distance,Reach Distance,リーチ距離
effect.cyclic.resistance,Resistance,耐性
effect.cyclic.snowwalk,Snow-walker,雪歩き
effect.cyclic.wither,Wither,ウィザー
enchantment.cyclic.laststand,Last Stand,最後の戦い
enchantment.cyclic.laststand.activated,Last Stand activated,最後の砦が発動しました
enchantment.cyclic.laststand.desc,Prevents killing blows at the cost of experience,致命傷を防ぎますが経験値を消費します
enchantment.cyclic.laststand.guide,"Leg armor by design. If you take lethal damage, and have enough EXP points to spare (30 default at level 1) then the damage is mostly prevented leaving you at 1/2 heart and the experience points are spent. Not compatible with mending, xp boost, launch, thorns",レッグアーマーの設計。致命傷を受け、十分なEXPポイント(レベル1ではデフォルト30)を持っている場合、ダメージはほぼ防がれ、体力は1/2ハートに落ち、経験値ポイントが消費されます。修繕、経験値増加、マルチジャンプ、トゲと互換性がありません
enchantment.cyclic.launch.desc,"Gives you the power of multi jump (double jump) when enchanted on boots or elytra.  One extra jump per level, after that cooldown kicks in; sneak to jump normally.",ブーツまたはエリトラにエンチャントすると、マルチジャンプ(二段ジャンプ)の力が得られます。レベルごとに1回の追加ジャンプ、その後クールダウンが発動します。スニークで通常ジャンプができます
enchantment.cyclic.launch.guide,"Gives you the power of multi jump (double jump) when enchanted on boots or elytra.  One extra jump per level, after that cooldown kicks in; sneak to jump normally.",ブーツまたはエリトラにエンチャントすると、マルチジャンプ(二段ジャンプ)の力が得られます。レベルごとに1回の追加ジャンプ、その後クールダウンが発動します。スニークで通常ジャンプができます
enchantment.cyclic.steady,Steady Body,安定した体
enchantment.cyclic.steady.desc,Prevents knockback during combat,戦闘中のノックバックを防ぎます
enchantment.cyclic.steady.guide,Combat knockback events are cancelled while wearing at least one level on this anywhere (does not stack),装備中のどの場所にでも少なくとも1レベルを装備すると、戦闘のノックバックイベントがキャンセルされます(重複しません)
fluid.cyclic.biomass.guide,Combine solid Biomass with various organic material in a Melter to create Fluid Biomass.,固体バイオマスを溶融炉で様々な有機材料と組み合わせて、液体バイオマスを生成します
fluid.cyclic.honey.guide,Fluid Honey can be extracted from honey byproducts in a Melting Chamber and is used in a Solidification Chamber.,液体ハチミツは融解チャンバーでハチミツ副産物から抽出でき、固化チャンバーで使用されます
fluid.cyclic.magma.guide,Fluid Magma can be extracted from Magma Blocks or Magma Cream in a  Melting Chamber and is used in a Solidification Chamber.,液体マグマは融解チャンバーでマグマブロックまたはマグマクリームから抽出でき、固化チャンバーで使用されます
fluid.cyclic.slime.guide,Fluid Slime can be extracted from Slimeballs or Slime Blocks in a  Melting Chamber and is used in a Solidification Chamber.,液体スライムは融解チャンバーでスライムボールまたはスライムブロックから抽出でき、固化チャンバーで使用されます
fluid.cyclic.wax.guide,An empty honeycomb can be melted into wax.  See recipes in Melting Chamber and Solidification Chamber.,空のハニカムを蝋に溶かすことができます。融解チャンバーと固化チャンバーのレシピを参照してください
fluid.cyclic.xpjuice.guide,Fluid Experience is created and used by the Experience Pylon.,液体経験値は経験値パイロンによって生成・使用されます
fluid_type.cyclic.biomass,Liquid Biomass,液体バイオマス
fluid_type.cyclic.honey,Liquid Honey,液体ハチミツ
fluid_type.cyclic.magma,Liquid Magma,マグマ
fluid_type.cyclic.slime,Liquid Slime,液体スライム
fluid_type.cyclic.wax,Liquid Wax,液体ワックス
fluid_type.cyclic.xpjuice,Liquid Experience,液体経験値
gui.cyclic.render1,Preview Shadow,プレビュー(影付き)
gui.cyclic.render2,Preview Outline,プレビュー(輪郭)
guide.category.items,Tools and Items,ツール・アイテム
