key,source_text,target_text
item.cyclic.charm_longfall.guide,"Immune to fall damage, and cactus and sweetberry damage",落下ダメージ、サボテン、スイートベリーダメージから免疫
item.cyclic.charm_longfall.tooltip,Immune to fall damage,落下ダメージから免疫
item.cyclic.charm_luck,Harlequin Ring of Luck,ハーレクインの幸運の指輪
item.cyclic.charm_luck.guide,"Increase players passive luck attribute, which affects some loot tables such as mobs, fishing, treasure chests.  Default is 10 points, depends on config file ",プレイヤーのパッシブな幸運属性を増加させ、モブ、釣り、宝箱などのいくつかのルートテーブルに影響します。  デフォルトは10ポイント、コンフィグファイルに依存します
item.cyclic.charm_luck.tooltip,Increase player luck,プレイヤーの幸運を増加させる
item.cyclic.charm_magicdefense,Arcane Relic,秘術の遺物
item.cyclic.charm_magicdefense.guide,All magic that wearer takes is reduced while this is worn in inventory or curios.  Can be disabled with right click just like other baubles,これがインベントリまたはキュリオスで装備されている間、装備者が受けるすべての魔法が削減されます。他のボーブルのような右クリックで無効にできます
item.cyclic.charm_magicdefense.tooltip,Magic damage taken decreased by 50%,受ける魔法ダメージが50%減少
item.cyclic.charm_speed,Speed Charm,スピードチャーム
item.cyclic.charm_speed.guide,"Gives you a passive speed boost, can be stacked with speed potions.  Default is 50 percent boost, depends on config file.  Right click in your inventory to turn it off.  ",受動的な速度ブーストを与え、速度ポーションと積み重ねることができます。  デフォルトは50%のブースト、コンフィグファイルに依存します。  インベントリで右クリックしてオフにします。
item.cyclic.charm_speed.tooltip,Increase movement speed,移動速度を増加させる
item.cyclic.charm_starvation,Everlasting Rock Candy,永遠の岩塩キャンディ
item.cyclic.charm_starvation.guide,Immune to damage and death by starvation,飢えと死によるダメージから免疫
item.cyclic.charm_starvation.tooltip,Immune to damage and death by starvation,飢えと死によるダメージから免疫
item.cyclic.charm_stealthpotion,Runic Signet of Alchemy,錬金術のルーン署名
item.cyclic.charm_stealthpotion.guide,"Disables potion particles at the moment you gain the effect, or drink the potion.  Does not work on existing effects, so if you drink a potion and then equip it does not know",効果を得た瞬間またはポーションを飲んだ瞬間にポーション粒子を無効にします。既存の効果では機能しないため、ポーションを飲んで装備しても認識されません
item.cyclic.charm_stealthpotion.tooltip,Disables potion particles,ポーション粒子を無効にする
item.cyclic.charm_stone,Ethereal Circlet,エーテルの冠
item.cyclic.charm_stone.guide,Prevents damage when elytra crashing into walls.  Also suffocation if you noClip or teleport into solid wall of blocks,エリトラが壁に衝突するときのダメージを防ぎます。noClipまたは固いブロック壁にテレポートされた場合も窒息ダメージを防ぎます
item.cyclic.charm_stone.tooltip,Immune to suffocation & elytra crash damage,窒息とエリトラ衝突ダメージから免疫
item.cyclic.charm_torch,Torch Charm,懐中電灯チャーム
item.cyclic.charm_torch.guide,"Whenever this detects darkness at your feet, it places a torch there and drains some durability.  Right click in your inventory to turn it off.",足元の暗闇を検出するたびに、ここに松明を置いて耐久度を消費します。インベントリで右クリックしてオフにできます。
item.cyclic.charm_torch.tooltip,Torches the darkness at your feet while in your inventory,インベントリの足元の暗さに懐中電灯を置く
item.cyclic.charm_torch_cave,Caving Torch Charm,洞窟懐中電灯チャーム
item.cyclic.charm_torch_cave.guide,"Detects darkness in an area around you and places torches where necessary, draining some durability.  Right click in your inventory to turn it off.",周囲の暗さを検出し、必要に応じて懐中電灯を置き、いくらかの耐久度を消費します。インベントリで右クリックしてオフにします。
item.cyclic.charm_torch_cave.tooltip,Torches your dark surroundings while in your inventory,インベントリの暗い周囲に懐中電灯を置く
item.cyclic.charm_ultimate,Charm Talisman,チャームタリスマン
item.cyclic.charm_venom,Spiderfang Amulet,スパイダーファングアミュレット
item.cyclic.charm_venom.guide,"When damage dealt from the player as a source, this adds a chance to give the poison potion effect for a few seconds on the target",プレイヤーからのダメージが与えられた場合、これは数秒間、ターゲットに毒ポーション効果を与える機会を追加します
item.cyclic.charm_venom.tooltip,Attacks have 25% chance to poison target,攻撃に25%の確率で毒効果
item.cyclic.charm_void,Void Charm,ボイドチャーム
item.cyclic.charm_void.guide,Works in your inventory or in a Baubles slot.  This charm saves you from the void; it detects if you have fallen down below y=-30 and teleports you way up into the sky instead.,インベントリまたはボーブルスロットで機能します。このチャームはあなたを虚空から救います。y=-30未満に落下したことを検出し、代わりに空高くテレポートします。
item.cyclic.charm_void.tooltip,Saves you from falling into the void,ボイドへの落下から救う
item.cyclic.charm_water,Waterbreathing Charm,水中呼吸チャーム
item.cyclic.charm_water.guide,Prevent drowning damage after air is empty,空気が空になった後、溺れダメージを防ぐ
item.cyclic.charm_water.tooltip,Immune to Drowning Damage,溺れダメージから免疫
item.cyclic.charm_wing,Parachute Pauldrons,パラシュートショルダーアーマー
item.cyclic.charm_wing.guide,"Protects you from falling long distances.  If this is on when you fall more than six blocks, it gives you a short burst of the Slowfall potion effect, which is just like a parachute.  Right click in your inventory to turn it off.",長距離の落下から保護します。落下時にこれがオンになっていて6ブロック以上落下すると、パラシュートのような低速落下ポーション効果の短いバーストが与えられます。インベントリで右クリックしてオフにします。
item.cyclic.charm_wing.tooltip,Grants slowfall after falling far enough,十分に落下した後、低速落下を付与
item.cyclic.charm_wither,Wither Charm,ウィザーチャーム
item.cyclic.charm_wither.guide,"When in your inventory or worn as an accessory, protects you from the Wither status effect at the expense of durability.",インベントリにあるか、アクセサリーとして装備しているとき、耐久度を消費してウィザーステータス効果から保護します。
item.cyclic.charm_wither.tooltip,Wither protection,ウィザー保護
item.cyclic.charm_world,Ender Wing,エンダーウィング
item.cyclic.charm_world.guide,Warps you to world spawn at the cost of durability.,耐久度を消費してワールドスポーンにワープします。
item.cyclic.charm_world.tooltip,Teleport to world-spawn,ワールドスポーンにテレポート
item.cyclic.charm_xp_blocker,Cursed Ring of Experience,呪いの経験の指輪
item.cyclic.charm_xp_blocker.guide,Blocks pickup of XP Orbs.  They are still attracted to and float around the player,XPオーブのピックアップをブロックします。それでもプレイヤーに引き寄せられ、周りを浮かぶ
item.cyclic.charm_xp_blocker.tooltip,Blocks pickup of XP Orbs,XPオーブのピックアップをブロック
item.cyclic.charm_xp_speed,Ring of Experience,経験の指輪
item.cyclic.charm_xp_speed.guide,Pickup XP Orbs as fast as possible by removing the internal cooldown on pickup,内部クールダウンをピックアップから削除することで、できるだけ早くXPオーブをピックアップします
item.cyclic.charm_xp_speed.tooltip,Pickup XP Orbs as fast as possible,できるだけ早くXPオーブをピックアップ
item.cyclic.chorus_flight,Glistering Chorus Fruit,きらめくコーラスフルーツ
item.cyclic.chorus_flight.guide,A balanced way to get the power of flight.  Gives you a few (stackable) minutes of creative flight each time its eaten.  Use milk to remove.,飛行力を手に入れる準栄養的な方法です。これを食べるたびに数分間（スタック可能）の創造モード飛行を得ます。牛乳で削除できます。
item.cyclic.chorus_flight.tooltip,A burst of flight,飛行のバースト
item.cyclic.chorus_spectral,Corrupted Chorus Fruit,破損したコーラスフルーツ
item.cyclic.chorus_spectral.guide,"Eat this to phase through walls for a few seconds. Does not include flight, you will fall into the void without extra items or abilities, and you can get stuck inside a wall",これを食べると、数秒間、壁を通り抜けられます。フライトを含まず、追加アイテムまたは能力なしで虚空に落ちます。壁内に留まることができます
item.cyclic.chorus_spectral.tooltip,Grants the curse of noClip,noClipの呪いを付与
item.cyclic.crafting_bag,Advanced Crafting Stick,高度なクラフトスティック
item.cyclic.crafting_bag.guide,Handheld crafting table with an inventory that is saved in itself like a backpack,バックパックのようにインベントリを保存する携帯型作業台
item.cyclic.crafting_bag.tooltip,Saves inventory,インベントリを保存
item.cyclic.crafting_stick,Crafting Stick,クラフトスティック
item.cyclic.crafting_stick.guide,Handheld crafting table.  Does not preserve its inventory,携帯型作業台。インベントリを保持しません
item.cyclic.crafting_stick.tooltip,Handheld crafting table,携帯型作業台
item.cyclic.crystal_axe,Crystal Axe,水晶斧
item.cyclic.crystal_boots,Crystallized Obsidian Boots,結晶化された黒曜石のブーツ
item.cyclic.crystal_chestplate,Crystallized Obsidian Chestplate,結晶化された黒曜石のチェストプレート
item.cyclic.crystal_gear,Crystallized Obsidian Gear,結晶化された黒曜石ギア
item.cyclic.crystal_gear.guide,Crystallized Obsidian gear is very strong (and very expensive as a result). Much stronger than Netherite gear.,結晶化された黒曜石ギアは非常に強力です(そしてそれの結果として非常に高価です)。ネザライト装備よりもはるかに強力です。
item.cyclic.crystal_helmet,Crystallized Obsidian Helmet,結晶化された黒曜石のヘルメット
item.cyclic.crystal_hoe,Crystal Hoe,水晶クワ
item.cyclic.crystal_leggings,Crystallized Obsidian Leggings,結晶化された黒曜石のレギンス
item.cyclic.crystal_pickaxe,Crystal Pickaxe,水晶のツルハシ
item.cyclic.crystal_shovel,Crystal Shovel,結晶のシャベル
item.cyclic.crystal_sword,Crystal Sword,水晶剣
item.cyclic.diamond_carrot_health,Diamond Carrot,ダイヤモンドの人参
item.cyclic.diamond_carrot_health.tooltip,Increase horse max health,馬の最大体力を増加させる
item.cyclic.elevation_wand,Rod of Elevation,上昇の棒
item.cyclic.elevation_wand.guide,"Teleporter that works only vertically, and only if it can find an empty space with a surface above.  Works on yourself, or target another entity.",垂直方向にのみ機能し、上に表面がある空のスペースが見つかった場合にのみ機能するテレポーター。自分自身で機能するか、別のエンティティを対象にします。
item.cyclic.elevation_wand.tooltip,Teleport yourself or the target entity up to the nearest surface above,自分または対象エンティティを上の最も近い表面にテレポート
item.cyclic.emerald_axe,Emerald Axe,エメラルド斧
item.cyclic.emerald_boots,Emerald Boots,エメラルドブーツ
item.cyclic.emerald_carrot_jump,Emerald Carrot,エメラルドニンジン
item.cyclic.emerald_carrot_jump.tooltip,Increase horse jump height,馬のジャンプの高さを増加させる
item.cyclic.emerald_chestplate,Emerald Chestplate,エメラルドチェストプレート
item.cyclic.emerald_gear,Emerald Gear,エメラルドギア
item.cyclic.emerald_gear.guide,Equipment and armor made from Emeralds. Stronger than diamond equipment.,エメラルドで作られた装備と装甲。ダイヤモンド装備より強力です。
item.cyclic.emerald_helmet,Emerald Helmet,エメラルドヘルメット
item.cyclic.emerald_hoe,Emerald Hoe,エメラルドクワ
item.cyclic.emerald_leggings,Emerald Leggings,エメラルドのレギンス
item.cyclic.emerald_pickaxe,Emerald Pickaxe,エメラルドのツルハシ
item.cyclic.emerald_shovel,Emerald Shovel,エメラルドシャベル
item.cyclic.emerald_sword,Emerald Sword,エメラルドの剣
item.cyclic.ender_bag,Ender Sack,エンダーサック
item.cyclic.ender_bag.guide,"The Ender Bag provides a portable interface to your Ender Chest. Anything you store in your Ender Chest inventory can be accessed via the Ender Bag, and vice versa.",エンダーサックはエンダーチェストへのポータブルインターフェースを提供します。エンダーチェストインベントリに保存したものはエンダーサック経由でアクセスでき、その逆も同様です。
item.cyclic.ender_bag.tooltip,Portable Ender Chest,ポータブルエンダーチェスト
item.cyclic.ender_book,Ender Book,エンダーの本
item.cyclic.ender_book.countdown,Teleporting in ,移動中
item.cyclic.ender_book.start,Teleporting... (jump to cancel)  ,移動中…（ジャンプでキャンセル）
item.cyclic.ender_book.tooltip,Crouch to teleport or scroll through locations,しゃがみでテレポートまたはスクロールで位置選択
item.cyclic.ender_eye_reuse,Solid Ender Eye,固体のエンダーアイ
item.cyclic.ender_eye_reuse.guide,Reuseable Ender Eye for finding strongholds. Can be thrown multiple times and will not break.,要塞を探すための再利用可能なエンダーアイ。複数回投げることができ、壊れません。
item.cyclic.ender_eye_reuse.tooltip,Reuseable ender eye for finding strongholds,強固地を探すための再利用可能エンダーアイ
item.cyclic.ender_pearl_mounted,Ender Orb Translocator,エンダーオーブ転送機
item.cyclic.ender_pearl_mounted.guide,An enhanced Ender Pearl that also carries the user when thrown.,投げると使用者も運ぶ強化版エンダーパール。
item.cyclic.ender_pearl_mounted.tooltip,Reuseable ender pearl that carries you,あなたも運ぶ再利用可能なエンダーパール
item.cyclic.ender_pearl_reuse,Ender Orb,エンダーオーブ
item.cyclic.ender_pearl_reuse.guide,"An Ender Pearl that can be thrown, picked up, and thrown again.",投げたり、拾ったり、また投げたりできるエンダーパール。
item.cyclic.ender_pearl_reuse.tooltip,Reuseable ender pearl,再利用可能なエンダーパール
item.cyclic.ender_tnt_1,Dynamite I,ダイナマイトI
item.cyclic.ender_tnt_1.guide,Throw these to make explosions.  There are six different levels of power.  These are standard normal explosions with no special properties.,これを投げて爆発を起こします。6つの異なる威力レベルがあります。これらは特殊な性質を持たない通常の爆発です。
item.cyclic.ender_tnt_1.tooltip,1/3 power of creeper,クリーパーの1/3の威力
item.cyclic.ender_tnt_2,Dynamite II,ダイナマイトII
item.cyclic.ender_tnt_2.guide,2/3 power of creeper,クリーパーの2/3の威力
item.cyclic.ender_tnt_2.tooltip,2/3 power of creeper,クリーパーの2/3の威力
item.cyclic.ender_tnt_3,Dynamite III,ダイナマイトIII
item.cyclic.ender_tnt_3.guide,Same power as creeper,クリーパーと同じパワー
item.cyclic.ender_tnt_3.tooltip,Same power as creeper,クリーパーと同じパワー
item.cyclic.ender_tnt_4,Dynamite IV,ダイナマイトIV
item.cyclic.ender_tnt_4.guide,1/3 power of charged creeper; Same strength as TNT,チャージクリーパーの1/3の威力。TNTと同じ強度
item.cyclic.ender_tnt_4.tooltip,1/3 power of charged creeper; Same strength as TNT,チャージクリーパーの1/3の威力。TNTと同じ強度
item.cyclic.ender_tnt_5,Dynamite V,ダイナマイトV
item.cyclic.ender_tnt_5.guide,2/3 power of charged creeper,チャージクリーパーの2/3の威力
item.cyclic.ender_tnt_5.tooltip,2/3 power of charged creeper,チャージクリーパーの2/3の威力
item.cyclic.ender_tnt_6,Dynamite VI,ダイナマイトVI
item.cyclic.ender_tnt_6.guide,Same power as charged creeper; Same strength as Ender Crystal,チャージクリーパーと同じ威力。エンダークリスタルと同じ強度
item.cyclic.ender_tnt_6.tooltip,Same power as charged creeper; Same strength as Ender Crystal,チャージクリーパーと同じ威力。エンダークリスタルと同じ強度
item.cyclic.ender_torch,Throwing Torch,投げられる松明
item.cyclic.ender_torch.guide,A throwable torch.  This places a torch in the world wherever it lands.,投げられる松明。着地した場所に松明を設置します。
item.cyclic.ender_torch.tooltip,Throwable Torch,投げられる松明
item.cyclic.ender_water,Antimatter Evaporator,反物質蒸発装置
item.cyclic.ender_water.guide,"Vaporize nearby liquid, three modes of water, lava, generic liquid",近くの液体を蒸発させます。水、溶岩、汎用液体の3つのモードがあります
item.cyclic.ender_water.tooltip,Vaporize nearby liquid,近くの液体を蒸発させる
item.cyclic.ender_wool,Enhanced Shears,強化された剪定器
item.cyclic.ender_wool.guide,Throw a bunch of these at a herd of sheeep to shear them all at a distance.  Gives a slight bonus to wool drops compared to regular shears.,羊の群れに向かってこれらを投げて、遠距離からすべてを刈ります。通常のハサミに比べ、羊毛ドロップにわずかなボーナスがあります。
item.cyclic.ender_wool.tooltip,Launches magic shears,魔法のシャベルを発射
item.cyclic.evoker_fang,Evoker Fang,エボーカーの Fang
item.cyclic.evoker_fang.guide,Summons a beam of Evoker Fangs in whatever direction youre facing.  Must be used on an entity or a block.,向いている方向に唱術師の牙のビームを召喚します。エンティティまたはブロックで使用する必要があります。
item.cyclic.evoker_fang.tooltip,Summons the secret magic of the Evoker Illager,唱術師の秘密の魔法を召喚する
item.cyclic.experience_food,Experience Confection,経験値菓子
item.cyclic.experience_food.guide,"Created by using the Experience Pylon, and the Solidifier.  Eat the confection to gain the experience held within, or use it on an Experience Pylon to put experience back into the pylon.",経験値パイロンと固化装置を使用して作成します。菓子を食べて保有している経験値を獲得するか、経験値パイロンで使用して経験値をパイロンに戻します。
item.cyclic.experience_food.tooltip,Eat to gain experience,食べて経験値を獲得
item.cyclic.filter_data,Filter Data Card,フィルターデータカード
item.cyclic.filter_data.guide,Fill with items to adjust machine or cable settings that are filtered,アイテムで満たしてマシンまたはケーブルの設定をフィルター対応で調整する
item.cyclic.filter_data.tooltip,Holds items and settings used for filters,フィルターで使用するアイテムと設定を保有
item.cyclic.fire_dark.guide,Does not burn players or destroy blocks.,プレイヤーを燃やしたりブロックを破壊したりしません。
item.cyclic.fire_dark_anim,Duskflame Essence,薄暮炎エッセンス
item.cyclic.fire_dark_anim.guide,Used for Duskflame Hex,ダスクフレイム・ヘックス用
item.cyclic.fire_dark_anim.tooltip,Used for Duskflame Hex,ダスクフレイム・ヘックス用
item.cyclic.fire_killer.tooltip,Extinguish nearby fire,近くの火を消す
item.cyclic.fire_scepter,Duskflame Hex,ダスクフレイム・ヘックス
item.cyclic.fire_scepter.guide,Launch three projectiles that burn and damage entities.  Does not set fire to the world.,3つの発射体を発射して、エンティティを燃やしてダメージを与えます。世界に火をつけません。
item.cyclic.flippers,Flippers,フィン
item.cyclic.flippers.tooltip,Increase swim speed,水中移動速度を上げる
item.cyclic.gem.guide.title,Gems,宝石
item.cyclic.gem_amber,Crystallized Amber,結晶化した琥珀
item.cyclic.gem_amber.tooltip,Crafting material,クラフト材料
item.cyclic.gem_obsidian,Crystallized Obsidian,結晶化した黒曜石
item.cyclic.gem_obsidian.tooltip,Crafting material,クラフト材料
item.cyclic.glove_climb,Climbing Gloves,クライミンググローブ
item.cyclic.glove_climb.tooltip,Climb any vertical surface,任意の垂直面を登れる
item.cyclic.glowing_helmet,Vision Helmet,ビジョンヘルメット
item.cyclic.glowing_helmet.guide,"Enables glowing night vision while worn, you can also turn it on and off by right-clicking (works in most inventory screens)",装備中は明るい暗視ができます。右クリックでオン/オフを切り替えることもできます（ほとんどのインベントリ画面で動作）。
item.cyclic.glowing_helmet.tooltip,Glowing night vision,発光する暗視
item.cyclic.guide,Cyclic Guide Book,Cyclicガイドブック
item.cyclic.heart,Heart Container,ハートの器
item.cyclic.heart.guide,"When consumed, grants the player 1 permanent, extra heart. Multiple can be consumed for additional hearts.  Config file specifies the maximum number of hearts allowed, default is 20. ",消費されると、プレイヤーに1つの永続的な追加ハートを与えます。 複数を消費して追加のハートを獲得できます。  コンフィグファイルは許可されたハートの最大数を指定し、デフォルトは20です。
item.cyclic.heart.tooltip,+1 Heart,+1 体力
item.cyclic.heart_empty,Empty Heart Container,空のハートコンテナ
item.cyclic.heart_empty.tooltip,-1 Heart +500 Experience,-1ハート +500経験値
item.cyclic.honey_bucket,Honey Bucket,はちみつバケツ
item.cyclic.ice_scepter,Frost Bringer,フロスト・ブリンガー
item.cyclic.ice_scepter.tooltip,Shoot ice that will stun enemies,敵を気絶させる氷を発射
item.cyclic.inventory_cake,Ender Inventory Cake,エンダーインベントリケーキ
item.cyclic.inventory_cake.guide,Eating this will unlock a second inventory screen.  ,これを食べると第二インベントリ画面が解放されます。  
item.cyclic.inventory_cake.tooltip,Eat to gain a permanent magical backpack,食べて永続的な魔法のバックパックを獲得
item.cyclic.lapis_carrot_variant,Lapis Carrot,ラピスキャロット
item.cyclic.lapis_carrot_variant.tooltip,Change horse variant color,馬のバリアント色を変更
item.cyclic.lever_remote,Remote Lever,リモートレバー
item.cyclic.lever_remote.guide,Remote redstone lever that you bind to a lever in the world by sneaking.  Works across any distance including dimensions if the chunk is loaded.,スニークして世界のレバーに結合する遠隔レッドストーンレバー。チャンクが読み込まれていれば、ディメンション間を含めて任意の距離で動作します。
item.cyclic.lever_remote.invalid,"Invalid position, Lever not found",位置が不正です、レバーが見つかりません
item.cyclic.lever_remote.powered.false,Off,オフ
item.cyclic.lever_remote.powered.true,On,オン
item.cyclic.lever_remote.saved,Position Saved,位置を保存しました
item.cyclic.lever_remote.tooltip,Bind this to a lever in the world (shift click) to activate it remotely,レバーにこの機能をバインドし（シフトクリック）、遠隔で作動させます
item.cyclic.lightning_scepter,Engraved Thunder,刻まれた雷
item.cyclic.lightning_scepter.guide,Launch a projectile that will spawn a natural lightning bolt when it lands. ,自然雷鳴を発生させるプロジェクタイルを発射します。着地時に雷が落ちます。
item.cyclic.lightning_scepter.tooltip,Shoot lightning magic,雷魔法を発射
item.cyclic.location,GPS Data Card,GPSデータカード
item.cyclic.location.tooltip,Saves the location of a block,ブロックの位置を保存
item.cyclic.magic_net,Monster Ball,モンスターボール
item.cyclic.magic_net.tooltip,Charge and throw at a living entity to capture,生きているエンティティにチャージして投げてキャプチャ
item.cyclic.magma_bucket,Magma Bucket,マグマ入りバケツ
item.cyclic.mattock.guide,The Mattock combines the mining capability of a pickaxe with a shovel in a 3x3 pattern that treats dirt and stone type blocks equally.,マットックはツルハシのマイニング能力とシャベルを組み合わせて、土と石タイプのブロックを同等に扱う3×3パターンです。
item.cyclic.mattock.tooltip,3x3 mining; equal parts shovel and pickaxe,3×3採掘。シャベルとツルハシの両方
item.cyclic.mattock_nether,Netherite Mattock,ネザライトマットック
