key,source_text,target_text
defaultworldtype.configuration.allowed-world-types,Allowed World Types,許可された世界タイプ
defaultworldtype.configuration.disable-button,Disable Button,ボタンを無効化
defaultworldtype.configuration.flat-settings,Flatland Settings,フラットランド設定
defaultworldtype.configuration.flat-settings.tooltip,Type in a valid generation setting for flat world type. Only works if world-type if 'minecraft:flat'.,フラットワールドの有効なジェネレーション設定を入力してください。ワールドタイプが「minecraft:flat」の場合のみ機能します。
defaultworldtype.configuration.section.defaultworldtype.client.config.toml.title,Default World Type,デフォルトワールドタイプ
defaultworldtype.configuration.world-preset,World Preset,世界のプレセット
defaultworldtype.configuration.world-preset.button,Dive deeper,深く潜る
defaultworldtype.configuration.world-preset.tooltip,The name from the world type which should be selected by default,デフォルトで選択されるワールドタイプ名
defaultworldtype.tooltip.disable,Disabled by DefaultWorldType,デフォルトでは無効
