key,source_text,target_text
denseores.prefix,Dense ORENAME,高密度鉱石
denseores.command.help,Outputs the current generated textures to the 'denseoretextures' folder.,現在生成されているテクスチャを 'denseoretextures' フォルダーに出力します。
denseores.commandIdentify.help,Identifies the block's registry name and it's texture,ブロックのレジストリ名とテクスチャを識別します
denseores.commandIdentify.invalid,Currently held item is not a block,現在保持しているアイテムはブロックではありません。
denseores.commandIdentify.invalidtexture,Unable to find valid texture,有効なテクスチャが見つかりません
denseores.commandIdentify.multipleTextures,There are multiple textures available for S:baseBlockTexture,S:baseBlockTexture には複数のテクスチャがあります。
denseores.commandIdentify.start,-= Analyzing Item: %s =-,-= アイテムを解析中: %s =-
denseores.commandIdentify.obligitarydisclaimer,Disclaimer: These values are not guaranteed to be accurate,免責事項: これらの値は正確であることを保証できません
