key,source_text,target_text
subtitles.nameless_guardian.hurt,Nameless Guardian hurts,名前のないガードナーがダメージを受ける
subtitles.nameless_guardian.idle,Nameless Guardian engine roared,名もないガーディアンのエンジンが轟いた
subtitles.nameless_guardian.madness,Nameless Guardian roared,名無しの守護者が咆哮した
subtitles.nameless_guardian.pre_pounce,Nameless Guardian target locked,名もないガーディアンのターゲットがロックされた
subtitles.nameless_guardian.step,Nameless Guardian steps,名前のないガードナーが歩く
subtitles.nameless_guardian.whoosh,Axe of a Guardian whooshes,守護者の斧が鳴る
subtitles.nameless_guardian_theme_climax,Guardians climax,守護者の最期
subtitles.nameless_guardian_theme_prelude,Guardians prelude,ガーディアンズ・プレリュード
subtitles.undamaged,Illegal hit,不正な攻撃
upgrade.eeeabsmobs.ghost_warrior_upgrade,Ghost Steel Upgrade,ゴースト鋼アップグレード
