key,source_text,target_text
googlyeyes.config.prop.disabledGoogly.name,Disabled Googly Eyes,ゴグリィアイズを無効化しました
googlyeyes.config.prop.acidTripEyes.name,Acid Trip Eyes,酸のトリップ目
googlyeyes.config.prop.googlyEyeChance.name,Googly Eye Chance,目玉の確率
googlyeyes.config.prop.allPlayersHaveGooglyEyes.name,All Players Have Googly Eyes,全プレイヤーがゴーグルアイを獲得しました
googlyeyes.config.prop.acidTripEyes.comment,Let them googly eyes be trippin',グーグリーアイズがトリッピーになるようにしてください
googlyeyes.config.prop.googlyEyeChance.comment,Googly Eye chance (in %),グーグリーアイズの確率（％）
googlyeyes.config.prop.allPlayersHaveGooglyEyes.comment,Should all players have googly eyes?,すべてのプレイヤーがグーグリーアイズを持つべきですか？
