key,source_text,target_text
container.mekanism_extras.supreme_injecting_factory,Supreme Injecting Factory,至高注入ファクトリー
container.mekanism_extras.supreme_purifying_factory,Supreme Purifying Factory,至高浄化ファクトリー
container.mekanism_extras.supreme_sawing_factory,Supreme Sawing Factory,至高製材ファクトリー
container.mekanism_extras.supreme_smelting_factory,Supreme Smelting Factory,至高精錬ファクトリー
gui.mekanism_extras.energy_consumption,Consumption: %1$s,消費: %1$s
item.mekanism_extras.upgrade_creative,Creative Upgrade,クリエイティブアップグレード
item.mekanism_extras.upgrade_ionic_membrane,Ionic Membrane Upgrade,イオニックメンブレンアップグレード
item.mekanism_extras.upgrade_stack,Stack Upgrade,スタックアップグレード
pack.mekanism_extras.pack_description,Stop the flashing of Cosmic and Infinite's items and blocks,コズミックとインフィニットのアイテム・ブロックの点滅を停止する
pack.mekanism_extras.pack_name,MekE: Stop the flashing!,MekE: 点滅を止めて！
upgrade.mekanism.creative,Creative,クリエイティブ
upgrade.mekanism.creative.description,The machine does not consume energy and has no working time.,機械はエネルギーを消費せず、稼働時間もありません。
upgrade.mekanism.ionic_membrane,Ionic Membrane,アイオニックメンブレン
upgrade.mekanism.ionic_membrane.description,Ions can be filtered out from liquids.,イオンは液体からフィルタリングできる
upgrade.mekanism.stack,Stack,スタック
upgrade.mekanism.stack.description,Increase the parallel number of work.,作業の並列数を増やします。
constants.mekanism_extras.mod_name,Mekanism:Extras,
advancements.mekanism_extras.shining_alloy.title,Twinkle,
gui.mekanism_extras.upgrades.stack,Parallel: %1$sx,
item.mekanism_extras.enriched_osmium,Enriched Osmium,
advancements.mekanism_extras.creative_upgrade.title,You actually got it?,
advancements.mekanism_extras.shining_alloy.description,Try adding some antimatter to the alloy,
