key,source_text,target_text
block.mekanism_extras.absolute_bin,Absolute Bin,絶対ビン
block.mekanism_extras.absolute_chemical_tank,Absolute Chemical Tank,絶対化学タンク
block.mekanism_extras.absolute_energy_cube,Absolute Energy Cube,絶対エネルギーキューブ
block.mekanism_extras.absolute_fluid_tank,Absolute Fluid Tank,絶対液体タンク
block.mekanism_extras.absolute_induction_cell,Absolute Induction Cell,絶対インダクションセル
block.mekanism_extras.absolute_induction_provider,Absolute Induction Provider,絶対インダクションプロバイダ
block.mekanism_extras.absolute_logistical_transporter,Absolute Logistical Transporter,絶対物流トランスポーター
block.mekanism_extras.absolute_mechanical_pipe,Absolute Mechanical Pipe,絶対メカニカルパイプ
block.mekanism_extras.absolute_pressurized_tube,Absolute Pressurized Tube,絶対加圧チューブ
block.mekanism_extras.absolute_thermodynamic_conductor,Absolute Thermodynamic Conductor,絶対熱力学的コンダクター
block.mekanism_extras.absolute_universal_cable,Absolute Universal Cable,絶対ユニバーサルケーブル
block.mekanism_extras.advance_electric_pump,Advance Electric Pump,発展型電動ポンプ
block.mekanism_extras.block_naquadah,Naquadah Block,ナクアダのブロック
block.mekanism_extras.block_raw_naquadah,Raw Naquadah Block,ナクアダの原石ブロック
block.mekanism_extras.cosmic_bin,Cosmic Bin,宇宙ビン
block.mekanism_extras.cosmic_chemical_tank,Cosmic Chemical Tank,宇宙化学タンク
block.mekanism_extras.cosmic_energy_cube,Cosmic Energy Cube,宇宙エネルギーキューブ
block.mekanism_extras.cosmic_fluid_tank,Cosmic Fluid Tank,宇宙液体タンク
block.mekanism_extras.cosmic_induction_cell,Cosmic Induction Cell,宇宙インダクションセル
block.mekanism_extras.cosmic_induction_provider,Cosmic Induction Provider,宇宙インダクションプロバイダ
block.mekanism_extras.cosmic_logistical_transporter,Cosmic Logistical Transporter,宇宙物流トランスポーター
block.mekanism_extras.cosmic_mechanical_pipe,Cosmic Mechanical Pipe,宇宙メカニカルパイプ
block.mekanism_extras.cosmic_pressurized_tube,Cosmic Pressurized Tube,宇宙加圧チューブ
block.mekanism_extras.cosmic_thermodynamic_conductor,Cosmic Thermodynamic Conductor,宇宙熱力学的コンダクター
block.mekanism_extras.cosmic_universal_cable,Cosmic Universal Cable,宇宙ユニバーサルケーブル
block.mekanism_extras.end_naquadah_ore,End Naquadah Ore,エンドナクアダ鉱石
block.mekanism_extras.expand_radioactive_waste_barrel,Expand Radioactive Waste Barrel,容量拡張放射性廃棄物バレル
block.mekanism_extras.fluorinated_silicon_uranium_fuel,Liquid Fluorinated Silicon Uranium Fuel,液体フッ素化ケイ素ウラン燃料
block.mekanism_extras.infinite_bin,Infinite Bin,無限ビン
block.mekanism_extras.infinite_chemical_tank,Infinite Chemical Tank,無限化学タンク
block.mekanism_extras.infinite_energy_cube,Infinite Energy Cube,無限エネルギーキューブ
block.mekanism_extras.infinite_fluid_tank,Infinite Fluid Tank,無限液体タンク
block.mekanism_extras.infinite_induction_cell,Infinite Induction Cell,無限インダクションセル
block.mekanism_extras.infinite_induction_provider,Infinite Induction Provider,無限インダクションプロバイダ
block.mekanism_extras.infinite_logistical_transporter,Infinite Logistical Transporter,無限物流トランスポーター
block.mekanism_extras.infinite_mechanical_pipe,Infinite Mechanical Pipe,無限メカニカルパイプ
block.mekanism_extras.infinite_pressurized_tube,Infinite Pressurized Tube,無限加圧チューブ
block.mekanism_extras.infinite_thermodynamic_conductor,Infinite Thermodynamic Conductor,無限熱力学的コンダクター
block.mekanism_extras.infinite_universal_cable,Infinite Universal Cable,無限ユニバーサルケーブル
block.mekanism_extras.lead_coated_glass,Lead Coated Glass,鉛コートガラス
block.mekanism_extras.lead_coated_laser_focus_matrix,Lead Coated Laser Focus Matrix,鉛コートレーザーフォーカスマトリックス
block.mekanism_extras.naquadah_ore,Naquadah Ore,ナクアダ鉱石
block.mekanism_extras.naquadah_reactor_casing,Naquadah Reactor Casing,ナクアダリアクター筐体
block.mekanism_extras.naquadah_reactor_controller,Naquadah Reactor Controller,ナクアダリアクター制御装置
block.mekanism_extras.naquadah_reactor_logic_adapter,Naquadah Reactor Logic Adapter,ナクアダリアクター論理アダプター
block.mekanism_extras.naquadah_reactor_port,Naquadah Reactor Port,ナクアダリアクターポート
block.mekanism_extras.polonium-208,Polonium-208,ポロニウム208
block.mekanism_extras.polonium_containing_solution,Polonium Containing Solution,ポロニウム含有溶液
block.mekanism_extras.reinforced_induction_casing,Reinforced Induction Casing,強化インダクションケーシング
block.mekanism_extras.reinforced_induction_port,Reinforced Induction Port,強化インダクションポート
block.mekanism_extras.rich_silicon_fuel,Liquid Rich Silicon Fuel,液体リッチケイ素燃料
block.mekanism_extras.rich_uranium_fuel,Liquid Rich Uranium Fuel,液体リッチウラン燃料
block.mekanism_extras.silicon_tetrafluoride,Liquid silicon Tetrafluoride,液体四フッ化ケイ素
block.mekanism_extras.supreme_bin,Supreme Bin,至高ビン
block.mekanism_extras.supreme_chemical_tank,Supreme Chemical Tank,至高化学タンク
block.mekanism_extras.supreme_energy_cube,Supreme Energy Cube,至高エネルギーキューブ
block.mekanism_extras.supreme_fluid_tank,Supreme Fluid Tank,至高液体タンク
block.mekanism_extras.supreme_induction_cell,Supreme Induction Cell,至高インダクションセル
block.mekanism_extras.supreme_induction_provider,Supreme Induction Provider,至高インダクションプロバイダ
block.mekanism_extras.supreme_logistical_transporter,Supreme Logistical Transporter,至高物流トランスポーター
block.mekanism_extras.supreme_mechanical_pipe,Supreme Mechanical Pipe,至高メカニカルパイプ
block.mekanism_extras.supreme_pressurized_tube,Supreme Pressurized Tube,至高加圧チューブ
block.mekanism_extras.supreme_thermodynamic_conductor,Supreme Thermodynamic Conductor,至高熱力学的コンダクター
block.mekanism_extras.supreme_universal_cable,Supreme Universal Cable,至高ユニバーサルケーブル
container.mekanism_extras.absolute_chemical_tank,Absolute Chemical Tank,絶対化学タンク
container.mekanism_extras.absolute_energy_cube,Absolute Energy Cube,絶対エネルギーキューブ
container.mekanism_extras.absolute_fluid_tank,Absolute Fluid Tank,絶対液体タンク
container.mekanism_extras.advance_electric_pump,Advance Electric Pump,発展型電動ポンプ
container.mekanism_extras.cosmic_chemical_tank,Cosmic Chemical Tank,宇宙化学タンク
container.mekanism_extras.cosmic_energy_cube,Cosmic Energy Cube,宇宙エネルギーキューブ
container.mekanism_extras.cosmic_fluid_tank,Cosmic Fluid Tank,宇宙液体タンク
container.mekanism_extras.infinite_chemical_tank,Infinite Chemical Tank,無限化学タンク
container.mekanism_extras.infinite_energy_cube,Infinite Energy Cube,無限エネルギーキューブ
container.mekanism_extras.infinite_fluid_tank,Infinite Fluid Tank,無限液体タンク
container.mekanism_extras.naquadah_reactor_logic_adapter,Naquadah Reactor Logic Adapter,ナクアダリアクター論理アダプター
container.mekanism_extras.supreme_chemical_tank,Supreme Chemical Tank,至高化学タンク
container.mekanism_extras.supreme_energy_cube,Supreme Energy Cube,至高エネルギーキューブ
container.mekanism_extras.supreme_fluid_tank,Supreme Fluid Tank,至高液体タンク
description.mekanism_extras.end_naquadah_ore,"Compared to the Overworld,naquadah ores are more common in the End, and you can find it near the void.",エンドに存在するナクアダ鉱石は、オーバーワールドより多く含有しており、奈落により近い場所で見つけることができます。
description.mekanism_extras.lead_coated_glass,Reactor glass that can prevent the radiation from the reactor.,ナクアダリアクターからの放射線を遮断してくれる、より優れた反応炉ガラスです。
description.mekanism_extras.lead_coated_laser_focus_matrix,"Compared to the laser focusing matrix, it can prevent radiation.",レーザーフォーカスマトリックスを鉛コーティングし、耐放射線を高めたブロックです。
description.mekanism_extras.naquadah_ore,"A type of naquadah that Earth does not have, but you can find one or two near the bedrock layer of the Overworld.",地球には存在しうるはずのないナクアダの一種です。オーバーワールドの岩盤層で1～2つの塊を見つけることができます。
description.mekanism_extras.naquadah_reactor_casing,Radiation-proof framing that can be used in the Naquadah Reactor multiblock.,ナクアダリアクター構築に使用できる、耐放射線筐体です。
description.mekanism_extras.naquadah_reactor_controller,The controlling block for the entire Naquadah Reactor structure.,ナクアダリアクター全体の制御を担うブロックです。
description.mekanism_extras.naquadah_reactor_port,A block of radiation-proof framing that is capable of managing both the gas and energy transfer of the Naquadah Reactor.,ナクアダリアクターにおいてガスとエネルギーの搬入出を担う、耐放射線筐体製のブロックです。
gas.mekanism_extras.fluorinated_silicon_uranium_fuel,Fluorinated Silicon Uranium Fuel,フッ素化ケイ素ウラン燃料
gas.mekanism_extras.molten_thermonuclear,Molten Thermonuclear,溶融熱核
gas.mekanism_extras.polonium-208,Polonium-208,ポロニウム208
gas.mekanism_extras.polonium_containing_steam,Polonium Containing Steam,ポロニウム含有蒸気
gas.mekanism_extras.rich_silicon_fuel,Rich Silicon Fuel,リッチケイ素燃料
gas.mekanism_extras.rich_uranium_fuel,Rich Uranium Fuel,リッチウラン燃料
gas.mekanism_extras.silicon_tetrafluoride,Silicon Tetrafluoride,四フッ化ケイ素
gas.mekanism_extras.silicon_uranium_fuel,Silicon Uranium Fuel,ケイ素ウラン燃料
gas.mekanism_extras.spectrum_pigments,Spectrum Pigments,分光顔料
info.mekanism_extras.jei.polonium_containing_solution,"When coolant is injected into a Naquadah Reactor, the generated steam will capture polonium-208 that does not decay in the reactor, resulting in polonium containing steam.",冷媒がナクアダリアクターに搬入されると生成された蒸気は、リアクター内で崩壊を起こしにくいポロニウム208を捕捉し、ポロニウムを含有する蒸気を生産します。
info.mekanism_extras.jei.rich_silicon_fuel,Rich Silicon Fuel can be extracted from a Silicon Tetrafluoride source block via an advance electric pump with a filter upgrade installed.,リッチケイ素燃料はフィルターアップグレードがインストールされた発展型電動ポンプを使って四フッ化ケイ素液源から抽出することができます。
info.mekanism_extras.jei.rich_uranium_fuel,Rich Uranium Fuel can be extracted from a Uranium Hexafluoride source block via an advance electric pump with a filter upgrade installed.,リッチウラン燃料はフィルターアップグレードがインストールされた発展型電動ポンプを使って六フッ化ウラン液源から抽出することができます。
infuse_type.mekanism_extras.lead,Lead,鉛
infuse_type.mekanism_extras.radiance,Radiance,放射
infuse_type.mekanism_extras.shining,Shining,光輝
infuse_type.mekanism_extras.spectrum,Spectrum,分光
infuse_type.mekanism_extras.thermonuclear,Thermonuclear,熱核
item.mekanism_extras.absolute_control_circuit,Absolute Control Circuit,絶対制御回路
item.mekanism_extras.absolute_tier_installer,Absolute Tier Installer,絶対ティアインストーラー
item.mekanism_extras.alloy_radiance,Radiance Alloy,放射合金
item.mekanism_extras.alloy_shining,Shining Alloy,光輝合金
item.mekanism_extras.alloy_spectrum,Spectrum Alloy,分光合金
item.mekanism_extras.alloy_thermonuclear,Thermonuclear Alloy,熱核合金
item.mekanism_extras.clump_naquadah,Naquadah Clump,ナクアダの凝塊
item.mekanism_extras.cosmic_control_circuit,Cosmic Control Circuit,宇宙制御回路
item.mekanism_extras.cosmic_tier_installer,Cosmic Tier Installer,宇宙ティアインストーラー
item.mekanism_extras.crystal_naquadah,Naquadah Crystal,ナクアダの結晶
item.mekanism_extras.dirty_dust_naquadah,Dirty Naquadah Dust,汚れたナクアダの粉
item.mekanism_extras.dust_naquadah,Naquadah Dust,ナクアダの粉
item.mekanism_extras.dust_radiance,Radiance Dust,放射光の粉
item.mekanism_extras.enriched_lead,Enriched Lead,濃縮鉛
item.mekanism_extras.enriched_radiance,Enriched Radiance,濃縮放射
item.mekanism_extras.enriched_shining,Enriched Shining,濃縮光輝
item.mekanism_extras.enriched_spectrum,Enriched Spectrum,濃縮分光
item.mekanism_extras.enriched_thermonuclear,Enriched Thermonuclear,濃縮熱核
item.mekanism_extras.fluorinated_silicon_uranium_fuel_bucket,Liquid fluorinated Silicon Uranium Fuel Bucket,液体フッ素化ケイ素ウラン燃料入りバケツ
item.mekanism_extras.infinite_control_circuit,Infinite Control Circuit,無限制御回路
item.mekanism_extras.infinite_tier_installer,Infinite Tier Installer,無限ティアインストーラー
item.mekanism_extras.ingot_naquadah,Naquadah Ingot,ナクアダインゴット
item.mekanism_extras.naquadah_hohlraum,Naquadah Hohlraum,ナクアダホールラウム
item.mekanism_extras.polonium-208_bucket,Liquid Polonium-208 Bucket,液体ポロニウム208入りバケツ
item.mekanism_extras.polonium_containing_solution_bucket,Polonium Containing Solution Bucket,ポロニウム含有溶液入りバケツ
item.mekanism_extras.qio_drive_black_hole,Black Hole QIO Drive,黒ホールQIOドライブ
item.mekanism_extras.qio_drive_collapse,Collapse QIO Drive,崩壊QIOドライブ
item.mekanism_extras.qio_drive_gamma,Gamma QIO Drive,ガンマQIOドライブ
item.mekanism_extras.qio_drive_singularity,Singularity QIO Drive,特異点QIOドライブ
item.mekanism_extras.raw_naquadah,Raw Naquadah,ナクアダの原石
item.mekanism_extras.rich_silicon_fuel_bucket,Liquid Rich Silicon Fuel Bucket,液体リッチケイ素燃料入りバケツ
item.mekanism_extras.rich_uranium_fuel_bucket,Liquid Rich Uranium Fuel Bucket,液体リッチウラン燃料入りバケツ
item.mekanism_extras.shard_naquadah,Naquadah Shard,ナクアダの欠片
item.mekanism_extras.silicon_tetrafluoride_bucket,Liquid Silicon Tetrafluoride Bucket,液体四フッ化ケイ素入りバケツ
item.mekanism_extras.supreme_control_circuit,Supreme Control Circuit,至高制御回路
item.mekanism_extras.supreme_tier_installer,Supreme Tier Installer,至高ティアインストーラー
matrix.mekanism_extras.reinforced_induction_matrix,Reinforced Induction Matrix,強化インダクションマトリックス
plasma.mekanism_extras.hydrogen,Hydrogen Plasma,水素プラズマ
reactor.mekanism_extras.naquadah_reactor,Naquadah Reactor,ナクアダリアクター
reactor.mekanism_extras.stats.pcs_production,PCS Production: %1$s mB/t,PCS生産量: %1$s mB/t
slurry.mekanism_extras.clean_naquadah,Clean Naquadah Slurry,純粋なナクアダの懸濁液
slurry.mekanism_extras.dirty_naquadah,Dirty Naquadah Slurry,汚れたナクアダの懸濁液
advancements.mekanism_extras.absolute_control_circuit.description,Your DNA may have suffered,あなたのDNAが損傷した可能性があります
advancements.mekanism_extras.absolute_control_circuit.title,Perhaps it also has radiation?,放射線もあるかもしれませんね？
advancements.mekanism_extras.cosmic_control_circuit.description,"If you dislike them constantly flashing, you can install the built-in resource pack",もし彼らが常に点滅するのが嫌なら、組み込みリソースパックをインストールできます
advancements.mekanism_extras.cosmic_control_circuit.title,oh It's as shiny as that alloy,ああ、それは合金と同じくらい光沢があります
advancements.mekanism_extras.creative_upgrade.description,"If the modpack didn’t add a recipe, you cheated, right?",モッドパックがレシピを追加していない場合、あなたはチートしましたね？
advancements.mekanism_extras.infinite_control_circuit.description,This thing can definitely be used to run Minecraft,このアイテムは Minecraft を実行するために確実に使用できます
advancements.mekanism_extras.infinite_control_circuit.title,Your supercomputer is here,あなたのスーパーコンピュータはここにあります
advancements.mekanism_extras.ionic_membrane_upgrade.description,"Make the pump only extract cations or anions, is this reasonable?",ポンプをカチオンまたはアニオンのみ抽出させるのは妥当でしょうか？
advancements.mekanism_extras.ionic_membrane_upgrade.title,Non-conservation of charge,電荷保存則違反
advancements.mekanism_extras.radiance_alloy.description,Atomic alloy are not the strongest,原子合金は最強ではない
advancements.mekanism_extras.radiance_alloy.title,"You are in the midst of radiation, but you don't know",あなたは放射線の真っ只中にいますが、知りません
advancements.mekanism_extras.spectrum_alloy.description,It existed during the Big Bang,ビッグバンの間に存在していた
advancements.mekanism_extras.spectrum_alloy.title,Alloys from the universe,宇宙からの合金
advancements.mekanism_extras.stack_upgrade.description,Making one by one is still too slow,一つずつ作るのはまだ遅すぎます
advancements.mekanism_extras.stack_upgrade.title,You will like this,あなたはこれが好きになるでしょう
advancements.mekanism_extras.supreme_control_circuit.description,The temperature of that alloy didn't actually ruin it?,その合金の温度は実際に壊れたわけではない？
advancements.mekanism_extras.supreme_control_circuit.title,Perhaps it can operate at high temperatures,高温で動作できるかもしれません
advancements.mekanism_extras.thermonuclear_alloy.description,"It's incredibly hard, but also very hot to the touch, maybe?",非常に難しいですが、触ると熱いかもしれませんね？
advancements.mekanism_extras.thermonuclear_alloy.title,Equivalent to the temperature of a star,星の温度に相当する
block.mekanism_extras.absolute_combining_factory,Absolute Combining Factory,絶対結合ファクトリー
block.mekanism_extras.absolute_compressing_factory,Absolute Compressing Factory,絶対圧縮ファクトリー
block.mekanism_extras.absolute_crushing_factory,Absolute Crushing Factory,絶対粉砕ファクトリー
block.mekanism_extras.absolute_enriching_factory,Absolute Enriching Factory,絶対濃縮ファクトリー
block.mekanism_extras.absolute_infusing_factory,Absolute Infusing Factory,絶対吹込ファクトリー
block.mekanism_extras.absolute_injecting_factory,Absolute Injecting Factory,絶対注入ファクトリー
block.mekanism_extras.absolute_purifying_factory,Absolute Purifying Factory,絶対浄化ファクトリー
block.mekanism_extras.absolute_sawing_factory,Absolute Sawing Factory,絶対製材ファクトリー
block.mekanism_extras.absolute_smelting_factory,Absolute Smelting Factory,絶対精錬ファクトリー
block.mekanism_extras.cosmic_combining_factory,Cosmic Combining Factory,宇宙結合ファクトリー
block.mekanism_extras.cosmic_compressing_factory,Cosmic Compressing Factory,宇宙圧縮ファクトリー
block.mekanism_extras.cosmic_crushing_factory,Cosmic Crushing Factory,宇宙粉砕ファクトリー
block.mekanism_extras.cosmic_enriching_factory,Cosmic Enriching Factory,宇宙濃縮ファクトリー
block.mekanism_extras.cosmic_infusing_factory,Cosmic Infusing Factory,宇宙吹込ファクトリー
block.mekanism_extras.cosmic_injecting_factory,Cosmic Injecting Factory,宇宙注入ファクトリー
block.mekanism_extras.cosmic_purifying_factory,Cosmic Purifying Factory,宇宙浄化ファクトリー
block.mekanism_extras.cosmic_sawing_factory,Cosmic Sawing Factory,宇宙製材ファクトリー
block.mekanism_extras.cosmic_smelting_factory,Cosmic Smelting Factory,宇宙精錬ファクトリー
block.mekanism_extras.infinite_combining_factory,Infinite Combining Factory,無限結合ファクトリー
block.mekanism_extras.infinite_compressing_factory,Infinite Compressing Factory,無限圧縮ファクトリー
block.mekanism_extras.infinite_crushing_factory,Infinite Crushing Factory,無限粉砕ファクトリー
block.mekanism_extras.infinite_enriching_factory,Infinite Enriching Factory,無限濃縮ファクトリー
block.mekanism_extras.infinite_infusing_factory,Infinite Infusing Factory,無限吹込ファクトリー
block.mekanism_extras.infinite_injecting_factory,Infinite Injecting Factory,無限注入ファクトリー
block.mekanism_extras.infinite_purifying_factory,Infinite Purifying Factory,無限浄化ファクトリー
block.mekanism_extras.infinite_sawing_factory,Infinite Sawing Factory,無限製材ファクトリー
block.mekanism_extras.infinite_smelting_factory,Infinite Smelting Factory,無限精錬ファクトリー
block.mekanism_extras.supreme_combining_factory,Supreme Combining Factory,至高結合ファクトリー
block.mekanism_extras.supreme_compressing_factory,Supreme Compressing Factory,至高圧縮ファクトリー
block.mekanism_extras.supreme_crushing_factory,Supreme Crushing Factory,至高粉砕ファクトリー
block.mekanism_extras.supreme_enriching_factory,Supreme Enriching Factory,至高濃縮ファクトリー
block.mekanism_extras.supreme_infusing_factory,Supreme Infusing Factory,至高吹込ファクトリー
block.mekanism_extras.supreme_injecting_factory,Supreme Injecting Factory,至高注入ファクトリー
block.mekanism_extras.supreme_purifying_factory,Supreme Purifying Factory,至高浄化ファクトリー
block.mekanism_extras.supreme_sawing_factory,Supreme Sawing Factory,至高製材ファクトリー
block.mekanism_extras.supreme_smelting_factory,Supreme Smelting Factory,至高精錬ファクトリー
container.mekanism_extras.absolute_combining_factory,Absolute Combining Factory,絶対結合ファクトリー
container.mekanism_extras.absolute_compressing_factory,Absolute Compressing Factory,絶対圧縮ファクトリー
container.mekanism_extras.absolute_crushing_factory,Absolute Crushing Factory,絶対粉砕ファクトリー
container.mekanism_extras.absolute_enriching_factory,Absolute Enriching Factory,絶対濃縮ファクトリー
container.mekanism_extras.absolute_infusing_factory,Absolute Infusing Factory,絶対吹込ファクトリー
container.mekanism_extras.absolute_injecting_factory,Absolute Injecting Factory,絶対注入ファクトリー
container.mekanism_extras.absolute_purifying_factory,Absolute Purifying Factory,絶対浄化ファクトリー
container.mekanism_extras.absolute_sawing_factory,Absolute Sawing Factory,絶対製材ファクトリー
container.mekanism_extras.absolute_smelting_factory,Absolute Smelting Factory,絶対精錬ファクトリー
container.mekanism_extras.cosmic_combining_factory,Cosmic Combining Factory,宇宙結合ファクトリー
container.mekanism_extras.cosmic_compressing_factory,Cosmic Compressing Factory,宇宙圧縮ファクトリー
container.mekanism_extras.cosmic_crushing_factory,Cosmic Crushing Factory,宇宙粉砕ファクトリー
container.mekanism_extras.cosmic_enriching_factory,Cosmic Enriching Factory,宇宙濃縮ファクトリー
container.mekanism_extras.cosmic_infusing_factory,Cosmic Infusing Factory,宇宙吹込ファクトリー
container.mekanism_extras.cosmic_injecting_factory,Cosmic Injecting Factory,宇宙注入ファクトリー
container.mekanism_extras.cosmic_purifying_factory,Cosmic Purifying Factory,宇宙浄化ファクトリー
container.mekanism_extras.cosmic_sawing_factory,Cosmic Sawing Factory,宇宙製材ファクトリー
container.mekanism_extras.cosmic_smelting_factory,Cosmic Smelting Factory,宇宙精錬ファクトリー
container.mekanism_extras.infinite_combining_factory,Infinite Combining Factory,無限結合ファクトリー
container.mekanism_extras.infinite_compressing_factory,Infinite Compressing Factory,無限圧縮ファクトリー
container.mekanism_extras.infinite_crushing_factory,Infinite Crushing Factory,無限粉砕ファクトリー
container.mekanism_extras.infinite_enriching_factory,Infinite Enriching Factory,無限濃縮ファクトリー
container.mekanism_extras.infinite_infusing_factory,Infinite Infusing Factory,無限吹込ファクトリー
container.mekanism_extras.infinite_injecting_factory,Infinite Injecting Factory,無限注入ファクトリー
container.mekanism_extras.infinite_purifying_factory,Infinite Purifying Factory,無限浄化ファクトリー
container.mekanism_extras.infinite_sawing_factory,Infinite Sawing Factory,無限製材ファクトリー
container.mekanism_extras.infinite_smelting_factory,Infinite Smelting Factory,無限精錬ファクトリー
container.mekanism_extras.supreme_combining_factory,Supreme Combining Factory,至高結合ファクトリー
container.mekanism_extras.supreme_compressing_factory,Supreme Compressing Factory,至高圧縮ファクトリー
container.mekanism_extras.supreme_crushing_factory,Supreme Crushing Factory,至高粉砕ファクトリー
container.mekanism_extras.supreme_enriching_factory,Supreme Enriching Factory,至高濃縮ファクトリー
container.mekanism_extras.supreme_infusing_factory,Supreme Infusing Factory,至高吹込ファクトリー
