key,source_text,target_text
select.a.painting,Select A Painting,絵画を選択
text.autoconfig.paintings.option.cycle_paintings,Pick True to enable painting cycling on right click with a painting item,右クリックでペインティングアイテムを使用して絵画のサイクルを有効にするか選択してください
text.autoconfig.paintings.option.show_painting_size,Pick True to show the size of paintings in the painting gui,ペイントGUIで絵画のサイズを表示するにはTrueに設定
text.autoconfig.paintings.option.use_selection_gui,Pick true to enable the Painting Selection Gui tot pop up when placing a painting,真に選択すると、絵画配置時にペインティング選択GUIがポップアップします
text.autoconfig.paintings.option.use_vanilla_only,Pick true to only use the vanilla paintings and skip loading any other paintings,trueを選択すると、バニラ絵画のみ使用し、他の絵画の読み込みをスキップします
