key,source_text,target_text
block.replication_matter_overflow.matter_void,Matter Overflow Tank,質量オーバーフロータンク
itemGroup.replication_matter_overflow,Replication: Matter Overflow Tank,複製: 物質オーバーフロータンク
tooltip.replication_matter_overflow.matter_void.line1,Stores matter like a regular tank,通常のタンクと同様に物質を貯蔵します
tooltip.replication_matter_overflow.matter_void.line2,Voids excess matter when full,満杯時に余剰物質を無効化します
tooltip.replication_matter_overflow.priority.current,Priority: %s,優先度: %s
tooltip.replication_matter_overflow.priority.decrease,Decrease tank priority,タンク優先度を下げる
tooltip.replication_matter_overflow.priority.increase,Increase tank priority,タンク優先度を上げる
