key,source_text,target_text
item.rsinfinitybooster.dimension_card,Dimension Card,次元カード
item.rsinfinitybooster.infinity_card,Infinity Range Booster,無限範囲ブースター
item.rsinfinitybooster.tooltip.dimension_card.help,Increases the range of the wireless transmitter by ∞ blocks and allows you to access the network from any dimension,ワイヤレストランスミッターの範囲を∞ブロック拡大し、どのディメンションからでもネットワークにアクセスできるようにします
item.rsinfinitybooster.tooltip.infinity_card.help,Increases the range of the wireless transmitter by ∞ blocks,ワイヤレストランスミッターの範囲を∞ブロック拡大します
item_group.rsinfinitybooster.tab,RS Infinity Booster,RSインフィニティブースター
