key,source_text,target_text
gamerule.secureFarmlandAndCrops,Secure Farmland and Crops,農地と作物を安全に保つ
gamerule.secureFarmlandAndCrops.description,"If farmland has crops, secure farmland and crops",農地に作物がある場合、農地と作物を確保する
gamerule.secureFarmlandBreakCrops,Secure Farmland but break Crops,農地を安全に守るが、作物を破壊する
gamerule.secureFarmlandBreakCrops.description,"If farmland has crops, secure farmland but trample crops",農地に作物がある場合、農地を確保しつつ作物を踏み潰す
gamerule.secureFarmlandIfEmpty,Secure Farmland if empty,空き畑を確保
gamerule.secureFarmlandIfEmpty.description,"If farmland is empty, secure farmland",畑が空の場合、畑を確保する
