key,source_text,target_text
config.simplyjetpacks.gui.showExactEnergyInHUD.tooltip,"When enabled, the energy HUD will display the exact amount of RF rather than just a percentage.",有効にすると、エネルギーHUDはRFの正確な量を表示し、パーセンテージのみではなくなります。
config.simplyjetpacks.gui.enableStateHUD,Enable State HUD,状態表示HUD
config.simplyjetpacks.gui.enableStateHUD.tooltip,"When enabled, the HUD that displays the states (engine/hover/charger) of the currently worn Jetpack or Fluxpack will show.",有効にすると、現在装備されているジェットパックまたはフラックスパックの状態(エンジン/ホバー/チャージャー)を表示するHUDが表示されます。
config.simplyjetpacks.gui.enableStateMessages,Enable State Messages,ステートメッセージを有効にします。
config.simplyjetpacks.gui.enableStateMessages.tooltip,"When enabled, switching Jetpacks or Fluxpacks on or off, or changing their modes will display a status message above the inventory bar.",有効にすると、ジェットパックまたはフラックスパックのオン/オフの切り替え、またはモード変更時に、インベントリバーの上にステータスメッセージが表示されます。
config.simplyjetpacks.gui.HUDTextColor,HUD Text Color,HUDテキストカラー
config.simplyjetpacks.gui.HUDTextColor.tooltip,Change the text color in the HUD. (Note: Color is in Integer form),HUD のテキストカラーを変更します。（注：カラーは整数形式です）
config.simplyjetpacks.items.enableFuelEfficiencyEnchantment,Enable Fuel Efficiency Enchantment,燃料効率エンチャントを有効化
config.simplyjetpacks.items.enableFuelEfficiencyEnchantment.tooltip,Enable the Fuel Efficiency enchantment.,燃料効率エンチャントを有効にする
config.simplyjetpacks.items.addRAItemsIfNotInstalled,Add Redstone Arsenal items if not installed,レッドストーンアーセナルアイテムを追加（未インストールの場合）
config.simplyjetpacks.integration.enableIntegrationVanilla,Vanilla Integration,Vanilla統合
config.simplyjetpacks.integration.enableIntegrationVanilla.tooltip,"When enabled, Simply Jetpacks will register its Vanilla Jetpacks.",有効にすると、Simply Jetpacks は Vanilla Jetpack を登録します。
config.simplyjetpacks.integration.enableIntegrationEIO,EnderIO Integration,EnderIO統合
config.simplyjetpacks.integration.enableIntegrationTE,Thermal Expansion Integration,Thermal Expansion統合
config.simplyjetpacks.integration.enableIntegrationTD,Thermal Dynamics Integration,熱力学統合
config.simplyjetpacks.integration.enableIntegrationRA,Redstone Arsenal Integration,レッドストーン兵器庫統合
config.simplyjetpacks.integration.enableIntegrationMek,Mekanism Integration,メカニズム統合
config.simplyjetpacks.integration.enableIntegrationMek.tooltip,"When enabled, Simply Jetpacks will register its Mekanism Jetpacks.",有効にすると、Simply Jetpacks は Mekanism Jetpacks を登録します。
config.simplyjetpacks.integration.enableIntegrationIE,Immersive Engineering Integration,浸透的工学統合
config.simplyjetpacks.integration.enableIntegrationRR,Redstone Repository Integration,レッドストーンリポジトリ統合
config.simplyjetpacks.integration.gelidEnderiumEnergyUsageBonus,Redstone Repository Enderium Energy Efficiency Bonus,Redstone Repository Enderium エネルギー効率ボーナス
config.simplyjetpacks.integration.gelidEnderiumEnergyUsageBonus.tooltip,"When set to a value between 0-100, changes the energy efficiency bonus of the Enderium Armored Jetplate (Example: 80 uses energy at 80% rate).",0～100の値に設定すると、Enderiumアーマー付きジェットプレートのエネルギー効率ボーナスが変わります(例:80は80%のレートでエネルギーを使用します)。
config.simplyjetpacks.tuning.energyCapacity.tooltip,The maximum amount of energy that this pack can hold.,このパックが保持できる最大エネルギー量です。
config.simplyjetpacks.misc,Misc,その他
config.simplyjetpacks.misc.tooltip,Adjust various variables,さまざまな変数を調整
config.simplyjetpacks.misc.joinAdvancements,Join Advancements,進捗に参加
config.simplyjetpacks.misc.joinAdvancements.tooltip,"When enabled, you will get several advancements when joining a world for the first time.",有効にすると、ワールドに初めて参加した際にいくつかの進捗が取得できます。
advancement.simplyjetpacks.root.desc,Install Simply Jetpacks 2,Simply Jetpacks 2 をインストールする
advancement.simplyjetpacks.vanilla.desc,Enable Vanilla Integration,バニラ統合を有効にする
advancement.simplyjetpacks.jetpack_vanilla1.desc,Obtain an Iron Jetpack,鉄製ジェットパックを入手する
advancement.simplyjetpacks.jetpack_vanilla2.desc,Obtain a Gold Jetpack,ゴールドジェットパックを入手
advancement.simplyjetpacks.jetpack_vanilla3.desc,Obtain a Diamond Jetpack,ダイヤモンドジェットパックを入手
advancement.simplyjetpacks.eio.title,EnderIO Jetpacks,EnderIOジェットパック
advancement.simplyjetpacks.eio.desc,Enable EnderIO Integration,EnderIO統合を有効にする
advancement.simplyjetpacks.jetpack_eio1.desc,Obtain a Conductive Iron Jetpack,導電性鉄製ジェットパックを取得
advancement.simplyjetpacks.jetpack_eio2.desc,Obtain an Electrical Steel Jetpack,電気鋼ジェットパックを入手
advancement.simplyjetpacks.jetpack_eio3.desc,Obtain an Energetic Jetpack,エネルギージェットパックを入手
advancement.simplyjetpacks.jetpack_eio4.desc,Obtain a Vibrant Jetpack,鮮やかなジェットパックを取得
advancement.simplyjetpacks.jetpack_eio5.desc,Obtain a Dark Soularium JetPlate,ダークソウラリアムジェットプレートを取得
advancement.simplyjetpacks.te.title,Thermal Expansion Jetpacks,サーマルエクスパンションジェットパック
advancement.simplyjetpacks.te.desc,Enable Thermal Expansion Integration,Thermal Expansion 統合を有効化
advancement.simplyjetpacks.jetpack_te1.desc,Obtain a Leadstone Jetpack,リードストーンジェットパックを入手
advancement.simplyjetpacks.jetpack_te2.desc,Obtain a Hardened Jetpack,強化ジェットパックを入手する
advancement.simplyjetpacks.jetpack_te3.desc,Obtain a Reinforced Jetpack,強化ジェットパックを入手
advancement.simplyjetpacks.jetpack_te4.desc,Obtain a Resonant JetPlate,共鳴ジェットプレートを入手する
advancement.simplyjetpacks.jetpack_te5.desc,Obtain a Flux-Infused JetPlate,フラックス注入ジェットプレートを取得
advancement.simplyjetpacks.jetpack_te5_enderium.desc,Obtain an Enderium Flux-Infused JetPlate,エンダリウムフロックスを含むジェットプレートを取得
advancement.simplyjetpacks.ie.desc,Enable Immersive Engineering Integration,浸透工学統合を有効にします
advancement.simplyjetpacks.jetpack_ie1.desc,Obtain a Low Voltage Jetpack,低電圧ジェットパックを入手する
advancement.simplyjetpacks.jetpack_ie2.desc,Obtain a Medium Voltage Jetpack,中電圧ジェットパックを取得する
advancement.simplyjetpacks.jetpack_ie3.desc,Obtain a High Voltage Jetpack,高電圧ジェットパックを入手する
advancement.simplyjetpacks.mek.desc,Enable Mekanism Integration,Mekanism統合を有効にする
advancement.simplyjetpacks.jetpack_mek1.desc,Obtain a Basic Jetpack,基本ジェットパックを入手する
advancement.simplyjetpacks.jetpack_mek2.desc,Obtain an Advanced Jetpack,アドバンストジェットパックを入手
advancement.simplyjetpacks.jetpack_mek3.desc,Obtain an Elite Jetpack,エリートジェットパックを入手する
advancement.simplyjetpacks.jetpack_mek4.desc,Obtain an Ultimate Jetpack,アルティメットジェットパックを入手
config.simplyjetpacks.showEHoverState.tooltip,Show the Emergency Hover State in the HUD.,
config.simplyjetpacks.tuning.speedVerticalHoverSlow,Vertical Speed (Hover Mode / Slow Descent),
config.simplyjetpacks.items.addRAItemsIfNotInstalled.tooltip,"When enabled, Simply Jetpacks will register some crafting components from Redstone Arsenal to make the Flux-Infused JetPlate craftable if Redstone Arsenal is not installed.",
config.simplyjetpacks.integration.enableIntegrationEIO.tooltip,"When enabled, Simply Jetpacks will register its EnderIO Jetpacks and Fluxpacks.",
config.simplyjetpacks.integration.enableIntegrationTE.tooltip,"When enabled, Simply Jetpacks will register its Thermal Expansion Jetpacks and Fluxpacks.",
config.simplyjetpacks.integration.enableIntegrationTD.tooltip,"When enabled, Simply Jetpacks will register Thermal Dynamics items for thruster recipes.",
config.simplyjetpacks.integration.enableIntegrationRA.tooltip,"When enabled, Simply Jetpacks will register its Redstone Arsenal Tier5 Jetpack recipes.",
config.simplyjetpacks.integration.enableIntegrationIE.tooltip,"When enabled, Simply Jetpacks will register its Immersive Engineering Jetpacks.",
config.simplyjetpacks.integration.enableIntegrationRR.tooltip,"When enabled, Simply Jetpacks will register its Redstone Repository Tier5 JetPlate recipes.",
tooltip.simplyjetpacks.mysterious_potato.description,Can do the thing...,
