key,source_text,target_text
advancement.simplyjetpacks.ie.description,Enable the Immersive Engineering Jetpacks,Immersive Engineering ジェットパックを有効にする
advancement.simplyjetpacks.ie.title,Immersive Engineering Jetpacks,浸透工学ジェットパック
advancement.simplyjetpacks.jetpack_creative.description,Obtain a Creative Jetpack,クリエイティブジェットパックを入手する
advancement.simplyjetpacks.jetpack_creative.title,Creative Jetpack,クリエイティブジェットパック
advancement.simplyjetpacks.jetpack_creative_armored.description,Obtain an Armored Creative Jetpack,アーマードクリエイティブジェットパックを入手
advancement.simplyjetpacks.jetpack_creative_armored.title,Creative Jetpack (Armored),アーマードジェットパック（クリエイティブ）
advancement.simplyjetpacks.jetpack_ie1.description,Obtain a Low Voltage Jetpack,低電圧ジェットパックを入手する
advancement.simplyjetpacks.jetpack_ie1.title,Low Voltage Jetpack,低電圧ジェットパック
advancement.simplyjetpacks.jetpack_ie2.description,Obtain a Medium Voltage Jetpack,中電圧ジェットパックを取得する
advancement.simplyjetpacks.jetpack_ie2.title,Medium Voltage Jetpack,中電圧ジェットパック
advancement.simplyjetpacks.jetpack_ie3.description,Obtain a High Voltage Jetpack,高電圧ジェットパックを入手する
advancement.simplyjetpacks.jetpack_ie3.title,High Voltage Jetpack,高電圧ジェットパック
advancement.simplyjetpacks.jetpack_mek1.description,Obtain a Basic Jetpack,基本ジェットパックを入手する
advancement.simplyjetpacks.jetpack_mek1.title,Basic Jetpack,ベーシックジェットパック
advancement.simplyjetpacks.jetpack_mek2.description,Obtain an Advanced Jetpack,アドバンストジェットパックを入手
advancement.simplyjetpacks.jetpack_mek2.title,Advanced Jetpack,アドバンスジェットパック
advancement.simplyjetpacks.jetpack_mek3.description,Obtain an Elite Jetpack,エリートジェットパックを入手する
advancement.simplyjetpacks.jetpack_mek3.title,Elite Jetpack,エリートジェットパック
advancement.simplyjetpacks.jetpack_mek4.description,Obtain an Ultimate Jetpack,アルティメットジェットパックを入手
advancement.simplyjetpacks.jetpack_mek4.title,Ultimate Jetpack,アンチマットジェットパック
advancement.simplyjetpacks.jetpack_potato.description,Obtain the Potato Jetpack and take potato-powered flight!,ジャガイモジェットパックを取得して、ジャガイモ駆動のフライトを体験してください！
advancement.simplyjetpacks.jetpack_potato.title,Potato Jetpack,ジャガイモジェットパック
advancement.simplyjetpacks.jetpack_te1.description,Obtain a Leadstone Jetpack,リードストーンジェットパックを入手
advancement.simplyjetpacks.jetpack_te1.title,Leadstone Jetpack,リードストーンジェットパック
advancement.simplyjetpacks.jetpack_te2.description,Obtain a Hardened Jetpack,強化ジェットパックを入手する
advancement.simplyjetpacks.jetpack_te2.title,Hardened Jetpack,強化ジェットパック
advancement.simplyjetpacks.jetpack_te3.description,Obtain a Reinforced Jetpack,強化ジェットパックを入手
advancement.simplyjetpacks.jetpack_te3.title,Reinforced Jetpack,強化ジェットパック
advancement.simplyjetpacks.jetpack_te4.description,Obtain a Resonant Jetpack,レゾナントジェットパックを入手する
advancement.simplyjetpacks.jetpack_te4.title,Resonant Jetpack,共鳴ジェットパック
advancement.simplyjetpacks.jetpack_te5.description,Obtain a Flux-Infused JetPlate,フラックス注入ジェットプレートを取得
advancement.simplyjetpacks.jetpack_te5.title,Flux-Infused JetPlate,フラックス注入ジェットプレート
advancement.simplyjetpacks.jetpack_te5_enderium.description,Obtain a Flux-Infused JetPlate (Enderium),フラックス注入ジェットプレート（エンダリウム）を取得する
advancement.simplyjetpacks.jetpack_te5_enderium.title,Flux-Infused JetPlate (Enderium),フラックス注入ジェットプレート（エンダリウム）
advancement.simplyjetpacks.jetpack_vanilla1.description,Obtain an Iron Jetpack,鉄製ジェットパックを入手する
advancement.simplyjetpacks.jetpack_vanilla1.title,Iron Jetpack,鉄のジェットパック
advancement.simplyjetpacks.jetpack_vanilla2.description,Obtain a Gold Jetpack,ゴールドジェットパックを入手
advancement.simplyjetpacks.jetpack_vanilla2.title,Gold Jetpack,金のジェットパック
advancement.simplyjetpacks.jetpack_vanilla3.description,Obtain a Diamond Jetpack,ダイヤモンドジェットパックを入手
advancement.simplyjetpacks.jetpack_vanilla3.title,Diamond Jetpack,ダイヤモンドジェットパック
advancement.simplyjetpacks.jetpack_vanilla4.description,Obtain a Netherite Jetpack,ネザーライトジェットパックを入手
advancement.simplyjetpacks.jetpack_vanilla4.title,Netherite Jetpack,ネザーiteジェットパック
advancement.simplyjetpacks.mek.description,Enable the Mekanism Jetpacks,Mekanism Jetpacks を有効にする
advancement.simplyjetpacks.mek.title,Mekanism Jetpacks,メカニズムジェットパック
advancement.simplyjetpacks.root.description,Install Simply Jetpacks 2,Simply Jetpacks 2 をインストールする
advancement.simplyjetpacks.root.title,Simply Jetpacks 2,シンプリージェットパック 2
advancement.simplyjetpacks.thermal.description,Enable the Thermal Series Jetpacks,サーマルシリーズジェットパックを有効化
advancement.simplyjetpacks.thermal.title,Thermal Series Jetpacks,サーマルシリーズジェットパック
advancement.simplyjetpacks.vanilla.description,Enable the Vanilla Jetpacks,ベーシックジェットパックを有効化
advancement.simplyjetpacks.vanilla.title,Vanilla Jetpacks,バニラジェットパック
button.simplyjetpacks.charger,Charger,充電器
button.simplyjetpacks.eHoverToggle,Emergency Hover,緊急ホバー
button.simplyjetpacks.engineToggle,Engine,エンジン
button.simplyjetpacks.hoverToggle,Hover,ホバー
chat.simplyjetpacks.itemJetpack.charger,Charger: %s,充電器: %s
chat.simplyjetpacks.itemJetpack.chargerMode,Charger Mode: %s,充電モード: %s
chat.simplyjetpacks.itemJetpack.emergencyHover,Emergency Hover: %s,緊急ホバー: %s
chat.simplyjetpacks.itemJetpack.emergencyHoverMode,Emergency Hover Mode: %s,緊急ホバーモード: %s
chat.simplyjetpacks.itemJetpack.emergencyHoverModeActivated,WARNING: Emergency Hover Activated!,注意: 緊急ホバーがアクティブになりました！
chat.simplyjetpacks.itemJetpack.engine,Jetpack: %s,ジェットパック: %s
chat.simplyjetpacks.itemJetpack.engineMode,Jetpack Engine: %s,ジェットパックエンジン: %s
chat.simplyjetpacks.itemJetpack.hover,Hover: %s,ホバー: %s
chat.simplyjetpacks.itemJetpack.hoverMode,Hover Mode: %s,ホバーモード: %s
config.simplyjetpacks.enableIntegrationEnderIO,Enable EnderIO Integration,EnderIO統合を有効にする
config.simplyjetpacks.enableIntegrationEnderIO.tooltip,Enable EnderIO Jetpacks Integration.,EnderIOジェットパック統合を有効化する
config.simplyjetpacks.enableIntegrationImmersiveEngineering,Enable Immersive Engineering Integration,浸透工学統合を有効にします
config.simplyjetpacks.enableIntegrationImmersiveEngineering.tooltip,Enable Immersive Engineering Jetpacks Integration.,Immersive Engineering Jetpacks統合を有効化します
config.simplyjetpacks.enableIntegrationMekanism,Enable Mekanism Integration,Mekanism統合を有効にする
config.simplyjetpacks.enableIntegrationMekanism.tooltip,Enable Mekanism Jetpacks Integration.,Mekanismジェットパック統合を有効にします。
config.simplyjetpacks.enableIntegrationThermalDynamics,Enable Thermal Dynamics Integration,Thermal Dynamics の統合を有効にする。
config.simplyjetpacks.enableIntegrationThermalDynamics.tooltip,Enable Thermal Dynamics Jetpacks Integration.,Thermal Dynamics Jetpacks 統合を有効化します。
config.simplyjetpacks.enableIntegrationThermalExpansion,Enable Thermal Expansion Integration,Thermal Expansion 統合を有効化
config.simplyjetpacks.enableIntegrationThermalExpansion.tooltip,Enable Thermal Expansion Jetpacks Integration.,Thermal Expansion ジェットパック統合を有効化します。
config.simplyjetpacks.enableIntegrationVanilla,Enable Vanilla Integration,バニラ統合を有効にする
config.simplyjetpacks.enableIntegrationVanilla.tooltip,Enable Vanilla Jetpacks Integration.,Vanilla Jetpacks 統合を有効化。
config.simplyjetpacks.enableJetpackHud,Enable Jetpack HUD,ジェットパックHUDを有効にする
config.simplyjetpacks.enableJetpackHud.tooltip,This sets whether or not the Jetpack HUD will be visible.,ジェットパックHUDの表示可否を設定します。
config.simplyjetpacks.enableJetpackParticles,Enable Jetpack Particles,ジェットパックの粒子を有効にする
config.simplyjetpacks.enableJetpackParticles.tooltip,This sets whether Jetpack particles will be displayed.,ジェットパック粒子を表示するかどうかを設定します。
config.simplyjetpacks.enableJetpackSounds,Enable Jetpack Sounds,ジェットパック音を有効化
config.simplyjetpacks.enableJetpackSounds.tooltip,This sets whether Jetpack sounds will play.,ジェットパック音声の再生設定です。
config.simplyjetpacks.enableJoinAdvancements,Enable Join Advancements,進捗を表示する
config.simplyjetpacks.enableJoinAdvancements.tooltip,Enable Advancements on Player join.,プレイヤーが参加した際に進捗を有効にする。
config.simplyjetpacks.enableStateMessages,Enable Jetpack State Messages,ジェットパックのステータスメッセージを有効にする
config.simplyjetpacks.enableStateMessages.tooltip,This sets whether or not Jetpack state messages will show.,ジェットパック状態メッセージを表示するかどうかを設定します。
config.simplyjetpacks.hudScale,Set the HUD Scale,HUDスケールを設定
config.simplyjetpacks.hudScale.tooltip,Set the scale of the Jetpack HUD on the screen.,画面上のジェットパックHUDのスケールを設定します。
config.simplyjetpacks.hudTextColor,Set the HUD color,HUDカラーを設定
config.simplyjetpacks.hudTextColor.tooltip,This sets the color of the Jetpack HUD.,ジェットパックのHUDの色を設定します。
config.simplyjetpacks.hudTextPosition,Set the HUD position,HUDの位置を設定する
config.simplyjetpacks.hudTextPosition.tooltip,Set the position of the Jetpack HUD on the screen.,ジェットパックHUDの画面上での位置を設定する。
config.simplyjetpacks.hudTextShadow,Set the HUD text shadow,HUDテキストシャドウを設定
config.simplyjetpacks.hudTextShadow.tooltip,Set if the Jetpack HUD values have text shadows.,ジェットパックHUDの値にテキストシャドウを設定するかどうか
config.simplyjetpacks.hudXOffset,HUD Position X Offset,HUD位置Xオフセット
config.simplyjetpacks.hudXOffset.tooltip,Set the X offset of the Jetpack HUD on the screen.,ジェットパックHUDのXオフセットを設定する。
config.simplyjetpacks.hudYOffset,HUD Position Y Offset,HUD位置Yオフセット
config.simplyjetpacks.hudYOffset.tooltip,Set the Y offset of the Jetpack HUD on the screen.,ジェットパックHUDのYオフセットを設定する。
config.simplyjetpacks.invertHoverSneakingBehavior,Invert Hover Sneaking,ホバーハイキングを反転
config.simplyjetpacks.invertHoverSneakingBehavior.tooltip,This sets whether you must hold sneak to hover.,ホバリングするには隠密を押し続ける必要があるかどうかを設定します。
config.simplyjetpacks.showChargerState,Show Charger State,チャージャーステートを表示
config.simplyjetpacks.showChargerState.tooltip,Show the Charger State in the HUD.,HUDにチャージャーの状態を表示する。
config.simplyjetpacks.showEHoverState,Show Emergency Hover State,緊急ホバーステートを表示
config.simplyjetpacks.showExactEnergy,Show exact Energy in HUD,HUDに正確なエネルギーを表示
config.simplyjetpacks.showExactEnergy.tooltip,Show the exact energy of the Jetpack in the HUD.,ジェットパックの正確なエネルギー量をHUDに表示する
config.simplyjetpacks.showHoverState,Show Hover State,ホバー状態表示
config.simplyjetpacks.showHoverState.tooltip,Show the Hover State in the HUD.,HUDにフロート状態を表示
config.simplyjetpacks.showThrottle,Show Throttle in HUD,HUDにスロットを表示
config.simplyjetpacks.showThrottle.tooltip,Show the Throttle value in the Jetpack HUD.,ジェットパックHUDにスロット値を表示します。
config.simplyjetpacks.tuning.accelVertical,Vertical Acceleration,垂直加速度
config.simplyjetpacks.tuning.accelVertical.tooltip,"The vertical acceleration of this Jetpack when flying, every tick, this amount of vertical speed will be added until maximum speed is reached.",飛行時のジェットパックの垂直加速度です。毎tick、この量の垂直速度が加算され、最大速度に達します。
config.simplyjetpacks.tuning.armorEnergyPerHit,Armor Energy Per Hit,防具の攻撃ごとのエネルギー
config.simplyjetpacks.tuning.armorEnergyPerHit.tooltip,"How much energy is lost from this Jetpack/Fluxpack when the user is hit, if armored.",ユーザーがヒットした際に、装甲を着用している場合、このジェットパック/フラックスパックから失われるエネルギー量は？
config.simplyjetpacks.tuning.armorReduction,Armor Reduction,アーマーロワー
config.simplyjetpacks.tuning.armorReduction.tooltip,"How well this Jetpack/Fluxpack can protect the user from damage, if armored. The higher the value, the stronger the armor will be.",このジェットパック/フラックスパックが装甲されている場合のダメージ軽減性能です。値が高いほど、アーマーは強くなります。
config.simplyjetpacks.tuning.chargerMode,Charger Mode,充電モード
config.simplyjetpacks.tuning.chargerMode.tooltip,"When enabled, this Jetpack will be able to activate Charger Mode.",有効にすると、このジェットパックはチャージャーモードを起動できるようになります。
config.simplyjetpacks.tuning.emergencyHoverMode,Emergency Hover Mode,緊急ホバーモード
config.simplyjetpacks.tuning.emergencyHoverMode.tooltip,"When enabled, this Jetpack will be able to activate Hover Mode automatically when the wearer is about to die from a fall.",有効にすると、このジェットパックは着用者が落下ダメージで死にそうになった時に自動的にホバーモードを起動できます。
config.simplyjetpacks.tuning.enchantability,Enchantability,エンチャント可能度
config.simplyjetpacks.tuning.enchantability.tooltip,"The enchantability of this Jetpack/Fluxpack. If set to 0, no enchantments can be applied.",このジェットパック/フラックスパックのエンチャント可能性。0に設定すると、エンチャントが適用できません
config.simplyjetpacks.tuning.energyCapacity,Energy Capacity,エネルギー容量
config.simplyjetpacks.tuning.energyPerTickIn,Energy Per Tick In,Tickあたりのエネルギー入力
config.simplyjetpacks.tuning.energyPerTickIn.tooltip,The amount of energy that can be inserted into this Jetpack/Fluxpack per tick from external sources.,外部ソースからこのジェットパック／フラックスポックに挿入できるエネルギー量（1ティックあたり）です。
config.simplyjetpacks.tuning.energyPerTickOut,Energy Per Tick Out,出力エネルギー/ティック
config.simplyjetpacks.tuning.energyPerTickOut.tooltip,The amount of energy that can be extracted from this Jetpack/Fluxpack per tick by external sources. Also determines how quickly Jetpacks/Fluxpacks can charge other items.,外部ソースからこのジェットパック/フラックスパックから抽出できるエネルギーの量です(1tick)。また、ジェットパック/フラックスパックが他のアイテムを充電できる速度も決定します。
config.simplyjetpacks.tuning.energyUsage,Energy Usage,エネルギー使用量
config.simplyjetpacks.tuning.energyUsage.tooltip,"The amount of energy that this Jetpack/Fluxpack uses every tick, when being used.",使用時にこのジェットパック/フラックスパックが毎ティック消費するエネルギー量
config.simplyjetpacks.tuning.hoverMode,Hover Mode,ホバーモード
config.simplyjetpacks.tuning.hoverMode.tooltip,"When enabled, this Jetpack will be able to activate Hover Mode.",有効にすると、このジェットパックはホバーモードを起動できるようになります。
config.simplyjetpacks.tuning.speedSideways,Sideways Speed,横方向速度
config.simplyjetpacks.tuning.speedSideways.tooltip,The speed of this Jetpack when flying sideways. This is mostly noticeable in Hover Mode.,ジェットパックが横方向に飛行する速度です。主にホバーモードで顕著です。
config.simplyjetpacks.tuning.speedVertical,Vertical Speed,垂直速度
config.simplyjetpacks.tuning.speedVertical.tooltip,The maximum vertical speed of this Jetpack when flying.,ジェットパックが飛行時の最大垂直速度
config.simplyjetpacks.tuning.speedVerticalHover,Vertical Speed (Hover Mode),垂直速度（飛行モード）
config.simplyjetpacks.tuning.speedVerticalHover.tooltip,The maximum vertical speed of this Jetpack when flying in Hover Mode.,ホバーモードで飛行時のこのジェットパックの最大垂直速度です
config.simplyjetpacks.tuning.speedVerticalHoverSlow.tooltip,The maximum vertical speed of this Jetpack when slowly descending in Hover Mode.,ホバーモードでゆっくり降下時のジェットパックの最大垂直速度
config.simplyjetpacks.tuning.sprintEnergyModifier,Sprint Energy Usage Multiplier,スプリント時のエネルギー消費倍率
config.simplyjetpacks.tuning.sprintEnergyModifier.tooltip,How much more energy this Jetpack will use when sprinting. Setting this to 1.0 will make sprinting have no effect on energy usage.,スプリント時にこのジェットパックが使用するエネルギーの増加倍率です。1.0に設定するとスプリントはエネルギー消費に影響しません。
config.simplyjetpacks.tuning.sprintSpeedModifier,Sprint Speed Multiplier,スプリント速度乗数
config.simplyjetpacks.tuning.sprintSpeedModifier.tooltip,How much faster this Jetpack will fly forward when sprinting. Setting this to 1.0 will make sprinting have no effect apart from the added speed from vanilla.,スプリント時にこのジェットパックが前方へ飛行する速度です。1.0に設定するとスプリントはバニラスピードアップ以外に影響しません。
curios.identifier.jetpack,Jetpack,ジェットパック
death.attack.simplyjetpacks.jetpack_explode,%1$s spontaneously detonated!,%1$s が突然爆発しました!
death.attack.simplyjetpacks.jetpack_potato,%1$s attempted to fly a potato!,%1$s がジャガイモで飛ぼうとしました！
enchantment.simplyjetpacks.energy_efficiency,Energy Efficiency,エネルギー効率強化
enchantment.simplyjetpacks.energy_efficiency.desc,Increases the efficiency of Jetpack energy consumption.,ジェットパックのエネルギー消費効率を向上させます
enchantment.simplyjetpacks.fuel_efficiency,Fuel Efficiency,燃料効率
enchantment.simplyjetpacks.fuel_efficiency.desc,Increases the efficiency of Jetpack fuel consumption.,ジェットパック燃料消費効率を向上させます。
guidebook.simplyjetpacks.landing_text,Welcome to the Simply Jetpacks 2 Patchouli Manual.,Simply Jetpacks 2 Patchouli Manualへようこそ。
guidebook.simplyjetpacks.name,Simply Jetpacks 2,シンプリージェットパック 2
guidebook.simplyjetpacks.subtitle,The Complete Guide,完全ガイド
hud.simplyjetpacks.charger,Charger,充電器
hud.simplyjetpacks.eHover,EHover,エアホバー
hud.simplyjetpacks.energyDepleted,Depleted,枯渇
hud.simplyjetpacks.energyDisplay,Energy: %s,エネルギー: %s
hud.simplyjetpacks.energyDisplayExtra,Energy: %s (%s),エネルギー: %s (%s)
hud.simplyjetpacks.engine,Engine,エンジン
hud.simplyjetpacks.hover,Hover,ホバー
hud.simplyjetpacks.infiniteEnergy,Infinite,無限
hud.simplyjetpacks.jetpackStates.1,%s,
hud.simplyjetpacks.jetpackStates.2,%s - %s,
hud.simplyjetpacks.jetpackStates.3,%s - %s - %s,
hud.simplyjetpacks.jetpackStates.4,%s - %s - %s - %s,
hud.simplyjetpacks.throttle,Throttle: %s%%,スロットル: %s%%
item.simplyjetpacks.armorplating_ie1,Tough Fabric Padding,強固な布製パッド
item.simplyjetpacks.armorplating_ie2,Iron Armor Plating,鉄装甲プレーティング
item.simplyjetpacks.armorplating_ie3,Steel Armor Plating,鋼鉄の防具板
item.simplyjetpacks.armorplating_mek1,Basic Armor Plating,基本防具板
item.simplyjetpacks.armorplating_mek2,Advanced Armor Plating,先進装甲プレート
item.simplyjetpacks.armorplating_mek3,Elite Armor Plating,精英防具板
item.simplyjetpacks.armorplating_mek4,Ultimate Armor Plating,究極装甲プレート
item.simplyjetpacks.armorplating_te1,Iron Alloy Armor Plating,鉄合金防具板
item.simplyjetpacks.armorplating_te2,Bronze Armor Plating,ブロンズアーマープレート
item.simplyjetpacks.armorplating_te3,Invar Armor Plating,インバール製防具板
item.simplyjetpacks.armorplating_te4,Enderium Armor Plating,エンダリウム装甲プレート
item.simplyjetpacks.armorplating_te5,Flux Armor Plating,フラックス装甲プレーティング
item.simplyjetpacks.armorplating_te5_enderium,Gelid Enderium Armor Plating,氷結エンドリウム装甲板
item.simplyjetpacks.flux_chestplate,Flux Chestplate,フラックスチェストプレート
item.simplyjetpacks.jetpack_creative,Creative Jetpack,クリエイティブジェットパック
item.simplyjetpacks.jetpack_creative_armored,Creative Jetpack (Armored),アーマードジェットパック（クリエイティブ）
item.simplyjetpacks.jetpack_ie1,Low Voltage Jetpack,低電圧ジェットパック
item.simplyjetpacks.jetpack_ie1_armored,Padded Low Voltage Jetpack (Armored),パッド付き低電圧ジェットパック（装甲付き）
item.simplyjetpacks.jetpack_ie2,Medium Voltage Jetpack,中電圧ジェットパック
item.simplyjetpacks.jetpack_ie2_armored,Medium Voltage Jetpack (Armored),中電圧ジェットパック（装甲）
item.simplyjetpacks.jetpack_ie3,High Voltage Jetpack,高電圧ジェットパック
item.simplyjetpacks.jetpack_ie3_armored,High Voltage Jetpack (Armored),高電圧ジェットパック（装甲付き）
item.simplyjetpacks.jetpack_mek1,Basic Jetpack,ベーシックジェットパック
item.simplyjetpacks.jetpack_mek1_armored,Basic Jetpack (Armored),ベーシックジェットパック（装甲付き）
item.simplyjetpacks.jetpack_mek2,Advanced Jetpack,アドバンスジェットパック
item.simplyjetpacks.jetpack_mek2_armored,Advanced Jetpack (Armored),アーマードジェットパック（高度）
item.simplyjetpacks.jetpack_mek3,Elite Jetpack,エリートジェットパック
item.simplyjetpacks.jetpack_mek3_armored,Elite Jetpack (Armored),エリートジェットパック（装甲付き）
item.simplyjetpacks.jetpack_mek4,Ultimate Jetpack,アンチマットジェットパック
item.simplyjetpacks.jetpack_mek4_armored,Ultimate Jetpack (Armored),アーマードジェットパック（究極）
item.simplyjetpacks.jetpack_potato,Potato Jetpack,ジャガイモジェットパック
item.simplyjetpacks.jetpack_te1,Leadstone Jetpack,リードストーンジェットパック
item.simplyjetpacks.jetpack_te1_armored,Leadstone Jetpack (Armored),鉛石ジェットパック（防具付き）
item.simplyjetpacks.jetpack_te2,Hardened Jetpack,強化ジェットパック
item.simplyjetpacks.jetpack_te2_armored,Hardened Jetpack (Armored),強化ジェットパック（装甲付き）
item.simplyjetpacks.jetpack_te3,Reinforced Jetpack,強化ジェットパック
item.simplyjetpacks.jetpack_te3_armored,Reinforced Jetpack (Armored),強化ジェットパック（装甲付き）
item.simplyjetpacks.jetpack_te4,Resonant Jetpack,共鳴ジェットパック
item.simplyjetpacks.jetpack_te4_armored,Resonant Jetpack (Armored),アーマードジェットパック（共鳴）
item.simplyjetpacks.jetpack_te5,Flux-Infused JetPlate,フラックス注入ジェットプレート
item.simplyjetpacks.jetpack_te5_enderium,Flux-Infused JetPlate (Enderium),フラックス注入ジェットプレート（エンダリウム）
item.simplyjetpacks.jetpack_vanilla1,Iron Jetpack,鉄のジェットパック
item.simplyjetpacks.jetpack_vanilla1_armored,Iron Jetpack (Armored),鉄製ジェットパック（防具付き）
item.simplyjetpacks.jetpack_vanilla2,Gold Jetpack,金のジェットパック
item.simplyjetpacks.jetpack_vanilla2_armored,Gold Jetpack (Armored),金製ジェットパック（防具付き）
item.simplyjetpacks.jetpack_vanilla3,Diamond Jetpack,ダイヤモンドジェットパック
item.simplyjetpacks.jetpack_vanilla3_armored,Diamond Jetpack (Armored),ダイヤモンドジェットパック（装甲付き）
item.simplyjetpacks.jetpack_vanilla4,Netherite Jetpack,ネザーiteジェットパック
item.simplyjetpacks.jetpack_vanilla4_armored,Netherite Jetpack (Armored),ネザーiteジェットパック（防具付き）
item.simplyjetpacks.leather_strap,Leather Strap,レザーストラップ
item.simplyjetpacks.particle_blend,Particle Blend,粒子ブレンド
item.simplyjetpacks.particle_flame,Particle Customizer (Flame),粒子カスタマーザー（炎）
