key,source_text,target_text
simplyjetpacks.config.tuning.jetpackEIO2,Tuning - Electrical Steel Jetpack (EIO 2),チューニング - 電気鋼ジェットパック (EIO 2)
simplyjetpacks.config.tuning.jetpackEIO3,Tuning - Energetic Jetpack (EIO 3),チューニング - エネルギックジェットパック (EIO 3)
simplyjetpacks.config.tuning.jetpackEIO4,Tuning - Vibrant Jetpack (EIO 4),調整 - 色鮮やかなジェットパック（EIO 4）
simplyjetpacks.config.tuning.jetpackEIO5,Tuning - Dark Soularium JetPlate (EIO 5),調整 - ダークソラリアムジェットプレート (EIO 5)
simplyjetpacks.config.tuning.fluxPackEIO1,Tuning - Basic Capacitor Pack (EIO 1),調整 - 基本キャパシタパック（EIO 1）
simplyjetpacks.config.tuning.fluxPackEIO2,Tuning - Double-Layer Capacitor Pack (EIO 2),チューニング - ダブルレイヤーコンデンサーパック (EIO 2)
simplyjetpacks.config.tuning.fluxPackEIO3,Tuning - Quadruple-Layer Capacitor Pack (EIO 3),チューニング - クアドラプルレイヤーコンデンサーパック (EIO 3)
simplyjetpacks.config.tuning.fluxPackEIO4,Tuning - Octadic Capacitor Pack (EIO 4),調整 - オクタディックキャパシタパック (EIO 4)
simplyjetpacks.config.tuning.jetpackBC1,Tuning - Combustion Jetpack (BC 1),チューニング - 燃焼ジェットパック (BC 1)
simplyjetpacks.config.tuning.jetpackBC2,Tuning - Kinetic Jetpack (BC 2),調整 - キネティックジェットパック (BC 2)
item.simplyjetpacks.jetpack_creative.name,Creative Jetpack,クリエイティブジェットパック
item.simplyjetpacks.fluxpack_creative.name,Creative Fluxpack,クリエイティブ・フラックスパック
item.simplyjetpacks.particle_default.name,Particle Customizer (Default),粒子カスタマーザー（デフォルト）
item.simplyjetpacks.particle_none.name,Particle Customizer (None),パーティクルカスタマイザー (なし)
item.simplyjetpacks.particle_smoke.name,Particle Customizer (Smoke),粒子カスタマーザー（煙）
item.simplyjetpacks.particle_rainbow.name,Particle Customizer (Rainbow),粒子カスタマーザー (レインボー)
item.simplyjetpacks.leather_strap.name,Leather Strap,レザーストラップ
item.simplyjetpacks.pilot_goggles.name,Pilot Goggles,パイロットゴーグル
item.simplyjetpacks.jetpack_potato.name,Potato Jetpack,ジャガイモジェットパック
item.simplyjetpacks.mysterious_potato.name,Mysterious Potato,謎のジャガイモ
item.simplyjetpacks.thruster_vanilla1.name,Iron Thruster,鉄製の推進器
item.simplyjetpacks.thruster_vanilla2.name,Gold Thruster,金製の推進器
item.simplyjetpacks.thruster_vanilla3.name,Diamond Thruster,ダイヤモンド推進器
item.simplyjetpacks.jetpack_vanilla1.name,Iron Jetpack,鉄のジェットパック
item.simplyjetpacks.jetpack_vanilla1_armored.name,Iron Jetpack (Armored),鉄製ジェットパック（防具付き）
item.simplyjetpacks.jetpack_vanilla2.name,Gold Jetpack,金のジェットパック
item.simplyjetpacks.jetpack_vanilla2_armored.name,Gold Jetpack (Armored),金製ジェットパック（防具付き）
item.simplyjetpacks.jetpack_vanilla3.name,Diamond Jetpack,ダイヤモンドジェットパック
item.simplyjetpacks.jetpack_vanilla3_armored.name,Diamond Jetpack (Armored),ダイヤモンドジェットパック（装甲付き）
item.simplyjetpacks.armorplating_eio1.name,Silicon Armor Plating,シリコンアーマープレート
item.simplyjetpacks.armorplating_eio2.name,Conductive Iron Armor Plating,導電性鉄製防具板
item.simplyjetpacks.armorplating_eio3.name,Electrical Steel Armor Plating,電気鋼鉄装甲板
item.simplyjetpacks.armorplating_eio4.name,Dark Steel Armor Plating,ダークステールアーマープレート
item.simplyjetpacks.thruster_eio1.name,Conductive Iron Thruster,導電性鉄推進器
item.simplyjetpacks.thruster_eio2.name,Electrical Steel Thruster,電気鋼推進器
item.simplyjetpacks.thruster_eio3.name,Energetic Thruster,エネルギー推進器
item.simplyjetpacks.thruster_eio4.name,Vibrant Thruster,鮮やか推進器
item.simplyjetpacks.thruster_eio5.name,Dark Soularium Thruster,ダークソウリアリウム推進器
item.simplyjetpacks.jetpack_eio1.name,Conductive Iron Jetpack,導電性鉄製ジェットパック
item.simplyjetpacks.jetpack_eio1_armored.name,Conductive Iron Jetpack (Armored),導電性鉄製ジェットパック（防具付き）
item.simplyjetpacks.jetpack_eio2.name,Electrical Steel Jetpack,電気鋼鉄ジェットパック
item.simplyjetpacks.jetpack_eio2_armored.name,Electrical Steel Jetpack (Armored),電気鋼ジェットパック（装甲付き）
item.simplyjetpacks.jetpack_eio3.name,Energetic Jetpack,エネルギージェットパック
item.simplyjetpacks.jetpack_eio3_armored.name,Energetic Jetpack (Armored),エネルギージェットパック（装甲付き）
item.simplyjetpacks.jetpack_eio4.name,Vibrant Jetpack,カラフルジェットパック
item.simplyjetpacks.jetpack_eio4_armored.name,Vibrant Jetpack (Armored),ビブラントジェットパック（装甲付き）
item.simplyjetpacks.jetpack_eio5.name,Dark Soularium JetPlate,ダークソウリアリウムジェットプレート
item.simplyjetpacks.fluxpack_eio1.name,Basic Capacitor Pack,基本キャパシタパック
item.simplyjetpacks.fluxpack_eio1_armored.name,Basic Capacitor Pack (Armored),基本キャパシタパック（防具付き）
item.simplyjetpacks.fluxpack_eio2.name,Double-Layer Capacitor Pack,ダブルレイヤーコンデンサーパック
item.simplyjetpacks.fluxpack_eio2_armored.name,Double-Layer Capacitor Pack (Armored),二重層キャパシタパック（装甲版）
item.simplyjetpacks.fluxpack_eio3.name,Octadic Capacitor Pack,オクタディックキャパシターパック
item.simplyjetpacks.fluxpack_eio3_armored.name,Octadic Capacitor Pack (Armored),八極キャパシタパック（防具付き）
item.simplyjetpacks.armorplating_te1.name,Iron Armor Plating,鉄装甲プレーティング
item.simplyjetpacks.armorplating_te2.name,Bronze Armor Plating,ブロンズアーマープレート
item.simplyjetpacks.armorplating_te3.name,Invar Armor Plating,インバール製防具板
item.simplyjetpacks.armorplating_te4.name,Enderium Armor Plating,エンダリウム装甲プレート
item.simplyjetpacks.thruster_te1.name,Leadstone Thruster,鉛石推進器
item.simplyjetpacks.thruster_te2.name,Hardened Thruster,強化推進器
item.simplyjetpacks.thruster_te3.name,Reinforced Thruster,強化推進器
item.simplyjetpacks.thruster_te4.name,Resonant Thruster,共鳴推進器
item.simplyjetpacks.thruster_te5.name,Fluxed Thruster,フラックス推進器
item.simplyjetpacks.jetpack_te1.name,Leadstone Jetpack,リードストーンジェットパック
item.simplyjetpacks.jetpack_te1_armored.name,Leadstone Jetpack (Armored),鉛石ジェットパック（防具付き）
item.simplyjetpacks.jetpack_te2.name,Hardened Jetpack,強化ジェットパック
item.simplyjetpacks.jetpack_te2_armored.name,Hardened Jetpack (Armored),強化ジェットパック（装甲付き）
item.simplyjetpacks.jetpack_te3.name,Reinforced Jetpack,強化ジェットパック
item.simplyjetpacks.jetpack_te3_armored.name,Reinforced Jetpack (Armored),強化ジェットパック（装甲付き）
item.simplyjetpacks.jetpack_te4.name,Resonant Jetpack,共鳴ジェットパック
item.simplyjetpacks.jetpack_te4_armored.name,Resonant Jetpack (Armored),アーマードジェットパック（共鳴）
item.simplyjetpacks.jetpack_te5.name,Flux-Infused JetPlate,フラックス注入ジェットプレート
item.simplyjetpacks.jetpack_te5_enderium.name,Enderium Flux-Infused JetPlate,エンダリウムフロックスイフトジェットプレート
item.simplyjetpacks.fluxpack_te1.name,Leadstone Fluxpack,鉛石フラックスパック
item.simplyjetpacks.fluxpack_te1_armored.name,Leadstone Fluxpack (Armored),鉛石フラックスパック（装甲付き）
item.simplyjetpacks.fluxpack_te2.name,Hardened Fluxpack,硬化フラックスパック
item.simplyjetpacks.fluxpack_te2_armored.name,Hardened Fluxpack (Armored),硬化フラックスパック（装甲付き）
item.simplyjetpacks.fluxpack_te3.name,Reinforced Fluxpack,強化フラックスパック
item.simplyjetpacks.fluxpack_te3_armored.name,Reinforced Fluxpack (Armored),強化フラックスパック（防具付き）
item.simplyjetpacks.fluxpack_te4.name,Resonant Fluxpack,共鳴フラックスパック
item.simplyjetpacks.fluxpack_te4_armored.name,Resonant Fluxpack (Armored),共鳴フラックスパック（装甲付き）
item.simplyjetpacks.armorplating_mek1.name,Basic Armor Plating,基本防具板
item.simplyjetpacks.armorplating_mek2.name,Advanced Armor Plating,先進装甲プレート
item.simplyjetpacks.armorplating_mek3.name,Elite Armor Plating,精英防具板
item.simplyjetpacks.armorplating_mek4.name,Ultimate Armor Plating,究極装甲プレート
item.simplyjetpacks.thruster_mek1.name,Basic Thruster,基本推進器
item.simplyjetpacks.thruster_mek2.name,Advanced Thruster,アドバンスド推進器
item.simplyjetpacks.thruster_mek3.name,Elite Thruster,エリート推進器
item.simplyjetpacks.thruster_mek4.name,Ultimate Thruster,アルティメット推進器
item.simplyjetpacks.jetpack_mek1.name,Basic Jetpack,ベーシックジェットパック
item.simplyjetpacks.jetpack_mek1_armored.name,Basic Jetpack (Armored),ベーシックジェットパック（装甲付き）
item.simplyjetpacks.jetpack_mek2.name,Advanced Jetpack,アドバンスジェットパック
item.simplyjetpacks.jetpack_mek2_armored.name,Advanced Jetpack (Armored),アーマードジェットパック（高度）
item.simplyjetpacks.jetpack_mek3.name,Elite Jetpack,エリートジェットパック
item.simplyjetpacks.jetpack_mek3_armored.name,Elite Jetpack (Armored),エリートジェットパック（装甲付き）
item.simplyjetpacks.jetpack_mek4.name,Ultimate Jetpack,アンチマットジェットパック
item.simplyjetpacks.jetpack_mek4_armored.name,Ultimate Jetpack (Armored),アーマードジェットパック（究極）
item.simplyjetpacks.armorplating_ie1.name,Tough Fabric Padding,強固な布製パッド
item.simplyjetpacks.armorplating_ie2.name,Iron Armor Plating,鉄装甲プレーティング
item.simplyjetpacks.armorplating_ie3.name,Steel Armor Plating,鋼鉄の防具板
item.simplyjetpacks.thruster_ie1.name,Low Voltage Thruster,低電圧推進器
item.simplyjetpacks.thruster_ie2.name,Medium Voltage Thruster,中電圧推進器
item.simplyjetpacks.thruster_ie3.name,High Voltage Thruster,高電圧推進器
item.simplyjetpacks.jetpack_ie1.name,Low Voltage Jetpack,低電圧ジェットパック
item.simplyjetpacks.jetpack_ie1_armored.name,Low Voltage Jetpack (Armored),低電圧ジェットパック（防具付き）
item.simplyjetpacks.jetpack_ie2.name,Medium Voltage Jetpack,中電圧ジェットパック
item.simplyjetpacks.jetpack_ie2_armored.name,Medium Voltage Jetpack (Armored),中電圧ジェットパック（装甲）
item.simplyjetpacks.jetpack_ie3.name,High Voltage Jetpack,高電圧ジェットパック
item.simplyjetpacks.jetpack_ie3_armored.name,High Voltage Jetpack (Armored),高電圧ジェットパック（装甲付き）
item.simplyjetpacks.unit_cryotheum_empty.name,Cryotheum Coolant Unit (Empty),クライオテム冷却ユニット（空）
item.simplyjetpacks.unit_cryotheum.name,Cryotheum Coolant Unit,クライオテム冷却ユニット
item.simplyjetpacks.unit_glowstone_empty.name,Glowstone Elevation Unit (Empty),グロウストーン・エレベーションユニット（空）
item.simplyjetpacks.unit_glowstone.name,Glowstone Elevation Unit,グロウストーン上昇ユニット
item.simplyjetpacks.unit_flight_control_empty.name,Flight Control Unit (Empty),飛行制御ユニット（空）
item.simplyjetpacks.unit_flight_control.name,Flight Control Unit,フライト制御ユニット
item.simplyjetpacks.ingot_dark_soularium.name,Dark Soularium Ingot,ダークソウラリウムインゴット
item.simplyjetpacks.reinforced_glider_wing.name,Reinforced Glider Wing,強化滑空翼
item.simplyjetpacks.flux_plate.name,Flux-Infused Chestplate Assembly,フラックス注入チェストプレート組立
item.simplyjetpacks.flux_armorplating.name,Fluxed Armor Plating,フラックス化アーマープレート
chat.simplyjetpacks.enabled,enabled,有効
chat.simplyjetpacks.disabled,disabled,無効
chat.simplyjetpacks.not_available,not available,利用不可
chat.simplyjetpacks.jetpack.engine_mode,Jetpack Engine %s,ジェットパックエンジン %s
chat.simplyjetpacks.jetpack.hover_mode,Hover Mode %s,ホバーモード %s
chat.simplyjetpacks.jetpack.charger_mode,Charger Mode %s,充電モード %s
chat.simplyjetpacks.jetpack.emergency_hover_mode,Emergency Hover Mode %s,緊急ホバーモード %s
chat.simplyjetpacks.jetpack.emergency_hover_mode.msg,"WARNING: User about to die, Emergency Hover Activated!",警告：ユーザーが死亡寸前です。緊急ホバーモードを起動！
chat.simplyjetpacks.fluxpack.engine_mode,Fluxpack Engine %s,フロックスペックエンジン %s
tooltip.simplyjetpacks.holdShift,Hold %s for Details,%s を押し続けて詳細
tooltip.simplyjetpacks.holdShift.shift,Shift,シフト
tooltip.simplyjetpacks.on,On,オン
tooltip.simplyjetpacks.off,Off,オフ
tooltip.simplyjetpacks.enabled,Enabled,有効
tooltip.simplyjetpacks.disabled,Disabled,無効
tooltip.simplyjetpacks.yes,Yes,はい
tooltip.simplyjetpacks.no,No,いいえ
tooltip.simplyjetpacks.state,State,状態
tooltip.simplyjetpacks.tier,Tier %d,レベル %d
tooltip.simplyjetpacks.energy.none,None,なし
tooltip.simplyjetpacks.energy.infinite,Infinite Energy,無限エネルギー
tooltip.simplyjetpacks.energyPerTick,%s RF/t,
tooltip.simplyjetpacks.energyWithMax,%s/%s RF,
tooltip.simplyjetpacks.energyUsage,Energy Usage,エネルギー使用量
tooltip.simplyjetpacks.chargerRate,Charger Rate,充電率
tooltip.simplyjetpacks.energySend,Send,送信
tooltip.simplyjetpacks.energyReceive,Receive,受信
tooltip.simplyjetpacks.hover_mode,Hover Mode,ホバーモード
tooltip.simplyjetpacks.emergency_hover_mode,Emergency Hover Mode,緊急ホバーモード
tooltip.simplyjetpacks.charger_mode,Charger Mode,充電モード
tooltip.simplyjetpacks.particles,Particles,粒子
tooltip.simplyjetpacks.particles.0,Default,デフォルト
tooltip.simplyjetpacks.particles.1,None,なし
tooltip.simplyjetpacks.particles.2,Smoke,煙
tooltip.simplyjetpacks.particles.3,Rainbow,レインボー
tooltip.simplyjetpacks.enderium_energy_bonus,Supercooled! Energy Usage Rate %s%%,超低温！エネルギー使用率 %s%%
tooltip.simplyjetpacks.jetpack.description.1,Allows flight when active.,有効時に飛行を許可
tooltip.simplyjetpacks.jetpack.description.2,Must be worn as a chestplate.,チェストプレートとして装着する必要があります
tooltip.simplyjetpacks.fluxpack.description.1,Charges armor and held items when active.,アクティブ時に防具と保持アイテムにチャージします。
tooltip.simplyjetpacks.fluxpack.description.2,Must be worn as a chestplate.,チェストプレートとして装着する必要があります
tooltip.simplyjetpacks.jetplate.description.1,Allows flight and can charge items when active.,飛行を許可し、アクティブ時にアイテムを充電できます。
tooltip.simplyjetpacks.jetplate.description.2,Must be worn as a chestplate.,チェストプレートとして装着する必要があります
tooltip.simplyjetpacks.particle_customizers.description.1,Used to customize a Jetpack's particles.,ジェットパックの粒子をカスタマイズするために使用します。
tooltip.simplyjetpacks.particle_customizers.description.2,Craft with a Jetpack to apply.,ジェットパックでクラフトして適用します。
tooltip.simplyjetpacks.ra_replacement.description.1,Redstone Arsenal is not installed.,レッドストーンアーセナルがインストールされていません。
tooltip.simplyjetpacks.ra_replacement.description.2,"So instead, have this blatant rip-off",その代わりに、これを明白な盗作として扱う
tooltip.simplyjetpacks.ra_replacement.description.3,of one if its items.,アイテムのいずれかの
tooltip.simplyjetpacks.enderium_upgrade.description.1,Makes a Flux-Infused JetPlate look like an Enderium Flux armor piece.,フラックス浸透ジェットプレートをエンダリウムフラックスアーマーに見せます。
tooltip.simplyjetpacks.enderium_upgrade.description.2,an Enderium Flux armor piece.,エンダリウムフラックス製の防具片
tooltip.simplyjetpacks.pilot_goggles.description.1,Only the best goggles for the best pilot!,最高のパイロットには最高のゴーグルだけ！
tooltip.simplyjetpacks.jetpack_potato.warning,Clever! But not survivable.,賢いが、生存不可能。
gui.simplyjetpacks.hud.jetpack.energy,Jetpack Energy,ジェットパックのエネルギー
gui.simplyjetpacks.hud.fluxpack.energy,Fluxpack Energy,フラックスパックエネルギー
gui.simplyjetpacks.hud.energy.depleted,Depleted,枯渇
gui.simplyjetpacks.hud.state.engine,Engine,エンジン
gui.simplyjetpacks.hud.state.charger,Charger,充電器
gui.simplyjetpacks.hud.state.hover,Hover,ホバー
gui.simplyjetpacks.hud.state.eHover,Emergency Hover,緊急ホバー
gui.simplyjetpacks.button.toggleEngine,Toggle Engine,エンジンの切り替え
gui.simplyjetpacks.button.toggleCharger,Toggle Charger,充電器の切り替え
gui.simplyjetpacks.button.toggleHover,Toggle Hover Mode,ホバーモードを切替
gui.simplyjetpacks.button.toggleEHover,Toggle Emergency Hover Mode,緊急ホバーモードを切り替え
death.attack.jetpack_potato.player,%1$s attempted to fly a potato,%1$s がジャガイモを飛ばそうとしました
death.attack.jetpack_explode.player,%1$s spontaneously detonated,%1$s が自発的に爆発した
death.fall.jetpack_no_energy.player,%1$s ran out of energy and hit the ground to hard,%1$s がエネルギー切れになり、地面に激しく衝突しました
death.fall.jetpack_no_hover.player,%1$s did not enable hover and hit the ground to hard,%1$s はホバーモードを有効にせず、地面に激しく衝突しました
keybind.simplyjetpacks.engine,Toggle Jetpack/Fluxpack Engine,ジェットパック/フロックスイフトエンジンを切り替え
keybind.simplyjetpacks.hover,Toggle Hover Mode,ホバーモードを切替
keybind.simplyjetpacks.emergency_hover,Toggle Emergency Hover Mode,緊急ホバーモードを切り替え
keybind.simplyjetpacks.charger,Toggle Jetpack Charger,ジェットパック充電器を切り替え
keybind.simplyjetpacks.gui,Toggle Jetpack/Fluxpack GUI,ジェットパック/フラックスパックGUIを切替
config.simplyjetpacks.title,Simply Jetpacks Configuration,Simply Jetpacks設定
config.simplyjetpacks.items,Item Settings,アイテム設定
config.simplyjetpacks.items.tooltip,Adjust Item Settings.,アイテム設定を調整します。
config.simplyjetpacks.integration,Integration Settings,統合設定
config.simplyjetpacks.integration.tooltip,Turn Integration with other mods on or off. (Note: Integrations for different mods are not explicitly balanced around each other!),他のModとの統合をオン/オフにしてください。(注:異なるMod間の統合は相互にバランス調整されていません。)
config.simplyjetpacks.controls,Controls Settings,コントロール設定
config.simplyjetpacks.controls.tooltip,Adjust Controls Settings.,制御設定を調整します。
config.simplyjetpacks.crafting,Crafting Settings,クラフト設定
config.simplyjetpacks.crafting.tooltip,Adjust Crafting Settings.,クラフト設定を調整します。
config.simplyjetpacks.aesthetics,Aesthetics Settings,美観設定
config.simplyjetpacks.aesthetics.tooltip,Adjust Aesthetics Settings.,美観設定を調整
config.simplyjetpacks.gui,GUI Settings,GUI設定
config.simplyjetpacks.gui.tooltip,Adjust GUI Settings,GUI設定調整
config.simplyjetpacks.sounds,Sound Settings,音声設定
config.simplyjetpacks.sounds.tooltip,Adjust Sound Settings.,音声設定を調整します。
config.simplyjetpacks.tuning,Tuning Settings,チューニング設定
config.simplyjetpacks.tuning.tooltip,Tune Jetpack and Fluxpack values.,ジェットパックとフラックスパックの値を調整します。
config.simplyjetpacks.controls.customControls,Custom Controls,カスタムコントロール
config.simplyjetpacks.controls.customControls.tooltip,"When enabled, the key codes specified here will be used for the fly and descend keys. Otherwise, the vanilla jump and sneak keys will be used.",有効にすると、ここで指定されたキーコードが飛行およびニフティダッシュキーに使用されます。そうでない場合は、バニラのジャンプキーとスニークキーが使用されます。
config.simplyjetpacks.controls.flyKey,Custom Fly key,カスタム飛行キー
config.simplyjetpacks.controls.flyKey.tooltip,The name of the Fly key when Custom Controls are enabled.,カスタムコントロールが有効なときのフライキーの名前
config.simplyjetpacks.controls.descendKey,Custom Descend key,カスタム下落キー
config.simplyjetpacks.controls.descendKey.tooltip,The name of the Descend key when Custom Controls are enabled.,カスタムコントロール有効時のDescendキー名
config.simplyjetpacks.controls.invertHoverSneakingBehavior,Invert Hover Mode Sneaking Behavior,ホバーモードの隠れ行動を反転
config.simplyjetpacks.controls.invertHoverSneakingBehavior.tooltip,Invert Hover Mode sneaking behavior.,ホバー・モードの潜行行動を反転します。
config.simplyjetpacks.controls.doubleTapSprintInAir,Allow double-tap sprinting while flying,飛行中でもダブルタップでジャンプを許可
config.simplyjetpacks.controls.doubleTapSprintInAir.tooltip,"When enabled, sprinting by double-tapping the forward key will work while flying with a Jetpack. Can be used as an easier way to activate a Jetpack's boost while airborne (the sprint key also works).",有効にすると、前進キーのダブルタップによるスプリントがジェットパックでの飛行中に機能します。ジェットパックのブースト起動の簡単な方法として使用できます(スプリントキーも機能します)。
config.simplyjetpacks.aesthetics.enableArmor3DModels,Enable Armor 3D Models,防具の3Dモデルを有効にします。
config.simplyjetpacks.aesthetics.enableArmor3DModels.tooltip,"When enabled, worn Jetpacks and Fluxpacks will have a 3D armor model. Otherwise, flat textures will be used.",有効にすると、装備されたジェットパックとフラックスパックは3Dアーマーモデルを使用します。有効でない場合は、フラットテクスチャが使用されます。
config.simplyjetpacks.sounds.jetpackSounds,Jetpack Sounds,ジェットパックの音声
config.simplyjetpacks.sounds.jetpackSounds.tooltip,"When enabled, jetpacks will make sounds when used.",有効にすると、ジェットパックが使用時に音を出します
config.simplyjetpacks.gui.holdShiftForDetails,Hold Shift for Details,詳細を表示するにはシフトを押してください。
config.simplyjetpacks.gui.holdShiftForDetails.tooltip,"When enabled, item details are only shown in the tooltip when holding Shift.",有効にすると、Shiftを保持しているときのみツールチップでアイテム詳細が表示されます
config.simplyjetpacks.gui.hudPosition,HUD Position,HUD位置
config.simplyjetpacks.gui.hudPosition.tooltip,Change the position of the HUD.,HUDの位置を変更
config.simplyjetpacks.gui.HUDOffsetX,HUD Offset - X,HUDオフセット - X
config.simplyjetpacks.gui.HUDOffsetX.tooltip,The HUD display will be shifted horizontally by this value. This value may be negative.,HUD表示がこの値だけ水平方向にシフトします。この値は負になる場合があります。
config.simplyjetpacks.gui.HUDOffsetY,HUD Offset - Y,HUDオフセット - Y
config.simplyjetpacks.gui.HUDOffsetY.tooltip,The HUD display will be shifted vertically by this value. This value may be negative.,HUD表示はこの値だけ垂直方向にシフトされます。この値は負になることもあります。
config.simplyjetpacks.gui.HUDScale,HUD Scale,HUDスケール
config.simplyjetpacks.gui.HUDScale.tooltip,How large the HUD will be rendered.,HUDの描画サイズはどれくらいですか。
config.simplyjetpacks.gui.showHUDWhileChatting,Show HUD While Chatting,チャット時にHUDを表示
config.simplyjetpacks.gui.showHUDWhileChatting.tooltip,"When enabled, the HUD will display even when the chat window is opened.",有効にすると、チャットウィンドウが開いている時でもHUDが表示されます。
config.simplyjetpacks.gui.enableEnergyHUD,Enable Energy HUD,エネルギーHUDを有効化
config.simplyjetpacks.gui.enableEnergyHUD.tooltip,"When enabled, a HUD that displays the energy level of the currently worn Jetpack or Fluxpack will show.",有効にすると、現在装備されているジェットパックまたはフラックスパックのエネルギーレベルを表示するHUDが表示されます。
config.simplyjetpacks.gui.minimalEnergyHUD,Minimal Energy HUD,最小エネルギーHUD
config.simplyjetpacks.gui.minimalEnergyHUD.tooltip,"When enabled, only the energy amounts themselves will be rendered on the energy HUD.",有効にすると、エネルギーHUDにはエネルギー量のみが表示されます。
config.simplyjetpacks.gui.showExactEnergyInHUD,Exact Energy HUD,正確エネルギーHUD
