key,source_text,target_text
config.structure_layout_optimizer.deduplicate_shuffled_template_pool_element_list,Deduplicate shuffled template pool element list,シャッフルされたテンプレートプール要素リストを重複除去する
config.structure_layout_optimizer.deduplicate_shuffled_template_pool_element_list.desc,"Whether to use an alternative strategy to make structure layouts generate slightly even faster than the default optimization this mod has for template pool weights. This alternative strategy works by changing the list of pieces that structures collect from the template pool to not have duplicate entries.
This will not break the structure generation, but it will make the structure layout different than if this config was off (breaking vanilla seed parity). The cost of speed may be worth it in large modpacks where many structure mods are using very high weight values in their template pools.

Pros: Get a bit more performance from high weight Template Pool Structures.
Cons: Loses parity with vanilla seeds on the layout of the structure. (Structure layout is not broken, just different)","テンプレートプール要素リストの重複排除シャッフル戦略を使用するかどうか。このModがテンプレートプールの重さに対して行うデフォルトの最適化よりも若干高速に構造レイアウトを生成する代替戦略を使用します。この代替戦略は、構造物がテンプレートプールから収集するピースのリストが重複しないエントリを持つように変更することで機能します。

これは構造物生成を破壊しませんが、この設定がオフの場合とは異なる構造レイアウトになります（バニラシード互換性が失われます）。大規模なModpackで多くの構造物Modが非常に高い重み値をテンプレートプールで使用している場合、速度のコストは価値があるかもしれません。

メリット：高い重さのテンプレートプール構造からのパフォーマンスが向上します。
デメリット：構造レイアウトのバニラシードとの互換性が失われます。（構造物生成は破壊されませんが、異なります）"
