key,source_text,target_text
__comment,Tier 3 Mod Compat Traits,ティア3モッド互換特性
_comment,Gadget Advancements,ガジェット進捗
_conment,Tool Descriptions,ツールの説明
advancements.tconstruct.foundry.alloyer.description,"Create a basic alloying setup using an alloyer, a fuel tank, some ingot tanks, a casting table, a casting basin, and a faucet",鋳造テーブル、鋳造盆地、蛇口、インゴットタンク、燃料タンクを使って基本的な合金化設備を構築する
advancements.tconstruct.foundry.alloyer.title,Basic Alloyer,基本的な合金装置
advancements.tconstruct.foundry.blaze.description,Fill a tank with blazing blood,タンクにブレイズの血液を入れます
advancements.tconstruct.foundry.blaze.title,Blazing Blood,ブレイズの血液
advancements.tconstruct.foundry.encyclopedia.description,Craft the encyclopedia of materials with your knowledge from all the books,すべての本から得た知識で、素材百科事典を作成してください
advancements.tconstruct.foundry.encyclopedia.title,Encyclopedia,百科事典
advancements.tconstruct.foundry.fantastic_foundry.description,"Create fantastic foundry, the nether smelting guidebook",ネザー精錬ガイドブックの素晴らしい鍛冶場を製作する
advancements.tconstruct.foundry.fantastic_foundry.title,Nether Smelting,ネザー精錬
advancements.tconstruct.foundry.manyullyn_lanterns.description,Create a full stack of seared or scorched lanterns filled with molten manyullyn,溶けたマニウリンで満杯になる焼き灯や焦げたランタンのスタックを作成します。
advancements.tconstruct.foundry.manyullyn_lanterns.title,Rich Lighting,豪華な照明
advancements.tconstruct.foundry.plate_armor.description,Create a full set of plate armor,プレートアーマーのフルセットを作る
advancements.tconstruct.foundry.plate_armor.title,Plate Armor,プレートアーマー
advancements.tconstruct.foundry.structure.description,"Craft a founry controller from alloyed obsidian, build a foundry, and open the foundry UI",鋳造制御ブロックを鍛えた黒曜石から製作し、鋳造炉を構築してUIを開く
advancements.tconstruct.foundry.structure.title,The Fantastic Foundry,素晴らしい鍛冶場
advancements.tconstruct.smeltery.abilities.description,Apply every single default ability modifier to a tool at least once,すべてのデフォルト能力修飾子をツールに少なくとも一度は適用します
advancements.tconstruct.smeltery.abilities.title,Ability Master,能力マスター
advancements.tconstruct.smeltery.cast_collector.description,Collect one of each gold cast,各金型を一つずつ集めてください
advancements.tconstruct.smeltery.cast_collector.title,Cast Collector,投射物収集器
advancements.tconstruct.smeltery.gold_casting.title,Shiny Casts,キラキラの金型
advancements.tconstruct.smeltery.melter.description,"Make a basic melting setup with a melter, a heater or tank, a casting basin, a casting table, and a faucet",鋳造テーブル、鋳造盆地、蛇口、加熱装置またはタンクを使って基本的な溶解設備を構築する
advancements.tconstruct.smeltery.melter.title,Basic Meltery,基本的な精錬所
advancements.tconstruct.smeltery.mighty_smelting.description,"Craft the guidebook into the smeltery, mighty smelting",説明書を精錬炉で製作して、強力な精錬を実行する
advancements.tconstruct.smeltery.mighty_smelting.title,Smelting 201,中級の精錬
advancements.tconstruct.smeltery.puny_smelting.description,Craft the guidebook puny smelting,説明書を製作して、初級の精錬を実行する
advancements.tconstruct.smeltery.puny_smelting.title,Smeltery Recruit,精錬初心者
advancements.tconstruct.smeltery.sand_casting.title,Sand Casting,砂の成型
advancements.tconstruct.smeltery.structure.description,"Craft a smeltery controller from casting molten copper, build a smeltery, and open the smeltery UI","溶銅から精錬制御ブロックをつくって、精錬所を作って,UIを使ってみる"
advancements.tconstruct.smeltery.structure.title,The Mighty Smeltery,偉大な精錬所
advancements.tconstruct.smeltery.tinkers_anvil.description,Craft a Tinker's Anvil using alloys from the smeltery!,精錬炉の合金を使って鋳掛け者の金床をクラフトする
advancements.tconstruct.smeltery.tinkers_anvil.title,Advanced Tool Making,高度なツール作成
advancements.tconstruct.smeltery.tool_forge.title,Tool Forge,ツールフォージ
advancements.tconstruct.tools.glass_cannon.description,Create a tool that does over 20 damage with at most 100 durability,耐久値最大100で20以上のダメージを与えるツールを作成します。
advancements.tconstruct.tools.glass_cannon.title,Glass Cannon,ガラスキャノン
advancements.tconstruct.tools.make_part.description,Create your first tool part using a pattern and some material in the part builder,パーツビルダーでパターンといくつかのマテリアルを使用して、最初のツールパーツを作成します
advancements.tconstruct.tools.make_part.title,Tool Parts,ツールパーツ
advancements.tconstruct.tools.material_master.description,Use each default material at least once,各デフォルト素材を少なくとも一度は使用してください
advancements.tconstruct.tools.material_master.title,Material Master,素材マスター
advancements.tconstruct.tools.materials_and_you.description,"Craft Materials and You, the introduction book into Tinkers' Construct",Tinkers Constructの紹介書「Materials and You」をクラフトする
advancements.tconstruct.tools.materials_and_you.title,Tinker In Training,初心者の鋳掛け者
advancements.tconstruct.tools.modified.description,Apply a modifier to a tinker tool,鋳掛け者ツールに改造を施す
advancements.tconstruct.tools.modified.title,Modification,改造
advancements.tconstruct.tools.part_builder.description,"Create a part builder, your first step to making tools",パーツビルダーを作りました。ツールを作るための最初のステップ。
advancements.tconstruct.tools.part_builder.title,Part Builder,パーツビルダー
advancements.tconstruct.tools.tinker_station.description,Create a tinker station to combine parts into tools,パーツをツールに組み合わせる。　鋳掛け者ステーションを作ってみる。
advancements.tconstruct.tools.tinker_station.title,Tinker Station,鋳掛け者ステーション
advancements.tconstruct.tools.tinker_tool.description,Create a your first tinker tool,最初のツールを作った！
advancements.tconstruct.tools.tinker_tool.title,Novice Tinker,低級の鋳掛け者
advancements.tconstruct.tools.tool_smith.description,Create one of every default small tool,デフォルトの小型ツールをすべて作成する
advancements.tconstruct.tools.tool_smith.title,Tool Smith,ツールの鍛冶屋
advancements.tconstruct.tools.travelers_gear.description,Craft a full set of traveler's gear,旅行者の防具を全種類作る
advancements.tconstruct.tools.travelers_gear.title,Traveler,旅行者
advancements.tconstruct.tools.upgrade_slots.description,"Give a tool 6 more upgrade slots using writable, recapitated, harmonious, resurrected, and gilded",書き込み可能、再生された、調和した、復活させた、金装飾された 5 種類のアップグレードスロットをツールに追加します
advancements.tconstruct.tools.upgrade_slots.title,All the Upgrades,全てのアップグレード
advancements.tconstruct.world.blood_island.title,Blood Island,血液スライム島
advancements.tconstruct.world.clay_island.description,Locate a clay island in the sky,空中にある粘土島を探す
advancements.tconstruct.world.clay_island.title,Clay Island,粘土島
advancements.tconstruct.world.earth_island.description,Locate an earthslime island in the ocean,海でアーススライム島を探す
advancements.tconstruct.world.earth_island.title,Earthslime Island,土スライム島
advancements.tconstruct.world.ender_island.description,Locate an enderslime island in the end outer islands,エンダースライム島をエンド外層の島で探す。
advancements.tconstruct.world.ender_island.title,Enderslime Island,エンダースライム島
advancements.tconstruct.world.piggybackpack.description,Pick up a pig with a piggybackpack,ピッグバックパック付きの豚を拾う
advancements.tconstruct.world.piggybackpack.title,Pig Piggyback,豚の背負い
advancements.tconstruct.world.sky_island.title,Skyslime Island,空スライム島
advancements.tconstruct.world.slime_collector.title,Slime Collector,スライムコレクター
advancements.tconstruct.world.slime_sling.description,Sufficiently use each of the 4 slime sling types,４種類のスライムスリングを使ってみる
advancements.tconstruct.world.slime_sling.title,Sling Expert,スリング使いの達人
advancements.tconstruct.world.slimeskull.description,Craft every type of slimeskull,全種類のスライムスカルを作る
advancements.tconstruct.world.slimeskull.title,Skull Collector,頭蓋骨コレクター
advancements.tconstruct.world.slimesuit.description,Create a full slimesuit,スライムスーツのフルセットを作る
advancements.tconstruct.world.slimesuit.title,Slimesuit,スライムスーツ
advancements.tconstruct.world.tinkers_gadgetry.description,Craft Tinker's Gadgetry to begin exploring the world,Tinker's Gadgetryをクラフトして世界探検を始める
advancements.tconstruct.world.tinkers_gadgetry.title,Tinker's Gadgetry,鋳掛け者の機械
block.tconstruct.black_clear_stained_glass,Clear Black Stained Glass,黒色の透明なステンドグラス
block.tconstruct.black_clear_stained_glass_pane,Clear Black Stained Glass Pane,黒色の透明なステンドグラス版
block.tconstruct.blaze_head,Blaze Head,ブレイズの頭
block.tconstruct.blazewood,Blazewood,ブレイズの板材
block.tconstruct.blazewood_slab,Blazewood Slab,ブレイズの板材のハーフブロック
block.tconstruct.blazewood_stairs,Blazewood Stairs,ブレイズの板材の階段
block.tconstruct.blazing_blood_fluid,Blazing Blood,ブレイズの血液
block.tconstruct.blood_cake,Blood Cake,血液ケーキ
block.tconstruct.blood_congealed_slime,Congealed Blood,凝固のブラッディーブロック
block.tconstruct.blood_congealed_slime.tooltip,Lets you jump really high,本当に高くジャンプできます
block.tconstruct.blood_earth_slime_grass,Bloody Nylium,ブラッディー草
block.tconstruct.blood_earth_slime_grass.tooltip,Lets you jump higher and produces bloodshrooms when bonemealed,高くに飛べる。骨粉をまくと血キノコを生成します。
block.tconstruct.blood_ender_slime_grass,Bloody Nylium,ブラッディー草
block.tconstruct.blood_ender_slime_grass.tooltip,Lets you jump higher and produces bloodshrooms when bonemealed,高くに飛べる。骨粉をまくと血キノコを生成します。
block.tconstruct.blood_fluid,Blood,血液
block.tconstruct.blood_ichor_slime_grass,Bloody Nylium,ブラッディー草
block.tconstruct.blood_ichor_slime_grass.tooltip,Lets you jump higher and produces bloodshrooms when bonemealed,高くに飛べる。骨粉をまくと血キノコを生成します。
block.tconstruct.blood_sky_slime_grass,Bloody Nylium,ブラッディー草
block.tconstruct.blood_sky_slime_grass.tooltip,Lets you jump higher and produces bloodshrooms when bonemealed,高くに飛べる。骨粉をまくと血キノコを生成します。
block.tconstruct.blood_slime,Blood Block,ブラッディーブロック
block.tconstruct.blood_slime.tooltip,"Bouncy, but not sticky",弾力的だが粘着性がない
block.tconstruct.blood_slime_sapling,Bloodshroom,血キノコ
block.tconstruct.blood_slime_sapling.tooltip,Only grows on slimy nylium,ぬるぬるした土や草の上でのみ成長します
block.tconstruct.blood_vanilla_slime_grass,Bloody Nylium,ブラッディー草
block.tconstruct.blood_vanilla_slime_grass.tooltip,Lets you jump higher and produces bloodshrooms when bonemealed,高くに飛べる。骨粉をまくと血キノコを生成します。
block.tconstruct.bloodshroom_button,Bloodshroom Button,血キノコのボタン
block.tconstruct.bloodshroom_door,Bloodshroom Door,血キノコのドア
block.tconstruct.bloodshroom_fence,Bloodshroom Fence,血キノコのフェンス
block.tconstruct.bloodshroom_fence_gate,Bloodshroom Fence Gate,血キノコのフェンスゲート
block.tconstruct.bloodshroom_log,Bloodshroom Stem,血キノコの幹
block.tconstruct.bloodshroom_planks,Bloodshroom Planks,血キノコの板材
block.tconstruct.bloodshroom_planks_slab,Bloodshroom Slab,血キノコのハーフブロック
block.tconstruct.bloodshroom_planks_stairs,Bloodshroom Stairs,血キノコの階段
block.tconstruct.bloodshroom_pressure_plate,Bloodshroom Pressure Plate,血キノコの圧力板
block.tconstruct.bloodshroom_sign,Bloodshroom Sign,血キノコの看板
block.tconstruct.bloodshroom_trapdoor,Bloodshroom Trapdoor,血キノコのトラップドア
block.tconstruct.bloodshroom_wall_sign,Bloodshroom Sign,血キノコの看板
block.tconstruct.bloodshroom_wood,Bloodshroom Hyphae,血キノコの菌糸
block.tconstruct.blue_clear_stained_glass,Clear Blue Stained Glass,青色の透明なステンドグラス
block.tconstruct.blue_clear_stained_glass_pane,Clear Blue Stained Glass Pane,青色の透明なステンドグラス版
block.tconstruct.brown_clear_stained_glass,Clear Brown Stained Glass,茶色の透明なステンドグラス
block.tconstruct.brown_clear_stained_glass_pane,Clear Brown Stained Glass Pane,茶色の透明なステンドグラス版
block.tconstruct.cast_chest,Cast Chest,鋳型チェスト
block.tconstruct.cast_chest.tooltip,Holds all relevant casts,全ての関連する金型を保管できます
block.tconstruct.cave_spider_head,Cave Spider Head,洞窟クモの頭
block.tconstruct.channel.down.none,Disallowed flowing down,下に流しません
block.tconstruct.channel.down.out,Allowed flowing down,下に流れます
block.tconstruct.channel.side.in,Set side to flow inwards,手前側に流れるように設定
block.tconstruct.channel.side.none,Disallowed flowing on side,流れないように設定
block.tconstruct.channel.side.out,Set side to flow outwards,奥側に流れるように設定
block.tconstruct.chiseled_scorched_bricks,Chiseled Scorched Bricks,彫刻された焦げたレンガ
block.tconstruct.clear_glass,Clear Glass,透明なグラス
block.tconstruct.clear_glass_pane,Clear Glass Pane,透明なグラス版
block.tconstruct.cobalt_block,Block of Cobalt,コバルトブロック
block.tconstruct.cobalt_block.tooltip,Can be used as beacon base,ビーコンのベースとして使用できます
block.tconstruct.cobalt_ore,Nether Cobalt Ore,ネザーコバルト鉱石
block.tconstruct.copper_block,Block of Copper,銅ブロック
block.tconstruct.copper_block.tooltip,Can be used as beacon base,ビーコンのベースとして使用できます
block.tconstruct.copper_ore,Copper Ore,銅鉱石
block.tconstruct.crafting_station,Crafting Station,改良作業台
block.tconstruct.cyan_clear_stained_glass,Clear Cyan Stained Glass,青緑色の透明なステンドグラス
block.tconstruct.cyan_clear_stained_glass_pane,Clear Cyan Stained Glass Pane,青緑色の透明なステンドグラス版
block.tconstruct.drowned_head,Drowned Head,ドラウンドの頭
block.tconstruct.earth_cake,Earthslime Cake,スライムケーキ
block.tconstruct.earth_congealed_slime,Congealed Slime Block,凝固したスライムブロック
block.tconstruct.earth_congealed_slime.tooltip,Lets you jump really high,本当に高くジャンプできます
block.tconstruct.earth_earth_slime_grass,Earthslime Grass,スライムの草
block.tconstruct.earth_earth_slime_grass.tooltip,Lets you jump higher and spawns earthslimes in the overworld,高くに飛べる。スライムを生み出します。
block.tconstruct.earth_ender_slime_grass,Earthslime Grass,スライムの草
block.tconstruct.earth_ender_slime_grass.tooltip,Lets you jump higher and spawns earthslimes in the overworld,高くに飛べる。スライムを生み出します。
block.tconstruct.earth_ichor_slime_grass,Earthslime Grass,スライムの草
block.tconstruct.earth_ichor_slime_grass.tooltip,Lets you jump higher and spawns earthslimes in the overworld,高くに飛べる。スライムを生み出します。
block.tconstruct.earth_sky_slime_grass,Earthslime Grass,スライムの草
block.tconstruct.earth_sky_slime_grass.tooltip,Lets you jump higher and spawns earthslimes in the overworld,高くに飛べる。スライムを生み出します。
block.tconstruct.earth_slime_dirt,Earthslime Dirt,スライムの土
block.tconstruct.earth_slime_dirt.tooltip,"Slimy, but lets you jump higher",ぬるぬるしていますが、高くジャンプできます。
block.tconstruct.earth_slime_fern,Slimy Fern,ぬるぬるしたシダ
block.tconstruct.earth_slime_leaves,Slimy Leaves,ぬるぬるした葉
block.tconstruct.earth_slime_sapling,Greenheart Sapling,グリーンハートの苗木
block.tconstruct.earth_slime_sapling.tooltip,Only grows on slimy dirt or grass,ぬるぬるした土や草の上でのみ成長します
block.tconstruct.earth_slime_tall_grass,Tall Slimy Grass,ぬるぬるした高い草
block.tconstruct.earth_vanilla_slime_grass,Earthslime Grass,スライムの草
block.tconstruct.earth_vanilla_slime_grass.tooltip,Lets you jump higher and spawns earthslimes in the overworld,高くに飛べる。スライムを生み出します。
block.tconstruct.ender_cake,Enderslime Cake,エンダースライムケーキ
block.tconstruct.ender_congealed_slime,Congealed Enderslime Block,凝固のエンダースライムブロック
block.tconstruct.ender_congealed_slime.tooltip,Lets you jump really high,本当に高くジャンプできます
block.tconstruct.ender_earth_slime_grass,Enderslime Grass,エンダースライムの草
block.tconstruct.ender_earth_slime_grass.tooltip,Lets you jump higher and spawns enderslimes in the end,高くに飛べる。エンドにエンダースライムを生成します。
block.tconstruct.ender_ender_slime_grass,Enderslime Grass,エンダースライムの草
block.tconstruct.ender_ender_slime_grass.tooltip,Lets you jump higher and spawns enderslimes in the end,高くに飛べる。エンドにエンダースライムを生成します。
block.tconstruct.ender_ichor_slime_grass,Enderslime Grass,エンダースライムの草
block.tconstruct.ender_ichor_slime_grass.tooltip,Lets you jump higher and spawns enderslimes in the end,高くに飛べる。エンドにエンダースライムを生成します。
block.tconstruct.ender_sky_slime_grass,Enderslime Grass,エンダースライムの草
block.tconstruct.ender_sky_slime_grass.tooltip,Lets you jump higher and spawns enderslimes in the end,高くに飛べる。エンドにエンダースライムを生成します。
block.tconstruct.ender_slime,Enderslime Block,エンダースライムブロック
block.tconstruct.ender_slime.tooltip,"Sticks when pushed, but not when adjacent to a sticky block",押すとくっつきますが、粘着性のブロックと隣接するとくっつきません
block.tconstruct.ender_slime_dirt,Enderslime Dirt,エンダースライムの土
block.tconstruct.ender_slime_dirt.tooltip,"Slimy, but lets you jump higher",ぬるぬるしていますが、高くジャンプできます。
block.tconstruct.ender_slime_fern,Slimy Fern,ぬるぬるしたシダ
block.tconstruct.ender_slime_fluid,Enderslime,溶けたエンダースライム
block.tconstruct.ender_slime_leaves,Slimy Leaves,ぬるぬるした葉
block.tconstruct.ender_slime_sapling.tooltip,Only grows on slimy dirt or grass,ぬるぬるした土や草の上でのみ成長します
block.tconstruct.ender_slime_tall_grass,Tall Slimy Grass,ぬるぬるした高い草
block.tconstruct.ender_slime_vine,Slimy Vine,ぬるぬるしたツタ
block.tconstruct.ender_vanilla_slime_grass,Enderslime Grass,エンダースライムの草
block.tconstruct.ender_vanilla_slime_grass.tooltip,Lets you jump higher and spawns enderslimes in the end,高くに飛べる。エンドにエンダースライムを生成します。
block.tconstruct.enderman_head,Enderman Head,エンダーマンの頭
block.tconstruct.foundry_controller,Foundry Controller,鋳造制御ブロック
block.tconstruct.foundry_controller.tooltip,Brain of the Foundry.,鋳造炉の中枢
block.tconstruct.glow,Glow,グロー
block.tconstruct.gray_clear_stained_glass,Clear Gray Stained Glass,灰色の透明なステンドグラス
block.tconstruct.gray_clear_stained_glass_pane,Clear Gray Stained Glass Pane,灰色の透明なステンドグラス版
block.tconstruct.green_clear_stained_glass,Clear Green Stained Glass,緑色の透明なステンドグラス
block.tconstruct.green_clear_stained_glass_pane,Clear Green Stained Glass Pane,緑色の透明なステンドグラス版
block.tconstruct.greenheart_button,Greenheart Button,グリーンハートのボタン
block.tconstruct.greenheart_door,Greenheart Door,グリーンハートのドア
block.tconstruct.greenheart_fence,Greenheart Fence,グリーンハートのフェンス
block.tconstruct.greenheart_fence_gate,Greenheart Fence Gate,グリーンハートのフェンスゲート
block.tconstruct.greenheart_log,Greenheart Log,グリーンハートの原木
block.tconstruct.greenheart_planks,Greenheart Planks,グリーンハートの板材
block.tconstruct.greenheart_planks_slab,Greenheart Slab,グリーンハートのハーフブロック
block.tconstruct.greenheart_planks_stairs,Greenheart Stairs,グリーンハートの階段
block.tconstruct.greenheart_pressure_plate,Greenheart Pressure Plate,グリーンハートの減圧板
block.tconstruct.greenheart_sign,Greenheart Sign,グリーンハートの看板
block.tconstruct.greenheart_trapdoor,Greenheart Trapdoor,グリーンハートのトラップドア
block.tconstruct.greenheart_wall_sign,Greenheart Sign,グリーンハートの看板
block.tconstruct.greenheart_wood,Greenheart Wood,グリーンハートの木
block.tconstruct.grout,Grout,グラウト
block.tconstruct.grout.tooltip,I am Grout!,焼くと使用できます
block.tconstruct.hepatizon_block,Block of Hepatizon,ヘパティゾンブロック
block.tconstruct.hepatizon_block.tooltip,Can be used as beacon base,ビーコンベース可能
block.tconstruct.husk_head,Husk Head,ハスクの頭
block.tconstruct.ichor_cake,Ichor Cake,イコルケーキ
block.tconstruct.ichor_congealed_slime,Congealed Ichor,凝固のイコルブロック
block.tconstruct.ichor_congealed_slime.tooltip,Lets you jump really high,本当に高くジャンプできます
block.tconstruct.ichor_earth_slime_grass,Ichor Nylium,イコルの草
block.tconstruct.ichor_earth_slime_grass.tooltip,So soft! Lets you jump higher,柔らかい! 高くに飛べる。
block.tconstruct.ichor_ender_slime_grass,Ichor Nylium,イコルの草
block.tconstruct.ichor_ender_slime_grass.tooltip,So soft! Lets you jump higher,柔らかい! 高くに飛べる。
block.tconstruct.ichor_ichor_slime_grass,Ichor Nylium,イコルの草
block.tconstruct.ichor_ichor_slime_grass.tooltip,So soft! Lets you jump higher,柔らかい! 高くに飛べる。r
block.tconstruct.ichor_sky_slime_grass,Ichor Nylium,イコルの草
block.tconstruct.ichor_sky_slime_grass.tooltip,So soft! Lets you jump higher,柔らかい! 高くに飛べる。
block.tconstruct.ichor_slime,Ichor Block,イコルブロック
block.tconstruct.ichor_slime.tooltip,Sticks all sticky blocks besides ichor,イコル以外のすべてのスティッキーブロックを貼り付けます
block.tconstruct.ichor_slime_dirt,Ichor Dirt,イコルの土
block.tconstruct.ichor_slime_dirt.tooltip,"Slimy, but lets you jump higher",ぬるぬるしていますが、高くジャンプできます。
block.tconstruct.ichor_slime_fern,Slimy Roots,ぬるぬるしたシダ
block.tconstruct.ichor_slime_leaves,Slimy Wart,ぬるぬるした葉
block.tconstruct.ichor_slime_sapling,Ichor Sapling,イコルの苗木
block.tconstruct.ichor_slime_sapling.tooltip,Only grows on slimy nylium,ぬるぬるした土や草の上でのみ成長します
block.tconstruct.ichor_slime_tall_grass,Tall Slimy Grass,ぬるぬるした高い草
block.tconstruct.ichor_vanilla_slime_grass,Ichor Nylium,イコルの草
block.tconstruct.ichor_vanilla_slime_grass.tooltip,So soft! Lets you jump higher,柔らかい! 高くに飛べる。
block.tconstruct.knightslime_block,Block of Knightslime,騎士スライムブロック
block.tconstruct.knightslime_block.tooltip,Can be used as beacon base,ビーコンベース可能
block.tconstruct.lavawood,Lavawood,溶岩の板材
block.tconstruct.lavawood_slab,Lavawood Slab,溶岩の板材のハーフブロック
block.tconstruct.lavawood_stairs,Lavawood Stairs,溶岩の板材の階段
block.tconstruct.light_blue_clear_stained_glass,Clear Light Blue Stained Glass,空色の透明なステンドグラス
block.tconstruct.light_blue_clear_stained_glass_pane,Clear Light Blue Stained Glass Pane,空色の透明なステンドグラス版
block.tconstruct.light_gray_clear_stained_glass,Clear Light Gray Stained Glass,ライトグレー色の透明なステンドグラス
block.tconstruct.light_gray_clear_stained_glass_pane,Clear Light Gray Stained Glass Pane,ライトグレー色の透明なステンドグラス版
block.tconstruct.liquid_soul_fluid,Liquid Soul,溶けたソウル
block.tconstruct.magenta_clear_stained_glass,Clear Magenta Stained Glass,赤系色の透明なステンドグラス
block.tconstruct.magenta_clear_stained_glass_pane,Clear Magenta Stained Glass Pane,赤系色の透明なステンドグラス版
block.tconstruct.magma_cake,Magma Cake,マグマケーキ
