key,source_text,target_text
tombstone.command.tbteleport.player.usage,"Teleports to a player
/tbteleport player [entity] <targetEntity>","プレイヤーにテレポート
/tbteleport プレイヤー [エンティティ] <targetEntity>"
tombstone.command.tbteleport.pos.usage,"Teleports to a location
/tbteleport pos [entity] <x> <y> <z> [dim]","場所にテレポートします
/tbteleport pos [entity] <x> <y> <z> [dim]"
tombstone.compendium.april_fools_day.desc,"During April Fools' Day:
- all graves throw bones that slow down players
- praying on a Decorative Grave will give you the effect Bad Omen as well as a chance to receive a random familiar
- the Perk Treasure Seeker is at the maximum level
- a reward awaits players the next day for this event","エイプリルフール中:
- すべての墓はプレイヤーの動きを遅くする骨を投げます
- 装飾的な墓で祈ると、不吉な予感の効果が得られるだけでなく、ランダムな使い魔を受け取るチャンスもあります
- 特典トレジャー シーカーは最大レベルで
- 翌日、このイベントの報酬がプレイヤーを待っています"
tombstone.compendium.april_fools_day.title,April Fools' Day,エイプリルフール
tombstone.compendium.book_of_disenchantment.desc,The book can extract enchantments from an item when in contact with a Grave Soul.\nThe item to be disenchanted must be held in your right hand.\nThe Perk Scribe allows you to remove one more enchantment by level.,"この本は、墓の魂と接触すると、アイテムからエンチャントを抽出できます。
エンチャントを解除するア​​イテムは、左手で保持する必要があります。
パーク スクライブを使用すると、レベルごとにもう 1 つのエンチャントを削除できます。"
tombstone.compendium.book_of_magic_impregnation.desc,The book allows you to enchant or strengthen the magic contained in certain items,この本を使用すると、特定のエンチャント可能なアイテムや矢に含まれる魔法をエンチャントまたは強化できます。
tombstone.compendium.book_of_oblivion.desc,The book allows you to reset your Knowledge of Death Perks.,本は死の知識の特典をリセットできます。
tombstone.compendium.book_of_recycling.desc,"With the help of a Grave's Soul, the book allows to recycle the pile of items in your other hand in order to collect its crafting ingredients.
The item to be recycled cannot be a container.
If any enchantments are present on this item, they will be lost.","墓の魂の助けを借りて、この本はもう一方の手のアイテムの山をリサイクルして、そのクラフト材料を集めることができます.
リサイクルするアイテムはコンテナにすることはできません.
このアイテムにエンチャントが存在する場合,それらは失われます。"
tombstone.compendium.book_of_repairing.desc,The book allows you to repair your items and erase the wear and tear left by non-magical methods,この本により、アイテムを修理し、非魔法の方法で残された損耗を消すことができます。
tombstone.compendium.book_of_scribe.desc,The book allows you to magically create multiple copies of a magic scroll.,本により、魔法のスクロールの複数のコピーを魔法的に作成できます。
tombstone.compendium.book_of_soulbound.desc,The book allows you to enchant an item with Soulbound allowing to keep it on you after death.,本により、アイテムをSoulboundで魔法付けでき、死後も持ち続けることができます。
tombstone.compendium.christmas.desc,"During the Christmas period:
- Grave Guardians exchanges new items and disguises themselves for the occasion
- the Perk Shadow Walker is increased by 3 and the Perk Treasure Seeker is at the maximum level
- some advancements
- Decorative Graves have special decorations","クリスマスイベントは12月の6日以降の月間中に行われます。
クリスマス期間中:
- 墓の守り手は新しいアイテムを交換し、この機会のために姿を変えます
- いくつかのロリポップはアンデッドと猫の朝の贈り物からドロップされます
- 複数の特典が増加します
- いくつかのアドバンスメント
- 装飾的な墓には特別な装飾があります"
tombstone.compendium.combination.desc,"Some recipes are not used at the Crafting Table but by directly combining the ingredient on the item in the inventory (similar to the action of filling a bundle).
For example, you can enchant a Grave Key by combining on it an Ender Pearl.
You can view theses recipes by hovering the item to display the tooltip or by using a mod that displays the recipes like Just Enough Items.","一部のレシピは、クラフト テーブルでは使用されませんが、インベントリ内のアイテムの材料を直接組み合わせることによって使用されます (バンドルを埋めるアクションに似ています)。
たとえば、エンダー パールを組み合わせることで墓の鍵をエンチャントできます。 
これらのレシピは、アイテムにカーソルを合わせてツールチップを表示するか、Just Enough Items のようなレシピを表示する mod を使用して表示できます。"
tombstone.compendium.combination.title,Combination,コンビネーション
tombstone.compendium.death.desc,"When a player dies, a grave is created containing all lost items.\nThe player reappears with the Grave's Key allowing to teleport if enchanted, as well as a Ghostly Shape effect preventing creatures from attacking you.\nThe amount of experience lost is defined in the config and adjusted by the Perk Memento Mori by 20 %% per level allowing to reach 100 %%.","プレイヤーが死亡すると、失われたすべてのアイテムを含む墓が作成されます。
プレイヤーは、エンチャントされている場合にテレポートできる墓の鍵と、クリーチャーがあなたを攻撃するのを防ぐ幽霊のような形の効果を持って再表示されます。
失われた経験値の量は、構成と特典メメントモリによってレベルごとに 20 %% ずつ調整され、100 %% に達することができます。"
tombstone.compendium.death.title,Die in Tombstone,トゥームストーンで死ぬ
tombstone.compendium.dust_of_frost.desc,"The Dust Of Frost allows an easy retreat by creating a wall of snow powder, and teleports you a few steps behind your old position.",ダスト オブ フロストは、粉雪の壁を作ることで簡単に退却でき、元の位置から数歩後ろにテレポートします。
tombstone.compendium.dust_of_vanishing.desc,"The Dust of Vanishing is created from Grave's Dust and Gunpowder.\nIt allows an easy retreat by disappearing from the eyes of creatures in a cloud of smoke, and reappearing a few steps behind your old position.",消失の粉塵は、煙の雲の中で生物の目から消え、元の位置の数歩後ろに再び現れることで、簡単に退却できます。
tombstone.compendium.easter_egg.desc,"Ingredient to cook during Easter.
It can also be traded at a Grave Guardian.",イースターで調理するための材料
tombstone.compendium.enchanted_bundle.desc,The Bundle can be enchanted with a Grave Soul allowing it to follow you beyond death with all its contents.,バンドルはグレイヴ ソウルでエンチャントすることができ、死を超えてすべての内容を追うことができます。
tombstone.compendium.enchantments.desc,"Most of enchantments in Tombstone can only be found as loot by default.\nEach enchantment is set to only work at specific equipment slots.\nThe config makes it possible to change the maximum level, to nerf them, or to allow them at enchanting table.","トゥームストーンのエンチャントのほとんどは、デフォルトでは戦利品としてのみ見つけることができます。
各エンチャントは、特定の装備スロットでのみ機能するように設定されています。
構成により、最大レベルを変更したり、弱体化させたり、エンチャント テーブルでそれらを許可したりできます。 ."
tombstone.compendium.enchantments.title,Enchantments,エンチャント
tombstone.compendium.essence_of_undeath.desc,The Essence of Undeath is a crafting ingredient to build decorative graves.\nIt can be dropped rarely from the undead creatures or by fishing.,"アンデスのエッセンスは、装飾的な墓を作るためのクラフト材料です。
深海で釣りをしたり、猫のモーニング ギフトを使ったりすると、アンデッド クリーチャーからまれにドロップします。"
tombstone.compendium.fishing_rod_of_misadventure.desc,This fishing rod seems to be bad luck fishing.\nEnchanting the item with a Grave's Soul seems to worsen this bad luck.,"この釣り竿は不運な釣りのようです。
このアイテムにグレイブ ソウルをエンチャントすると、この不運が悪化するようです。"
tombstone.compendium.ghostly_shape.desc,"The Ghostly Shape is an effect received after a death that prevents creatures from attacking you.\nIt can be improved with the Perk Ghostly Shape granting some additional effects.\nThe effect is canceled if you attack a creature or retrieve your grave.\nIf the config restricts Ghostly Shape, the effect will also be canceled if you open a chest, break a block, or push a hostile creature.","幽霊のような形は、クリーチャーがあなたを攻撃するのを防ぎ、落下を遅くし、有害な効果と受けたダメージを無効にし、真の視力を付与する死後に受ける中立的な効果です.
墓の鍵でテレポートすると、効果の持続時間は10秒に短縮されます( 
クリーチャーを攻撃すると、効果はキャンセルされます。
設定によっては、チェストを開いたり、ブロックを壊したり、敵を押したりすると、効果が無効になります。生き物。"
tombstone.compendium.grave_dust.desc,"The Grave's Dust is a crafting ingredient used in several recipes such as Dark Marble, Scrolls and Tablets.\nIt can be dropped from the undead creatures and more rarely when the lost tablets break.","グレイブ ダストは、グレイブ マーブル、スクロール、タブレットなどのいくつかのレシピで使用されるクラフト材料です。
アンデッド クリーチャーから、猫のモーニング ギフトで、または紛失したタブレットが壊れたときにドロップすることがあります。"
tombstone.compendium.grave_guardian.desc,"Rarely, a Grave Guardian can appear near a decorative grave.
This guardian will protect the surroundings from hostile creatures and will offer to trade with the players.
During special events, the trades may differ.","まれに、グレイブ ガーディアンが装飾的な墓の近くに現れることがあります。
このガーディアンは周囲を敵対的な生き物から守り、プレイヤーとの取引を申し出ます。
特別なイベント中は、取引が異なる場合があります。"
tombstone.compendium.grave_key.desc,"After you reappear from a death, you receive the Grave's Key.\nThis allows you to locate your grave at a distance when you are in the same dimension.\nThe key can be enchanted with a Soul haunting a Decorative Grave, or by crafting, allowing you to teleport directly to your grave.\nThe key has a chance to be directly enchanted defined in the config and adjusted by the Perk Jailer of 20 %% per level to reach 100 %%.","死から再び現れた後、墓の鍵を受け取ります。
これにより、同じ次元にいるときに離れた場所にある墓を見つけることができます。
鍵は、装飾的な墓に取り憑く魂で、またはエンダー パール。自分の墓に直接テレポートできます。
このキーは、構成で定義された直接エンチャントされる可能性があり、100 %% に到達するようにレベルごとに 20 %% のパーク看守によって調整されます。"
tombstone.compendium.grave_marble.desc,"The Grave Marble is a block created from Grave's Dust and Stone, and used to craft Decorative Graves.
It's also possible to craft White Marble by adding Bone Meal to the recipe.
The Grave Marble is really resistant to explosions.","グレイブ マーブルは装飾的なグレイブを作成するための材料です。
レシピに骨粉を追加することでホワイト マーブルを作成することもできます。
グレイブ マーブルは非常に爆発に強いです。"
tombstone.compendium.halloween.title,Halloween,ハロウィン
tombstone.compendium.impregnated_diamond.desc,Impregnated Diamond is a crafting ingredient made from a diamond and some Grave's Dusts.\nIt's used to create some receptacles.,"含浸されたダイヤモンドは、いくつかの容器を作成するためのクラフト材料です。
含浸された骨の針と組み合わせることができます"
tombstone.compendium.intro,"The Compendium is a collection of information about Tombstone to help new players.
Each information is linked to several others in the right hand menu for a consistent reading.","Compendium は、新しいプレイヤーを支援するためのトゥームストーンに関する情報のコレクションです。
各情報は、一貫して読むために、右側のメニューで他のいくつかの情報にリンクされています。"
tombstone.compendium.lollipop.desc,Halloween lollipops provide a random benefit.\nIt is possible to configure the effects that should not be granted in the config.,"ハロウィーン ロリポップはランダムな利益をもたらします。
構成で付与されるべきではない効果を構成することが可能です。"
tombstone.compendium.magic_books.desc,"They must be used in offhand, with the aid of a Grave Soul, in order to apply their effect to the item in the main hand.
The book is destroyed when the effect occurs.
The perk Scribe enhances the effect of books.","メインハンドのアイテムに効果を適用するには、墓の魂の助けを借りて、オフハンドで使用する必要があります。
効果が発生すると、本は破壊されます。
特典のスクライブは、本の効果を高めます。"
tombstone.compendium.magic_books.title,Magic Books,魔法の本
tombstone.compendium.magic_items.desc,"Most Tombstone items can be enchanted with the help of Grave's Soul that are haunting randomly Decorative Graves, by using the item on the grave with a right click.",ほとんどのトゥームストーン アイテムは、右クリックで墓のアイテムを使用することにより、ランダムに装飾的な墓に出没するグレイブ ソウルの助けを借りてエンチャントできます。
tombstone.compendium.magic_items.title,Magic Items,魔法のアイテム
tombstone.compendium.magic_scrolls.desc,"Magical Scrolls are made from Strange Scroll. Once enchanted with a Grave's Soul, they can provide an effect by holding the right mouse button, destroying the scroll at the same time.\nThe duration of the scrolls can be defined in config.","墓の魂にエンチャントされると、マウスの右ボタンを押し続けることで効果を発揮し、同時にスクロールを破壊できます.
スクロールの持続時間は構成で定義できます."
tombstone.compendium.magic_scrolls.title,Magic Scrolls,魔法の巻物
tombstone.compendium.magic_tablets.desc,"Magic tablets are made from Strange Tablet.\nOnce enchanted, they allow to teleport in various ways.\nIn ancient time, tablets had the ability to transport multiple creatures, but not one remembers the secret of their creation.","エンチャントされると、さまざまな方法でテレポートすることができます。
古代、タブレットには複数の生き物を運ぶ能力がありましたが、作成の秘密を覚えている人は誰もいません。"
tombstone.compendium.magic_tablets.title,Magic Tablets,魔法の錠剤
tombstone.compendium.perk.desc,Perks are bonuses related to the Tombstone features that can be obtained with your Knowledge of Death points.,特典は、死の知識ポイントで取得できる墓石機能に関連するボーナスです。
tombstone.compendium.perk.title,Perks,パークs
tombstone.compendium.prayer.title,Prayer,祈り
tombstone.compendium.receptacle_of_familiar.desc,"This receptacle can capture the soul of one of your dead familiar and all its possessions.
The soul contained in the receptacle must then recover by slowly absorbing the vital essence of the wearer.
The most common use of the receptacle is to bring this familiar back to life by praying with the Ankh.
On dedicated servers, the Receptacle of Familiar can capture even if you're offline.","このレセプタクルは、死んだ使い魔の 1 人の魂とそのすべての所有物を捕らえることができます。
レセプタクルに含まれる魂は、着用者のバイタル エッセンスをゆっくりと吸収して回復する必要があります。
レセプタクルの最も一般的な用途は、この使い魔を連れてくることです。アンクで祈ることで生き返ります。
専用サーバーでは、オフラインでもおなじみのレセプタクルをキャプチャできます。"
tombstone.compendium.receptacle_of_soul.desc,"Some stories say that necromancers sometimes imprison souls in a receptacle to prevent them from dying.
Make freedom to these souls by bringing them back to a Decorative Grave gives 10 Death Knowledge Points.
It is possible to find out on undead bosses.","いくつかの話では、ネクロマンサーは魂が死ぬのを防ぐために容器に魂を投獄することがあります。
これらの魂を装飾的な墓に戻して自由にすると、10 死の知識ポイントが得られます。
アンデッドのボスについて調べることができます。"
tombstone.compendium.scroll_of_aquatic_life.desc,Ce parchemin vous permet de partager vos effets bénéfiques entre vos alliés proches.,このスクロールにより、水中で自由に動き、息をすることができます。
tombstone.compendium.scroll_of_feather_fall.desc,This scroll gives you an effect slowing down your falls.,このスクロールは、落下を遅くする効果をもたらします。
tombstone.compendium.scroll_of_frost_resistance.desc,This scroll reduces damage taken by frost by 75%%.,この巻物は、霜から受けるダメージを 75% 軽減します。
tombstone.compendium.scroll_of_knowledge.desc,"This scroll is used to preserve your experience.\nWhen you make contact with a Grave's Soul, all your experience will be drained by the scroll.\nUse again the scroll will restore this experience.","この巻物は経験値を保存するために使用されます。
グレイブ ソウルと接触すると、すべての経験値が巻物によって失われます。
巻物を再度使用すると、この経験値が回復します。"
tombstone.compendium.scroll_of_lightning_resistance.desc,This scroll reduces damage taken by lightning by 75%%.,このスクロールは、雷から受けるダメージを 75% 軽減します。
tombstone.compendium.scroll_of_mercy.desc,This scroll allows you to share your beneficial effects among your nearby allies.,この巻物を使用すると、近くの味方の間で有益な効果を共有できます。
tombstone.compendium.scroll_of_preservation.desc,This scroll gives you an effect to keep your beneficial effects after a death.\nIt is possible to configure the effects that should not be restored in the config.,"この巻物は、死後も有益な効果を維持する効果を与えます。
設定で回復されるべきではない効果を設定することが可能です"
tombstone.compendium.scroll_of_purification.desc,This scroll gives you an effect to remove your negative effects throughout its duration.,この巻物は、その持続時間を通してあなたの負の効果を取り除く効果をあなたに与えます.
tombstone.compendium.scroll_of_reach.desc,This scroll gives you an effect increasing the range to hit creatures or to harvest.,この巻物は、クリーチャーを攻撃したり収穫したりする範囲を広げる効果をもたらします。
tombstone.compendium.scroll_of_true_sight.desc,"This scroll lets you in the dark, in the fog and under the water.\nIt also reveals invisible creatures.","この巻物を使えば、暗闇、霧、水の中を移動できます。
また、目に見えない生物を明らかにします。"
tombstone.compendium.scroll_of_unstable_intangibility.desc,This scroll gives you an effect making you invulnerable for a full second every 5 seconds.,このスクロールは、5 秒ごとに 1 秒間無敵にする効果を与えます。
tombstone.compendium.soul.title,Grave's Soul,グレイブソウル
tombstone.compendium.special_bonus.desc,Some bonuses are awarded at certain times of the year and other reasons necessary for the continuity of Tombstone.,いくつかのボーナスは、1 年の特定の時期や、トゥームストーンの継続に必要なその他の理由で授与されます。
tombstone.compendium.special_bonus.title,Special Bonuses,特別ボーナス
tombstone.compendium.strange_scroll.desc,"The strange scrolls are made from Grave's Dust, Paper and Sticks. They are used to craft Magic Scrolls.",奇妙な巻物は、インベントリで組み合わせて魔法の巻物を作成するために使用されます。
tombstone.compendium.strange_tablet.desc,Strange tablets are made from Grave's Dust and Dark Marble. They are used to craft Magic Tablets.,ストレンジ タブレットは、インベントリで組み合わせてマジック タブレットを作成するために使用されます。
tombstone.compendium.tablet_of_assistance.desc,"The Tablet of Assistance allows you to teleport to a player.\nFor this, it must be enchanted with a Grave's Soul and then the name of the player must be engraved with the Anvil and a Grave's Dust.","タブレット オブ アシスタンスを使用すると、プレイヤーにテレポートできます。
このためには、グレイブ ソウルをエンチャントし、プレイヤーの名前を金床とグレイブ ダストで刻印する必要があります。"
tombstone.compendium.tablet_of_cupidity.desc,"The Tablet of Cupidity allows you to teleport to places where fortune could smile at you, but also bring your loss.",キューピディティのタブレットを使用すると、幸運が微笑む場所にテレポートできますが、損失ももたらします。
tombstone.compendium.tablet_of_guard.desc,The Tablet of Guard allows to summon a Spectral Wolf to protect the place for a moment,守護のタブレットを使うと、スペクトラルウルフを召喚して一時的にその場所を守らせることができます。
tombstone.compendium.tablet_of_home.desc,The Tablet of Home allows you to teleport to your respawn point.,家のタブレットを使用すると、リスポーン ポイントにテレポートできます。
tombstone.compendium.tablet_of_recall.desc,The Tablet of Recall allows you to teleport to a Decorative Grave.,リコールのタブレットを使用すると、装飾的な墓にテレポートできます。
tombstone.config.activate_grave_by_sneaking,Activate Grave By Sneaking,こっそり墓場を発動
tombstone.config.activate_grave_by_sneaking.tooltip,Allows to activate a grave by sneaking,こっそりと墓を活性化することができます
tombstone.config.allow_creative_players_for_siege.tooltip,Allows to use the positions of creative players to define the siege location,創造的なプレイヤーの位置を使用して包囲場所を定義できます
tombstone.config.allow_grave_gardian.tooltip,Allows the merchant grave gardian,マーチャント グレイブ ガーディアンを許可する
tombstone.config.allow_grave_in_water,Grave In Water,水中の墓
tombstone.config.allow_grave_in_water.tooltip,Allows your grave to appear in water,あなたの墓が水中に出現することを許可します
tombstone.config.allow_to_fill_existing_grave.tooltip,Allows to fill an existing grave instead of creating a new one,新しい墓を作成する代わりに、既存の墓を埋めることができます
tombstone.config.always_enchant_grave_key.tooltip,Always enchant Grave's Key,常に墓の鍵をエンチャントする
tombstone.config.auto_equip_rule,Auto-Equip Rule,自動装備ルール
tombstone.config.auto_equip_rule.tooltip,Defines when to automatically equip your items,アイテムを自動的に装備するタイミングを定義します
tombstone.config.backup_on_death.tooltip,Backup players on death,死亡時のバックアッププレイヤー
tombstone.config.blessing_enchanting_table.tooltip,Allows Blessing at enchanting table,エンチャントテーブルで祝福を許可
tombstone.config.can_disenchant_enchanted_book.tooltip,Allows to disenchant enchanted books with the Book of Disenchantment,幻滅の書でエンチャントされた本を分解できます
tombstone.config.can_recycle_damaged_item.tooltip,Damaged items can be recycled with the Book of Recycling,壊れたアイテムはリサイクルの書でリサイクルできます
