key,source_text,target_text
block.tombstone.blue_marble_slab,Blue Marble Slab,青い大理石のハーフブロック
block.tombstone.blue_marble_stairs,Blue Marble Stairs,青い大理石の階段
block.tombstone.blue_marble_wall,Blue Marble Wall,青い大理石の壁
block.tombstone.carmin_marble_slab,Carmin Marble Slab,カルミンの大理石の板
block.tombstone.carmin_marble_stairs,Carmin Marble Stairs,カルミン大理石の階段
block.tombstone.carmin_marble_wall,Carmin Marble Wall,カルミン大理石の壁
block.tombstone.dark_marble_slab,Dark Marble Slab,ダークマーブルハーフブロック
block.tombstone.dark_marble_stairs,Dark Marble Stairs,暗い大理石の階段
block.tombstone.dark_marble_wall,Dark Marble Wall,ダークマーブルウォール
block.tombstone.green_marble_slab,Green Marble Slab,緑の大理石のハーフブロック
block.tombstone.green_marble_stairs,Green Marble Stairs,緑の大理石の階段
block.tombstone.green_marble_wall,Green Marble Wall,緑の大理石の壁
block.tombstone.white_marble_slab,White Marble Slab,ホワイトマーブルハーフブロック
block.tombstone.white_marble_stairs,White Marble Stairs,白大理石の階段
block.tombstone.white_marble_wall,White Marble Wall,白い大理石の壁
bonus.tombstone.exorcism,Can convert zombie-villagers to villagers by using the Ankh,アンクを使ってゾンビ村人を村人に変えることができます
bonus.tombstone.exorcism.title,Exorcism,エクソシズム
bonus.tombstone.pray_of_dissonance,Strengthens and controls an undead to become one of your familiars,人型アンデッドを強化・制御して使い魔の一人に
bonus.tombstone.pray_of_dissonance.title,Prayer of Dissonance,不協和音の祈り
bonus.tombstone.pray_of_empathy,Can encourage a creature to become one of your familiars,クリーチャーをあなたの使い魔にするように促すことができます
bonus.tombstone.pray_of_empathy.title,Pray of Empathy,共感の祈り
bonus.tombstone.pray_of_harmonization,Strengthens and encourages a creature to become one of your familiars,クリーチャーを強化し、あなたの使い魔の1人になるよう奨励します
bonus.tombstone.pray_of_harmonization.title,Prayer of Harmonization,調和の祈り
bonus.tombstone.pray_of_protection,Can protect villagers from a future death,村人とゴーレムを将来の死から守ることができる
bonus.tombstone.pray_of_undead.title,Pray of Undead,生ける屍の祈り
bonus.tombstone.zombify,Can convert villagers to zombie-villagers by using the Ankh,アンクを使って村人をゾンビ村人に変えることができます
config.jade.plugin_tombstone.graves,Plugin Corail Tombstone,プラグイン コライユ トゥームストーン
curios.identifier.bundle,Bundle,バンドル
curios.identifier.magic_book,Magic Book,魔法の本
death.attack.beyond_the_grave,Your soul have weaken,あなたの魂は弱っています
description.effect.minecraft.absorption,Damage absorption (extra hearts cannot be regenerated),ダメージ吸収（余分なハートは再生不可）
description.effect.minecraft.bad_omen,Triggers an illager raid by entering a village,村に入ることで村人の襲撃を誘発する
description.effect.minecraft.blindness,Impairs vision and disables the ability to sprint and critical hit,視力を損ない、スプリントとクリティカル ヒットの能力を無効にします
description.effect.minecraft.conduit_power,"Increases underwater visibility and mining speed, prevents drowning",水中の視認性と採掘速度を向上させ、溺死を防ぎます
description.effect.minecraft.darkness,Darkens the players vision,プレイヤーの視界を暗くする
description.effect.minecraft.dolphins_grace,Increases swimming speed,泳ぐ速度が上がる
description.effect.minecraft.fire_resistance,Prevents fire and lava damage,火と溶岩のダメージを防ぐ
description.effect.minecraft.glowing,Makes entities glow making them visible through blocks,エンティティを光らせ、ブロック越しに見えるようにする
description.effect.minecraft.haste,Increases mining and attack speed,採掘速度と攻撃速度が上昇する
description.effect.minecraft.health_boost,Increases maximum health,最大ヘルスを増加
description.effect.minecraft.hero_of_the_village,Villagers offer you items depending on their profession and discounted prices on their trades,村人は、職業に応じてアイテムを提供し、取引所で割引価格を提供します
description.effect.minecraft.hunger,Increases food exhaustion,食物疲労を増加させる
description.effect.minecraft.instant_damage,"Damages living entities, heals undead",生物にダメージを与え、アンデッドを癒す
description.effect.minecraft.instant_health,"Heals living entities, damages undead",生命体を癒し、アンデッドにダメージを与える
description.effect.minecraft.invisibility,Reduces other mobs' detection range,他のMobの検出範囲を狭めます
description.effect.minecraft.jump_boost,Increases jump height and reduces fall damage,ジャンプの高さが上がり、落下ダメージが減少する
description.effect.minecraft.levitation,Floats the affected entity upward,影響を受けたエンティティを上に浮かせます
description.effect.minecraft.luck,Can increase chances of high-quality and more loot,高品質などの戦利品の可能性を高めることができます
description.effect.minecraft.mining_fatigue,Decreases mining and attack speed,採掘速度と攻撃速度を低下させる
description.effect.minecraft.nausea,Wobbles and warps the vision,ぐらつき、視界をゆがめる
description.effect.minecraft.night_vision,Lets the player see well in darkness and underwater,プレイヤーが暗闇や水中でよく見えるようにします
description.effect.minecraft.poison,Inflicts damage over time (but can't kill),時間の経過とともにダメージを与えます (ただし、殺すことはできません)
description.effect.minecraft.regeneration,Regenerates health over time,時間の経過とともにヘルスを再生します
description.effect.minecraft.resistance,Reduces damage,ダメージを軽減
description.effect.minecraft.saturation,Restores hunger and saturation,満腹度と満腹度を回復する
description.effect.minecraft.slow_falling,Decreases falling speed and negates fall damage,落下速度を遅くし、落下ダメージを無効にする
description.effect.minecraft.slowness,Decreases walking speed,歩く速度が遅くなる
description.effect.minecraft.speed,Increases walking speed,歩く速度が上がる
description.effect.minecraft.strength,Increases melee damage,近接ダメージを増加させる
description.effect.minecraft.unluck,Can reduce chances of high-quality and more loot,高品質などの略奪の可能性を減らすことができます
description.effect.minecraft.water_breathing,Allows to breathe underwater and prevents drowning,水中での呼吸を可能にし、溺死を防ぎます
description.effect.minecraft.weakness,Decreases melee damage,近接ダメージを減少
description.effect.minecraft.wither,Inflicts damage over time,時間経過でダメージを与える
description.effect.tombstone.aquatic_life,Allows to move freely and breathe in the water,水の中で自由に動き、呼吸することができます
description.effect.tombstone.bone_shield,Protects against melee damages and reflects a part,近接ダメージを防ぎ、一部を反射します
description.effect.tombstone.discretion,Improves stealth speed and reduces range detection,ステルス速度を向上させ、範囲検出を減少させます
description.effect.tombstone.diversion,Prevents creatures to target you,クリーチャーがあなたをターゲットにするのを防ぎます
description.effect.tombstone.earthly_garden,Makes the surroundings more flowery,周囲をより華やかに
description.effect.tombstone.feather_fall,Slows down your falls,落下速度を遅くします
description.effect.tombstone.frost_resistance,Reduces damage taken by frost by 75%,冷気で受けるダメージを75%軽減
description.effect.tombstone.frostbite,Freezes and damages enemy,敵を凍らせてダメージを与える
description.effect.tombstone.ghostly_shape,Ghostly appearance received after a death,死後に受けた幽霊のような姿
description.effect.tombstone.lightning_resistance,Reduces damage taken by lightning by 75%,雷属性で受けるダメージを75%軽減
description.effect.tombstone.mercy,Share beneficial effects among nearby allies,近くの味方の間で有益な効果を共有する
description.effect.tombstone.prayer,Received when a prayer is cast on the target,対象に祈りを捧げると獲得
description.effect.tombstone.preservation,Preserves experience and beneficial effects on death,死亡時に経験値と有益な効果を保持する
description.effect.tombstone.purification,Dispels negative effects over time,時間の経過とともに負の効果を払いのける
description.effect.tombstone.reach,Increases the range to hit creatures or to harvest,クリーチャーを攻撃したり収穫したりする範囲を広げます
description.effect.tombstone.restoration,Heal all wounds,すべての傷を癒す
description.effect.tombstone.true_sight,"Lets you see in the dark, in the fog and underwater",暗闇の中、霧の中、水中であなたを可能にします
description.effect.tombstone.unstable_intangibility,Prevents damage for a full second every five seconds,5秒ごとに1秒間ダメージを防ぎます
effect.tombstone.aquatic_life,Aquatic Life,水生生物
effect.tombstone.bait,Bait,餌
effect.tombstone.bone_shield,Bone Shield,骨の盾
effect.tombstone.discretion,Discretion,裁量
effect.tombstone.diversion,Diversion,転換
effect.tombstone.earthly_garden,Earthly Garden,地球の庭
effect.tombstone.feather_fall,Feather Fall,フェザーフォール
effect.tombstone.frost_resistance,Frost Resistance,霜耐性
effect.tombstone.frostbite,Frostbite,凍傷
effect.tombstone.ghostly_shape,Ghostly Shape,ゴーストシェイプ
effect.tombstone.lightning_resistance,Lightning Resistance,雷耐性
effect.tombstone.mercy,Mercy,慈悲
effect.tombstone.prayer,Prayer,祈り
effect.tombstone.preservation,Preservation,保存
effect.tombstone.purification,Purification,精製
effect.tombstone.reach,Reach,リーチ
effect.tombstone.restoration,Restoration,再生
effect.tombstone.true_sight,True Sight,トゥルーサイト
effect.tombstone.unstable_intangibility,Unstable Intangibility,不安定な無形性
enchantment.tombstone.blessing,Blessing,祝福
enchantment.tombstone.curse_of_bones,Curse of Bones,骨の呪い
enchantment.tombstone.fishing_bad_luck,Fishing Bad Luck,釣りの不運
enchantment.tombstone.frostbite,Frostbite,凍傷
enchantment.tombstone.magic_siphon,Magic Siphon,魔法の吸収
enchantment.tombstone.plague_bringer,Plague Bringer,疫病の召喚者
enchantment.tombstone.soulbound,Tombstone Soulbound,トゥームストーン ソウルバウンド
enchantment.tombstone.spectral_bite,Spectral Bite,スペクトラルバイト
enchantment.tombstone.spectral_conjurer,Spectral Conjurer,幽霊の魔術師
entity.tombstone.cloud,Cloud,雲
entity.tombstone.grave_guardian,Grave Guardian,グレイブガーディアン
entity.tombstone.spectral_bite,Spectral Bite,スペクトラルバイト
entity.tombstone.spectral_wolf,Spectral Wolf,幽霊オオカミ
item.minecraft.lingering_potion.effect.bait,Lingering Potion of Bait,エサの残留ポーション
item.minecraft.lingering_potion.effect.darkness,Lingering Potion of Darkness,闇の残留ポーション
item.minecraft.lingering_potion.effect.discretion,Lingering Potion of Discretion,裁量の残留ポーション
item.minecraft.lingering_potion.effect.earthly_garden,Lingering Potion of Earthly Garden,地上の庭の残留ポーション
item.minecraft.lingering_potion.effect.frostbite,Lingering Potion of Frostbite,凍傷の残留ポーション
item.minecraft.lingering_potion.effect.restoration,Lingering Potion of Restoration,回復の残留ポーション
item.minecraft.lingering_potion.effect.spectral,Spectral Lingering Potion,スペクトラル残留ポーション
item.minecraft.potion.effect.bait,Potion of Bait,餌のポーション
item.minecraft.potion.effect.darkness,Potion of Darkness,闇のポーション
item.minecraft.potion.effect.discretion,Potion of Discretion,裁量のポーション
item.minecraft.potion.effect.earthly_garden,Potion of Earthly Garden,アースリーガーデンのポーション
item.minecraft.potion.effect.frostbite,Potion of Frostbite,凍傷のポーション
item.minecraft.potion.effect.restoration,Potion of Restoration,回復のポーション
item.minecraft.potion.effect.spectral,Spectral Potion,スペクトラルポーション
item.minecraft.splash_potion.effect.bait,Splash Potion of Bait,エサのスプラッシュポーション
item.minecraft.splash_potion.effect.darkness,Splash Potion of Darkness,闇のスプラッシュポーション
item.minecraft.splash_potion.effect.discretion,Splash Potion of Discretion,裁量のスプラッシュポーション
item.minecraft.splash_potion.effect.earthly_garden,Splash Potion of Earthly Garden,アースリーガーデンのスプラッシュポーション
item.minecraft.splash_potion.effect.frostbite,Splash Potion of Frostbite,凍傷のスプラッシュポーション
item.minecraft.splash_potion.effect.restoration,Splash Potion of Restoration,回復のスプラッシュポーション
item.minecraft.splash_potion.effect.spectral,Spectral Splash Potion,スペクトラルスプラッシュポーション
item.minecraft.tipped_arrow.effect.bait,Arrow of Bait,餌の矢
item.minecraft.tipped_arrow.effect.darkness,Arrow of Darkness,闇の矢
item.minecraft.tipped_arrow.effect.discretion,Arrow of Discretion,裁量の矢
item.minecraft.tipped_arrow.effect.earthly_garden,Arrow of Earthly Garden,地上の庭の矢
item.minecraft.tipped_arrow.effect.frostbite,Arrow of Frostbite,凍傷の矢
item.minecraft.tipped_arrow.effect.restoration,Arrow of Restoration,回復の矢
stat.tombstone.capture_soul,Captured Souls,キャプチャされた魂
stat.tombstone.cast_on_ally,Spells cast on allies,味方にかけられる呪文
stat.tombstone.consume_soul,Consumed Souls,消費された魂
stat.tombstone.create_ancient_item,Ancient Items Created,作成された古代のアイテム
stat.tombstone.create_imbued_arrow,Imbued Arrow,インビュードアロー
stat.tombstone.eaten_lollipop,Eaten Lollipop,食べられたロリポップ
stat.tombstone.exorcism,Exorcisms,エクソシズム
stat.tombstone.free_soul,Freed Souls,解放された魂
stat.tombstone.kill_undead_boss,Undead Boss Kills,アンデッド ボス キル
stat.tombstone.pray_of_protection,Villager Protected,保護された村人
stat.tombstone.pray_on_grave,Prayers Of Grave,墓の祈り
stat.tombstone.prayer_of_empathy,Prayer of Empathy,共感の祈り
stat.tombstone.prayer_of_undead,Prayer of Undead,アンデッドの祈り
stat.tombstone.raider_killed,Raider Kills,レイダーキル
stat.tombstone.revive_familiar,Revived Familiars,復活した使い魔
stat.tombstone.sneak_grave,Discreetly Recovered Tombs,慎重に回収された墓
stat.tombstone.steal_effect,Stolen Effects,盗まれた効果
stat.tombstone.tomb_raiding,Raided Tombs,襲撃された墓
stat.tombstone.trade_grave_guardian,Grave Guardian Trades,グレイブ・ガーディアン・トレード
stat.tombstone.traded_lollipop,Traded Halloween Lollipop,トレードハロウィンロリポップ
stat.tombstone.undead_killed,Undead Kills,アンデッドキル
stat.tombstone.use_disenchantment,Magic Disenchantments,魔法の解呪
stat.tombstone.use_magic_impregnation,Magic Impregnation,魔法の含浸
stat.tombstone.use_oblivion,Perks Reset,パークリセット
stat.tombstone.use_recycling,Magic Recycling,魔法のリサイクル
stat.tombstone.use_repairing,Magic Repairing,魔法の修復
stat.tombstone.use_scribe,Magic Writing,マジックライティング
stat.tombstone.use_soulbound,Soulbound,ソウルバウンド
stat.tombstone.use_vanishing,Vanishing,消失
stat.tombstone.villager_killed,Villager Kills,村人殺し
stat.tombstone.zombify,Zombified Villagers,ゾンビ化した村人
tombstone.advancement.ally_enhancer.desc,You cast 10 scrolls on an ally,味方に巻物を10回キャストした
tombstone.advancement.ally_enhancer.title,Ally Enhancer,アリーエンハンサー
tombstone.advancement.almost_unkillable.desc,You survived 10 hours,あなたは10時間生き延びました
tombstone.advancement.almost_unkillable.title,Almost Unkillable,ほとんど殺せない
tombstone.advancement.ambush.desc,You killed a raider,レイダーを殺した
tombstone.advancement.ambush.title,Ambush,待ち伏せ
tombstone.advancement.ancient_fishing_rod.desc,You created an Ancient Fishing Rod of Misadventure,あなたは不幸の古代釣り竿を作成しました
tombstone.advancement.ancient_fishing_rod.title,Ancient Fishing Rod,古代の釣り竿
tombstone.advancement.ancient_knowledge.desc,You used the magic of a blue soul,青い魂の魔法を使った
tombstone.advancement.ancient_knowledge.title,Ancient Knowledge,古代の知識
tombstone.advancement.ashes_and_bones.desc,You killed 10 undead creatures,アンデッドを10体倒した
tombstone.advancement.ashes_and_bones.title,Ashes 'n Bones,灰と骨
tombstone.advancement.bone_crusher.desc,You killed 50 undead creatures,あなたは 50 体のアンデッド クリーチャーを殺しました
tombstone.advancement.bone_crusher.title,Bone Crusher,ボーンクラッシャー
tombstone.advancement.cancel_ghostly_shape.desc,You cancelled the Ghostly Shape,ゴーストシェイプをキャンセルしました
tombstone.advancement.cancel_ghostly_shape.title,Here They Come,ほら来た
tombstone.advancement.candy_sick.desc,You eaten 50 Halloween Lollipop,ハロウィンロリポップを50個食べた
tombstone.advancement.candy_sick.title,Candy Sick,キャンディーシック
tombstone.advancement.capture_soul.desc,You captured a soul in a receptacle,あなたは容器に魂を捕らえました
tombstone.advancement.capture_soul.title,Soul Prison,ソウルプリズン
tombstone.advancement.chain_death.desc,You survived less than one minute after your last death,あなたは最後の死から 1 分も経たないうちに生き延びました
tombstone.advancement.chain_death.title,Chain Death,チェーンデス
tombstone.advancement.choose_grave_type.desc,You chose your grave type (ingame config),お墓の種類を選択しました (ゲーム内設定)
tombstone.advancement.choose_grave_type.title,Die Classy,ダイ・クラッシー
tombstone.advancement.choose_knowledge.desc,You chose your first knowledge of death (see the keybind),あなたは死についての最初の知識を選択しました (キーバインドを参照してください)
tombstone.advancement.choose_knowledge.title,Knowledge raises the soul,知識は魂を育てる
tombstone.advancement.christmas.desc,Advancements during Christmas,クリスマス中の特別な進歩
tombstone.advancement.christmas.title,Christmas,クリスマス
tombstone.advancement.color_smoke_ball.desc,You colored a Smoke Ball,あなたはスモークボールを着色しました
tombstone.advancement.color_smoke_ball.title,All colours will agree in the dark,暗闇ではすべての色が一致する
tombstone.advancement.combine_in_inventory.desc,You crafted an item by combining in inventory,インベントリで組み合わせてアイテムを作成しました
tombstone.advancement.combine_in_inventory.title,Quickly Applied,すぐに適用
tombstone.advancement.consume_soul.desc,Your item is now enchanted,あなたのアイテムはエンチャントされています
tombstone.advancement.consume_soul.title,Let The Magic Happen,魔法を起こそう
tombstone.advancement.create_decorative_grave.desc,You created a decorative grave,装飾的な墓を作成しました
tombstone.advancement.create_decorative_grave.title,A Small Cemetery,小さな墓地
tombstone.advancement.create_familiar_receptacle.title,Your First Receptacle,あなたの最初のレセプタクル
tombstone.advancement.create_fishing_rod.desc,You created a Fishing Rod of Misadventure,不幸の釣り竿を作成しました
tombstone.advancement.create_fishing_rod.title,A Time for Misadventure,不幸の時
tombstone.advancement.create_grave_marble.desc,You created Dark Marble,グレイブマーブルを作成しました
tombstone.advancement.create_grave_marble.title,Black or White,黒が？それでも白が
tombstone.advancement.create_grave_plate.title,Grave Inscription,墓碑銘
tombstone.advancement.create_imbued_arrow.desc,You enchanted an arrow with a Book of Magic Impregnation,魔法含浸の書で矢をエンチャントしました
tombstone.advancement.create_imbued_arrow.title,Imbued Arrow,インビュードアロー
tombstone.advancement.create_magic_scroll.desc,You created a magic scroll,あなたは魔法の巻物を作りました
tombstone.advancement.create_magic_scroll.title,Magic Writing,マジックライティング
tombstone.advancement.create_magic_tablet.desc,You created a magic tablet,魔法のタブレットを作成しました
tombstone.advancement.create_magic_tablet.title,Where Is The Stone Pen?,石のペンはどこですか?
tombstone.advancement.create_smoke_ball.desc,You created a Smoke Ball,スモークボールを作成しました
tombstone.advancement.create_smoke_ball.title,Not Carbolic,カーボリックではない
tombstone.advancement.create_spectral_potion.desc,You created a Spectral Potion,スペクトラル ポーションを作成しました
tombstone.advancement.create_spectral_potion.title,The alchemy of time on the soul,魂の時間の錬金術
tombstone.advancement.create_strange_scroll.desc,You created a Strange Scroll,奇妙なスクロールを作成しました
tombstone.advancement.create_strange_scroll.title,Not Even Double-Sided,両面でも構いません
tombstone.advancement.create_strange_tablet.desc,You created a Strange Tablet,奇妙なタブレットを作成しました
tombstone.advancement.create_strange_tablet.title,Not of Chocolate,チョコレートではない
tombstone.advancement.create_voodoo_poppet.desc,You created a Voodoo Poppet,ブードゥー・ポペットを作成しました
tombstone.advancement.create_voodoo_poppet.title,Back to childhood,子供時代に戻る
tombstone.advancement.crime_in_town.desc,You killed 10 villagers,村人を10人殺した
tombstone.advancement.crime_in_town.title,Crime in Town,ク黄緑・イン・タウン
tombstone.advancement.death_master.desc,You have mastered the art of Voodoo Poppet,あなたはブードゥー・ポペットの芸術をマスターしました
tombstone.advancement.death_master.title,Death Master,デスマスター
tombstone.advancement.discreet_search.desc,You activate your grave by sneaking,スニークすることで墓を活性化する
tombstone.advancement.discreet_search.title,Discreet Search,慎重な検索
tombstone.advancement.disenchanter.desc,You disenchanted with magic 10 items,魔法10アイテムで魔法を解いた
tombstone.advancement.disenchanter.title,Disenchanter,エンチャント解除器
tombstone.advancement.drink_potion_of_earthly_garden.desc,You brew a Potion of Earthly Garden,アースリー ガーデンのポーションを醸造する
tombstone.advancement.drink_potion_of_earthly_garden.title,The earth is too old to be laughed at,地球は笑うには古すぎる
tombstone.advancement.easter.desc,Special advancements during Easter,イースター期間中の特別進捗
tombstone.advancement.easter.title,Easter,イースター
tombstone.advancement.easy_opening.desc,You recovered your grave without the key,あなたは鍵なしで墓を取り戻した
tombstone.advancement.easy_opening.title,Easy Opening,イージーオープニング
tombstone.advancement.eat_easter_egg_food.desc,You ate a shaded egg dish,影の卵料理を食べました
tombstone.advancement.eat_easter_egg_food.title,Easter Food,イースターフード
tombstone.advancement.eat_lollipop.desc,You have tasted a Halloween Lollipop,ハロウィーンのロリポップを味わった
tombstone.advancement.eat_lollipop.title,Not so bad,そんなに悪くない
tombstone.advancement.enchant_fishing_rod.desc,You enchanted a Fishing Rod of Misadventure,不幸の釣り竿にエンチャントしました
tombstone.advancement.enchant_fishing_rod.title,Enchanted for Misadventure,不幸に魅了された
tombstone.advancement.enchant_grave_key.desc,You enchanted the Grave's Key,あなたは墓の鍵をエンチャントしました
tombstone.advancement.enchant_grave_key.title,The Most Useful Key,最も有用な鍵
tombstone.advancement.enchant_voodoo_poppet.desc,You enchanted a Voodoo Poppet,あなたはブードゥー・ポペットに魔法をかけました
tombstone.advancement.enchant_voodoo_poppet.title,Not even afraid of death,死さえも恐れない
tombstone.advancement.enchanted_bundle.desc,You enchanted a Bundle,あなたはバンドルをエンチャントしました
tombstone.advancement.enchanted_bundle.title,Enchanted Bundle,エンチャントバンドル
tombstone.advancement.engrave_decorative_grave.desc,You engraved a decorative grave,あなたは装飾的な墓を刻みました
tombstone.advancement.engrave_decorative_grave.title,Unforgettable,忘れられない
tombstone.advancement.engrave_grave_plate.title,Who's This Guy?,この男は誰ですか？
tombstone.advancement.exorcism.title,What an excellent day for an exorcism,お祓いには最高の日
