key,source_text,target_text
tombstone.config_cat.enchantments.tooltip,Allows to customize or disable the enchantments,エンチャントをカスタマイズまたは無効にすることができます
tombstone.config_cat.general,General,一般
tombstone.config_cat.general.tooltip,Miscellaneous options,その他のオプション
tombstone.config_cat.loot,Loot,戦利品
tombstone.config_cat.magic_item,Magic Item,マジックアイテム
tombstone.config_cat.magic_item.tooltip,For settings related to magic items,マジックアイテムに関する設定について
tombstone.config_cat.player_death,Player Death,プレイヤーの死
tombstone.config_cat.player_death.tooltip,Options related to the player's death,プレイヤーの死亡に関するオプション
tombstone.config_cat.recovery,Backup,バックアップ
tombstone.config_cat.recovery.tooltip,Options related to the command recovery and auto-save of players,プレイヤーのコマンド回復とオートセーブに関するオプション
tombstone.config_cat.village_siege,Village Siege,村の包囲
tombstone.config_cat.village_siege.tooltip,Allows to define the conditions for a village siege to begin,村の包囲を開始する条件を定義できます
tombstone.grave.grave_cross,Cross Grave,クロスグレイブ
tombstone.grave.grave_normal,Normal Grave,通常の墓
tombstone.grave.grave_original,Original Grave,原始の墓
tombstone.grave.grave_simple,Simple Grave,シンプルグレイブ
tombstone.grave.subaraki_grave,Subaraki's Grave,スバラキの墓
tombstone.grave.tombstone,Tombstone,墓石
tombstone.item.ancient_scroll_of,Ancient Scroll of %s,%s の古代の巻物
tombstone.item.ankh_of_prayer,Ankh of Prayer,祈りのアンク
tombstone.item.ankh_of_prayer.desc,Allows you to pray for your soul on graves,墓で魂のために祈ることができます
tombstone.item.ankh_of_prayer.use1,It doesn't appear to be the right time to pray %s,%s を祈るのに適切な時期ではないようです
tombstone.item.ankh_of_prayer.use2,Hold right click near a decorative grave to pray,装飾的な墓の近くで右クリックを長押しして祈る
tombstone.item.arrow_of,Arrow of %s,%s の矢
tombstone.item.bag_of_seeds,Bag of Seeds,種子の袋
tombstone.item.bag_of_seeds.desc,Seeds are present inside,種子が中に存在する
tombstone.item.bag_of_seeds.use,Right click to reveal the content,右クリックしてコンテンツを表示
tombstone.item.bone_needle,Bone Needle,骨針
tombstone.item.bone_needle.desc,Create a bind with a kind of creature to be used in magic practices,魔法の練習に使う生き物の一種とバインドを作成する
tombstone.item.bone_needle.use,Right click a creature to impregnate the bone needle,クリーチャーを右クリックして、骨針を含浸させます
tombstone.item.book_of_disenchantment,Book of Disenchantment,幻滅の書
tombstone.item.book_of_disenchantment.desc,Can strip some enchantments from an item and return them as books,アイテムからすべてのエンチャントを抽出します
tombstone.item.book_of_disenchantment.use,Right click on a grave's soul with an enchanted item in your offhand,この本がオフハンドにあり、エンチャントされたアイテムがメインハンドにあるトゥームソウルを右クリックします
tombstone.item.book_of_magic_impregnation,Book of Magic Impregnation,魔力注入の書
tombstone.item.book_of_magic_impregnation.desc,Strengthens with magic an item,エンチャントされたアイテムの魔法を強化する
tombstone.item.book_of_magic_impregnation.use,Right click on a grave's soul with an enchantable item in your offhand,この本をオフハンドに、エンチャント可能なアイテムをメインハンドに持ったトゥームソウルを右クリック
tombstone.item.book_of_oblivion,Book of Oblivion,忘却の本
tombstone.item.book_of_oblivion.desc,Resets your Perks,あなたの特典をリセットします
tombstone.item.book_of_oblivion.use,Right click on a Grave Soul with this book in the offhand,この本を左手に持って墓の魂を右クリック
tombstone.item.book_of_recycling,Book of Recycling,リサイクルの本
tombstone.item.book_of_recycling.desc,Can recycle an item to obtain its crafting ingredients,アイテムをリサイクルしてクラフト材料を入手できます
tombstone.item.book_of_recycling.use,Right click on a grave's soul with an item to recycle in your offhand,この本をオフハンドに持ち、リサイクルするアイテムをメインハンドに持つグレイブ ソウルを右クリックします
tombstone.item.book_of_repairing,Book of Repairing,修理書
tombstone.item.book_of_repairing.desc,Can magically repair an item,オブジェクトを魔法で修復できます
tombstone.item.book_of_repairing.use,Right click on a grave's soul with an item to repair in your offhand,この本をオフハンドに、修理するアイテムをメインハンドに持つ墓魂を右クリック
tombstone.item.book_of_scribe,Book of Scribe,書記の書
tombstone.item.book_of_scribe.desc,Can magically create multiple copies of a magic scroll,魔法の巻物のコピーを魔法で複数作成できる
tombstone.item.book_of_scribe.use,Right click on a Grave Soul with this book in the offhand and a scroll to copy in the mainhand,この本をオフハンドに、スクロールをメインハンドにコピーした状態で、魂の墓を右クリックします
tombstone.item.book_of_soulbound,Book of Soulbound,ソウルバウンドの本
tombstone.item.book_of_soulbound.desc,Enchants an item with Soulbound,アイテムにソウルバウンド付呪を付与します
tombstone.item.book_of_soulbound.use,Right click on a Grave Soul with this book in the offhand and a non stackable item in the mainhand,この本を左手に、スタック不可のアイテムを右手に持って墓の魂を右クリック
tombstone.item.christmas_gift,Mysterious Gift,ふしぎな贈り物
tombstone.item.christmas_gift.desc,"This gift has appeared mysteriously and doesn't seem to want to open.\nA message is written there: ""Cannot be opened before December 25.""","このギフトは不思議なことに現れ、開けたくないようです。
メッセージがそこに書かれています: 「12 月 25 日までは開けません」"
tombstone.item.christmas_gift.use,Find a way to open this gift,この贈り物を開く方法を見つけてください
tombstone.item.christmas_hat,Strange Christmas Hat,ストレンジ・クリスマス・ハット
tombstone.item.christmas_hat.desc,A strange hat that brings good luck and slightly increase your running speed,幸運をもたらし、走る速度を少しだけ上げる奇妙な帽子
tombstone.item.cursed_arrow,Cursed Arrow,呪われた矢
tombstone.item.dust_of_frost,Dust of Frost,霜のちり
tombstone.item.dust_of_vanishing,Dust of Vanishing,消えゆく塵
tombstone.item.dust_of_vanishing.desc,Allows for an easy retreat,簡単な後退を可能にする
tombstone.item.dust_of_vanishing.use,Right click to vanish,右クリックで消える
tombstone.item.easter_egg,Easter Egg,イースターエッグ
tombstone.item.easter_egg.desc,Ingredient to cook,調理するための材料
tombstone.item.easter_egg_food,Shadowed Egg Dish,影の卵皿
tombstone.item.easter_egg_food.desc,It looks tasty,美味しそうですね
tombstone.item.enchanted_bundle,Enchanted Bundle,エンチャントバンドル
tombstone.item.enchanted_bundle.desc,Right click on a Grave Soul to enchant the Bundle,墓魂を右クリックしてバンドルにエンチャントします
tombstone.item.enchanted_scroll_of,Enchanted Scroll of %s,%s の魔法の巻物
tombstone.item.essence_of_undeath,Essence of Undeath,不死のエッセンス
tombstone.item.fishing_rod_of_misadventure,Fishing Rod of Misadventure,不運のつりざお
tombstone.item.fishing_rod_of_misadventure.desc1,Presages unlucky fishing,不運な釣りの予感
tombstone.item.fishing_rod_of_misadventure.desc2,Presages disastrous fishing,大漁の予兆
tombstone.item.fishing_rod_of_misadventure.use1,Right click on a grave's soul to enchant,グレイブ ソウルを右クリックしてエンチャント
tombstone.item.fishing_rod_of_misadventure.use2,The grave magic makes this fishing rod faster and unbreakable,グレイブ・マジックは、この釣り竿をより速く、壊れないようにします
tombstone.item.gemstone_of_familiar,Gemstone of Familiar,おなじみの石
tombstone.item.gemstone_of_familiar.desc,Theses rare magic gemstones allow to bring back to life your last dead familiar,これらの珍しい魔法の石は、あなたの最後の死んだ使い魔を生き返らせることができます
tombstone.item.gemstone_of_familiar.use,Hold right click to revive your familiar,右クリックを長押しして使い魔を復活させる
tombstone.item.gemstone_of_guardian,Gemstone of Guardian,守護者の宝石
tombstone.item.gemstone_of_guardian.desc,Theses rare magic gemstones allow to invoke a Grave Guardian,これらの希少な魔法宝石は墓の守護者を呼び出せます
tombstone.item.gemstone_of_guardian.use,Hold right click to summon,右クリックで押し続けて召喚
tombstone.item.gemstone_of_merchant,Gemstone of Merchant,マーチャントストーン
tombstone.item.gemstone_of_merchant.desc,Theses rare magic gemstones allow to obtain better exchanges with a merchant,これらの珍しい魔法の石は、商人とより良い交換を得ることができます
tombstone.item.gemstone_of_merchant.use,Hold right click on a merchant,商人を右クリックしたままにする
tombstone.item.gemstone_of_prayer,Gemstone of Prayer,祈りの石
tombstone.item.gemstone_of_prayer.desc,Theses rare magic gemstones allow to reset your Ankh ability,レアな魔法石を使用すると、アンクの能力をリセットできます
tombstone.item.gemstone_of_prayer.use,Hold right click to reset your Ankh,右クリックを押したままにしてアンクをリセットします
tombstone.item.gift,Reward,報酬
tombstone.item.gift.desc,Reward received by completing advancements in Corail Tombstone,Corail Tombstone の進捗を完了して受け取る報酬
tombstone.item.gift.use,Right click to reveal the content,右クリックしてコンテンツを表示
tombstone.item.grave_dust,Grave's Dust,グレイブダスト
tombstone.item.grave_key,Grave's Key,墓の鍵
tombstone.item.grave_key.desc1,Allows you to see your grave at a distance\nRecover your lost items by right clicking on your grave or sneaking over it,遠くから自分の墓を見ることができます
tombstone.item.grave_key.desc2,Allows you to teleport to your grave\nRecover your lost items by right clicking on your grave or sneaking over it,あなたの墓にテレポートすることができます
tombstone.item.grave_key.desc3,Recover your lost items by right clicking on your grave or sneaking over it,あなたの墓を右クリックするか、それをこっそり通り抜けて、失われたアイテムを回復してください
tombstone.item.grave_key.use1,Right click on a grave's soul for teleportation,グレイブソウルを右クリックしてテレポーテーション
tombstone.item.grave_key.use2,Hold right click to teleport to your grave,右クリックを押し続けると、あなたの墓にテレポートします
tombstone.item.impregnated_diamond,Impregnated Diamond,含浸ダイヤモンド
tombstone.item.lollipop,Magic Lollipop,マジックロリポップ
tombstone.item.lollipop.desc,The effects are unpredictable (milk should be useful),効果は予測できない
tombstone.item.lost_tablet,Lost Tablet,紛失したタブレット
tombstone.item.lost_tablet.desc1,This tablet must have possessed a great power long ago,この石板は昔、大きな力を持っていたに違いない
tombstone.item.lost_tablet.desc2,Seems to depict a distant place,遠いところを描いているようだ
tombstone.item.lost_tablet.desc3,Allows you to teleport to this mysterious place,この不思議な場所にテレポートできます
tombstone.item.lost_tablet.use1,Needs time for its magic to awaken,魔力が目覚めるまで時間がかかる
tombstone.item.lost_tablet.use2,Right click on a grave's soul to provide teleportation,グレイブ ソウルを右クリックしてテレポーテーションを提供します
tombstone.item.lost_tablet.use3,Hold right click to teleport to this place,この場所にテレポートするには、右クリックを押したままにしてください
tombstone.item.magic_scroll,Magic Scroll,魔法の巻物
tombstone.item.rabbit_mask,Rabbit Mask,ウサギのマスク
tombstone.item.rabbit_mask.desc,A decorative mask from Easter,イースターの装飾用マスク
tombstone.item.receptacle_of_familiar,Receptacle of Familiar,おなじみのレセプタクル
tombstone.item.receptacle_of_familiar.desc1,This receptacle allows to capture the soul of one of your dead familiars,このレセプタクルは、あなたの死んだ使い魔の魂を捕らえることができます
tombstone.item.receptacle_of_familiar.desc2,The receptacle contains the soul of a creature: %s,レセプタクルにはクリーチャーの魂が入っています: %s
tombstone.item.receptacle_of_familiar.use1,The imprisoned soul must recover by absorbing some of your vital essence,幽閉された魂は、あなたの生命力を吸収して回復しなければなりません
tombstone.item.receptacle_of_familiar.use2,Right click on a Grave Soul to bring back to life your familiar,墓の魂を右クリックしてファミリアーを復活させる
tombstone.item.receptacle_of_soul,Receptacle of Soul,魂の受け皿
tombstone.item.receptacle_of_soul.desc1,A soul is trapped in this magical container,魂はこの魔法の容器に閉じ込められています
tombstone.item.receptacle_of_soul.desc2,The magic of this item prevents you from dying when in your inventory,このアイテムの魔法は、インベントリにあるときに死ぬのを防ぎます
tombstone.item.receptacle_of_soul.use,Right click a decorative grave to bind the soul,装飾墓を右クリックして魂を縛る
tombstone.item.scroll_buff.use1,Right click on a grave's soul to activate,グレイブ ソウルを右クリックしてエンチャント
tombstone.item.scroll_buff.use2,Hold right click to cast this spell,この呪文を唱えるには右クリックを長押ししてください
tombstone.item.scroll_of_aquatic_life,Scroll of Aquatic Life,水生生物の巻物
tombstone.item.scroll_of_feather_fall,Scroll of Feather Falling,羽落ちの巻物
tombstone.item.scroll_of_frost_resistance,Scroll of Frost Resistance,霜耐性の巻物
tombstone.item.scroll_of_knowledge,Scroll of Knowledge,知識の巻物
tombstone.item.scroll_of_knowledge.desc1,Allows you to store your experience (%d%% will be lost in the transfer),経験値を保存できます (%d%% は転送で失われます)
tombstone.item.scroll_of_knowledge.desc2,This scroll contains mysterious knowledge,この巻物には不思議な知識が含まれています
tombstone.item.scroll_of_knowledge.use1,Right click on a grave's soul to store your experience,墓魂を右クリックして経験値を保存します
tombstone.item.scroll_of_knowledge.use2,Hold right click to receive this knowledge,この知識を受け取るには右クリックを押し続けてください
tombstone.item.scroll_of_lightning_resistance,Scroll of Lightning Resistance,雷耐性の巻物
tombstone.item.scroll_of_mercy,Scroll of Mercy,慈悲の巻物
tombstone.item.scroll_of_preservation,Scroll of Preservation,保存の巻物
tombstone.item.scroll_of_purification,Scroll of Purification,浄化の巻物
tombstone.item.scroll_of_reach,Scroll of Reach,リーチの巻物
tombstone.item.scroll_of_true_sight,Scroll of True Sight,真視力の巻物
tombstone.item.scroll_of_unstable_intangibility,Scroll of Unstable Intangibility,不安定な無形性の巻物
tombstone.item.seeker_rod,Seeker Rod,シーカーロッド
tombstone.item.seeker_rod.desc,A slightly special rod guiding you to places holding secret knowledges,知の秘められた場所へと導く、ちょっと特殊なロッド
tombstone.item.seeker_rod.use1,The rod has revealed a distant place to you to reach,ロッドはあなたがたどり着ける遠い場所を明らかにしました
tombstone.item.seeker_rod.use2,Use the rod to that place to receive the reward,その場所にロッドを使って報酬を受け取ります
tombstone.item.smoke_ball,Smoke Ball,スモークボール
tombstone.item.smoke_ball.desc,Has no use except producing smoke,煙を出す以外に何の役にも立たない
tombstone.item.smoke_ball.use,Can be thrown,投げられる
tombstone.item.strange_scroll,Strange Scroll,ストレンジ スクロール
tombstone.item.strange_tablet,Strange Tablet,奇妙なタブレット
tombstone.item.tablet_of_assistance,Tablet of Assistance,援助のタブレット
tombstone.item.tablet_of_assistance.desc,Allows you to teleport to another player,別のプレイヤーにテレポートできます
tombstone.item.tablet_of_assistance.desc_ancient,Invite the players to join you,プレイヤーをあなたに招待する
tombstone.item.tablet_of_assistance.use1,Right click on a grave's soul to enchant,グレイブ ソウルを右クリックしてエンチャント
tombstone.item.tablet_of_assistance.use2,Engrave a player's name with an anvil and %s,選手名を刻む
tombstone.item.tablet_of_assistance.use3,Hold right click to teleport to the player with the engraved name,右クリックを押し続けると、名前が刻まれたプレイヤーにテレポートします
tombstone.item.tablet_of_assistance.use_ancient,Hold right click to call for help,右クリックを長押しして助けを求める
tombstone.item.tablet_of_cupidity,Tablet of Cupidity,キューピディティのタブレット
tombstone.item.tablet_of_cupidity.desc,"Can bring you fortune, even if few have returned",戻ってきた人が少なくても、あなたに幸運をもたらすことができます
tombstone.item.tablet_of_cupidity.desc_ancient,The item looks safer to use,アイテムはより安全に使用できます
tombstone.item.tablet_of_cupidity.desc_not_ancient,Something evil emanates from it,何か悪いものがそこから発せられる
tombstone.item.tablet_of_cupidity.use1,Right click on a grave's soul to enchant,グレイブ ソウルを右クリックしてエンチャント
tombstone.item.tablet_of_cupidity.use2,Hold right click to teleport,テレポートするには右クリックを押し続けます
tombstone.item.tablet_of_guard,Tablet of Guard,守護のタブレット
tombstone.item.tablet_of_guard.desc,Invoke a spectral wolf to protect the place for a short time,短時間、場所を保護するために幽霊狼を召喚
tombstone.item.tablet_of_guard.desc_ancient,Invoke a spectral wolf to protect the place for a long time,長時間、場所を保護するために幽霊狼を召喚
tombstone.item.tablet_of_guard.use1,Right click on a Grave Soul to enchant,墓の魂を右クリックして強化
tombstone.item.tablet_of_guard.use2,Hold right click to summon,右クリックで押し続けて召喚
tombstone.item.tablet_of_home,Tablet of Home,家のタブレット
tombstone.item.tablet_of_home.desc,Allows you to teleport to your respawn point,リスポーン ポイントにテレポートできます
tombstone.item.tablet_of_home.desc_ancient,All the creatures around you will also be teleported,あなたの周りのすべてのクリーチャーもテレポートされます
tombstone.item.tablet_of_home.use1,Right click on a grave's soul to enchant,グレイブ ソウルを右クリックしてエンチャント
tombstone.item.tablet_of_home.use2,Hold right click to teleport,テレポートするには右クリックを押し続けます
tombstone.item.tablet_of_recall,Tablet of Recall,リコールのタブレット
tombstone.item.tablet_of_recall.desc,Allows you to teleport to a memorized location,記憶した場所にテレポートできます
tombstone.item.tablet_of_recall.desc_ancient,All the creatures around you will also be teleported,あなたの周りのすべてのクリーチャーもテレポートされます
tombstone.item.tablet_of_recall.use1,Right click on a grave's soul to link,墓魂を右クリックしてリンク
tombstone.item.tablet_of_recall.use2,Sneak near a decorative grave to change the memorized location,装飾墓の近くに忍び込み、記憶された場所を変更する
tombstone.item.tablet_of_recall.use3,Hold right click to teleport,テレポートするには右クリックを押し続けます
tombstone.item.villager_gift,Villager Gift,村人ギフト
tombstone.item.villager_gift.desc,This gift must be brought to the villager's bed to get the reward from the undead merchant,誰も村人のベッドの近くに持ってくることを世話しない場合、この贈り物は時間に配達されません
tombstone.item.villager_gift.use1,Reach the faraway place where a village should be,村のあるべき遠い場所にたどり着く
tombstone.item.villager_gift.use2,Hide the Villager Gift under the bed to get the reward,ベッドを右クリックして村人の贈り物を隠し、報酬を受け取る
tombstone.item.voodoo_poppet,Voodoo Poppet,ブードゥー・ポペット
tombstone.item.voodoo_poppet.burn,Prevention of Burning,やけど防止
tombstone.item.voodoo_poppet.cold,Prevention of Cold,風邪の予防
tombstone.item.voodoo_poppet.darkness,Prevention of Darkness,暗闇の防止
tombstone.item.voodoo_poppet.fall,Prevention of Falling,落下防止
tombstone.item.voodoo_poppet.lightning,Prevention of Lightning,落雷防止
tombstone.item.voodoo_poppet.suffocation,Prevention of Suffocation,窒息防止
tombstone.item.voodoo_poppet.use3,This poppet is active,このポペットはアクティブです
tombstone.message.access_gui,You earned %s level(s). Click %s if you want to access the GUI to increase one of your perk.,%s レベルを獲得しました。GUI にアクセスして特典の 1 つを増やしたい場合は、%s をクリックしてください。
tombstone.message.alignment,Alignment,アライメント
tombstone.message.already_engraved,%s has already an inscription,%s にはすでに碑文があります
tombstone.message.already_impregnated,%s is already impregnated,%s はすでに含浸されています
tombstone.message.ancient_item,Ancient %s,古代の %s
tombstone.message.area_buff,All your nearby allies will benefit from the magic effect,近くの味方全員が魔法の効果の恩恵を受ける
tombstone.message.back,Back,戻る
tombstone.message.bind_location,You are bound to this location,あなたは今、この場所にバインドされています
tombstone.message.bring_back_to_life,%s has been brought back to life,%s が復活しました
tombstone.message.call_for_help,You called on all the players to help you,あなたはすべてのプレイヤーに助けを求めました
tombstone.message.cant_apply_effect,This effect can't be used on %s,この効果は %s では使用できません
tombstone.message.cant_pray,There are no decorative graves nearby,近くに装飾的な墓はありません
tombstone.message.cant_recycle_container,You can't recycle a container,コンテナをリサイクルすることはできません
tombstone.message.cant_recycle_damaged,You can't recycle a damaged item,破損したアイテムをリサイクルすることはできません
tombstone.message.cant_revive_familiar,%s seems to be lost forever in limbo,%s は宙に浮いた状態で永遠に失われているようです
tombstone.message.cant_upgrade,Cannot upgrade,アップグレードできません
tombstone.message.capture_familiar,%s was captured in one of your receptacles preventing his death,%s はあなたのレセプタクルの 1 つに捕らえられ、彼の死を防いでいます
tombstone.message.choose_favorite_grave,Choose your favorite grave,お好きなお墓をお選びください
tombstone.message.choose_no_grave,You chosen to have no grave,あなたは墓を持たないことを選びました
tombstone.message.click_to_upgrade,Click to learn,クリックして学習
tombstone.message.combine_in_inventory,Combine in Inventory,インベントリにまとめる
tombstone.message.command_in_cooldown,You have to wait %s before being able to use this command again,このコマンドを再度使用できるようになるまで、%s を待つ必要があります
tombstone.message.compendium,Compendium,大要
tombstone.message.config,Configuration,設定
tombstone.message.config_grave.message1,Hasn't died yet,まだ死んでいない
tombstone.message.config_grave.message2,but will soon,しかしすぐに
tombstone.message.config_prevent_death,The Power of the Graves prevented you from getting lost outside of the world,グレイブスの力は、あなたが世界の外で迷子になるのを防ぎました
tombstone.message.cost,Cost %d point(s),コスト %d ポイント
tombstone.message.craft_enchanted_grave_key_disabled,The craft of Enchanted Grave Key is disabled in config,エンチャント墓石キーのクラフトは設定で無効化されています
tombstone.message.crafting_ingredient,Crafting ingredient,クラフト材料
tombstone.message.day,Days: %d,日: %d
tombstone.message.dead_entity,The command can't be used on a dead entity,死んだエンティティには使用できません
tombstone.message.death_time,at %s,%sで
tombstone.message.decrease_of,%s decreased (-%s),%s が減少しました (-%s)
tombstone.message.description,Description,説明
tombstone.message.died_on,died on,死んだ
