key,source_text,target_text
advancements.via_romana.a_strand_type_game.descr,Use strands to connect the world,糸を使って世界を接続する
advancements.via_romana.a_strand_type_game.title,A Strand Type Game,ストランドタイプゲーム
effect.via_romana.travellers_fatigue,Travel Fatigue,移動による疲労
gui.viaromana.access_button,Access,アクセス
gui.viaromana.access_tooltip,Not a fast-travel destination,高速移動先ではありません
gui.viaromana.add_to_path,Add To Path,パスに追加
gui.viaromana.add_to_path_tooltip,Add this sign to path network,この看板を経路ネットワークに追加
gui.viaromana.approve_deleting,Approve deleting,切断を承認
gui.viaromana.approve_severing,Approve severing,宛名
gui.viaromana.cancel_button,Cancel,キャンセル
gui.viaromana.cancel_deleting,Cancel deleting,削除をキャンセル
gui.viaromana.cancel_severing,Cancel severing,切断をキャンセル
gui.viaromana.chart_continue_tooltip,Continue charting path from nearby node,近くのノードから経路を継続する
gui.viaromana.chart_start_tooltip,Chart path from current position,現在の位置から経路を描画する
gui.viaromana.charting_in_progress,Charting...,地図を描画中...
gui.viaromana.charting_map,Charting Map,地図の作成
gui.viaromana.charting_screen.title,Charting Screen,マップ画面
gui.viaromana.configure_sign_link.title,Configure Sign Link,サインリンク設定
gui.viaromana.confirm_button,Confirm,確認
gui.viaromana.default_destination_name,Travel Destination,移動先
gui.viaromana.delete_branch_confirmation,Are you sure you want to delete all connected nodes?,接続されたすべてのノードを削除してもよろしいですか？
gui.viaromana.delete_branch_detailed_tooltip,Delete connected path nodes up to nearest endpoint or junction,接続されたパスノードを最も近いエンドポイントまたはジャンクションまで削除します
gui.viaromana.delete_branch_disabled_charting,Cannot remove branch while charting,地図を描画しているとき、枝を削除できない
gui.viaromana.delete_branch_tooltip,Delete connected path nodes...,接続されたパスノードを削除...
gui.viaromana.destination_button,Destination,目的地
gui.viaromana.destination_name,Destination Name,宛名
gui.viaromana.destination_tooltip,Visible to all players,全プレイヤーに表示される
gui.viaromana.edit_destination,Edit Destination,目的地を編集
gui.viaromana.edit_destination_tooltip,Edit destination or unlink sign,宛先を編集またはサインをアンリンク
gui.viaromana.exit_tutorial_button,Return,帰還
gui.viaromana.exit_tutorial_tooltip,Return to charting screen,チャート画面に戻る
gui.viaromana.icon_label,Icon:,アイコン:
gui.viaromana.infrastructure_insufficient,Insufficient infrastructure blocks (%d / %d),インフラブロック不足 (%d / %d)
gui.viaromana.message.via_romana.cancel_charting_tooltip,Cancel current charting operation,現在の地図作成操作をキャンセル
gui.viaromana.message.via_romana.finish_charting_button,Finish Charting,マップ完了
gui.viaromana.message.via_romana.finish_charting_nearby_tooltip,Finish charting path by connecting to nearby node,近くのノードに接続して経路図を完成させます
gui.viaromana.message.via_romana.finish_charting_tooltip,Finish charting path,経路を描画を完了
gui.viaromana.message.via_romana.start_charting_button,Start Charting,経路を開始
gui.viaromana.name_label,Name:,名前:
gui.viaromana.nearby_node_selected,Nearby Node Selected,周辺のノードが選択されています
gui.viaromana.no_access,No Access,アクセス不可
gui.viaromana.no_access_tooltip,You do not have permission to edit this destination,この先に編集する権限がありません
gui.viaromana.node_distance_tooltip,Must be within %.0f blocks of a node,ノードから %.0f ブロック以内にいる必要があります
gui.viaromana.place_near_node_tooltip,Place near a path node to link,パスノードの近くに置くとリンクします
gui.viaromana.player_marker,You are here,ここにいます
gui.viaromana.private_button,Private,プライベート
gui.viaromana.private_tooltip,Only visible to you,自分だけが見える
gui.viaromana.remove_branch_button,Remove Branch,枝を削除
gui.viaromana.sever_path_button,Sever Path,セーブパス
gui.viaromana.sever_path_confirmation,Are you sure you want to sever the path?,本当にパスを切断してもよろしいですか？
gui.viaromana.sever_path_disabled_charting,Cannot sever path while charting,経路を描画中には切断できません
gui.viaromana.sever_path_tooltip,Sever path at nearest node,最も近いノードで経路を切断
gui.viaromana.signature_label,Signature:,署名:
gui.viaromana.tooltip.infrastructure,"Includes paths, bricks, wooden, and otherwise processed blocks",パス、レンガ、木材、およびその他の処理済みブロックが含まれます
gui.viaromana.tutorial_infrastructure_term,infrastructure blocks,インフラブロック
gui.viaromana.tutorial_page_1,Start by charting and walking on a valid path using your Charting Map,チャーティングマップを使って有効な経路を描画し、歩き始めてください
gui.viaromana.tutorial_page_2,A valid path consists of ! at least %s blocks wide,有効なパスは最低でも%sブロック幅で構成されます
gui.viaromana.tutorial_page_3,Nodes will be placed automatically along your path,ノードがあなたのパスに沿って自動的に配置されます
gui.viaromana.tutorial_page_4,Create a destination by placing a sign near a node and linking it via right clicking it,ノード近くにサインを置き、右クリックでリンクして目的地を作成します
gui.viaromana.tutorial_page_5,You can access the fast-travel screen by left clicking the linked sign,リンクされた看板を左クリックすると高速移動スクリーンにアクセスできます
gui.viaromana.tutorial_page_6,"Linked signs can be destroyed by sneaking and breaking them, or unlinking them",リンクされた看板はスニークして破壊するか、またはリンク解除すると消滅します
gui.viaromana.tutorial_page_7,Severing a path will remove the nearest node from the path,パスを切断すると、最も近いノードがパスから削除されます
gui.viaromana.tutorial_page_8,Removing a branch will remove all nodes up to the nearest endpoint or junction,枝を取り除くと、最も近い終点または分岐点までのすべてのノードが削除されます
gui.viaromana.tutorial_title,Tutorial,使い方
gui.viaromana.tutorial_tooltip,Open charting tutorial,チャート作成チュートリアルを開く
gui.viaromana.type_label,Type:,タイプ:
gui.viaromana.unlink_button,Unlink,アンリンク
gui.viaromana.unlink_tooltip,Unlink sign from network,ネットワークからサインを解離
gui.viaromana.warp_block,Warp Block,ワープブロック
gui.viaromana.warp_block.title,Warp Block,ワープブロック
item.via_romana.charting_map,Charting Map,地図の作成
message.via_romana.cancel_charting,Cancelled path,経路をキャンセル
message.via_romana.cancel_path_dimension,Cannot chart path across dimensions,次元を越えて経路を描画できない
message.via_romana.cannot_warp_when_recording,Cannot fast-travel while charting,地図作成中は高速移動できません
message.via_romana.entity_not_allowed,Fast-travel with current entity not allowed,現在のエンティティでファストトラベルは許可されません
message.via_romana.finish_charting,Path Charted,経路が設定されました
message.via_romana.has_fatigue,Cannot warp while fatigued,疲労時はワープできません
message.via_romana.invalid_dimension,Charting in current dimension not allowed,現在のディメンションではチャート作成が許可されていません
message.via_romana.low_quality_message,Region underdeveloped,開発未進展の地域
message.via_romana.path_charting,Charting...,地図を描画中...
message.via_romana.start_charting,Started charting,地図を開始
message.via_romana.too_far_from_node_message,Too far off path,道から離れすぎた
message.via_romana.unsafe,Cannot fast-travel: unsafe destination,急行できません：危険な目的地です。
message.via_romana.using_nearby_node,Using nearby node,近くのノードを使用
subtitles.via_romana.ambient.node_pulse,Node pulses,ノードが脈打つ
via_romana.midnightconfig.block_string_blacklist,Block Substring Blacklist,ブロックサブストリングブラックリスト
via_romana.midnightconfig.block_string_blacklist.tooltip,Substrings to search for in block IDs to exclude them from being valid for paths (used to avoid crashes with other mods).,ブロックIDから除外するサブストリングを検索します（他のModとのクラッシュを回避するためにパスに有効な状態を避けるために使用）
via_romana.midnightconfig.category.client,Client Variables,クライアント変数
via_romana.midnightconfig.category.management,Server Management,サーバー管理
via_romana.midnightconfig.category.variables,Server Variables,サーバー変数
via_romana.midnightconfig.client_title,§lClient Settings§r,§lクライアント設定§r
via_romana.midnightconfig.enable_surveyor_landmark,Enable Surveyor Landmark,調査員ランドマークを有効化
via_romana.midnightconfig.enable_surveyor_landmark.tooltip,Adds destinations as a landmark through Surveyor.,サーベイヤーでランドマークとして目的地を追加します
via_romana.midnightconfig.enable_surveyor_landmark_coloring,Colors connected destinations,接続された目的地の色付け
via_romana.midnightconfig.enable_surveyor_landmark_coloring.tooltip,Colors all landmarks in the same network the same colour to indicate connections.,同じネットワーク内のすべてのランドマークを同一色にして接続を示します。
via_romana.midnightconfig.fog_of_war_distance,Fog of War Distance,戦場の霧距離
via_romana.midnightconfig.fog_of_war_distance.tooltip,The radius (in chunks) around charted areas that will be rendered on the map.,チャートされた領域周辺（チャンク単位）の半径で、マップ上に描画される範囲です。
via_romana.midnightconfig.infrastructure_check_radius,Infrastructure Check Radius,インフラチェック半径
via_romana.midnightconfig.infrastructure_check_radius.tooltip,The radius (in blocks) to check around the player for node placement (eg. 1 block radius = 3 x 3 area check).,ノード配置時にプレイヤーの周辺をチェックする範囲（ブロック単位）。例：1ブロック半径 = 3×3範囲
via_romana.midnightconfig.invalid_block_overlay_opacity,Invalid Block Overlay Opacity,無効なブロックオーバーレイ不透明度
via_romana.midnightconfig.invalid_block_overlay_opacity.tooltip,Highlights blocks that do not count as valid infrastructure for charting. Set to 0 to disable.,チャート作成に有効なインフラとしてカウントされないブロックをハイライトします。無効にするには0に設定してください。
via_romana.midnightconfig.invalid_dimensions,Invalid Dimensions,無効なディメンション
via_romana.midnightconfig.invalid_dimensions.tooltip,List of dimension IDs where the fast-travel is disabled.,高速移動が無効化されているディメンションIDのリスト。
via_romana.midnightconfig.invalid_entities,Invalid Entities,無効なエンティティ
via_romana.midnightconfig.invalid_entities.tooltip,List of entity IDs that cannot fast-travel.,ファストトラベルできないエンティティ ID のリスト
via_romana.midnightconfig.map_refresh_interval,Map Refresh Interval,地図の更新間隔
via_romana.midnightconfig.map_refresh_interval.tooltip,The interval (in seconds) to refresh any rendered maps.,描画されたマップを更新する間隔（秒単位）
via_romana.midnightconfig.map_save_interval,Map Save Interval,マップ保存間隔
via_romana.midnightconfig.map_save_interval.tooltip,The interval (in minutes) to save the map cache to disk.,マップキャッシュをディスクに保存する間隔（分単位）
via_romana.midnightconfig.maximum_map_dimension,Maximum Map Dimension,最大マップディメンション
via_romana.midnightconfig.maximum_map_dimension.tooltip,The maximum dimension (in blocks) of the generated map texture.,生成されるマップテクスチャの最大寸法（ブロック単位）。
via_romana.midnightconfig.node_distance_maximum,Maximum Node Distance,最大ノード距離
via_romana.midnightconfig.node_distance_maximum.tooltip,The maximum distance (in blocks) between two nodes.,二つのノード間の最大距離（ブロック単位）です。
via_romana.midnightconfig.node_distance_minimum,Minimum Node Distance,最小ノード距離
via_romana.midnightconfig.node_distance_minimum.tooltip,The minimum distance (in blocks) between two nodes.,二つのノード間の最小距離（ブロック単位）
via_romana.midnightconfig.node_utility_distance,Node Utility Distance,ノードユーティリティ距離
via_romana.midnightconfig.node_utility_distance.tooltip,"The distance (in blocks) to select the nearest node from for actions like connect, sever, and delete.",接続、切断、削除などのアクション用に最も近いノードを選択する距離（ブロック単位）
via_romana.midnightconfig.path_block_ids,Infrastructure Block IDs,インフラブロックID
via_romana.midnightconfig.path_block_ids.tooltip,List of block IDs considered valid for paths.,パスとして有効とみなされるブロックIDのリスト。
via_romana.midnightconfig.path_block_strings,Infrastructure Block Substrings,インフラブロックの部分文字列
via_romana.midnightconfig.path_block_strings.tooltip,Substrings to search for in block IDs to consider them valid for paths.,パスとして有効とみなすブロックID内で検索するサブストリングです。
via_romana.midnightconfig.path_block_tags,Infrastructure Block Tags,インフラストラクチャーブロックタグ
via_romana.midnightconfig.path_block_tags.tooltip,List of block tags considered valid for paths.,有効とみなされるパス用のブロックタグ一覧。
via_romana.midnightconfig.path_quality_threshold,Path Quality Threshold,経路品質閾値
via_romana.midnightconfig.path_quality_threshold.tooltip,Minimum percentage of valid infrastructure blocks required between two nodes.,2つのノード間で必要な有効インフラブロックの最小割合です。
via_romana.midnightconfig.server_title,§lServer Settings§r,§lサーバー設定§r
via_romana.midnightconfig.spline_animation_speed,Map Path Animation Speed,マップパスアニメーション速度
via_romana.midnightconfig.spline_animation_speed.tooltip,The speed at which the teleport screen path animates (this will impact performance).,テレポート画面パスがアニメーションする速度（これがパフォーマンスに影響します）。
via_romana.midnightconfig.title,Via Romana Config,Via Romana設定
via_romana.midnightconfig.travel_fatigue_cooldown,Travel Fatigue Cooldown,移動疲労冷却時間
via_romana.midnightconfig.travel_fatigue_cooldown.tooltip,Cooldown (in ticks) before a player can fast-travel again.,プレイヤーが再び高速移動できるまでのクールダウン（ティック）
via_romana.midnightconfig.warp_block_ids,Warp Block IDs,ワープブロックID
via_romana.midnightconfig.warp_block_ids.tooltip,List of block IDs that can act as warp blocks.,ワープブロックとして機能できるブロックIDのリスト。
via_romana.midnightconfig.warp_block_tags,Warp Block Tags,ブロックタグのワープ
via_romana.midnightconfig.warp_block_tags.tooltip,List of block tags that can act as warp blocks.,ワープブロックとして機能できるブロックタグのリスト
