key,source_text,target_text,status
item.ae2.green_smart_dense_cable,Green ME Dense Smart Cable,緑色のME高密度スマートケーブル,verified
item.ae2.guide,Guide,ガイド,verified
item.ae2.import_bus,ME Import Bus,MEインポートバス,verified
item.ae2.inverted_toggle_bus,ME Inverted Toggle Bus,ME反転トグルバス,verified
item.ae2.inverter_card,Inverter Card,反転カード,verified
item.ae2.item_cell_housing,ME Item Cell Housing,MEアイテムセル筐体,verified
item.ae2.item_p2p_tunnel,Item P2P Tunnel,アイテムP2Pトンネル,verified
item.ae2.item_storage_cell_16k,16k ME Item Storage Cell,16k MEアイテムストレージセル,verified
item.ae2.item_storage_cell_1k,1k ME Item Storage Cell,1k MEアイテムストレージセル,verified
item.ae2.item_storage_cell_256k,256k ME Item Storage Cell,256k MEアイテムストレージセル,verified
item.ae2.item_storage_cell_4k,4k ME Item Storage Cell,4k MEアイテムストレージセル,verified
item.ae2.item_storage_cell_64k,64k ME Item Storage Cell,64k MEアイテムストレージセル,verified
item.ae2.level_emitter,ME Level Emitter,MEレベルエミッター,verified
item.ae2.light_blue_covered_cable,Light Blue ME Covered Cable,空色のMEカバーケーブル,verified
item.ae2.light_blue_covered_dense_cable,Light Blue ME Dense Covered Cable,空色のME高密度カバーケーブル,verified
item.ae2.light_blue_glass_cable,Light Blue ME Glass Cable,空色のMEガラスケーブル,verified
item.ae2.light_blue_lumen_paint_ball,Light Blue Lumen Paint Ball,空色の輝くペイントボール,verified
item.ae2.light_blue_paint_ball,Light Blue Paint Ball,空色のペイントボール,verified
item.ae2.light_blue_smart_cable,Light Blue ME Smart Cable,空色のMEスマートケーブル,verified
item.ae2.light_blue_smart_dense_cable,Light Blue ME Dense Smart Cable,空色のME高密度スマートケーブル,verified
item.ae2.light_gray_covered_cable,Light Gray ME Covered Cable,薄灰色のMEカバーケーブル,verified
item.ae2.light_gray_covered_dense_cable,Light Gray ME Dense Covered Cable,薄灰色のME高密度カバーケーブル,verified
item.ae2.light_gray_glass_cable,Light Gray ME Glass Cable,薄灰色のMEガラスケーブル,verified
item.ae2.light_gray_lumen_paint_ball,Light Gray Lumen Paint Ball,薄灰色の輝くペイントボール,verified
item.ae2.light_gray_paint_ball,Light Gray Paint Ball,薄灰色のペイントボール,verified
item.ae2.light_gray_smart_cable,Light Gray ME Smart Cable,薄灰色のMEスマートケーブル,verified
item.ae2.light_gray_smart_dense_cable,Light Gray ME Dense Smart Cable,薄灰色のME高密度スマートケーブル,verified
item.ae2.light_p2p_tunnel,Light P2P Tunnel,ライトP2Pトンネル,verified
item.ae2.lime_covered_cable,Lime ME Covered Cable,黄緑色のMEカバーケーブル,verified
item.ae2.lime_covered_dense_cable,Lime ME Dense Covered Cable,黄緑色のME高密度カバーケーブル,verified
item.ae2.lime_glass_cable,Lime ME Glass Cable,黄緑色のMEガラスケーブル,verified
item.ae2.lime_lumen_paint_ball,Lime Lumen Paint Ball,黄緑色の輝くペイントボール,verified
item.ae2.lime_paint_ball,Lime Paint Ball,黄緑色のペイントボール,verified
item.ae2.lime_smart_cable,Lime ME Smart Cable,黄緑色のMEスマートケーブル,verified
item.ae2.lime_smart_dense_cable,Lime ME Dense Smart Cable,黄緑色のME高密度スマートケーブル,verified
item.ae2.logic_processor,Logic Processor,論理プロセッサ,verified
item.ae2.logic_processor_press,Inscriber Logic Press,論理回路の金型,verified
item.ae2.magenta_covered_cable,Magenta ME Covered Cable,赤紫色のMEカバーケーブル,verified
item.ae2.magenta_covered_dense_cable,Magenta ME Dense Covered Cable,赤紫色のME高密度カバーケーブル,verified
item.ae2.magenta_glass_cable,Magenta ME Glass Cable,赤紫色のMEガラスケーブル,verified
item.ae2.magenta_lumen_paint_ball,Magenta Lumen Paint Ball,赤紫色の輝くペイントボール,verified
item.ae2.magenta_paint_ball,Magenta Paint Ball,赤紫色のペイントボール,verified
item.ae2.magenta_smart_cable,Magenta ME Smart Cable,赤紫色のMEスマートケーブル,verified
item.ae2.magenta_smart_dense_cable,Magenta ME Dense Smart Cable,赤紫色のME高密度スマートケーブル,verified
item.ae2.matter_ball,Matter Ball,マターボール,verified
item.ae2.matter_cannon,Matter Cannon,マターキャノン,verified
item.ae2.me_p2p_tunnel,ME P2P Tunnel,ME P2Pトンネル,verified
item.ae2.memory_card,Memory Card,メモリーカード,verified
item.ae2.meteorite_compass,Meteorite Compass,隕石コンパス,verified
item.ae2.missing_content,Missing Content,コンテンツがありません,verified
item.ae2.monitor,Bright Illuminated Panel,明るい照明パネル,verified
item.ae2.name_press,Inscriber Name Press,名称の金型,verified
item.ae2.nether_quartz_axe,Nether Quartz Axe,ネザークォーツの斧,verified
item.ae2.nether_quartz_cutting_knife,Nether Quartz Cutting Knife,ネザークォーツのナイフ,verified
item.ae2.nether_quartz_hoe,Nether Quartz Hoe,ネザークォーツのクワ,verified
item.ae2.nether_quartz_pickaxe,Nether Quartz Pickaxe,ネザークォーツのピッケル,verified
item.ae2.nether_quartz_shovel,Nether Quartz Shovel,ネザークォーツのシャベル,verified
item.ae2.nether_quartz_sword,Nether Quartz Sword,ネザークォーツの剣,verified
item.ae2.nether_quartz_wrench,Nether Quartz Wrench,ネザークォーツのレンチ,verified
item.ae2.network_tool,Network Tool,ネットワークツール,verified
item.ae2.orange_covered_cable,Orange ME Covered Cable,橙色のMEカバーケーブル,verified
item.ae2.orange_covered_dense_cable,Orange ME Dense Covered Cable,橙色のME高密度カバーケーブル,verified
item.ae2.orange_glass_cable,Orange ME Glass Cable,橙色のMEガラスケーブル,verified
item.ae2.orange_lumen_paint_ball,Orange Lumen Paint Ball,橙色の輝くペイントボール,verified
item.ae2.orange_paint_ball,Orange Paint Ball,橙色のペイントボール,verified
item.ae2.orange_smart_cable,Orange ME Smart Cable,橙色のMEスマートケーブル,verified
item.ae2.orange_smart_dense_cable,Orange ME Dense Smart Cable,橙色のME高密度スマートケーブル,verified
item.ae2.pattern_access_terminal,ME Pattern Access Terminal,MEパターンアクセスターミナル,verified
item.ae2.pattern_encoding_terminal,ME Pattern Encoding Terminal,MEパターンエンコーディングターミナル,verified
item.ae2.pink_covered_cable,Pink ME Covered Cable,桃色のMEカバーケーブル,verified
item.ae2.pink_covered_dense_cable,Pink ME Dense Covered Cable,桃色のME高密度カバーケーブル,verified
item.ae2.pink_glass_cable,Pink ME Glass Cable,桃色のMEガラスケーブル,verified
item.ae2.pink_lumen_paint_ball,Pink Lumen Paint Ball,桃色の輝くペイントボール,verified
item.ae2.pink_paint_ball,Pink Paint Ball,桃色のペイントボール,verified
item.ae2.pink_smart_cable,Pink ME Smart Cable,桃色のMEスマートケーブル,verified
item.ae2.pink_smart_dense_cable,Pink ME Dense Smart Cable,桃色のME高密度スマートケーブル,verified
item.ae2.portable_fluid_cell_16k,16k Portable Fluid Cell,16k ポータブル流体セル,verified
item.ae2.portable_fluid_cell_1k,1k Portable Fluid Cell,1k ポータブル流体セル,verified
item.ae2.portable_fluid_cell_256k,256k Portable Fluid Cell,256k ポータブル流体セル,verified
item.ae2.portable_fluid_cell_4k,4k Portable Fluid Cell,4k ポータブル流体セル,verified
item.ae2.portable_fluid_cell_64k,64k Portable Fluid Cell,64k ポータブル流体セル,verified
item.ae2.portable_item_cell_16k,16k Portable Item Cell,16k ポータブルアイテムセル,verified
item.ae2.portable_item_cell_1k,1k Portable Item Cell,ポータブルセル,verified
item.ae2.portable_item_cell_256k,256k Portable Item Cell,256k ポータブルアイテムセル,verified
item.ae2.portable_item_cell_4k,4k Portable Item Cell,4k ポータブルアイテムセル,verified
item.ae2.portable_item_cell_64k,64k Portable Item Cell,64k ポータブルアイテムセル,verified
item.ae2.printed_calculation_processor,Printed Calculation Circuit,演算回路,verified
item.ae2.printed_engineering_processor,Printed Engineering Circuit,情報処理回路,verified
item.ae2.printed_logic_processor,Printed Logic Circuit,論理回路,verified
item.ae2.printed_silicon,Printed Silicon,シリコン基板,verified
item.ae2.processing_pattern,Processing Pattern,処理パターン,verified
item.ae2.purple_covered_cable,Purple ME Covered Cable,紫色のMEカバーケーブル,verified
item.ae2.purple_covered_dense_cable,Purple ME Dense Covered Cable,紫色のME高密度カバーケーブル,verified
item.ae2.purple_glass_cable,Purple ME Glass Cable,紫色のMEガラスケーブル,verified
item.ae2.purple_lumen_paint_ball,Purple Lumen Paint Ball,紫色の輝くペイントボール,verified
item.ae2.purple_paint_ball,Purple Paint Ball,紫色のペイントボール,verified
item.ae2.purple_smart_cable,Purple ME Smart Cable,紫色のMEスマートケーブル,verified
item.ae2.purple_smart_dense_cable,Purple ME Dense Smart Cable,紫色のME高密度スマートケーブル,verified
item.ae2.quantum_entangled_singularity,Quantum Entangled Singularity,量子もつれシンギュラリティ,verified
item.ae2.quartz_fiber,Quartz Fiber,クォーツファイバー,verified
item.ae2.red_covered_cable,Red ME Covered Cable,赤色のMEカバーケーブル,verified
item.ae2.red_covered_dense_cable,Red ME Dense Covered Cable,赤色のME高密度カバーケーブル,verified
item.ae2.red_glass_cable,Red ME Glass Cable,赤色のMEガラスケーブル,verified
item.ae2.red_lumen_paint_ball,Red Lumen Paint Ball,赤色の輝くペイントボール,verified
item.ae2.red_paint_ball,Red Paint Ball,赤色のペイントボール,verified
item.ae2.red_smart_cable,Red ME Smart Cable,赤色のMEスマートケーブル,verified
item.ae2.red_smart_dense_cable,Red ME Dense Smart Cable,赤色のME高密度スマートケーブル,verified
item.ae2.redstone_card,Redstone Card,レッドストーンカード,verified
item.ae2.redstone_p2p_tunnel,Redstone P2P Tunnel,レッドストーンP2Pトンネル,verified
item.ae2.semi_dark_monitor,Illuminated Panel,照明パネル,verified
item.ae2.silicon,Silicon,シリコン,verified
item.ae2.silicon_press,Inscriber Silicon Press,シリコン基盤の金型,verified
item.ae2.singularity,Singularity,シンギュラリティ,verified
item.ae2.sky_dust,Sky Stone Dust,スカイストーンダスト,verified
item.ae2.smithing_table_pattern,Smithing Table Pattern,鍛冶台パターン,verified
item.ae2.spatial_cell_component_128,128³ Spatial Component,128³ 空間コンポーネント,verified
item.ae2.spatial_cell_component_16,16³ Spatial Component,16³ 空間コンポーネント,verified
item.ae2.spatial_cell_component_2,2³ Spatial Component,2³ 空間コンポーネント,verified
item.ae2.spatial_storage_cell_128,128³ Spatial Storage Cell,128³ 空間ストレージセル,verified
item.ae2.spatial_storage_cell_16,16³ Spatial Storage Cell,16³ 空間ストレージセル,verified
item.ae2.spatial_storage_cell_2,2³ Spatial Storage Cell,2³ 空間ストレージセル,verified
item.ae2.speed_card,Acceleration Card,加速カード,verified
item.ae2.stonecutting_pattern,Stonecutting Pattern,石切台パターン,verified
item.ae2.storage_bus,ME Storage Bus,MEストレージバス,verified
item.ae2.storage_monitor,ME Storage Monitor,MEストレージモニター,verified
item.ae2.terminal,ME Terminal,MEターミナル,verified
item.ae2.toggle_bus,ME Toggle Bus,MEトグルバス,verified
item.ae2.view_cell,View Cell,表示セル,verified
item.ae2.void_card,Overflow Destruction Card,オーバーフロー破棄カード,verified
item.ae2.white_covered_cable,White ME Covered Cable,白色のMEカバーケーブル,verified
item.ae2.white_covered_dense_cable,White ME Dense Covered Cable,白色のME高密度カバーケーブル,verified
item.ae2.white_glass_cable,White ME Glass Cable,白色のMEガラスケーブル,verified
item.ae2.white_lumen_paint_ball,White Lumen Paint Ball,白色の輝くペイントボール,verified
item.ae2.white_paint_ball,White Paint Ball,白色のペイントボール,verified
item.ae2.white_smart_cable,White ME Smart Cable,白色のMEスマートケーブル,verified
item.ae2.white_smart_dense_cable,White ME Dense Smart Cable,白色のME高密度スマートケーブル,verified
item.ae2.wireless_booster,Wireless Booster,無線ブースター,verified
item.ae2.wireless_crafting_terminal,Wireless Crafting Terminal,無線クラフトターミナル,verified
item.ae2.wireless_receiver,Wireless Receiver,無線受信機,verified
item.ae2.wireless_terminal,Wireless Terminal,無線ターミナル,verified
item.ae2.wrapped_generic_stack,Wrapped Generic Stack,ラップされた汎用スタック,verified
item.ae2.yellow_covered_cable,Yellow ME Covered Cable,黄色のMEカバーケーブル,verified
item.ae2.yellow_covered_dense_cable,Yellow ME Dense Covered Cable,黄色のME高密度カバーケーブル,verified
item.ae2.yellow_glass_cable,Yellow ME Glass Cable,黄色のMEガラスケーブル,verified
item.ae2.yellow_lumen_paint_ball,Yellow Lumen Paint Ball,黄色の輝くペイントボール,verified
item.ae2.yellow_paint_ball,Yellow Paint Ball,黄色のペイントボール,verified
item.ae2.yellow_smart_cable,Yellow ME Smart Cable,黄色のMEスマートケーブル,verified
item.ae2.yellow_smart_dense_cable,Yellow ME Dense Smart Cable,黄色のME高密度スマートケーブル,verified
key.ae2.category,Applied Energistics 2,Applied Energistics 2,verified
key.ae2.guide,Open Guide for Items,アイテムのガイドを開く,verified
key.ae2.mouse_wheel_item_modifier,Modifier for Mouse-Wheel Items,マウスホイールアイテムの追加オプション,verified
key.ae2.part_placement_opposite,Place Parts on Opposite Side,反対側にパーツを置く,verified
key.ae2.portable_fluid_cell,Open Portable Fluid Cell,ポータブル流体セルを開く,verified
key.ae2.portable_item_cell,Open Portable Item Cell,ポータブルアイテムセルを開く,verified
key.ae2.wireless_terminal,Open Wireless Terminal,無線ターミナルを開く,verified
key.toggle_focus.desc,Toggle search box focus,検索ボックスのフォーカスの切り替え,verified
stat.ae2.items_extracted,Items extracted from ME Storage,アイテムをMEストレージから取り出した回数,verified
stat.ae2.items_inserted,Items added to ME Storage,アイテムをMEストレージへ追加した回数,verified
theoneprobe.ae2.channels,%1$d Channels,%1$dチャンネル,verified
theoneprobe.ae2.channels_of,%1$d of %2$d Channels,%1$d / %2$dチャンネル,verified
theoneprobe.ae2.contains,Contains,含まれる,verified
theoneprobe.ae2.crafting,Crafting: %1$s,クラフト中: %1$s,verified
theoneprobe.ae2.device_missing_channel,Device Missing Channel,デバイスのチャンネル未探知,verified
theoneprobe.ae2.device_offline,Device Offline,デバイスオフライン,verified
theoneprobe.ae2.device_online,Device Online,デバイスオンライン,verified
theoneprobe.ae2.locked,Locked,ロックされた,verified
theoneprobe.ae2.nested_p2p_tunnel,Error: Nested P2P Tunnel,エラー: ネストされたP2Pトンネル,verified
theoneprobe.ae2.p2p_frequency,Frequency: %1$s,周波数: %1$s,verified
theoneprobe.ae2.p2p_input_many_outputs,Linked (Input Side) - %d Outputs,リンク済み(入力側) - 出力: %d,verified
theoneprobe.ae2.p2p_input_one_output,Linked (Input Side),リンク済み(入力側),verified
theoneprobe.ae2.p2p_output,Linked (Output Side),リンク済み(出力側),verified
theoneprobe.ae2.p2p_unlinked,Unlinked,リンクされてない,verified
theoneprobe.ae2.showing,Showing,表示中,verified
theoneprobe.ae2.stored_energy,%1$d / %2$d,%1$d / %2$d,verified
theoneprobe.ae2.unlocked,Unlocked,解錠された,verified
waila.ae2.Channels,%1$d Channels,%1$dチャンネル,verified
waila.ae2.ChannelsOf,%1$d of %2$d Channels,%1$d / %2$dチャンネル,verified
waila.ae2.Charged,%d%% charged,%d%% チャージ済み,verified
waila.ae2.Contains,Contains: %s,含まれるもの: %s,verified
waila.ae2.Crafting,Crafting: %s,クラフト中: %s,verified
waila.ae2.CraftingLockedByLackOfRedstoneSignal,Locked by lack of redstone signal,レッドストーン信号不足によりロックされています,verified
waila.ae2.CraftingLockedByRedstoneSignal,Locked by redstone signal,レッドストーン信号でロックされました,verified
waila.ae2.CraftingLockedUntilPulse,Waiting for redstone pulse to unlock,レッドストーン信号のロック解除を待機中,verified
waila.ae2.CraftingLockedUntilResult,Waiting for %s (%d) to unlock,%s(%d)のロック解除を待機中,verified
waila.ae2.DeviceMissingChannel,Device Missing Channel,デバイスのチャンネル未探知,verified
waila.ae2.DeviceOffline,Device Offline,デバイスオフライン,verified
waila.ae2.DeviceOnline,Device Online,デバイスオンライン,verified
waila.ae2.EnchantedWith,Enchanted with:,エンチャント対象:,verified
waila.ae2.ErrorControllerConflict,Error: Controller Conflict,エラー: コントローラーの競合,verified
waila.ae2.ErrorNestedP2PTunnel,Error: Nested P2P Tunnel,エラー: ネストされたP2Pトンネル,verified
waila.ae2.ErrorTooManyChannels,Error: Too Many Channels,エラー: チャンネルが多すぎます,verified
waila.ae2.Locked,Locked,ロックされた,verified
waila.ae2.NetworkBooting,Network Booting,ネットワーク起動中,verified
waila.ae2.P2PFrequency,Frequency: %s,周波数: %s,verified
waila.ae2.P2PInputManyOutputs,Linked (Input Side) - %d Outputs,リンク済み(入力側) - 出力: %d,verified
waila.ae2.P2PInputOneOutput,Linked (Input Side),リンク済み(入力側),verified
waila.ae2.P2PMECarriedChannels,Carried Channels: %d,配送済みチャンネル: %d,verified
waila.ae2.P2POutput,Linked (Output Side),リンク済み(出力側),verified
waila.ae2.P2PUnlinked,Unlinked,リンクされてない,verified
waila.ae2.Showing,Showing,表示中,verified
waila.ae2.Stored,Stored: %s / %s,保管済み: %s / %s,verified
waila.ae2.Suppressed,Suppressed,抑制されました,verified
waila.ae2.Unlocked,Unlocked,解錠された,verified
achievement.ae2.QuartzCrystal,Applied Energistics 2,Applied Energistics 2,translated
achievement.ae2.QuartzCrystal.desc,Obtain your first Certus Quartz Crystal.,最初のサーティスクォーツクリスタルを入手する。,translated
ae2.rei_jei_integration.silk_touch_causes_less_decay,Silk touch causes less decay,シルクタッチはより少ない分解を引き起こす,translated
ae2.rei_jei_integration.spatial_io_causes_none,Spatial I/O causes none,スペーシャルI/Oは分解を引き起こさない,translated
ae2.rei_jei_integration.throwing_in_water_category,Throwing In Water,水に投入する,translated
ae2.rei_jei_integration.with_crystal_growth_accelerators,With Crystal Growth Accelerators:,クリスタルグロースアクセレーターを使用：,translated
block.ae2.debug_chunk_loader,Dev.ChunkLoader,Dev.ChunkLoader,translated
block.ae2.deepslate_quartz_ore,Deepslate Certus Quartz Ore,深板サーティスクォーツ鉱石,translated
block.ae2.quartz_growth_accelerator,Crystal Growth Accelerator,クリスタル成長加速器,verified
block.ae2.quartz_ore,Certus Quartz Ore,ケルタスクォーツ鉱石,verified
block.ae2.security_station,ME Security Terminal,MEセキュリティターミナル,verified
block.ae2.sky_compass,Meteorite Compass,隕石コンパス,verified
chat.ae2.StationCanNotBeLocated,Station can not be located.,ステーションが見つかりません。,verified
entity.ae2.charged_quartz,Charged Quartz,帯電したクォーツ,translated
entity.ae2.growing_crystal,Growing Crystal,成長中のクリスタル,translated
entity.ae2.singularity,Singularity,シンギュラリティ,translated
gui.ae2.ChargedQuartz,"Charged Certus Quartz is crafted by inserting an uncharged Certus Quartz Crystal into the Charger, and powering it.",チャージ済みケルタスクォーツはチャージャーを使うことで、チャージされていないケルタスクォーツから作ることができます。,verified
gui.ae2.Chest,ME Chest,MEチェスト,verified
gui.ae2.LargeFontCraft,+,+,translated
gui.ae2.NoPermissions,No Permissions Selected,権限未選択,verified
gui.ae2.SearchSettingsSearchTooltips,Search in tooltips,ツールチップ内を検索,translated
gui.ae2.SearchTooltipIncludingTooltips,Search in Name and Tooltip,名前とツールチップ内を検索,translated
gui.ae2.Security,Security Term,セキュリティ端末,verified
gui.ae2.SecurityCardEditor,Biometric Card Editor,生体認証カードエディター,verified
gui.ae2.SmallFontCraft,Craft,クラフト,verified
gui.ae2.Substitute,Using Substitutions:,置き換えの使用:,verified
gui.ae2.security.build.name,Build,構築,translated
gui.ae2.security.build.tip,"User can modify the physical structure of the network, and make configuration changes.",ユーザーはネットワークの物理構造を変更し、構成を変更できます。,verified
gui.ae2.security.craft.name,Craft,クラフト,verified
gui.ae2.security.craft.tip,User can initiate new crafting jobs.,ユーザーは新しいクラフトジョブを開始できます。,verified
gui.ae2.security.extract.name,Withdraw,引き出す,translated
gui.ae2.security.extract.tip,User is allowed to remove items from storage.,ユーザーはストレージからアイテムを削除できます。,verified
gui.ae2.security.inject.name,Deposit,預ける,translated
gui.ae2.security.inject.tip,User is allowed to store new items into storage.,ユーザーは新しいアイテムをストレージに保存できます。,verified
gui.ae2.security.security.name,Security,セキュリティ,translated
gui.ae2.security.security.tip,User can access and modify the security terminal of the network.,ユーザーは、ネットワークのセキュリティ端末にアクセスして変更できます。,verified
gui.ae2.units.rf,RF,RF,translated
gui.tooltips.ae2.ShowAll,Show All,すべて表示,translated
gui.tooltips.ae2.ShowFluidsOnly,Show Fluids only,流体のみを表示,translated
gui.tooltips.ae2.ShowItemsOnly,Show Items only,アイテムのみを表示,translated
gui.tooltips.ae2.Substitutions,Item Substitutions,鉱石辞書の置換,verified
item.ae2.biometric_card,Biometric Card,バイオメトリクスカード,verified
item.ae2.certus_crystal_seed,Certus Quartz Seed,サーティスクォーツシード,translated
item.ae2.creative_fluid_cell,Creative ME Fluid Cell,Creative MEフルイドセル,translated
item.ae2.creative_item_cell,Creative ME Item Cell,クリエイティブMEストレージセル,verified
item.ae2.fluix_crystal_seed,Fluix Seed,Fluixシード,translated
item.ae2.identity_annihilation_plane,ME Identity Annihilation Plane,MEアイデンティティアンニヒレーションプレーン,translated
item.ae2.memory_card_black,Black Memory Card,黒色メモリカード,translated
item.ae2.memory_card_blue,Blue Memory Card,青色メモリカード,translated
item.ae2.memory_card_brown,Brown Memory Card,茶色メモリカード,translated
item.ae2.memory_card_cyan,Cyan Memory Card,青緑色メモリカード,translated
item.ae2.memory_card_gray,Gray Memory Card,灰色メモリカード,translated
item.ae2.memory_card_green,Green Memory Card,緑色メモリカード,translated
item.ae2.memory_card_light_blue,Light Blue Memory Card,水色メモリカード,translated
item.ae2.memory_card_light_gray,Light Gray Memory Card,薄灰色メモリカード,translated
item.ae2.memory_card_lime,Lime Memory Card,黄緑色メモリカード,translated
item.ae2.memory_card_magenta,Magenta Memory Card,マゼンタメモリカード,translated
item.ae2.memory_card_orange,Orange Memory Card,オレンジメモリカード,translated
item.ae2.memory_card_pink,Pink Memory Card,ピンク色メモリカード,translated
item.ae2.memory_card_purple,Purple Memory Card,紫色メモリカード,translated
item.ae2.memory_card_red,Red Memory Card,赤色メモリカード,translated
item.ae2.memory_card_white,White Memory Card,白色メモリカード,translated
item.ae2.memory_card_yellow,Yellow Memory Card,黄色メモリカード,translated
itemGroup.ae2.facades,Applied Energistics 2 - Facades,Applied Energistics 2 - 外観,verified
itemGroup.ae2.main,Applied Energistics 2,Applied Energistics 2,translated
waila.ae2.IdentityDeprecated,Deprecated. Convert with SHIFT + RIGHT-CLICK,廃止予定です。SHIFT + 右クリックで変換してください,translated
