key,source_text,target_text
lore.item.aether.aechor_petal,The petal of an Aechor Plant with a sweet aroma to it. These are a Moa's favorite food and can be used to feed baby Moas.,甘い香りのするエコープラントの花弁。モアの大好物で、ベビーモアの餌に使えます。
lore.item.aether.aether_portal_frame,A portable frame containing the power to travel to the Aether or back to the Overworld. Not something you're likely to find naturally.,エーテルに向かい、オーバーワールドに戻る力を持つ、持ち運び可能なフレーム。自然に見つかるアイテムではなさそうだ。
lore.item.aether.agility_cape,"An uncommon cape found in Bronze and Silver Dungeons. It makes the wearer's legs stronger, therefore they can walk up blocks instantly.",ブロンズとシルバーダンジョンで見つかる珍しいマント。着用者の脚を強化し、即座にブロックを登れるようになります。
lore.item.aether.ambrosium_shard,The Aether's Coal equivalent. These have the healing property of restoring a small amount of health when eaten.,エーテルの石炭相当。食べると体力を少量回復する。
lore.item.aether.black_moa_egg,"An egg laid by a Black Moa. Hatching this provides a Black Moa with 8 mid-air jumps, the best and rarest one!",ブラックモアが産んだ卵。孵化させると8回の空中ジャンプができる、最高かつ最も希少なブラックモアが得られます！
lore.item.aether.blue_berry,"Harvested from Berry Bushes, this is the most common food source in the Aether. It has very weak hunger restoration. You can enchant these in an Altar for much better hunger restoration.",ベリーの低木から収穫される、エーテルで最もよく見られる食料源。満腹度の回復量は非常に低い。祭壇でエンチャントすることでより高い満腹度の回復を期待できる。
lore.item.aether.blue_cape,A Blue Cape that has a silky feeling to it. It's crafted using Blue Wool.,絹のような感触を持つ青いマント。青い羊毛でクラフトされる。
lore.item.aether.blue_gummy_swet,A sweet-smelling gummy that can be found in chests in Bronze and Silver dungeons. It fully restores the Player's hunger when eaten. Very useful for boss fights.,ブロンズとシルバーダンジョンのチェストで見つかる甘い香りのグミ。食べるとプレイヤーの空腹を完全に回復します。ボス戦に非常に便利。
lore.item.aether.blue_moa_egg,An egg laid by a Blue Moa. Hatching this provides a Blue Moa with 3 mid-air jumps. The most common Moa.,青モアが産んだ卵。孵化させることで産まれる青モアは、最大3回まで空中ジャンプを行える。最もよく見られるモア種。
lore.item.aether.book_of_lore,A large book containing many lore entries. It describes every object in detail.,様々な伝承を記した、分厚い本。あまねく物を詳細に解説する。
lore.item.aether.bronze_dungeon_key,A dull key that is dropped from the Slider after being defeated. You can use it to claim the treasure you earned!,倒されたスライダーが落とした、鈍く光る鍵。これでダンジョンの宝物は君のものだ！
lore.item.aether.candy_cane,"Dropped by mobs killed with a Candy Cane Sword! They can be used to repair this weapon, and they're a very tasty treat.",キャンディケインの剣で倒されたモブが落としたお菓子だ！キャンディケインの剣を修理するのに使えるほか、非常に美味しいおやつにもなる。
lore.item.aether.candy_cane_sword,A sword made from decorative candy. Randomly drops Candy Canes when used. These are dropped from presents that are under Holiday Trees.,装飾的なキャンディで作られた剣。使用時にランダムでキャンディケインをドロップします。ホリデーツリーの下のプレゼントからドロップします。
lore.item.aether.chainmail_gloves,A very rare pair of gloves needed to complete the chain armor set.,チェーン防具セットを完成させるために必要な非常に珍しいグローブ。
lore.item.aether.cloud_staff,A staff with a light and fluffy top. It summons small Cloud Minions to fight next to the user for a short period of time by shooting large Cloud Crystals.,上部がふわふわで軽い杖。大きな雲の結晶を発射することで小さな雲のミニオンを召喚し、使用者の隣で短時間戦わせる。
lore.item.aether.cold_parachute,A quickly made Parachute. It's fluffy to the touch and is made from Cold Aerclouds. It has one use.,即席で作られたパラシュート。手触りはふわふわで、冷たい天空雲から作られている。1回しか使えない。
lore.item.aether.diamond_gloves,A pair of gloves needed to complete the diamond armor set.,ダイヤモンド防具セットを完成させるために必要なグローブ。
lore.item.aether.enchanted_berry,"An excellent food source, it tastes quite good and restores a massive amount of hunger.",優れた食料源。美味しい上、満腹度を大きく回復させる。
lore.item.aether.enchanted_dart,"The ammo for Enchanted Dart Shooters. This is the strongest of the darts, made by enchanting Golden Darts.",魔法の吹き筒に使用される矢。吹き矢の中で最も強力であり、金の吹き矢を祭壇でエンチャントすることで入手できる。
lore.item.aether.enchanted_dart_shooter,A Dart Shooter that shoots Enchanted Darts; the strongest one!,最強の吹き矢、魔法の吹き矢が撃てる吹き筒だ！
lore.item.aether.flaming_sword,An ancient sword which burns its foes to a crisp. It almost hurts to touch! Using this on animals can make them drop cooked meat!,敵をこんがりと焼き尽くす古代の剣。触ると痛いほど熱い！動物に使うと、焼かれた状態の肉を手に入れることができるぞ！
lore.item.aether.gingerbread_man,"Found in presents under Holiday Trees, these are the most common holiday item. They are very abundant when dropped from Presents.",ホリデーの木の下に置かれたプレゼントの中から、最もよく見つかるクリスマス系のアイテム。プレゼントから大量に入手できる。
lore.item.aether.gold_dungeon_key,A key that has a shiny finish. It is dropped by the Sun Spirit after you defeat him. You can use it to claim the legendary treasure in the back room!,キラキラと輝く鍵。太陽の精霊を倒すと、彼が落とす。これを使うことで、後室に保管されている伝説のお宝を手に入れることができるぞ！
lore.item.aether.golden_amber,These round golden orbs can be obtained by mining Golden Oak Logs with a Zanite or Gravitite Axe. Their main purpose is to craft Golden Darts and Dart Shooters.,これらの丸い金色の球体は、黄金のオークの原木をザナイトまたはグラビタイトの斧で壊すと入手できる。主な用途は黄金の吹き矢、及び吹き筒のクラフト。
lore.item.aether.golden_dart,"The ammo for Golden Dart Shooters. Crafted with Skyroot Sticks and Golden Amber, enchanting these converts them to Enchanted Darts.",黄金の吹き筒に使用される矢。スカイルートの棒と黄金の琥珀でクラフトでき、祭壇でエンチャントすると魔法の吹き矢に変わる。
lore.item.aether.golden_dart_shooter,A Dart Shooter that shoots Golden Darts; enchanting it on an Altar improves its attack power!,黄金の吹き矢を撃つ吹き筒。祭壇でエンチャントすると攻撃力が強化されるぞ！
lore.item.aether.golden_feather,"A fluffy feather found in Silver Dungeons. When worn, the wearer becomes lighter than air and can descend slowly.",シルバーダンジョンで見つかるふわふわの羽根。装備した者は空気よりも軽くなり、ゆっくりと降下できるようになる。
lore.item.aether.golden_gloves,"A pair of gloves, needed to complete the golden armor set.",金の防具セットを完成させるために必要なグローブ。
lore.item.aether.golden_gummy_swet,A sour-tasting gummy that can be found in chests in Bronze and Silver Dungeons. It fully restores the Player's hunger when eaten. Very useful for boss fights.,ブロンズとシルバーダンジョンのチェストで見つかる酸っぱい味のグミ。食べるとプレイヤーの空腹を完全に回復します。ボス戦に非常に便利。
lore.item.aether.golden_parachute,The best Parachute in the Aether. It has 20 uses and is made with Golden Aerclouds.,エーテルで最も優秀なパラシュート。20回使用することができ、金色の天空雲で作られる。
lore.item.aether.golden_pendant,An aesthetic accessory made of gold.,純金製の装飾品。
lore.item.aether.golden_ring,An aesthetic accessory made of gold.,純金製の装飾品。
lore.item.aether.gravitite_axe,"Part of the Aether's best tool tier. This Axe not only makes wood blocks float, but it can mine Golden Oak Logs for Golden Amber!",エーテルの最強のツールの一つ。この斧は木系のブロックを浮かせられるだけでなく、黄金のオークの木から黄金の琥珀を採取することもできるぞ！
lore.item.aether.gravitite_boots,"Part of the Aether's best armor set. When the full set is worn, you get an extra high jump!",エーテルの最強の防具の一式の一つ。一式を全て装備すると、非常に高い跳躍力を手にすることができるぞ！
lore.item.aether.gravitite_chestplate,"Part of the Aether's best armor set. When the full set is worn, you get an extra high jump!",エーテルの最強のアーマーセットの一部。フルセットで装備すると、非常に高い跳躍力を手にすることができるぞ！
lore.item.aether.gravitite_gloves,Part of the Aether's best armor set needed to complete the Gravitite set.,グラビタイトセットを完成させるために必要な、天界最高の防具セットの一部。
lore.item.aether.gravitite_helmet,"Part of the Aether's best armor set. When the full set is worn, you get an extra high jump!",エーテルの最強の防具の一式の一つ。一式を全て装備すると、非常に高い跳躍力を手にすることができるぞ！
lore.item.aether.gravitite_hoe,Part of the Aether's best tool tier. It can be used to harvest many plant-based or organic blocks and can also make them float.,Aetherの最強の道具の一つ。多くの植物系や有機物系のブロックを収穫するのに使える上、それらを浮遊させることもできる。
lore.item.aether.gravitite_leggings,"Part of the Aether's best armor set. When the full set is worn, you get an extra high jump!",エーテルの最強の防具の一式の一つ。一式を全て装備すると、非常に高い跳躍力を手にすることができるぞ！
lore.item.aether.gravitite_pickaxe,"Part of the Aether's best tool tier. When mining with this powerful tool, you can right-click on any stone block, and it will levitate into the air! You can mine any ore with this pickaxe.",天界最高のツールティアの一部。この強力なツールで採掘中に石ブロックを右クリックすると、空中に浮かびます！このつるはしであらゆる鉱石を採掘できます。
lore.item.aether.gravitite_shovel,"Part of the Aether's best tool tier. This shovel has the special ability to make dirt blocks or sand levitate! When combined with enchantments such as Efficiency, it will instantly break Aether Dirt!",天界最高のツールティアの一部。このシャベルは土ブロックや砂を浮かせる特殊能力があります！効率などのエンチャントと組み合わせると、天界の土を一瞬で壊せます！
lore.item.aether.gravitite_sword,"Part of the Aether's best tool tier. When attacking with this powerful weapon, anything you hit will be flung into the air, causing lots of damage!",エーテルの最強の道具の一つ。 この強力な武器で攻撃する時、攻撃された者は空中に舞い上がり、大ダメージを与えるぞ！
lore.item.aether.hammer_of_jeb,"A mysterious hammer that can shoot projectiles. At one point, it vanished from existence. It's said this was actually Jeb's hammer at one point.",謎の物体を発射することができる、不思議なハンマー。ある一時期、世界からその存在を消していた。一時期Jebの持ち物であったと言い伝えられている。
lore.item.aether.hammer_of_kingbdogz,A mighty hammer that shoots heavy projectiles at mobs. It's said that Kingbdogz actually held this hammer.,重い発射物をモブに撃つ、偉大なハンマー。Kingbdogzが手にしていたと言われている。
lore.item.aether.healing_stone,"Obtained from enchanting Holystone, it can be used as a reliable healing source, providing Regeneration. It has a surprisingly juicy flavor.",聖石を祭壇でエンチャントすることで入手できる。信頼できる回復限として使え、一時的な再生能力を付与する。味は驚くほどジューシー。
lore.item.aether.holy_sword,An ancient sword which does heavy damage to undead foes. A perfect weapon for traversing the Overworld.,アンデッドの敵に大ダメージを与える古代の剣。オーバーワールドを冒険するのに最適な武器。
lore.item.aether.holystone_axe,"One of Aether's stone tools. It mines faster than skyroot tools, as well as dropping random Ambrosium Shards.",エーテルの石の道具の一つ。スカイルートの道具より素早く採掘が行え、稀にアンブロシアの欠片も落とす。
lore.item.aether.holystone_hoe,"One of the Aether's stone tools. It can be used to harvest many plant-based or organic blocks, and till dirt blocks into farmable land. It will randomly drop Ambrosium Shards during use.",天界の石のツールの一つ。植物や有機ブロックの収穫、土を農地に耕すのに使えます。使用中にランダムでアンブロシウムの欠片をドロップします。
lore.item.aether.holystone_pickaxe,One of the Aether's stone tools. It can mine Zanite Ore and will randomly drop Ambrosium Shards while mining.,エーテルの石の道具の一つ。ザナイトを採掘することができ、採掘中にランダムでアンブロシアの欠片を落とすことがある。
lore.item.aether.holystone_shovel,"One of the Aether's stone tools. It can mine Quicksoil and all other blocks a Stone Shovel can mine, except it drops random Ambrosium Shards.",エーテルの石の道具の一つ。流土を始めとする、石のシャベルが採掘できるすべてのブロックを採掘できるが、石のシャベルと違ってランダムでアンブロシアの欠片を落とす。
lore.item.aether.holystone_sword,One of the Aether's stone tools. It can drop Ambrosium Shards at random while attacking.,エーテルの石の道具の一つ。攻撃時、稀にアンブロシアの欠片を落とす。
lore.item.aether.ice_pendant,A pendant which allows you to freeze water and lava when walked on.,歩くと水や溶岩を凍らせることができるペンダント。
lore.item.aether.ice_ring,A ring which allows you to freeze water and lava when walked on.,歩くと水や溶岩を凍らせることができる指輪。
lore.item.aether.invisibility_cloak,"A cloak that makes the wearer completely invisible! Since mobs cannot see you, they cannot attack you. Sneak up on your enemies with it!",装備した者を完全に透明にするマントだ！モブにも見えなくなるため、攻撃もされなくなる。これで敵の不意を突こう！
lore.item.aether.iron_bubble,A common dungeon loot item. It allows for the wearer to breathe underwater indefinitely.,ダンジョンでよくみられるアイテム。装備した者は水中で無限に呼吸することができる。
lore.item.aether.iron_gloves,"A pair of gloves, needed to complete the iron armor set.",鉄の防具セットを完成させるために必要なグローブ。
lore.item.aether.iron_pendant,An aesthetic accessory made of iron.,鉄製の装飾品。
lore.item.aether.iron_ring,An aesthetic accessory made of iron.,鉄製の装飾品。
lore.item.aether.leather_gloves,Dyeable gloves to match your Leather Tunic! This is needed to complete the leather armor set.,革のチュニックに合わせて染色可能なグローブ！革の防具セットを完成させるために必要。
lore.item.aether.life_shard,A very rare item found in Gold Dungeons. Using this will give you an extra permanent heart! The feeling of using it is very strange and hard to describe.,ゴールドダンジョンで見つけられる、かなり珍しいアイテム。これを使用することで、体力の上限が永久にハート一つ分増えるぞ！使ったときの感触は非常に奇妙で、言葉で説明するのが難しい。
lore.item.aether.lightning_knife,"Small knives that, when thrown, summon lightning bolts where they land.",投げると着地点に雷を落とす小さなナイフ。
lore.item.aether.lightning_sword,An ancient sword which summons lightning to its foes.,敵に雷を落とす古代の剣。
lore.item.aether.music_disc_aether_tune,"A music disc that plays ""Aether Tune"" by Noisestorm.",Noisestormの「Aether Tune」が流れるレコード。
lore.item.aether.music_disc_ascending_dawn,"A music disc that plays ""Ascending Dawn"" by Emile van Krieken.",Emile van Kriekenの「Ascending Dawn」が流れるレコード。
lore.item.aether.music_disc_chinchilla,"A music disc that plays ""chinchilla"" by RENREN.",RENRENの「chinchilla」が流れるレコード。
lore.item.aether.music_disc_high,"A music disc that plays ""high"" by RENREN.",RENRENの「high」が流れるレコード。
lore.item.aether.music_disc_klepto,"A music disc that plays ""klepto"" by sunsette.","sunsette作、""klepto"" が再生されるレコード。"
lore.item.aether.music_disc_sliders_wrath,"A music disc that plays ""Slider's Wrath"" by sunsette.",sunsetteの「Slider's Wrath」が流れるレコード。
lore.item.aether.nature_staff,A staff that can allow for commanding tamed Moas. It allows them to sit on the ground.,飼いならしたモアに命令できる杖。地面に座らせることができます。
lore.item.aether.neptune_boots,"Found in Bronze Dungeons, this armor allows for faster swimming in water. The full set is a much better replacement for the Depth Strider enchantment.",ブロンズダンジョンで見つかるこの防具は、水中での遊泳スピードを上げる。フルセットで装備すると、性能は水中歩行エンチャントを凌駕する。
lore.item.aether.neptune_chestplate,"Found in Bronze Dungeons, this armor allows for faster swimming in water. Combined with an Iron Bubble, this armor set is super useful for defeating underwater temples.",ブロンズダンジョンで見つかるこの防具は、水中での遊泳速度を上げる。鉄の泡と組み合わせると、海底遺跡を攻略するのに非常に役立つ。
lore.item.aether.neptune_gloves,"Found in Bronze Dungeons, these gloves are required to complete the Neptune armor set, which allows for underwater walking.",ブロンズダンジョンで見つかるこのグローブは、水中での移動を補助するネプチューン防具のセットを完成させるのに必要。
lore.item.aether.neptune_helmet,"Found in Bronze Dungeons, this armor allows faster swimming in water. Combined with an Iron Bubble, this armor set is super useful for defeating underwater temples.",ブロンズダンジョンで見つかるこの防具は、水中での遊泳速度を上げる。鉄の泡と組み合わせると、海底遺跡を攻略するのに非常に役立つ。
lore.item.aether.neptune_leggings,"Found in Bronze Dungeons, this armor allows faster swimming in water. Combined with an Iron Bubble, this armor set is super useful for defeating underwater temples.",ブロンズダンジョンで見つかるこの防具は、水中での遊泳速度を上げる。鉄の泡と組み合わせると、海底遺跡を攻略するのに非常に役立つ。
lore.item.aether.netherite_gloves,A pair of gloves needed to complete the Netherite armor set.,ネザライト防具セットを完成させるために必要なグローブ。
lore.item.aether.obsidian_boots,"A super powerful piece of armor, more powerful than diamond. This armor is only obtainable by standing in water while wearing Phoenix armor, converting it to obsidian.",ダイヤモンドより強力な超強力な防具。フェニックス防具を着て水に立つと黒曜石に変化することでのみ入手可能。
lore.item.aether.obsidian_chestplate,"A super powerful piece of armor, more powerful than diamond. This armor is only obtainable by standing in water while wearing Phoenix armor, converting it to obsidian.",ダイヤモンドより強力な超強力な防具。フェニックス防具を着て水に立つと黒曜石に変化することでのみ入手可能。
lore.item.aether.obsidian_gloves,"Needed to complete the obsidian armor set, you can obtain these by standing in water while wearing Phoenix Gloves.",黒曜石防具セットを完成させるために必要。フェニックスグローブを着て水に立つと入手可能。
lore.item.aether.obsidian_helmet,"A super powerful piece of armor, more powerful than diamond. This armor is only obtainable by standing in water while wearing Phoenix armor, converting it to obsidian.",ダイヤモンドより強力な超強力な防具。フェニックス防具を着て水に立つと黒曜石に変化することでのみ入手可能。
lore.item.aether.obsidian_leggings,"A super powerful piece of armor, more powerful than diamond. This armor is only obtainable by standing in water while wearing Phoenix armor, converting it to obsidian.",ダイヤモンドより強力な超強力な防具。フェニックス防具を着て水に立つと黒曜石に変化することでのみ入手可能。
lore.item.aether.phoenix_boots,"Found in Gold Dungeons, when fully worn, this armor set grants fire resistance; you can swim in lava as well. Be careful when standing in water, as it will turn into obsidian armor.",ゴールドダンジョンで発見。フルセットで着用すると火炎耐性が付与され、溶岩の中を泳げます。水に立つと黒曜石防具に変化するので注意。
lore.item.aether.phoenix_bow,"Found as dungeon loot, this bow is very heated and can shoot flaming Arrows! It's warm to the touch.",ダンジョンの中で見つかるこの弓は熱の力を蓄えている。火のついた矢を放てるぞ！触ると暖かい。
lore.item.aether.phoenix_chestplate,"Found in Gold Dungeons, when fully worn, this armor set grants fire resistance; you can swim in lava as well. Be careful when standing in water, as it will turn into obsidian armor.",ゴールドダンジョンで発見。フルセットで着用すると火炎耐性が付与され、溶岩の中を泳げます。水に立つと黒曜石防具に変化するので注意。
lore.item.aether.phoenix_gloves,"Found in Gold Dungeons, these gloves are required to finish the Phoenix armor set. If you stand in water for long enough, they will turn into Obsidian Gloves.",ゴールドダンジョンで発見。フェニックス防具セットを完成させるために必要。水に長時間立つと黒曜石グローブに変化します。
lore.item.aether.phoenix_helmet,"Found in Gold Dungeons, when fully worn, this armor set grants fire resistance; you can swim in lava as well. Be careful when standing in water, as it will turn into obsidian armor.",ゴールドダンジョンで発見。フルセットで着用すると火炎耐性が付与され、溶岩の中を泳げます。水に立つと黒曜石防具に変化するので注意。
lore.item.aether.phoenix_leggings,"Found in Gold Dungeons, when fully worn, this armor set grants fire resistance; you can swim in lava as well. Be careful when standing in water, as it will turn into obsidian armor.",ゴールドダンジョンで発見。フルセットで着用すると火炎耐性が付与され、溶岩の中を泳げます。水に立つと黒曜石防具に変化するので注意。
lore.item.aether.pig_slayer,"Kills any pig-type mob with nothing with a single blow, or stronger ones with a couple blows. But why would you want to do that? Great for traversing the Nether.",豚タイプのモブを一撃で倒し、強いものでも数撃で倒せます。でも、なぜそうしたいのでしょう？ネザー探索に最適。
lore.item.aether.poison_dart,"The ammo for Poison Dart Shooters, these are made by coating Golden Darts with poison!",毒の吹き筒が撃つ吹き矢。黄金の吹き矢に毒を塗ることで作られるぞ！
lore.item.aether.poison_dart_shooter,A Dart Shooter that shoots Poison Darts. Shooting this at something infects them with a deadly poison!,毒ダーツを発射するダートシューター。これを撃つと対象を致命的な毒に感染させます！
lore.item.aether.red_cape,A rough-feeling cape that is crafted using Red Wool.,赤い羊毛から作られたざらざらした手触りのマント。
lore.item.aether.regeneration_stone,A treasure found in Silver Dungeons. This stone makes the wearer feel healthy and heals their wounds. The effects can stack with other Regeneration Stones.,シルバーダンジョンで見つかる宝物。この石は着用者を健康に保ち、傷を癒します。他の再生の石と効果が重複します。
