key,source_text,target_text,status
artifacts.advancements.adventurous_eater.description,Eat an Artifact,遺物を食べる,translated
artifacts.advancements.adventurous_eater.title,Adventurous Eater,冒険好きな食人,translated
artifacts.advancements.amateur_archaeologist.description,Find an Artifact,アーティファクトを探す,verified
artifacts.advancements.amateur_archaeologist.title,Amateur Archaeologist,アマチュア考古学者,verified
artifacts.advancements.chest_slayer.description,Kill a Mimic,ミミックを倒す,verified
artifacts.advancements.chest_slayer.title,Chest Slayer,チェストスレイヤー,verified
artifacts.config.client.cooldownOverlayOffset.description.0,Location of the artifact cooldown gui element,アーティファクトのクールダウン GUI 要素の場所,verified
artifacts.config.client.cooldownOverlayOffset.description.1,Distance from the hotbar measured in pixels,ホットバーからの距離 (ピクセル単位),verified
artifacts.config.client.cooldownOverlayOffset.description.2,Negative values place the element left of the hotbar,負の値を指定すると、要素がホットバーの左側に配置されます。,verified
artifacts.config.client.cooldownOverlayOffset.title,Cooldown Overlay Offset,クールダウンオーバーレイのオフセット,verified
artifacts.config.client.enableCooldownOverlay.description,Whether artifacts on cooldown should be displayed next to the hotbar,ホットバーの隣にアーティファクトを表示する際のクールダウン,verified
artifacts.config.client.enableCooldownOverlay.title,Enable Cooldown Overlay,クールダウンオーバーレイを有効にする,verified
artifacts.config.client.heliumFlamingoOverlayOffset.description,Controls the vertical position of the Helium Flamingo's charge meter,ヘリウムフラミンゴのチャージメーターの垂直位置を制御します,translated
artifacts.config.client.heliumFlamingoOverlayOffset.title,Helium Flamingo Overlay Offset,ヘリウムフラミンゴオーバーレイオフセット,translated
artifacts.config.client.showFirstPersonGloves.description,Whether models for gloves are shown in first person,手袋のモデルが一人称視点で表示されるかどうか,verified
artifacts.config.client.showFirstPersonGloves.title,Show First Person Gloves,一人称視点の手袋を表示,verified
artifacts.config.client.showTooltips.description,Whether artifacts have tooltips explaining their effects,アーティファクトにその効果を説明するツールチップがあるかどうか,verified
artifacts.config.client.showTooltips.title,Show Tooltips,アイテムのツールチップを表示する,verified
artifacts.config.client.title,Client,クライアント,verified
artifacts.config.client.useModdedMimicTextures.description,Whether mimics can use textures from Lootr or Quark,ミミックが Lootr または Quark のテクスチャを使用できるかどうか,verified
artifacts.config.client.useModdedMimicTextures.title,Use Modded Mimic Textures,ミミックに改造されたチェストのテクスチャを使用す,verified
artifacts.config.cooldown.title,Cooldown,クールダウン,translated
artifacts.config.enabled.title,Enabled,有効,translated
artifacts.config.general.archaeologyChance.description,The chance that an artifact generates in suspicious sand or gravel,怪しい砂または砂利に遺物が生成される確率,translated
artifacts.config.general.archaeologyChance.title,Archaeology Chance,考古学的確率,translated
artifacts.config.general.artifactRarity.description.0,Affects how common artifacts are in chests,チェスト内のアーティファクトの一般的な頻度に影響します,verified
artifacts.config.general.artifactRarity.description.1,"Values above 1 will make artifacts rarer, values between 0 and 1 will make artifacts more common",1 を超える値はアーティファクトのレア度を高めます,verified
artifacts.config.general.artifactRarity.description.2,"Doubling this value will make artifacts approximately twice as hard to find, and vice versa",0 から 1 までの値を指定すると、アーティファクトがより一般的になります,verified
artifacts.config.general.artifactRarity.description.3,"To prevent artifacts from appearing as chest loot, set this to 10000.",これを 10000 に設定すると、チェスト戦利品からすべてのアーティファクトが削除されます,verified
artifacts.config.general.artifactRarity.title,Artifact Rarity,アーティファクトのレア度,verified
artifacts.config.general.campsite.allowLightSources.description,Whether campsites can contain blocks that emit light,キャンプサイトが光を放つブロックを含めることができるかどうか,translated
artifacts.config.general.campsite.allowLightSources.title,Allow Light Sources,光源を許可,translated
artifacts.config.general.campsite.campsiteCount.description.0,How many times a campsite will attempt to generate per chunk,チャンクごとのキャンプサイト生成試行回数,verified
artifacts.config.general.campsite.campsiteCount.description.1,Set this to 0 to prevent campsites from generating,キャンプ場が生成しないようにするには、これを 0 に設定します。,verified
artifacts.config.general.campsite.campsiteCount.title,Campsite Count,キャンプサイト数,verified
artifacts.config.general.campsite.maxY.description,The maximum height campsites can spawn at,キャンプ場が出現できる最大の高さは次のとおりです。,verified
artifacts.config.general.campsite.maxY.title,Max Y,最大Yレベル,verified
artifacts.config.general.campsite.mimicChance.description,The probability that a campsite has a mimic instead of a chest,キャンプ場にミミックがいる確率,verified
artifacts.config.general.campsite.mimicChance.title,Mimic Chance,ミミックチャンス,verified
artifacts.config.general.campsite.minY.description,The minimum height campsites can spawn at,キャンプ場が出現できる最小の高さは次のとおりです。,verified
artifacts.config.general.campsite.minY.title,Min Y,最小 Y レベル,verified
artifacts.config.general.campsite.title,Campsite,キャンプ場,verified
artifacts.config.general.campsite.useModdedChests.description,Whether to use wooden chests from other mods when generating campsites,他の MOD のチェストがキャンプ場で生成されるかどうか,verified
artifacts.config.general.campsite.useModdedChests.title,Use Modded Chests,改造されたチェストを使用する,verified
artifacts.config.general.entityEquipmentChance.description,"The chance that a skeleton, zombie or piglin spawns with an artifact equipped",スケルトン、ゾンビ、またはピグリンが遺物を装備した状態でスポーンする確率,translated
artifacts.config.general.entityEquipmentChance.title,Entity Equipment Chance,エンティティ装備確率,translated
artifacts.config.general.slots.addFaceSlot.description.0,"When enabled, adds a separate slot for the Snorkel and Night Vision Goggles",有効にすると、スノーケルとナイトビジョンゴーグルの個別スロットが追加されます,translated
artifacts.config.general.slots.addFaceSlot.description.1,"(Trinkets only, currently not compatible with Curios or Accessories)",（トリンケットのみ、現在CuriosまたはAccessoriesとの互換性がありません）,translated
artifacts.config.general.slots.addFaceSlot.title,Add Face Slot,顔スロットを追加,translated
artifacts.config.general.slots.enableAccessoriesCompat.description.0,"Whether Artifacts should add slots to the Accessories menu,",Artifactsが[アクセサリー]メニューにスロットを追加するかどうか、,translated
artifacts.config.general.slots.enableAccessoriesCompat.description.1,and allow artifacts to be equipped in them,および遺物をそれらで装備できるようにします,translated
artifacts.config.general.slots.enableAccessoriesCompat.title,Enable Accessories Compat,アクセサリー互換性を有効にする,translated
artifacts.config.general.slots.enableCuriosCompat.description.0,"Whether Artifacts should add slots to the Curios menu,",Artifactsが[Curios]メニューにスロットを追加するかどうか、,translated
artifacts.config.general.slots.enableCuriosCompat.description.1,and allow artifacts to be equipped in them,および遺物をそれらで装備できるようにします,translated
artifacts.config.general.slots.enableCuriosCompat.title,Enable Curios Compat,Curios互換性を有効にする,translated
artifacts.config.general.slots.enableTrinketsCompat.description.0,"Whether Artifacts should add slots to the Trinket menu,",Artifactsがトリンケットメニューにスロットを追加するかどうか、,translated
artifacts.config.general.slots.enableTrinketsCompat.description.1,and allow artifacts to be equipped in them,および遺物をそれらで装備できるようにします,translated
artifacts.config.general.slots.enableTrinketsCompat.title,Enable Trinkets Compat,トリンケット互換性を有効にする,translated
artifacts.config.general.slots.removeSlotRestrictions.description.0,"When enabled, allows any artifact to be equipped in any slot",有効にすると、任意の遺物を任意のスロットで装備できます,translated
artifacts.config.general.slots.removeSlotRestrictions.description.1,"(Requires Curios or Trinkets, currently not compatible with Accessories)",（Curiosまたはトリンケットが必要、現在アクセサリーとの互換性がありません）,translated
artifacts.config.general.slots.removeSlotRestrictions.title,Remove Slot Restrictions,スロット制限を削除,translated
artifacts.config.general.slots.title,Slots,スロット,translated
artifacts.config.general.title,General,一般,translated
artifacts.config.generateAsLoot.description,Whether this item can be found in structures or drop from entities,このアイテムが構造体で見つかるか、エンティティからドロップするかどうか,translated
artifacts.config.generateAsLoot.title,Generate as loot,戦利品として生成,translated
artifacts.config.items.anglers_hat.luckOfTheSeaLevelBonus.description,The amount of extra levels of luck of the sea that are granted by the Angler's Hat,釣人の帽子により付与される海の幸運の追加レベルの量,translated
artifacts.config.items.anglers_hat.luckOfTheSeaLevelBonus.title,Luck of the Sea Level Bonus,海の幸運レベルボーナス,translated
artifacts.config.items.anglers_hat.lureLevelBonus.description,The amount of extra levels of lure that are granted by the Angler's Hat,釣人の帽子により付与される釣りの追加レベルの量,translated
artifacts.config.items.anglers_hat.lureLevelBonus.title,Lure Level Bonus,釣りレベルボーナス,translated
artifacts.config.items.antidote_vessel.enabled.description,Whether the Antidote Vessel reduces the duration of negative effects,解毒の瓶が負の効果の継続時間を軽減するかどうか,translated
artifacts.config.items.antidote_vessel.maxEffectDuration.description,The maximum duration in seconds negative mob effects can last when wearing the Antidote Vessel,解毒の瓶を着用している場合、負のモブ効果が継続できる最大継続時間（秒）,translated
artifacts.config.items.antidote_vessel.maxEffectDuration.title,Max Effect Duration,アーティファクト: 解毒剤の容器の最大悪影響持続時間,verified
artifacts.config.items.aqua_dashers.enabled.description,Whether the Aqua-Dashers allow the wearer to sprint on water,アクアダッシャーがプレイヤーが水を走るスプリントを許可するかどうか,translated
artifacts.config.items.bunny_hoppers.fallDamageMultiplier.description.0,How much the Bunny Hoppers reduce or increase fall damage,バニーホッパーが落下ダメージをどれだけ軽減または増加させるか,translated
artifacts.config.items.bunny_hoppers.fallDamageMultiplier.description.1,Values between -1 and 0 reduce fall damage,-1～0の値は落下ダメージを軽減します,translated
artifacts.config.items.bunny_hoppers.fallDamageMultiplier.description.2,Values above 0 increase fall damage,0より大きい値は落下ダメージを増加させます,translated
artifacts.config.items.bunny_hoppers.fallDamageMultiplier.title,Fall Damage Multiplier,落下ダメージ乗数,translated
artifacts.config.items.bunny_hoppers.jumpStrengthBonus.description,The amount of extra jump strength the Bunny Hoppers apply to players,バニーホッパーがプレイヤーに与える追加のジャンプ強度の量,translated
artifacts.config.items.bunny_hoppers.jumpStrengthBonus.title,Jump Strength Bonus,ジャンプ強度ボーナス,translated
artifacts.config.items.bunny_hoppers.modifyHurtSounds.description,Whether the Bunny Hoppers change the player's hurt sounds,バニーホッパーがプレイヤーのダメージ音を変更するかどうか,translated
artifacts.config.items.bunny_hoppers.modifyHurtSounds.title,Modify Hurt Sounds,プレイヤーのダメージ音を変更する,verified
artifacts.config.items.bunny_hoppers.safeFallDistanceBonus.description,The amount of extra safe fall distance in blocks that is granted by the Bunny Hoppers,バニーホッパーにより与えられるブロック単位の追加の安全落下距離の量,translated
artifacts.config.items.bunny_hoppers.safeFallDistanceBonus.title,Safe Fall Distance Bonus,安全落下距離ボーナス,translated
artifacts.config.items.charm_of_shrinking.scaleModifier.description.0,How much the Charm of Shrinking decreases or increases the player's Scale,縮小のお守りがプレイヤーのスケールをどれだけ減少または増加させるか,translated
artifacts.config.items.charm_of_shrinking.scaleModifier.description.1,Values between -1 and 0 reduce the player's scale,-1～0の値はプレイヤーのスケールを減少させます,translated
artifacts.config.items.charm_of_shrinking.scaleModifier.description.2,Values above 0 increase the player's scale,0より大きい値はプレイヤーのスケールを増加させます,translated
artifacts.config.items.charm_of_shrinking.scaleModifier.title,Scale Modifier,スケール修飾子,translated
artifacts.config.items.charm_of_sinking.enabled.description,Whether the Charm of Sinking removes the wearer's collision with water,沈降のお守りが着用者の水との衝突を除去するかどうか,translated
artifacts.config.items.charm_of_sinking.oxygenBonus.description,How much longer players wearing the Charm of Sinking can stay underwater,沈降のお守りを着用しているプレイヤーが水中に留まることができる期間,translated
artifacts.config.items.charm_of_sinking.oxygenBonus.title,Oxygen Bonus,酸素ボーナス,translated
artifacts.config.items.charm_of_sinking.underwaterFallDamage.description,Whether it is possible to take fall damage underwater when wearing the Charm of Sinking,沈降のお守りを着用しているときに水中で落下ダメージを受けることが可能かどうか,translated
artifacts.config.items.charm_of_sinking.underwaterFallDamage.title,Underwater Fall Damage,水中落下ダメージ,translated
artifacts.config.items.chorus_totem.consumeOnUse.description,Whether the Chorus Totem is consumed after activating,コーラストーテムが起動後に消費されるかどうか,translated
artifacts.config.items.chorus_totem.consumeOnUse.title,Consume on Use,使用時に消費,translated
artifacts.config.items.chorus_totem.cooldown.description,The duration in seconds the Chorus Totem goes on cooldown for after activating,コーラストーテムが起動後にクールダウンする期間（秒単位）,translated
artifacts.config.items.chorus_totem.healthRestored.description,The amount of health points that are restored after the Chorus Totem activates,コーラストーテムが起動した後に回復するヘルスポイントの量,translated
artifacts.config.items.chorus_totem.healthRestored.title,Health Restored,回復するヘルス,translated
artifacts.config.items.chorus_totem.teleportationChance.description,The probability that the Chorus Totem activates when a player dies,プレイヤーが死ぬときにコーラストーテムが起動する確率,translated
artifacts.config.items.chorus_totem.teleportationChance.title,Teleportation Chance,テレポート確率,translated
artifacts.config.items.cloud_in_a_bottle.enabled.description,Whether the Cloud in a Bottle allows the wearer to double jump,クラウドインアボトルが着用者にダブルジャンプを許可するかどうか,translated
artifacts.config.items.cloud_in_a_bottle.fallDamageMultiplier.description,How much fall damage is dealt when double jumping with the Cloud in a Bottle,クラウドインアボトルでダブルジャンプするときに与えられる落下ダメージの量,translated
artifacts.config.items.cloud_in_a_bottle.fallDamageMultiplier.title,Fall Damage Multiplier,落下ダメージ乗数,translated
artifacts.config.items.cloud_in_a_bottle.safeFallDistanceBonus.description,The amount of extra safe fall distance in blocks that is granted by the Cloud in a Bottle,クラウドインアボトルにより与えられるブロック単位の追加の安全落下距離の量,translated
artifacts.config.items.cloud_in_a_bottle.safeFallDistanceBonus.title,Safe Fall Distance Bonus,安全落下距離ボーナス,translated
artifacts.config.items.cloud_in_a_bottle.sprintJumpHorizontalVelocity.description,The amount of extra horizontal velocity that is applied to players that double jump while sprinting using the Cloud in a Bottle,クラウドインアボトルを使用してスプリント中にダブルジャンプするプレイヤーに適用される追加の水平速度の量,translated
artifacts.config.items.cloud_in_a_bottle.sprintJumpHorizontalVelocity.title,Sprint Jump Horizontal Velocity,アーティファクト: 雲入りの瓶のスプリント ジャンプの水平速度,verified
artifacts.config.items.cloud_in_a_bottle.sprintJumpVerticalVelocity.description,The amount of extra vertical velocity that is applied to players that double jump while sprinting using the Cloud in a Bottle,クラウドインアボトルを使用してスプリント中にダブルジャンプするプレイヤーに適用される追加の垂直速度の量,translated
artifacts.config.items.cloud_in_a_bottle.sprintJumpVerticalVelocity.title,Sprint Jump Vertical Velocity,アーティファクト: 雲入りの瓶のスプリント ジャンプの垂直速度,verified
artifacts.config.items.cowboy_hat.mountSpeedBonus.description,How much the Cowboy Hat increases the speed of ridden mounts,カウボーイハットが乗騎の速度をどれだけ増加させるか,translated
artifacts.config.items.cowboy_hat.mountSpeedBonus.title,Mount Speed Bonus,乗騎速度ボーナス,translated
artifacts.config.items.cross_necklace.bonusInvincibilityTicks.description,The amount of extra ticks the player stays invincible for after taking damage while wearing the Cross Necklace,クロスネックレスを着用している場合、ダメージを受けた後にプレイヤーが無敵でいるティックの追加数,translated
artifacts.config.items.cross_necklace.bonusInvincibilityTicks.title,Bonus Invincibility Ticks,アーティファクト: 十字架のネックレスの無敵時間,verified
artifacts.config.items.cross_necklace.cooldown.description,The duration in seconds the Cross Necklace goes on cooldown for after activating,クロスネックレスが起動後にクールダウンする期間（秒単位）,translated
artifacts.config.items.crystal_heart.healthBonus.description,The amount of extra health points that are granted by the Crystal Heart,クリスタルハートにより与えられるヘルスポイントの追加量,translated
artifacts.config.items.crystal_heart.healthBonus.title,Health Bonus,アーティファクト: クリスタルハートの体力ボーナス,verified
artifacts.config.items.digging_claws.blockBreakSpeedBonus.description,How much the Digging Claws increase the wearer's mining speed,掘削爪がプレイヤーのマイニング速度をどれだけ増加させるか,translated
artifacts.config.items.digging_claws.blockBreakSpeedBonus.title,Block Break Speed Bonus,アーティファクト: 掘削爪掘削速度の値,verified
artifacts.config.items.digging_claws.toolTier.description,The tool tier that the Digging Claws increase the wearer's mining level to,掘削爪がプレイヤーのマイニングレベルを増加させるツールティア,translated
artifacts.config.items.digging_claws.toolTier.title,Tool Tier,アーティファクト: 掘削爪ツール層,verified
artifacts.config.items.eternal_steak.cooldown.description,The duration in seconds the Eternal Steak goes on cooldown for after being eaten,エターナルステーキが食べられた後にクールダウンする期間（秒単位）,translated
artifacts.config.items.eternal_steak.enabled.description,Whether the Eternal Steak can be eaten,エターナルステーキが食べられるかどうか,translated
artifacts.config.items.everlasting_beef.cooldown.description,The duration in seconds the Everlasting Beef goes on cooldown for after being eaten,永遠の牛肉が食べられた後にクールダウンする期間（秒単位）,translated
artifacts.config.items.everlasting_beef.dropRate.description,The probability that Everlasting Beef drops when a cow or mooshroom is killed by a player,プレイヤーが牛またはムーシュルームを殺すときに永遠の牛肉がドロップする確率,translated
artifacts.config.items.everlasting_beef.dropRate.title,Drop Rate,永遠なる牛肉チャンス,verified
artifacts.config.items.everlasting_beef.enabled.description,Whether the Everlasting Beef can be eaten,永遠の牛肉が食べられるかどうか,translated
artifacts.config.items.feral_claws.attackSpeedBonus.description,How much the Feral Claws increase the wearer's attack speed,野生爪がプレイヤーの攻撃速度をどれだけ増加させるか,translated
artifacts.config.items.feral_claws.attackSpeedBonus.title,Attack Speed Bonus,アーティファクト: フェラルクローの攻撃速度ボーナス,verified
artifacts.config.items.fire_gauntlet.fireDuration.description,How long an entity is set on fire for after being attacked by an entity wearing the Fire Gauntlet,ファイアガントレットを着用しているエンティティに攻撃された後、エンティティが火に包まれている時間,translated
artifacts.config.items.fire_gauntlet.fireDuration.title,Fire Duration,アーティファクト: 炎のガントレットの発射持続時間,verified
artifacts.config.items.flame_pendant.cooldown.description,The duration in seconds the Flame Pendant goes on cooldown for after setting an entity on fire,フレームペンダントがエンティティに火をつけた後にクールダウンする期間（秒単位）,translated
artifacts.config.items.flame_pendant.fireDuration.description,How long an attacking entity is set on fire for when the Flame Pendant activates,フレームペンダントが起動するときに攻撃エンティティが火に包まれている時間,translated
artifacts.config.items.flame_pendant.fireDuration.title,Fire Duration,アーティファクト: 炎のペンダントの発火時間,verified
artifacts.config.items.flame_pendant.grantFireResistance.description,Whether the Flame Pendant grants Fire Resistance after igniting an entity,フレームペンダントがエンティティに火をつけた後に火炎耐性を与えるかどうか,translated
artifacts.config.items.flame_pendant.grantFireResistance.title,Grant Fire Resistance,アーティファクト: 炎のペンダントは耐火性を付与する,verified
artifacts.config.items.flame_pendant.strikeChance.description,The probability that the Flame Pendant lights an attacker on fire,フレームペンダントが攻撃者に火をつける確率,translated
artifacts.config.items.flame_pendant.strikeChance.title,Strike Chance,アーティファクト: 炎のペンダントのストライクチャンス,verified
artifacts.config.items.flippers.swimSpeedBonus.description,How much the Flippers increase the wearer's swim speed,フリッパーがプレイヤーの水泳速度をどれだけ増加させるか,translated
artifacts.config.items.flippers.swimSpeedBonus.title,Swim Speed Bonus,アーティファクト: 足ひれの水泳速度ボーナス,verified
artifacts.config.items.golden_hook.entityExperienceBonus.description,The amount of extra experience dropped by entities that are killed by players wearing the Golden Hook,ゴールデンフックを着用しているプレイヤーに殺されたエンティティがドロップする追加経験の量,translated
artifacts.config.items.golden_hook.entityExperienceBonus.title,Entity Experience Bonus,アーティファクト: 金のフックの経験値ボーナス,verified
artifacts.config.items.helium_flamingo.cooldown.description,The duration in seconds the Helium Flamingo goes on cooldown for when stopping flight,ヘリウムフラミンゴが飛行を停止するときにクールダウンする期間（秒単位）,translated
artifacts.config.items.helium_flamingo.flightDuration.description,The amount of time in seconds a player can fly with the Helium Flamingo before needing to recharge,プレイヤーがヘリウムフラミンゴで飛行してから再充電が必要になるまでの秒数,translated
