key,source_text,target_text,status
artifacts.config.items.helium_flamingo.flightDuration.title,Flight Duration,アーティファクト: ヘリウムフラミンゴの最大飛行時間,verified
artifacts.config.items.helium_flamingo.rechargeDuration.description,The amount of time in seconds it takes for the Helium Flamingo to recharge,ヘリウムフラミンゴが再充電に要する秒数,translated
artifacts.config.items.helium_flamingo.rechargeDuration.title,Recharge Duration,アーティファクト: ヘリウムフラミンゴのリチャージ時間,verified
artifacts.config.items.kitty_slippers.modifyHurtSounds.description,Whether the Kitty Slippers change the player's hurt sounds,キティスリッパーがプレイヤーのダメージ音を変更するかどうか,translated
artifacts.config.items.kitty_slippers.modifyHurtSounds.title,Modify Hurt Sounds,プレイヤーのダメージ音を変更する,verified
artifacts.config.items.kitty_slippers.repelCreepers.description,Whether the Kitty Slippers scare nearby creepers,キティスリッパーが近くのクリーパーを怖がらせるかどうか,translated
artifacts.config.items.kitty_slippers.repelCreepers.title,Repel Creepers,クリーパーを撃退,translated
artifacts.config.items.kitty_slippers.repelPhantoms.description,Whether the Kitty Slippers hiss at nearby phantoms,キティスリッパーが近くのファントムにシューッと音を立てるかどうか,translated
artifacts.config.items.kitty_slippers.repelPhantoms.title,Repel Phantoms,ファントムを撃退,translated
artifacts.config.items.lucky_scarf.fortuneLevelBonus.description,The amount of extra levels of fortune that are granted by the Lucky Scarf,ラッキースカーフにより与えられる幸運の追加レベルの量,translated
artifacts.config.items.lucky_scarf.fortuneLevelBonus.title,Fortune Level Bonus,アーティファクト: ラッキースカーフの幸運ボーナス,verified
artifacts.config.items.night_vision_goggles.strength.description,The strength of the night vision effect applied by the Night Vision Goggles,ナイトビジョンゴーグルにより適用される夜間視認効果の強度,translated
artifacts.config.items.night_vision_goggles.strength.title,Strength,強度,translated
artifacts.config.items.novelty_drinking_hat.drinkingSpeedBonus.description,How much the Novelty Drinking Hat increases the wearer's drinking speed,ノベルティ飲酒帽がプレイヤーの飲酒速度をどれだけ増加させるか,translated
artifacts.config.items.novelty_drinking_hat.drinkingSpeedBonus.title,Drinking Speed Bonus,飲酒速度ボーナス,translated
artifacts.config.items.novelty_drinking_hat.eatingSpeedBonus.description,How much the Novelty Drinking Hat increases the wearer's eating speed,ノベルティ飲酒帽がプレイヤーの食べる速度をどれだけ増加させるか,translated
artifacts.config.items.novelty_drinking_hat.eatingSpeedBonus.title,Eating Speed Bonus,食べる速度ボーナス,translated
artifacts.config.items.obsidian_skull.cooldown.description,The amount of time in seconds the Obsidian Skull goes on cooldown for after taking fire damage,黒曜石の頭蓋骨が火のダメージを受けた後にクールダウンする時間（秒単位）,translated
artifacts.config.items.obsidian_skull.fireResistanceDuration.description,The duration of the fire resistance effect that is applied when taking fire damage while wearing the Obsidian Skull,黒曜石の頭蓋骨を着用しているときに火のダメージを受けるときに適用される火炎耐性効果の期間,translated
artifacts.config.items.obsidian_skull.fireResistanceDuration.title,Fire Resistance Duration,アーティファクト: 黒曜石の頭蓋骨の耐火持続時間,verified
artifacts.config.items.onion_ring.hasteDurationPerFoodPoint.description,The duration of haste that is applied per food point eaten while wearing the Onion Ring,オニオンリングを着用している場合、食べた食料ポイントごとに適用される速度効果の期間,translated
artifacts.config.items.onion_ring.hasteDurationPerFoodPoint.title,Haste Duration per Food Point,食料ポイントあたりの速度期間,translated
artifacts.config.items.onion_ring.hasteLevel.description,The level of the haste effect that is applied by the Onion Ring,オニオンリングにより適用される速度効果のレベル,translated
artifacts.config.items.onion_ring.hasteLevel.title,Haste Level,速度レベル,translated
artifacts.config.items.panic_necklace.cooldown.description,The duration in seconds the Panic Necklace goes on cooldown for after taking damage,パニックネックレスがダメージを受けた後にクールダウンする期間（秒単位）,translated
artifacts.config.items.panic_necklace.speedDuration.description,The duration in seconds of the speed effect that is applied when taking damage while wearing the Panic Necklace,パニックネックレスを着用しているときにダメージを受けるときに適用される速度効果の期間（秒単位）,translated
artifacts.config.items.panic_necklace.speedDuration.title,Speed Duration,アーティファクト: パニックのネックレスの速度持続時間,verified
artifacts.config.items.panic_necklace.speedLevel.description,The level of the speed effect that is applied by the Panic Necklace,パニックネックレスにより適用される速度効果のレベル,translated
artifacts.config.items.panic_necklace.speedLevel.title,Speed Level,アーティファクト: パニックネックレスの速度レベル,verified
artifacts.config.items.pickaxe_heater.enabled.description,Whether the Pickaxe Heater smelts mined ores,ピッケルヒーターが採掘された鉱石を製錬するかどうか,translated
artifacts.config.items.plastic_drinking_hat.drinkingSpeedBonus.description,How much the Plastic Drinking Hat increases the wearer's drinking speed,プラスチック飲酒帽がプレイヤーの飲酒速度をどれだけ増加させるか,translated
artifacts.config.items.plastic_drinking_hat.drinkingSpeedBonus.title,Drinking Speed Bonus,飲酒速度ボーナス,translated
artifacts.config.items.plastic_drinking_hat.eatingSpeedBonus.description,How much the Plastic Drinking Hat increases the wearer's eating speed,プラスチック飲酒帽がプレイヤーの食べる速度をどれだけ増加させるか,translated
artifacts.config.items.plastic_drinking_hat.eatingSpeedBonus.title,Eating Speed Bonus,食べる速度ボーナス,translated
artifacts.config.items.pocket_piston.attackKnockbackBonus.description,The amount of extra knockback that is granted by the Pocket Piston,ポケットピストンにより与えられるノックバックの追加量,translated
artifacts.config.items.pocket_piston.attackKnockbackBonus.title,Attack Knockback Bonus,アーティファクト: ポケットピストンのノックバック強度,verified
artifacts.config.items.power_glove.attackDamageBonus.description,The amount of extra damage that is dealt by melee attacks from players wearing the Power Glove,パワーグローブを着用しているプレイヤーの近接攻撃により与えられるダメージの追加量,translated
artifacts.config.items.power_glove.attackDamageBonus.title,Attack Damage Bonus,アーティファクト: パワーグローブの攻撃ダメージボーナス,verified
artifacts.config.items.rooted_boots.enabled.description,Whether the Rooted Boots replenish hunger when standing on grass,ルーテッドブーツが草の上に立っているときにハンガーを補充するかどうか,translated
artifacts.config.items.rooted_boots.growPlantsAfterEating.description,Whether the Rooted Boots apply a bone meal effect after eating food,ルーテッドブーツが食べた後にボーンミール効果を適用するかどうか,translated
artifacts.config.items.rooted_boots.growPlantsAfterEating.title,Grow Plants After Eating,食後に植物を成長させる,translated
artifacts.config.items.rooted_boots.hungerReplenishingDuration.description,The amount of time in seconds it takes to replenish a single point of hunger while wearing the Rooted Boots,ルーテッドブーツを着用しているときに1ポイントのハンガーを補充するのに要する秒数,translated
artifacts.config.items.rooted_boots.hungerReplenishingDuration.title,Hunger Replenishing Duration,ハンガー補充期間,translated
artifacts.config.items.running_shoes.sprintingSpeedBonus.description,How much the Running Shoes increase the wearer's sprinting speed,ランニングシューズがプレイヤーのスプリント速度をどれだけ増加させるか,translated
artifacts.config.items.running_shoes.sprintingSpeedBonus.title,Sprinting Speed Bonus,アーティファクト: ランニングシューズのスピードボーナス,verified
artifacts.config.items.running_shoes.sprintingStepHeightBonus.description,How much the Running Shoes increase the wearer's step height while sprinting,ランニングシューズがスプリント中のプレイヤーのステップ高さをどれだけ増加させるか,translated
artifacts.config.items.running_shoes.sprintingStepHeightBonus.title,Sprinting Step Height Bonus,スプリントステップ高さボーナス,translated
artifacts.config.items.scarf_of_invisibility.enabled.description,Whether the Scarf of Invisibility makes players invisible,不可視のスカーフがプレイヤーを不可視にするかどうか,translated
artifacts.config.items.scarf_of_invisibility.hideWhenInvisible.description,Whether the Scarf of Invisibility is hidden when the wearer is invisible,不可視のスカーフが着用者が不可視のときに隠れるかどうか,translated
artifacts.config.items.scarf_of_invisibility.hideWhenInvisible.title,Hide When Invisible,不可視のときに隠す,translated
artifacts.config.items.shock_pendant.cancelLightningDamage.description,Whether the Shock Pendant cancels damage from lightning,ショックペンダントが落雷によるダメージをキャンセルするかどうか,translated
artifacts.config.items.shock_pendant.cancelLightningDamage.title,Cancel Lightning Damage,アーティファクト:衝撃のペンダントは雷ダメージをキャンセルする,verified
artifacts.config.items.shock_pendant.cooldown.description,The amount of time in seconds the Shock Pendant goes on cooldown for after striking an attacker with lightning,ショックペンダントが攻撃者に落雷を与えた後にクールダウンする時間（秒単位）,translated
artifacts.config.items.shock_pendant.strikeChance.description,The probability that the Shock Pendant strikes an attacking entity with lightning,ショックペンダントが攻撃エンティティに落雷を与える確率,translated
artifacts.config.items.shock_pendant.strikeChance.title,Strike Chance,アーティファクト: 衝撃のペンダントのストライクチャンス,verified
artifacts.config.items.snorkel.isInfinite.description,Whether the Snorkel's water breathing effect depletes when underwater,シュノーケルの水呼吸効果が水中で減少するかどうか,translated
artifacts.config.items.snorkel.isInfinite.title,Is Infinite,無限,translated
artifacts.config.items.snorkel.waterBreathingDuration.description,The duration of the water breathing effect that is applied by the Snorkel,シュノーケルにより適用される水呼吸効果の期間,translated
artifacts.config.items.snorkel.waterBreathingDuration.title,Water Breathing Duration,水呼吸期間,translated
artifacts.config.items.snowshoes.allowWalkingOnPowderedSnow.description,Whether the Snowshoes allow the wearer to walk on powdered snow,スノーシューズが着用者にパウダースノーを歩かせるかどうか,translated
artifacts.config.items.snowshoes.allowWalkingOnPowderedSnow.title,Allow Walking on Powdered Snow,パウダースノーを歩くことを許可,translated
artifacts.config.items.snowshoes.movementSpeedOnSnowBonus.description,How much the Snowshoes increase the wearer's movement speed on snow blocks,スノーシューズが雪ブロック上でのプレイヤーの移動速度をどれだけ増加させるか,translated
artifacts.config.items.snowshoes.movementSpeedOnSnowBonus.title,Movement Speed on Snow Bonus,雪上での移動速度ボーナス,translated
artifacts.config.items.steadfast_spikes.knockbackResistance.description,How much knockback resistance is granted by the Steadfast Spikes,ステディファストスパイクスにより与えられるノックバック耐性の量,translated
artifacts.config.items.steadfast_spikes.knockbackResistance.title,Knockback Resistance,ノックバック耐性,translated
artifacts.config.items.steadfast_spikes.slipperinessReduction.description,How much the Steadfast Spikes reduce the slipperiness of ice,ステディファストスパイクスが氷の滑りやすさをどれだけ軽減するか,translated
artifacts.config.items.steadfast_spikes.slipperinessReduction.title,Slipperiness Reduction,滑りやすさ軽減,translated
artifacts.config.items.strider_shoes.cancelHotFloorDamage.description,Whether the Strider Shoes make the wearer immune to hot floor damage,ストライダーシューズが着用者をホットフロアダメージから保護するかどうか,translated
artifacts.config.items.strider_shoes.cancelHotFloorDamage.title,Cancel Hot Floor Damage,ホットフロアダメージをキャンセル,translated
artifacts.config.items.strider_shoes.enabled.description,Whether the Strider Shoes allow sneaking on lava,ストライダーシューズが溶岩の上でしゃがむことを許可するかどうか,translated
artifacts.config.items.superstitious_hat.lootingLevelBonus.description,The amount of extra levels of Looting that are granted by the Superstitious Hat,迷信的な帽子により与えられる幸運の追加レベルの量,translated
artifacts.config.items.superstitious_hat.lootingLevelBonus.title,Looting Level Bonus,アーティファクト: 迷信深い帽子の略奪レベルボーナス,verified
artifacts.config.items.thorn_pendant.cooldown.description,The duration in seconds the Thorn Pendant goes on cooldown for after activating,トゥーンペンダントが起動後にクールダウンする期間（秒単位）,translated
artifacts.config.items.thorn_pendant.maxDamage.description,The minimum amount of damage that is dealt when the Thorn Pendant activates,トゥーンペンダントが起動するときに与えられるダメージの最小量,translated
artifacts.config.items.thorn_pendant.maxDamage.title,Max Damage,アーティファクト: とげのペンダントの最大ダメージ,verified
artifacts.config.items.thorn_pendant.minDamage.description,The maximum amount of damage that is dealt when the Thorn Pendant activates,トゥーンペンダントが起動するときに与えられるダメージの最大量,translated
artifacts.config.items.thorn_pendant.minDamage.title,Min Damage,アーティファクト: とげのペンダントの最小ダメージ,verified
artifacts.config.items.thorn_pendant.strikeChance.description,The probability that the Thorn Pendant damages an attacking entity,トゥーンペンダントが攻撃エンティティにダメージを与える確率,translated
artifacts.config.items.thorn_pendant.strikeChance.title,Strike Chance,アーティファクト: とげのペンダントのストライクチャンス,verified
artifacts.config.items.title,Items,アイテム,translated
artifacts.config.items.umbrella.isGlider.description,Whether the Umbrella slows the player's falling speed when held,傘がプレイヤーの落下速度を遅くするかどうか（保有時）,translated
artifacts.config.items.umbrella.isGlider.title,Is Glider,アーティファクト: 傘が落ちるのが遅くなる,verified
artifacts.config.items.umbrella.isShield.description,Whether the Umbrella can be used as a shield,傘を盾として使用できるかどうか,translated
artifacts.config.items.umbrella.isShield.title,Is Shield,アーティファクト: 傘で遮られる可能性がある,verified
artifacts.config.items.universal_attractor.magnetismLevel.description,The level of the magnetism effect that is applied by the Universal Attractor,ユニバーサルアトラクターにより適用される磁力効果のレベル,translated
artifacts.config.items.universal_attractor.magnetismLevel.title,Magnetism Level,磁力レベル,translated
artifacts.config.items.vampiric_glove.absorptionChance.description,The probability that damage is absorbed when attacking an entity with the Vampiric Gloves,ヴァンパイリックグローブでエンティティを攻撃するときにダメージが吸収される確率,translated
artifacts.config.items.vampiric_glove.absorptionChance.title,Absorption Chance,吸収確率,translated
artifacts.config.items.vampiric_glove.absorptionRatio.description,The proportion of melee damage dealt that is absorbed by the Vampiric Gloves,ヴァンパイリックグローブにより吸収される近接ダメージの割合,translated
artifacts.config.items.vampiric_glove.absorptionRatio.title,Absorption Ratio,アーティファクト: 吸血鬼のグローブの体力吸収率,verified
artifacts.config.items.vampiric_glove.maxHealingPerHit.description,The maximum amount of healing that can be absorbed in a single hit when attacking an entity while wearing the Vampiric Glove,ヴァンパイリックグローブを着用している場合、エンティティを攻撃するときに1ヒットで吸収できる最大回復量,translated
artifacts.config.items.vampiric_glove.maxHealingPerHit.title,Max Healing per Hit,アーティファクト: 吸血鬼のグローブのヒットあたりの最大回復量,verified
artifacts.config.items.villager_hat.reputationBonus.description,The amount of extra reputation that is granted by the Villager Hat when trading with villagers,村人の帽子が村人との取引時に与える追加レピュテーションの量,translated
artifacts.config.items.villager_hat.reputationBonus.title,Reputation Bonus,アーティファクト: 村人の帽子の評判ボーナス,verified
artifacts.config.items.warp_drive.cooldown.description,The duration Ender Pearls go on cooldown for after being thrown using the Warp Drive,ワープドライブを使用してエンダーパールを投げた後にクールダウンする期間,translated
artifacts.config.items.warp_drive.enabled.description,Whether the Warp Drive causes ender pearls to not be consumed,ワープドライブがエンダーパールを消費しないようにするかどうか,translated
artifacts.config.items.warp_drive.hungerCost.description,How many hunger points it costs to throw an Ender Pearl using the Warp Drive,ワープドライブを使用してエンダーパールを投げるのにかかるハンガーポイント数,translated
artifacts.config.items.warp_drive.hungerCost.title,Hunger Cost,ハンガーコスト,translated
artifacts.config.items.warp_drive.nullifyEnderPearlDamage.description,Whether the Warp Drive causes Ender Pearls not to deal any damage,ワープドライブがエンダーパールがダメージを与えないようにするかどうか,translated
artifacts.config.items.warp_drive.nullifyEnderPearlDamage.title,Nullify Ender Pearl Damage,エンダーパールダメージを無効化,translated
artifacts.config.items.whoopee_cushion.fartChance.description,The probability that a fart sound plays when sneaking or double jumping while wearing the Whoopee Cushion,ウーピークッションを着用しているときにしゃがむまたはダブルジャンプするときにオナラ音が鳴る確率,translated
artifacts.config.items.whoopee_cushion.fartChance.title,Fart Chance,アーティファクト: ブーブークッションのおならチャンス,verified
artifacts.config.items.withered_bracelet.cooldown.description,The duration the Withered Bracelet goes on cooldown for after inflicting wither on an entity,ウィザーブレスレットがエンティティにウィザー効果を与えた後にクールダウンする期間,translated
artifacts.config.items.withered_bracelet.witherChance.description,The probability that the Withered Bracelet inflicts a wither effect,ウィザーブレスレットがウィザー効果を与える確率,translated
artifacts.config.items.withered_bracelet.witherChance.title,Wither Chance,ウィザー確率,translated
artifacts.config.items.withered_bracelet.witherDuration.description,The duration of the wither effect applied by the Withered Bracelet,ウィザーブレスレットにより適用されるウィザー効果の期間,translated
artifacts.config.items.withered_bracelet.witherDuration.title,Wither Duration,ウィザー期間,translated
artifacts.config.items.withered_bracelet.witherLevel.description,The level of the wither effect that is inflicted by the Withered Bracelet,ウィザーブレスレットにより与えられるウィザー効果のレベル,translated
artifacts.config.items.withered_bracelet.witherLevel.title,Wither Level,ウィザーレベル,translated
artifacts.config.title,Artifacts Config,アーティファクトのコンフィグ,verified
artifacts.creative_tab,Artifacts,アーティファクト,verified
artifacts.key.charm_of_shrinking.toggle,Toggle Charm of Shrinking,縮小のお守りを切り替え,translated
artifacts.key.charm_of_sinking.toggle,Toggle Charm of Sinking,沈降のお守りを切り替え,translated
artifacts.key.helium_flamingo.activate,Activate Helium Flamingo,ヘリウムフラミンゴをアクティブ化,verified
artifacts.key.night_vision_goggles.toggle,Toggle Night Vision Goggles,暗視ゴーグルの切り替え,verified
artifacts.key.scarf_of_invisibility.toggle,Toggle Scarf of Invisibility,不可視のスカーフを切り替え,translated
artifacts.key.universal_attractor.toggle,Toggle Universal Attractor,ユニバーサルアトラクターの切り替え,verified
artifacts.key_category,Artifacts,アーティファクト,verified
artifacts.subtitles.entity.mimic.close,Mimic closes,ミミックが閉じる,verified
artifacts.subtitles.entity.mimic.death,Mimic dies,ミミックが死ぬ,verified
artifacts.subtitles.entity.mimic.hurt,Mimic hurts,ミミックがダメージを受ける,verified
artifacts.subtitles.entity.mimic.open,Mimic hops,ミミックが開く,verified
artifacts.subtitles.item.whoopee_cushion.fart,Fart,おなら,verified
artifacts.tooltip.ability.attack_effects.wither.chance,Melee attacks have a chance to inflict a wither effect,近接攻撃にウィザー効果を与える可能性があります,translated
artifacts.tooltip.ability.attack_effects.wither.constant,Causes the wearer's melee attacks to inflict a wither effect,着用者の近接攻撃がウィザー効果を与えます,translated
artifacts.tooltip.ability.attribute_modifiers.generic.attack_burning_duration,Causes the wearer's melee attacks to deal fire damage,着用者の近接攻撃に火ダメージを付与する,verified
artifacts.tooltip.ability.attribute_modifiers.generic.attack_damage,Increases damage dealt by the wearer,着用者が与えるダメージが増加する,verified
artifacts.tooltip.ability.attribute_modifiers.generic.attack_knockback,Increases knockback dealt by the wearer,着用者が与えるノックバック量が増加する,verified
artifacts.tooltip.ability.attribute_modifiers.generic.attack_speed,Increases the wearer's attack speed,着用者の攻撃速度を上昇させる,verified
artifacts.tooltip.ability.attribute_modifiers.generic.drinking_speed,Decreases the time it takes to drink items,アイテムを飲むまでの時間が短縮される,verified
artifacts.tooltip.ability.attribute_modifiers.generic.eating_speed,Decreases the time it takes to eat items,アイテムを食べるまでの時間が短縮される,verified
artifacts.tooltip.ability.attribute_modifiers.generic.fall_damage_multiplier,Reduces fall damage taken by the wearer,着用者が受ける落下ダメージを軽減します,translated
artifacts.tooltip.ability.attribute_modifiers.generic.flatulence,Increases the wearer's flatulence,着用者の鼓腸を増加させる,verified
artifacts.tooltip.ability.attribute_modifiers.generic.invincibility_ticks,Increases the length of invincibility after taking damage,ダメージを受けた後の無敵時間が延長される,verified
artifacts.tooltip.ability.attribute_modifiers.generic.jump_strength,Increases the wearer's jump height,着用者のジャンプの高さを増加させる,verified
artifacts.tooltip.ability.attribute_modifiers.generic.knockback_resistance,Grants immunity to knockback,ノックバックに対する耐性を与える,verified
artifacts.tooltip.ability.attribute_modifiers.generic.max_health,Increases the wearer's maximum health,着用者の最大体力を増加させる,verified
artifacts.tooltip.ability.attribute_modifiers.generic.mount_speed,Increases the speed of ridden mounts,乗騎の速度を増加させます,translated
artifacts.tooltip.ability.attribute_modifiers.generic.movement_speed_on_snow,Increases the wearer's walking speed on snow,着用者の雪上での移動速度を増加させます,translated
artifacts.tooltip.ability.attribute_modifiers.generic.oxygen_bonus,Increases the time the wearer can stay underwater,着用者が水中にいられる時間を増加させます,translated
artifacts.tooltip.ability.attribute_modifiers.generic.safe_fall_distance,Increases the wearer's maximum safe fall distance,着用者の最大安全落下距離を増加させます,translated
artifacts.tooltip.ability.attribute_modifiers.generic.scale,Shrinks the wearer,着用者を縮小させます,translated
