key,source_text,target_text,status
artifacts.tooltip.ability.attribute_modifiers.generic.slip_resistance,Makes ice less slippery to walk on,氷の上を歩くのが滑りにくくなります,translated
artifacts.tooltip.ability.attribute_modifiers.generic.sprinting_speed,Increases the wearer's movement speed while sprinting,ダッシュ中の着用者の移動速度が増加する,verified
artifacts.tooltip.ability.attribute_modifiers.generic.sprinting_step_height,Increases the wearer's step height while sprinting,ダッシュの着用者の歩幅を増加させる,verified
artifacts.tooltip.ability.attribute_modifiers.generic.swim_speed,Improves agility in water,水中での敏捷性を向上させる,verified
artifacts.tooltip.ability.attribute_modifiers.player.block_break_speed,Increases the wearer's mining speed,着用者の採掘速度を増加する,verified
artifacts.tooltip.ability.attribute_modifiers.player.entity_experience,Increases experience dropped by creatures,敵がが落とす経験値が増加する,verified
artifacts.tooltip.ability.attribute_modifiers.player.villager_reputation,Decreases the trading prices of villagers,村人の取引価格を下げる,verified
artifacts.tooltip.ability.auto_smelt,Automatically smelts mined ores,採掘された鉱石を自動的に製錬します,translated
artifacts.tooltip.ability.creeper_repellent,Creepers avoid the wearer,クリーパーは着用者を避ける,verified
artifacts.tooltip.ability.cure_effects,Greatly reduces the duration of negative effects,マイナス効果の持続時間を大幅に短縮,verified
artifacts.tooltip.ability.damage_absorption.chance,The wearer's melee attacks have a %s%% chance to absorb health,着用者の近接攻撃が%s%%の確率でヘルスを吸収します,translated
artifacts.tooltip.ability.damage_absorption.constant,Causes the wearer's melee attacks to absorb health,着用者の近接攻撃で体力を吸収する,verified
artifacts.tooltip.ability.damage_immunity.is_hot_floor,Grants protection against hot floor damage,ホットフロアダメージから保護を与えます,translated
artifacts.tooltip.ability.damage_immunity.is_lightning,Grants protection against lightning strikes,落雷に対する保護を付与,verified
artifacts.tooltip.ability.death_protection_teleport.chance,A fatal hit has a %s%% chance to teleport you somewhere else instead,致命的な一撃に%s%%の確率で代わりにどこかへテレポートします,translated
artifacts.tooltip.ability.death_protection_teleport.constant,A fatal hit teleports you somewhere else instead,致命的な一撃であなたを代わりにどこかへテレポートさせます,translated
artifacts.tooltip.ability.death_protection_teleport.not_consumed,Not consumed on use,使用時に消費されません,translated
artifacts.tooltip.ability.double_jump,Allows the wearer to double jump,着用者は二段ジャンプが可能になる,verified
artifacts.tooltip.ability.enchantment_level_modifiers.fortune.multiple_levels,Applies %s extra levels of fortune to mined blocks,%s の追加レベルの幸運を採掘されたブロックに適用する,verified
artifacts.tooltip.ability.enchantment_level_modifiers.fortune.single_level,Applies an extra level of fortune to mined blocks,採掘されたブロックに追加レベルの幸運を適用する,verified
artifacts.tooltip.ability.enchantment_level_modifiers.looting.multiple_levels,Applies %s extra levels of looting to killed entities,%s の追加レベルのドロップ増加を殺されたエンティティに適用する,verified
artifacts.tooltip.ability.enchantment_level_modifiers.looting.single_level,Applies an extra level of looting to killed entities,殺されたエンティティに追加レベルのロップ増加を適用する,verified
artifacts.tooltip.ability.enchantment_level_modifiers.luck_of_the_sea.multiple_levels,Applies %s extra levels of Luck of the Sea when fishing,釣りをするときに%sレベルの余分な海の幸運を適用します,translated
artifacts.tooltip.ability.enchantment_level_modifiers.luck_of_the_sea.single_level,Applies an extra Luck of the Sea when fishing,釣りをするときに余分な海の幸運を適用します,translated
artifacts.tooltip.ability.enchantment_level_modifiers.lure.multiple_levels,Applies %s extra levels of Lure when fishing,釣りをするときに%sレベルの余分な釣りエンチャントを適用します,translated
artifacts.tooltip.ability.enchantment_level_modifiers.lure.single_level,Applies an extra level of Lure when fishing,釣りをするときに余分な釣りレベルを適用します,translated
artifacts.tooltip.ability.ender_pearl_damage_immunity,Ender Pearls deal no damage,エンダーパールはダメージを与えません,translated
artifacts.tooltip.ability.ender_pearl_hunger_cost.cost,"Ender Pearls are not consumed, but cost hunger instead",エンダーパールは消費されませんが、代わりにハンガーがかかります,translated
artifacts.tooltip.ability.ender_pearl_hunger_cost.free,Ender Pearls are not consumed when thrown,エンダーパールを投げるときに消費されません,translated
artifacts.tooltip.ability.fluid_collision.sneaking.lava,Allows the wearer to stand on lava while sneaking,着用者がしゃがみながら溶岩の上に立つことができます,translated
artifacts.tooltip.ability.fluid_collision.sprinting,Allows the wearer to walk on fluids while sprinting,着用者はダッシュ中に液体の上を歩くことができる,verified
artifacts.tooltip.ability.mob_effects.invisibility,Turns the wearer invisible,着用者を透明化する,verified
artifacts.tooltip.ability.mob_effects.magnetism,Attracts nearby items,近くのアイテムを引き寄せる,verified
artifacts.tooltip.ability.mob_effects.night_vision.full,Allows the wearer to see in the dark,着用者が暗闇でも見えるようにする,verified
artifacts.tooltip.ability.mob_effects.night_vision.partial,Allows the wearer to see in the dark slightly,着用者は暗闇の中を少し見ることができます,translated
artifacts.tooltip.ability.mob_effects.water_breathing.infinite,Allows the wearer to breathe underwater,着用者が水中で呼吸できるようにする,verified
artifacts.tooltip.ability.mob_effects.water_breathing.limited,Allows the wearer to breathe underwater for a limited amount of time,着用者が水中で呼吸できるようにする,verified
artifacts.tooltip.ability.phantom_repellent,Hisses at attacking phantoms,攻撃しているファントムにシューッと音を立てます,translated
artifacts.tooltip.ability.post_damage_effects.fire_resistance,Applies a temporary fire resistance effect after taking fire damage,着用者は火で傷ついた場合、一時的に火によるダメージを受けなくなる,verified
artifacts.tooltip.ability.post_damage_effects.speed,Increases the wearer's movement speed after taking damage,ダメージを受けた後の着用者の移動速度が増加する,verified
artifacts.tooltip.ability.post_eating_effects.haste,Grants a temporary boost to mining speed after eating food,食べた後にマイニング速度への一時的なブーストを与えます,translated
artifacts.tooltip.ability.post_eating_plant_growth,Plants grow after eating when standing on grass,草の上に立っているときに食べた後に植物が成長します,translated
artifacts.tooltip.ability.replenish_hunger_on_grass,Slowly replenishes hunger while walking on grass,草の上を歩いているときにゆっくりハンガーを補充します,translated
artifacts.tooltip.ability.retaliation_effects.fire.chance,Has a %s%% chance to light attackers on fire,攻撃者に火をつけるチャンスがある,verified
artifacts.tooltip.ability.retaliation_effects.fire.constant,Attacking entities are lit on fire,攻撃するエンティティが火に包まれます,translated
artifacts.tooltip.ability.retaliation_effects.fire.fire_resistance,Grants fire resistance after lighting an attacker on fire,攻撃者に火をつけた後、火炎耐性を与える,verified
artifacts.tooltip.ability.retaliation_effects.lightning.chance,Has a %s%% chance to strike attackers with lightning,雷で攻撃者を攻撃するチャンスがある,verified
artifacts.tooltip.ability.retaliation_effects.lightning.constant,Attacking entities are struck by lightning,攻撃するエンティティが落雷に当たります,translated
artifacts.tooltip.ability.retaliation_effects.thorns.chance,Has a %s%% chance to damage attackers,攻撃者にダメージを与える可能性がある,verified
artifacts.tooltip.ability.retaliation_effects.thorns.constant,Attacking entities are damaged as well,攻撃するエンティティも傷つけられます,translated
artifacts.tooltip.ability.sinking,Allows the wearer to move freely in water,着用者が水中で自由に動けるようにする,verified
artifacts.tooltip.ability.swim_in_air.keymapping,Press %s while in the air to start swimming,空中で %s を押すと泳げる,verified
artifacts.tooltip.ability.swim_in_air.swimming,Allows the wearer to swim in the air for a limited period of time,着用者は一定時間空中を泳ぐことができる。,verified
artifacts.tooltip.ability.tool_tier_upgrade,Increases the wearer's base mining level to %s,着用者の基本採掘レベルを%sに増加する,verified
artifacts.tooltip.ability.walk_on_powder_snow,Allows the wearer to walk on Powder Snow,着用者がパウダースノーを歩くことができます,translated
artifacts.tooltip.attacks_inflict,Attacks inflict:,攻撃が与えるもの：,translated
artifacts.tooltip.cooldown,+Cooldown (%s),+クールダウン（%s）,translated
artifacts.tooltip.cosmetic,Cosmetic,化粧品,verified
artifacts.tooltip.cosmetics_disabled,Cosmetics disabled (right-click to toggle),化粧品が無効になっている (右クリックして切り替え),verified
artifacts.tooltip.cosmetics_enabled,Cosmetics enabled (right-click to toggle),コスメティックスが有効です（右クリックして切り替え）,translated
artifacts.tooltip.item.everlasting_food,Not consumed when eaten,食べても消費されない,verified
artifacts.tooltip.item.novelty_drinking_hat,"'Hey! I'm #1, and I let gravity do my drinking!'",'やあ！ 私はナンバー 1 だ。重力に任せてお酒を飲むぜ!',verified
artifacts.tooltip.item.umbrella.glider,Slows your fall when held,持っていると落下が遅くなる,verified
artifacts.tooltip.item.umbrella.shield,Can be used as a shield,盾としても使える,verified
artifacts.tooltip.missing_dependency,"Install Curios, Trinkets or Accessories to use this item",このアイテムを使用するには、CuriosまたはTrinketsまたはAccessoriesをインストールしてください,translated
artifacts.tooltip.per_food_point_restored,For every food point restored:,回復した食料ポイントごと：,translated
artifacts.tooltip.plus_mob_effect,+%s,,pending
artifacts.tooltip.plus_mob_effect_chance,+%s (%s%%),+%s（%s%%）,translated
artifacts.tooltip.toggle_keymapping,Press %s to toggle,%s を押して切り替える,verified
artifacts.tooltip.tool_tier.diamond,diamond,ダイヤモンド,verified
artifacts.tooltip.tool_tier.iron,iron,鉄,verified
artifacts.tooltip.tool_tier.netherite,netherite,ネザライト,verified
artifacts.tooltip.tool_tier.none,none,なし,translated
artifacts.tooltip.tool_tier.stone,stone,石,verified
artifacts.tooltip.tool_tier.wood,wood,木,verified
artifacts.tooltip.when_hurt,When hurt:,傷つけられたとき：,translated
artifacts.tooltip.when_hurt.is_fire,When hurt by Fire:,火で傷つけられたとき：,translated
curios.identifier.feet,Feet,足,verified
curios.modifiers.feet,When on feet:,足に装備した時:,verified
effect.artifacts.magnetism,Magnetism,磁力,translated
entity.artifacts.mimic,Mimic,ミシック,verified
generic.attack_burning_duration,Attack Burning Duration,攻撃炎上期間,translated
generic.drinking_speed,Drinking Speed,飲酒速度,translated
generic.eating_speed,Eating Speed,食べる速度,translated
generic.flatulence,Flatulence,放屁,translated
generic.invincibility_ticks,Invincibility Ticks,無敵ティック,translated
generic.mount_speed,Mount Speed,乗騎速度,translated
generic.movement_speed_on_snow,Movement Speed on Snow,雪上での移動速度,translated
generic.slip_resistance,Slip Resistance,滑り抵抗,translated
generic.sprinting_speed,Sprinting Speed,スプリント速度,translated
generic.sprinting_step_height,Sprinting Step Height,スプリントステップ高さ,translated
generic.swim_speed,Swim Speed,水泳速度,translated
item.artifacts.anglers_hat,Angler's Hat,釣人の帽子,translated
item.artifacts.antidote_vessel,Antidote Vessel,解毒剤の容器,verified
item.artifacts.aqua_dashers,Aqua-Dashers,アクアダッシャー,verified
item.artifacts.bunny_hoppers,Bunny Hoppers,バニーホッパーズ,verified
item.artifacts.charm_of_shrinking,Charm of Shrinking,縮小のお守り,translated
item.artifacts.charm_of_sinking,Charm of Sinking,沈没の魅力,verified
item.artifacts.chorus_totem,Chorus Totem,コーラストーテム,translated
item.artifacts.cloud_in_a_bottle,Cloud in a Bottle,雲入りの瓶,verified
item.artifacts.cowboy_hat,Cowboy Hat,カウボーイハット,translated
item.artifacts.cross_necklace,Cross Necklace,十字架のネックレス,verified
item.artifacts.crystal_heart,Crystal Heart,クリスタルハート,verified
item.artifacts.digging_claws,Digging Claws,掘削爪,verified
item.artifacts.eternal_steak,Eternal Steak,永遠なるステーキ,verified
item.artifacts.everlasting_beef,Everlasting Beef,永遠なる牛肉,verified
item.artifacts.feral_claws,Feral Claws,野生の爪,verified
item.artifacts.fire_gauntlet,Fire Gauntlet,炎のガントレット,verified
item.artifacts.flame_pendant,Flame Pendant,炎のペンダント,verified
item.artifacts.flippers,Flippers,足ひれ,verified
item.artifacts.golden_hook,Golden Hook,黄金のフック,verified
item.artifacts.helium_flamingo,Helium Flamingo,ヘリウムフラミンゴ,verified
item.artifacts.kitty_slippers,Kitty Slippers,猫のスリッパ,verified
item.artifacts.lucky_scarf,Lucky Scarf,ラッキースカーフ,verified
item.artifacts.mimic_spawn_egg,Mimic Spawn Egg,ミミックのスポーンエッグ,verified
item.artifacts.night_vision_goggles,Night Vision Goggles,暗視ゴーグル,verified
item.artifacts.novelty_drinking_hat,Novelty Drinking Hat,目新しい水飲み帽子,verified
item.artifacts.obsidian_skull,Obsidian Skull,黒曜石の頭蓋骨,verified
item.artifacts.onion_ring,Onion Ring,オニオンリング,translated
item.artifacts.panic_necklace,Panic Necklace,パニックのネックレス,verified
item.artifacts.pickaxe_heater,Pickaxe Heater,ピッケルヒーター,translated
item.artifacts.plastic_drinking_hat,Plastic Drinking Hat,プラスチック製の水飲み帽子,verified
item.artifacts.pocket_piston,Pocket Piston,ポケットピストン,verified
item.artifacts.power_glove,Power Glove,パワーグローブ,verified
item.artifacts.rooted_boots,Rooted Boots,ルーテッドブーツ,translated
item.artifacts.running_shoes,Running Shoes,ランニングシューズ,verified
item.artifacts.scarf_of_invisibility,Scarf of Invisibility,透明のスカーフ,verified
item.artifacts.shock_pendant,Shock Pendant,衝撃のペンダント,verified
item.artifacts.snorkel,Snorkel,シュノーケル,verified
item.artifacts.snowshoes,Snowshoes,スノーシューズ,translated
item.artifacts.steadfast_spikes,Steadfast Spikes,しっかりとしたスパイク,verified
item.artifacts.strider_shoes,Strider Shoes,ストライダーシューズ,translated
item.artifacts.superstitious_hat,Superstitious Hat,迷信深い帽子,verified
item.artifacts.thorn_pendant,Thorn Pendant,とげのペンダント,verified
item.artifacts.umbrella,Umbrella,傘,verified
item.artifacts.universal_attractor,Universal Attractor,ユニバーサルアトラクター,verified
item.artifacts.vampiric_glove,Vampiric Glove,吸血鬼の手袋,verified
item.artifacts.villager_hat,Villager Hat,村人の帽子,verified
item.artifacts.warp_drive,Warp Drive,ワープドライブ,translated
item.artifacts.whoopee_cushion,Whoopee Cushion,ブーブークッション,verified
item.artifacts.withered_bracelet,Withered Bracelet,ウィザーブレスレット,translated
player.entity_experience,Entity Experience,エンティティ経験値,translated
player.villager_reputation,Villager Reputation,村人レピュテーション,translated
tag.block.artifacts.campsite_chests,Campsite Chests,キャンプサイトチェスト,translated
tag.block.artifacts.mineable.digging_claws,Mineable With Digging Claws,掘削爪で採掘可能,translated
tag.block.artifacts.rooted_boots_grass,Rooted Boots Grass,ルーテッドブーツ草,translated
tag.block.artifacts.snow_layers,Snow Layers,雪層,translated
tag.entity_type.artifacts.creepers,Creepers,クリーパー,translated
tag.item.artifacts.artifacts,Artifacts,遺物,translated
tag.item.artifacts.slot.all,Any Slot Equipable Artifacts,任意のスロットで装備可能な遺物,translated
tag.item.artifacts.slot.belt,Belt Slot Equipable Artifacts,ベルトスロットで装備可能な遺物,translated
tag.item.artifacts.slot.face,Face Slot Equipable Artifacts,顔スロットで装備可能な遺物,translated
tag.item.artifacts.slot.feet,Feet Slot Equipable Artifacts,足スロットで装備可能な遺物,translated
tag.item.artifacts.slot.hands,Hands Slot Equipable Artifacts,手スロットで装備可能な遺物,translated
tag.item.artifacts.slot.head,Head Slot Equipable Artifacts,頭スロットで装備可能な遺物,translated
tag.item.artifacts.slot.necklace,Necklace Slot Equipable Artifacts,ネックレススロットで装備可能な遺物,translated
tag.mob_effect.artifacts.antidote_vessel_cancellable,Antidote Vessel Cancellable,解毒の瓶キャンセル可能,translated
