key,source_text,target_text
block.cookingforblockheads.black_kitchen_floor,Black Kitchen Floor,黒色のキッチンの床
block.cookingforblockheads.black_oven,Black Oven,黒色のオーブン
block.cookingforblockheads.blue_kitchen_floor,Blue Kitchen Floor,青色のキッチンの床
block.cookingforblockheads.blue_oven,Blue Oven,青色のオーブン
block.cookingforblockheads.brown_kitchen_floor,Brown Kitchen Floor,茶色のキッチンの床
block.cookingforblockheads.brown_oven,Brown Oven,茶色のオーブン
block.cookingforblockheads.cabinet,Kitchen Cabinet,食器棚
block.cookingforblockheads.cooking_table,Cooking Table,調理台
block.cookingforblockheads.counter,Kitchen Counter,キッチンカウンター
block.cookingforblockheads.cow_jar,Cow in a Jar,牛入り瓶
block.cookingforblockheads.cutting_board,Cutting Board,まな板
block.cookingforblockheads.cyan_kitchen_floor,Cyan Kitchen Floor,青緑色のキッチンの床
block.cookingforblockheads.cyan_oven,Cyan Oven,青緑色のオーブン
block.cookingforblockheads.fruit_basket,Fruit Basket,フルーツバスケット
block.cookingforblockheads.gray_kitchen_floor,Gray Kitchen Floor,灰色のキッチンの床
block.cookingforblockheads.gray_oven,Gray Oven,灰色のオーブン
block.cookingforblockheads.green_kitchen_floor,Green Kitchen Floor,緑色のキッチンの床
block.cookingforblockheads.green_oven,Green Oven,緑色のオーブン
block.cookingforblockheads.light_blue_kitchen_floor,Light Blue Kitchen Floor,空色のキッチンの床
block.cookingforblockheads.light_blue_oven,Light Blue Oven,空色のオーブン
block.cookingforblockheads.light_gray_kitchen_floor,Light Gray Kitchen Floor,薄灰色のキッチンの床
block.cookingforblockheads.light_gray_oven,Light Gray Oven,薄灰色のオーブン
block.cookingforblockheads.lime_kitchen_floor,Lime Kitchen Floor,黄緑色のキッチンの床
block.cookingforblockheads.lime_oven,Lime Oven,黄緑色のオーブン
block.cookingforblockheads.magenta_kitchen_floor,Magenta Kitchen Floor,赤紫色のキッチンの床
block.cookingforblockheads.magenta_oven,Magenta Oven,赤紫色のオーブン
block.cookingforblockheads.milk_jar,Milk Jar,ミルク瓶
block.cookingforblockheads.orange_kitchen_floor,Orange Kitchen Floor,橙色のキッチンの床
block.cookingforblockheads.orange_oven,Orange Oven,橙色のオーブン
block.cookingforblockheads.pink_kitchen_floor,Pink Kitchen Floor,桃色のキッチンの床
block.cookingforblockheads.pink_oven,Pink Oven,桃色のオーブン
block.cookingforblockheads.purple_kitchen_floor,Purple Kitchen Floor,紫色のキッチンの床
block.cookingforblockheads.purple_oven,Purple Oven,紫色のオーブン
block.cookingforblockheads.red_kitchen_floor,Red Kitchen Floor,赤色のキッチンの床
block.cookingforblockheads.red_oven,Red Oven,赤色のオーブン
block.cookingforblockheads.sink,Sink,流し台
block.cookingforblockheads.spice_rack,Spice Rack,スパイスラック
block.cookingforblockheads.toaster,Toaster,トースター
block.cookingforblockheads.tool_rack,Tool Rack,ツールラック
block.cookingforblockheads.white_kitchen_floor,Kitchen Floor,キッチンの床
block.cookingforblockheads.yellow_kitchen_floor,Yellow Kitchen Floor,黄色のキッチンの床
block.cookingforblockheads.yellow_oven,Yellow Oven,黄色のオーブン
config.cookingforblockheads,Cooking for Blockheads,料理ブロック化 MOD
config.cookingforblockheads.allowVeryToastedBread,Allow Very Toasted Bread,よくトーストしたパンを許可
config.cookingforblockheads.allowVeryToastedBread.tooltip,Toasting toasted bread again will turn into charcoal (only if no other mod adding toast is present). Set to false to disable.,トーストしたパンをもう一度トーストすると炭になるか。(トーストを追加する他のMODが存在しない場合のみ)無効にするにはfalseに設定します。
config.cookingforblockheads.compressedCowJarMilkMultiplier,Compressed Cow in a Jar Milk Multiplier,瓶に入った圧縮牛の倍率
config.cookingforblockheads.compressedCowJarMilkMultiplier.tooltip,Ex Compressum compatibility. Multiplier applied to the milk per tick for Compressed Cow in a Jar.,圧縮牛の互換性です。瓶に入った圧縮牛の場合、1ティックあたりのミルクに倍率が適用されます。
config.cookingforblockheads.cowJarEnabled,Enable Cow in a Jar,牛入り瓶を有効
config.cookingforblockheads.cowJarEnabled.tooltip,"If true, a cow can be squished into a Milk Jar by dropping an anvil on top.",trueの場合、金床を上に落とすことで牛をミルク瓶の中に押し込むことができる。
config.cookingforblockheads.cowJarMilkPerTick,Milk Generation per Tick in Jar,ティックごとに生成する瓶内のミルク
config.cookingforblockheads.cowJarMilkPerTick.tooltip,The amount of milk the cow in a jar generates per tick.,瓶に入った圧縮牛が1ティックあたりに生成するミルクの量。
config.cookingforblockheads.disallowOvenAutomation,Disallow Oven Automation,オーブン自動化の禁止
config.cookingforblockheads.disallowOvenAutomation.tooltip,Set this to true if you'd like to disallow automation of the oven (pipes and such won't be able to insert/extract),オーブンの自動化を無効にしたい場合は、trueを設定します。(パイプなどが挿入/抽出できなくなります)
config.cookingforblockheads.largeCounters,Large Kitchen Counters,大型キッチンカウンター
config.cookingforblockheads.largeCounters.tooltip,Enabling this will make the kitchen counters have twice as much inventory space.,これをtrueにすると、キッチンカウンターの在庫スペースが2倍になります。
config.cookingforblockheads.ovenCookTimeMultiplier,Oven Cooking Time Multiplier,オーブン調理時間倍率
config.cookingforblockheads.ovenCookTimeMultiplier.tooltip,The cooking time multiplier for the cooking oven. Higher values means it will take longer.,調理オーブンの調理時間倍率。値が大きいほど調理時間が長くなります。
config.cookingforblockheads.ovenFuelTimeMultiplier,Oven Fuel Time Multiplier,オーブン燃料時間倍率
config.cookingforblockheads.ovenFuelTimeMultiplier.tooltip,"The fuel multiplier for the cooking oven. Higher values means fuel lasts longer, 1.0 is furnace default.",調理オーブンの燃料倍率。1.0が炉のデフォルトです。
config.cookingforblockheads.ovenRequiresCookingOil,Oven Requires Cooking Oil,オーブンには食用油が必要
config.cookingforblockheads.ovenRequiresCookingOil.tooltip,Set this to true if you'd like the oven to only accept cooking oil as fuel (requires Pam's Harvestcraft),オーブンに食用油のみを燃料として使用させたい場合は、これをtrueに設定します。(Pam's Harvestcraftが必要)
config.cookingforblockheads.showIngredientIcon,Show Ingredient Icon,食材アイコンを表示
config.cookingforblockheads.showIngredientIcon.tooltip,Set to false if you don't want ingredients to be marked with a special icon in the recipe book.,レシピ本で食材に特別なアイコンを付けたくない場合はfalseに設定してください。
config.cookingforblockheads.sinkRequiresWater,Sink Requires Water,シンクは水が必要
config.cookingforblockheads.sinkRequiresWater.tooltip,"Set this to true if you'd like the sink to require water to be piped in, instead of providing infinite of it.",シンクに無限に水を供給するのではなく、水を配管する必要がある場合は、これをtrueに設定します。
config.jade.plugin_cookingforblockheads.fridge,Fridge,冷蔵庫
config.jade.plugin_cookingforblockheads.milk_jar,Milk Jar,ミルク瓶
config.jade.plugin_cookingforblockheads.oven,Oven,オーブン
config.jade.plugin_cookingforblockheads.preservation_chamber,Preservation Chamber,保存室
config.jade.plugin_cookingforblockheads.sink,Sink,流し台
config.jade.plugin_cookingforblockheads.toaster,Toaster,トースター
container.cookingforblockheads.cabinet,Kitchen Cabinet,食器棚
container.cookingforblockheads.counter,Kitchen Counter,キッチンカウンター
container.cookingforblockheads.cow_jar,Cow in a Jar,牛入り瓶
container.cookingforblockheads.cow_jar_compressed,Compressed Cow in a Jar,瓶に入った圧縮牛
container.cookingforblockheads.cow_jar_custom,%s in a Jar,%s入り瓶
container.cookingforblockheads.fridge,Fridge,冷蔵庫
container.cookingforblockheads.fruit_basket,Fruit Basket,フルーツバスケット
container.cookingforblockheads.oven,Cooking Oven,クッキングオーブン
container.cookingforblockheads.spice_rack,Spice Rack,スパイスラック
item.cookingforblockheads.crafting_book,Cooking for Blockheads II,料理ブロック化 II
item.cookingforblockheads.heating_unit,Heating Unit,ヒートユニット
item.cookingforblockheads.ice_unit,Ice Unit,アイスユニット
item.cookingforblockheads.no_filter_edition,Cooking for Blockheads,料理ブロック化
item.cookingforblockheads.preservation_chamber,Preservation Chamber,貯蔵庫
item.cookingforblockheads.recipe_book,Cooking for Blockheads I,料理ブロック化 I
itemGroup.cookingforblockheads.cookingforblockheads,Cooking for Blockheads,料理ブロック化
block.cookingforblockheads.corner,Kitchen Corner,キッチンコーナー
block.cookingforblockheads.fridge,Fridge,冷蔵庫
block.cookingforblockheads.hanging_corner,Hanging Kitchen Corner,吊り下げキッチンコーナー
block.cookingforblockheads.oven,Oven,オーブン
cookingforblockheads:subtitle.fridge_close,Fridge closes,冷蔵庫が閉まる
cookingforblockheads:subtitle.fridge_open,Fridge opens,冷蔵庫が開く
cookingforblockheads:subtitle.oven_close,Oven closes,オーブンが閉まる
cookingforblockheads:subtitle.oven_open,Oven opens,オーブンが開く
cookingforblockheads:subtitle.toaster_start,Toaster starts toasting,トースターがトースト開始
cookingforblockheads:subtitle.toaster_stop,Toaster finished toasting,トースターがトースト完了
gui.cookingforblockheads:no_ingredients,Not\nenough\ningredients,"材料が
不足しています"
gui.cookingforblockheads:no_selection,Select an item\non the right to\nsee its recipe.,"右側でアイテムを
選択してレシピを
確認してください。"
jei.cookingforblockheads:cow_jar,Cow in a Jar,瓶詰めウシ
tooltip.cookingforblockheads:cabinet.description,Can be placed on the wall above kitchen blocks.,キッチンブロックの上の壁に配置できます。
tooltip.cookingforblockheads:can_be_placed_in_world,Can be placed in the world.,ワールドに配置できます。
tooltip.cookingforblockheads:click_to_craft_one,Click again to craft,もう一度クリックでクラフト
tooltip.cookingforblockheads:click_to_craft_stack,Shift-Click to craft a stack,Shift+クリックでスタック分クラフト
tooltip.cookingforblockheads:click_to_lock,Right-Click to lock item,右クリックでアイテムをロック
tooltip.cookingforblockheads:click_to_see_recipe,Click to see recipe,クリックでレシピを表示
tooltip.cookingforblockheads:click_to_smelt_one,Click again to cook,もう一度クリックで調理
tooltip.cookingforblockheads:click_to_smelt_stack,Shift-Click to cook a stack,Shift+クリックでスタック分調理
tooltip.cookingforblockheads:click_to_unlock,Right-Click to unlock item,右クリックでアイテムをロック解除
tooltip.cookingforblockheads:cooking_table.description,Enables crafting abilities.,クラフト機能を有効にします。
tooltip.cookingforblockheads:corner.description,Connect kitchen blocks over corners.,コーナーを越えてキッチンブロックをつなぎます。
tooltip.cookingforblockheads:counter.description,Stores ingredients for recipes.,レシピ用の材料を保管します。
tooltip.cookingforblockheads:cow_jar.description,Slowly produces milk for recipes.,レシピ用にゆっくり牛乳を生成します。
tooltip.cookingforblockheads:crafting_book,Crafting Book,クラフトブック
tooltip.cookingforblockheads:crafting_book.description,Can craft food using the things\nyou have in your inventory.,インベントリにあるものを使用して食べ物をクラフトできます。
tooltip.cookingforblockheads:cutting_board.description,Provides a cutting board for recipes.,レシピ用のまな板を提供します。
tooltip.cookingforblockheads:cutting_board_deprecated,This item is deprecated.\nPam's Cutting board can be placed directly now.,"このアイテムは非推奨です。
パムのまな板は現在直接配置できます。"
tooltip.cookingforblockheads:dyeable,Dyeable,染色可能
tooltip.cookingforblockheads:energy_stored,Energy stored: %d/%d,蓄積エネルギー: %d/%d
tooltip.cookingforblockheads:fridge.description,Stores ingredients for recipes.,レシピ用の材料を保管します。
tooltip.cookingforblockheads:fridge_upgrade,Fridge Upgrade,冷蔵庫アップグレード
tooltip.cookingforblockheads:fruit_basket.description,Stores fruits for recipes.,レシピ用の果物を保管します。
tooltip.cookingforblockheads:hanging_corner.description,Connect kitchen blocks over corners.,コーナーを越えてキッチンブロックをつなぎます。
tooltip.cookingforblockheads:heating_unit.description,Allows to heat an oven using energy.,エネルギーを使用してオーブンを加熱できます。
tooltip.cookingforblockheads:ice_unit.description,Provides snow and ice to recipes.,レシピに雪と氷を供給します。
tooltip.cookingforblockheads:kitchen_floor.description,Connect kitchen blocks over distances.,離れた場所にあるキッチンブロックをつなぎます。
tooltip.cookingforblockheads:milk_jar.description,Provides milk to recipes.,レシピに牛乳を供給します。
tooltip.cookingforblockheads:missing_ingredients,Missing ingredients to craft,クラフトに必要な材料がありません
tooltip.cookingforblockheads:missing_oven,Missing oven to cook,調理に必要なオーブンがありません
tooltip.cookingforblockheads:missing_tools,Missing tools to craft,クラフトに必要な道具がありません
tooltip.cookingforblockheads:multiblock_kitchen,Multiblock Kitchen,マルチブロックキッチン
tooltip.cookingforblockheads:no_filter_edition,#NoFilter Edition,#ノーフィルターエディション
tooltip.cookingforblockheads:no_filter_edition.description,Shows all food recipes.,すべての食べ物レシピを表示します。
tooltip.cookingforblockheads:oven.description,Enables smelting abilities.,製錬機能を有効にします。
tooltip.cookingforblockheads:oven_upgrade,Oven Upgrade,オーブンアップグレード
tooltip.cookingforblockheads:preservation_chamber.description,Prevents the last item of a slot from being used up.,スロット内の最後のアイテムが使用されるのを防ぎます。
tooltip.cookingforblockheads:recipe_book,Recipe Book,レシピブック
tooltip.cookingforblockheads:recipe_book.description,Shows food you can make with the\nthings you have in your inventory.,インベントリにあるものを使用して作成できる食べ物を表示します。
tooltip.cookingforblockheads:requires_pams,Requires Pam's Harvestcraft,Pam's Harvestcraft が必要です
tooltip.cookingforblockheads:scroll_to_switch,Scroll to select item,スクロールでアイテムを選択
tooltip.cookingforblockheads:sink.description,Provides water to recipes.,レシピに水を供給します。
tooltip.cookingforblockheads:sort_by_hunger,Sort by Hunger Restored,満腹度回復でソート
tooltip.cookingforblockheads:sort_by_name,Sort by Name,名前でソート
tooltip.cookingforblockheads:sort_by_saturation,Sort by Saturation,飽和度でソート
tooltip.cookingforblockheads:spice_rack.description,Stores spices and ingredients.,スパイスと材料を保管します。
tooltip.cookingforblockheads:toasted,Toasted %s,トーストした %s
tooltip.cookingforblockheads:toaster.description,Magically turns bread into toast.,魔法のようにパンをトーストに変えます。
tooltip.cookingforblockheads:tool_rack.description,Provides tools to recipes.,レシピに道具を提供します。
tooltip.cookingforblockheads:very_toasted,Very Toasted Bread (do not eat),焦げたパン（食べないでください）
waila.cookingforblockheads:heating_unit,Upgrade: Heating Unit,アップグレード: 加熱ユニット
waila.cookingforblockheads:ice_unit,Upgrade: Ice Unit,アップグレード: 冷却ユニット
waila.cookingforblockheads:milk_stored,Milk Stored: %d/%d,蓄積牛乳: %d/%d
waila.cookingforblockheads:preservation_chamber,Upgrade: Preservation Chamber,アップグレード: 保存チャンバー
waila.cookingforblockheads:toast_progress,Toasting... (%s %%),トースト中... (%s %%)
waila.cookingforblockheads:water_stored,Water Stored: %d/%d,蓄積水: %d/%d
gui.cookingforblockheads:moved_to_oven,Moved to Oven,オーブンへ移動
tooltip.cookingforblockheads:kitchen_upgrade,Kitchen Upgrade,キッチンアップグレード
tooltip.cookingforblockheads:sort_by_eatenness,Sort by Eaten,食べた順にソート
