key,source_text,target_text,status
minecolonies.config.permissioneventbypassminpermlevel.comment,Disables colony permissions if player has a given permission level.,プレイヤーが与えられた権限レベルを持っている場合、コロニー権限を無効化します。,translated
minecolonies.config.permissions,Permission Settings,権限設定,verified
minecolonies.config.permissions.comment,All permission configuration options,全ての権限設定オプション,verified
minecolonies.config.pvp_mode,PVP Mode,PVP モード,verified
minecolonies.config.pvp_mode.comment,Turn on MineColonies PVP mode (colonies can be destroyed and griefed under certain conditions).,MineColoniesのPVPモードをONにします(コロニーを破壊する事ができ、市民は悲嘆にくれるでしょう),verified
minecolonies.config.raidDifficulty,Raid Difficulty,襲撃難易度,verified
minecolonies.config.raidDifficulty.comment,The difficulty setting for raids.,襲撃の難易度を設定します。,verified
minecolonies.config.raidersbreakblocks,Do raiders break blocks,襲撃者がブロックを破壊するか,verified
minecolonies.config.raidersbreakblocks.comment,Whether or not raiders are able to break through blocks,襲撃者がブロックを破壊できるかどうか,verified
minecolonies.config.raidersbreakdoors,Do Raiders Break Doors,襲撃者がドアを破壊するか,verified
minecolonies.config.raidersbreakdoors.comment,Whether or not raiders can break through doors.,襲撃者がドアを破壊できるかどうかです。,verified
minecolonies.config.requestsystem,Request System Settings,要求システム設定,verified
minecolonies.config.requestsystem.comment,All configurations related to the request system,要求システムに関する全ての設定,verified
minecolonies.config.research,Research Settings,研究設定,verified
minecolonies.config.research.comment,All configurations related to the research system,研究システムに関するすべての設定,verified
minecolonies.config.researchcreativecompletion,Research Creative Completion,クリエイティブモード時の研究完了,verified
minecolonies.config.researchcreativecompletion.comment,"Allows automatic and (near) instant completion of research for players in creative mode. If false, creative players will still be able to begin researches, but will have normal progress rates.",クリエイティブモードのプレイヤーに対して、研究を自動的かつ（ほぼ）即座に完了させることを許可します。falseの場合、クリエイティブモードのプレイヤーも研究を始められますが、通常の進行速度になります。,verified
minecolonies.config.researchdebuglog,Log Research Data,研究用データの記録,verified
minecolonies.config.researchdebuglog.comment,Significantly increases the amount of information related to research datapacks that is logged during the world load.,ワールドロード時に記録される研究用データパックに関連する情報量を大幅に増やします。,verified
minecolonies.config.researchresetcost,Cost to Undo a Completed Research,完了した研究をもとに戻すのに必要なコスト,verified
minecolonies.config.researchresetcost.comment,A list of items to charge players when undoing an already-completed research.,研究を元に戻す際に、プレイヤーに要求される項目の一覧です。,verified
minecolonies.config.restrictcolonyplacement,Restrict Colony Placement,コロニー配置の制限,verified
minecolonies.config.restrictcolonyplacement.comment,Should the min/max distance from spawn also affect colony placement?,コロニーの配置によって初期領地の範囲の最小値/最大値に影響を及ぼすか。,verified
minecolonies.config.secondsbetweenpermissionmessages,Seconds Between Permission Messages,許可メッセージ間の秒数,verified
minecolonies.config.secondsbetweenpermissionmessages.comment,Seconds between each permission message (to reduce spam).,許可メッセージの秒数間隔(スパム軽減のため)。,verified
minecolonies.config.sendenteringleavingmessages,Colony Notifications,コロニーからの通知,verified
minecolonies.config.sendenteringleavingmessages.comment,Should players be sent entering/leaving colony notifications?,コロニーへの入室・退室をプレイヤーに通知しますか？,verified
minecolonies.config.siftableblocks,List of Siftable Blocks,選鉱可能なブロック一覧,verified
minecolonies.config.siftableblocks.comment,List of materials a Sifter can rifle through for resources.,選鉱師がリソースのために選鉱できる素材の一覧。,verified
minecolonies.config.sifterdrops,List of Sifter Production,選鉱製造一覧,verified
minecolonies.config.sifterdrops.comment,"List of materials a sifter can find from raw materials, as well as their weights.",選鉱師が原料から見つけることができる物質とその重量の一覧。,verified
minecolonies.config.siftermeshes,List of Sifter Meshes,ふるいメッシュのリスト,verified
minecolonies.config.siftermeshes.comment,"List of materials a sifter can use as a mesh material, along with bonus weights",ふるい機がメッシュ材料として使用できる材料のリストとボーナスウェイト,verified
minecolonies.config.skyraiders,Enable raiders to spawn in the sky,襲撃者が上空にスポーンできるようにする。,verified
minecolonies.config.skyraiders.comment,Raiders will spawn in the sky if this is enabled,この機能を有効にすると襲撃者が空から出現するようになります。,verified
minecolonies.config.specialpermgroup,Special Permissions Group,特別権限グループ,verified
minecolonies.config.specialpermgroup.comment,"Players who have special permissions, especially to change citizen names (see ""Name Changes"" above).","市民の名前を変更するための特別な権限を持っているプレイヤー(""名前の変更""参照)。",verified
minecolonies.config.suggestbuildtoolplacement,Build Tool Placement,ビルドツールの配置,verified
minecolonies.config.suggestbuildtoolplacement.comment,Suggest build tool usage when trying to place a building without the build tool.,ビルドツールを使わずに建物を配置しようとした時、ビルドツールの使用を提案します。,verified
minecolonies.config.turnoffexplosionsincolonies,Turn off Explosions in Colonies,コロニーでの爆発をオフにする,verified
minecolonies.config.turnoffexplosionsincolonies.comment,"Independent from the colony protection, should explosions be turned off inside colonies? DAMAGE_NOTHING prevents explosions completely. DAMAGE_PLAYERS, allows explosions to damage players and hostile mobs, but not blocks or neutral or friendly mobs. DAMAGE_ENTITIES allows damage to all entities. DAMAGE_EVERYTHING allows explosions to damage entities and blocks.",コロニー保護とは別にコロニー内での爆発はオフにするべきですか？DAMAGE_NOTHINGは爆発を完全に防ぐことができます。DAMAGE_PLAYERSは爆発がプレイヤーや敵対モブにダメージを与えることを許可しますが、ブロックや中立・友好MOBにはダメージを与えません。DAMAGE_ENTITIESはすべてのエンティティにダメージを与えることができます。DAMAGE_EVERYTHINGは爆発がエンティティやブロックにダメージを与えることを許可します。,verified
minecolonies.config.updaterate,Update Rate,行動の更新率,verified
minecolonies.config.updaterate.comment,AI Update rate. Increase this to improve performance. This throttles citizen updates.,AIの更新率。パフォーマンスを向上させるにはこれを増やします。市民の行動の更新を抑制します。,verified
minecolonies.config.workersalwaysworkinrain,Working in Rain,晴耕雨読,verified
minecolonies.config.workersalwaysworkinrain.comment,Should workers work during the rain?,雨の中でも仕事をさせますか？,verified
minecolonies.quests.general.alchemy,Alchemy!,錬金術！,verified
minecolonies.quests.general.alchemy.obj0,I just discovered a new alchemical process but I need some materials to test it out. Do you think you could help me with that?,新しい錬金術のプロセスを発見したのですがそれをテストするための材料が必要です。その手助けをしていただけますか？,verified
minecolonies.quests.general.alchemy.obj0.answer0,"Sure, what do you need?.",えぇ、必要なものは？,verified
minecolonies.quests.general.alchemy.obj0.answer0.reply,"Splendid! Well, I require the flesh of three zombies!",素晴らしい！では、ゾンビ3体の肉が必要です！,verified
minecolonies.quests.general.alchemy.obj0.answer0.reply.answer0,A bit creepy. But okay!,ちょっと不気味。でも大丈夫！,verified
minecolonies.quests.general.alchemy.obj0.answer0.reply.answer1,"I have no concerns, sure!",もちろん、心配はありません！,verified
minecolonies.quests.general.alchemy.obj0.answer0.reply.answer2,"Uhh, just three?",えっと、3つだけですか？,verified
minecolonies.quests.general.alchemy.obj0.answer0.reply.answer3,I suddenly don't feel like being part of this.,いきなりだけど、参加したくない気分になったよ。,verified
minecolonies.quests.general.alchemy.obj0.answer1,"I'm sorry, I can't help right now.",申し訳ないけど今は力になれないよ。,verified
minecolonies.quests.general.alchemy.obj0.answer2,I won't be able to help you with that.,それについてはお手伝いできないよ。,verified
minecolonies.quests.general.alchemy.obj10,*Laughs Maniacally* I have done it. I have done it! I have created a potion of eternal life! Here try it!,*狂ったように笑う* やった！やったよ！永遠の命の薬を作ったよ！さあ試してみて！,verified
minecolonies.quests.general.alchemy.obj10.answer0,Great! Take Potion,素晴らしい！ポーションを飲む,verified
minecolonies.quests.general.alchemy.obj2,The flesh you delivered me seemed a bit cold. I feel I require warm zombie flesh. Three again please,あなたが届けてくれた肉は少し冷たく感じた。暖かいゾンビの肉が必要なんだ もう一度3つお願いします。,verified
minecolonies.quests.general.alchemy.obj2.answer0,Meh. Okay. On it.,うん。オーケー。それでいい。,verified
minecolonies.quests.general.alchemy.obj2.answer1,"Uhhh, I get to kill some more zombies. Sure!",もっとゾンビを殺せるんだ。そうだね！,verified
minecolonies.quests.general.alchemy.obj2.answer2,I suddenly don't feel like being part of this anymore.,突然、この件に関わる気がしなくなったんだ。,verified
minecolonies.quests.general.alchemy.obj5,Splendid! This looks just perfect! But I'm afraid I need something new! Fetch me 2 fresh spider eyes.,素晴らしい！これは完璧だ！だが新しいものが必要だ！新鮮なクモの目を2つ持ってきてくれ,verified
minecolonies.quests.general.alchemy.obj5.answer0,Yes Master *rubs hands*!,はい、ご主人様*ゴマをする*！,verified
minecolonies.quests.general.alchemy.obj5.answer1,On it!,任せて！,verified
minecolonies.quests.general.alchemy.obj5.answer2,I hate spiders. No way!,クモは嫌いだ。とんでもない！,verified
minecolonies.quests.general.alchemy.obj7,Hehehehehe! Perfect! Now I just need something to fuel the reaction. Gun powder would be perfect!,ヘヘヘヘヘ！完璧だ！あとは反応を促進するものが必要だ。火薬があれば完璧だ！,verified
minecolonies.quests.general.alchemy.obj7.answer0,I have no concern. No problem!,心配はしていない。問題ない！,verified
minecolonies.quests.general.alchemy.obj7.answer1,One creeper for the gun powder or stealing some from the guards? No problem!,火薬のためにクリーパーを1人雇うか、警備員から火薬を盗むか？どちらにせよ問題ありません！,verified
minecolonies.quests.general.alchemy.obj7.answer2,This sounds concerning. I want out!,心配ですね。抜け出したいです！,verified
minecolonies.quests.general.alchemy.obj9,Splendid! Let me mix them together real quick!,素晴らしい！さっそく混ぜてみよう！,verified
minecolonies.quests.general.alchemy.obj9.answer0,"Okay, I'm waiting.",オーケー、待っているよ。,verified
minecolonies.quests.general.cookies,Cookies for the Kids!,子供たちにクッキーを！,verified
minecolonies.quests.general.cookies.obj0,"Hi, Thank you for hiring me as a baker! I always wanted to be a baker! Let's make some cookies for young ones!",こんにちは、パン職人として雇っていただきありがとうございます！ずっとパン屋さんになりたかったんです！若い子向けのクッキーを作りましょう！,verified
minecolonies.quests.general.cookies.obj0.answer0,"Sure, what do you need?.",えぇ、必要なものは？,verified
minecolonies.quests.general.cookies.obj0.answer0.reply,I need two wheat and one coco bean!,小麦が2つとカカオ豆が1つ必要なんだ！,verified
minecolonies.quests.general.cookies.obj0.answer0.reply.answer0,On my way!,今行くところだ！,verified
minecolonies.quests.general.cookies.obj0.answer0.reply.answer1,"They're not my kids, why should I do it?",私の子供じゃないのにどうして私がやらなきゃいけないの？,verified
minecolonies.quests.general.cookies.obj0.answer1,"I'm sorry, I can't help right now.",申し訳ないけど今は力になれないよ。,verified
minecolonies.quests.general.cookies.obj0.answer2,I won't be able to help you with that.,それについてはお手伝いできないよ。,verified
minecolonies.quests.general.cookies.obj3,Thank you. I'll get right on this!,ありがとう。すぐに取り掛かるよ！,verified
minecolonies.quests.general.cookies.obj3.answer0,Sure! I'll wait!,もちろん！ 待ってるよ！,verified
minecolonies.quests.general.cookies.obj4,Here you are. Please take those 8 cookies and deliver them to $1! You can find the kid with the help of the quest log.,お待たせしました。8個のクッキーを$1に届けてください！クエストログの助けを借りてその子を見つけることができます。,verified
minecolonies.quests.general.cookies.obj4.answer0,Sure! I'm on it!,もちろん！任せてください！,verified
minecolonies.quests.general.cookies.obj5,Hi! The baker told me you got cookies for me!,こんにちは！クッキーを買ってきてくれたってパン屋さんから聞いたよ！,verified
minecolonies.quests.general.cookies.obj5.answer0,"Yes, But I ate them all!",うん、でも全部食べちゃった！,verified
minecolonies.quests.general.cookies.obj5.answer0.reply,You are a so mean! I will never forget this!,意地悪！私はこのことを決して忘れないからね！,verified
minecolonies.quests.general.cookies.obj5.answer0.reply.answer0,Hihihihih,ヒヒヒ,verified
minecolonies.quests.general.cookies.obj5.answer1,"Yes, I have them here! Give me a second!",はい、ここにあります！ちょっと待って！,verified
minecolonies.quests.general.cookies.obj7,*Shiny Eyes* Uhhh! Those look delicious!,*目を輝かせて* うわあ！美味しそうですね！,verified
minecolonies.quests.general.cookies.obj7.answer0,Please make sure to share them with your friends!,お友達にもぜひ教えてあげてください！,verified
minecolonies.quests.general.cookies.obj7.answer0.reply,Suuuure! I found this shiny thing on the floor. Here you can have it!,もちろん！床にこのピカピカしたものを見つけたよ。君にあげる！,verified
minecolonies.quests.general.cookies.obj7.answer0.reply.answer0,Thanks,ありがとう,verified
minecolonies.quests.general.cookies.obj7.answer1,Yes they really do!,そう、本当にそうなんだ！,verified
minecolonies.quests.general.cookies.obj7.answer1.reply,Thank you! I found this shiny thing on the floor. Here you can have it!,ありがとう！床にこのピカピカしたものを見つけたよ。君にあげる！,verified
minecolonies.quests.general.cookies.obj7.answer1.reply.answer0,Thanks,ありがとう,verified
minecolonies.quests.general.cookies.obj7.answer2,Have a good one!,良い一日を！,verified
minecolonies.quests.general.cookies.obj7.answer2.reply,Thank you! I found this shiny thing on the floor. Here you can have it!,ありがとう！床にこのピカピカしたものを見つけたよ。君にあげる！,verified
minecolonies.quests.general.cookies.obj7.answer2.reply.answer0,Thanks,ありがとう,verified
minecolonies.quests.general.hungrycourier,The Hungry Deliveryman,空腹の配達員,verified
minecolonies.quests.general.hungrycourier.obj0,"Hey there, could I ask you a favour?",ちょっとお願いがあるんだけど？,verified
minecolonies.quests.general.hungrycourier.obj0.answer0,"Sure, what do you need?",もちろん、何が必要なんだい？,verified
minecolonies.quests.general.hungrycourier.obj0.answer0.reply,I'm starving and I forgot my lunch at home. Could you bring me some food?,お腹が空いたんだけどお弁当を家に忘れてきちゃった。何か持ってきてくれる？,verified
minecolonies.quests.general.hungrycourier.obj0.answer0.reply.answer0,What kind of food do you want?,どんな料理が食べたい？,verified
minecolonies.quests.general.hungrycourier.obj0.answer0.reply.answer0.reply,A baked potato would just hit the spot!,ベイクドポテトがちょうどいい！,verified
minecolonies.quests.general.hungrycourier.obj0.answer0.reply.answer0.reply.answer0,Got it. I'll be right back.,了解。すぐに戻るよ。,verified
minecolonies.quests.general.hungrycourier.obj0.answer0.reply.answer1,"I'm sorry, I don't have any food on me.",悪いけど、食べ物は持っていないんだ。,verified
minecolonies.quests.general.hungrycourier.obj0.answer0.reply.answer1.reply,"Ah, too bad. I guess I'll just have to make do until I get home.",ああ、残念だ。家に帰るまで頑張るしかなさそうだ。,verified
minecolonies.quests.general.hungrycourier.obj0.answer0.reply.answer1.reply.answer0,I'll see if I can find something for you later.,後で何か探してみるよ。,verified
minecolonies.quests.general.hungrycourier.obj0.answer1,"Sorry, I'm in a rush right now!",ごめん、今急いでいるんだ！,verified
minecolonies.quests.general.hungrycourier.obj2,"Oh, this was great! Thanks a lot!",素晴らしかったよ！ありがとう！,verified
minecolonies.quests.general.hungrycourier.obj2.answer0,You're welcome!,どういたしまして！,verified
minecolonies.quests.general.thezombiemenace1,The Zombie Menace,ゾンビの脅威,verified
minecolonies.quests.general.thezombiemenace1.obj0,We have a problem. The Zombies in the nearby forest are causing trouble. Can you help us take care of them?,問題が発生した。近くの森でゾンビがトラブルを起こしています。奴らを始末するのを手伝ってもらえませんか？,verified
minecolonies.quests.general.thezombiemenace1.obj0.answer0,"Sure, I'll do what I can.",もちろん、できることはするよ。,verified
minecolonies.quests.general.thezombiemenace1.obj0.answer0.reply,Thank you! We need you to kill 2 Zombies. We'll reward you for your efforts.,ありがとう！ゾンビを2体倒してください。努力に対して報酬を差し上げます。,verified
minecolonies.quests.general.thezombiemenace1.obj0.answer0.reply.answer0,I'm on it!,任せて！,verified
minecolonies.quests.general.thezombiemenace1.obj0.answer1,"I'm sorry, I can't help right now.",申し訳ないけど今は力になれないよ。,verified
minecolonies.quests.general.thezombiemenace1.obj2,You did it! We're safe for now. Here's your reward.,やったね！今のところは安全だ。報酬をあげるよ。,verified
minecolonies.quests.general.thezombiemenace1.obj2.answer0,Thank you!,ありがとうございます！,verified
minecolonies.quests.general.thezombiemenace2,The Zombie Menace II,ゾンビの脅威 II,verified
minecolonies.quests.general.thezombiemenace2.obj0,We have a problem. The Zombies in the nearby forest are causing trouble. Can you help us take care of them?,問題が発生した。近くの森でゾンビがトラブルを起こしています。奴らを始末するのを手伝ってもらえませんか？,verified
minecolonies.quests.general.thezombiemenace2.obj0.answer0,"Sure, I'll do what I can.",もちろん、できることはするよ。,verified
minecolonies.quests.general.thezombiemenace2.obj0.answer0.reply,Thank you! We need you to kill 10 Zombies. We'll reward you for your efforts.,ありがとう！ゾンビを10体倒してください。努力に対して報酬を差し上げます。,verified
minecolonies.quests.general.thezombiemenace2.obj0.answer0.reply.answer0,I'm on it!,任せて！,verified
minecolonies.quests.general.thezombiemenace2.obj0.answer1,"I'm sorry, I can't help right now.",申し訳ないけど今は力になれないよ。,verified
minecolonies.quests.general.thezombiemenace2.obj2,You did it! We're safe for now. Here's your reward.,やったね！今のところは安全だ。報酬をあげるよ。,verified
minecolonies.quests.general.thezombiemenace2.obj2.answer0,Thank you!,ありがとうございます！,verified
minecolonies.quests.guides.buildergoggles,The Builder's Glasses,建築家のゴーグル,verified
minecolonies.quests.guides.buildergoggles.obj0,Hey there! Can I ask you for a favor? I lost my glasses the other day and I can't see very well without them. Do you think you could get me a new pair of builders goggles?,こんにちは！お願いがあるんだけど。この前メガネをなくしてしまってメガネがないとよく見えないんだ。新しい建築家のゴーグルを買ってきてくれない？,verified
minecolonies.quests.guides.buildergoggles.obj0.answer0,"Of course, I'll see what I can do!",もちろん、何ができるか考えてみるよ！,verified
minecolonies.quests.guides.buildergoggles.obj0.answer1,"Sorry, I don't have time to help you right now.",ごめん、今は時間がないんだ。,verified
minecolonies.quests.guides.buildergoggles.obj0.answer2,I already know all about the builder goggles. You'll be fine without them!,建築家のゴーグルのことはもう全部知っている。なくても大丈夫だよ！,verified
minecolonies.quests.guides.buildergoggles.obj2,"Ah, you found my glasses! Thank you so much. I can finally see clearly what I'm building again. You should try them out sometime, they're pretty neat.",ああ、僕のメガネを見つけてくれたんだね！本当にありがとう。これでやっと今自分が何を作っているのかはっきり見えるようになったよ。いつか試してみてね、かなりいい感じだから。,verified
minecolonies.quests.guides.buildergoggles.obj2.answer0,You're welcome!,どういたしまして！,verified
minecolonies.quests.guides.clipboard,The Warehouse Manager,倉庫責任者,verified
minecolonies.quests.guides.clipboard.obj0,"Hey there! Have you heard of the clipboard? It's a tool that can help you keep track of all the requests in our colony. If you could bring me one, I would be forever grateful!",やあ！お願いがあるんだけど。クリップボードって知ってる？私たちのコロニーにあるすべてのリクエストを記録するのに役立つツールなんだ。持ってきてくれたら一生感謝するよ！,verified
minecolonies.quests.guides.clipboard.obj0.answer0,"Sure, I'll see what I can do!",もちろん、何ができるか考えてみるよ！,verified
minecolonies.quests.guides.clipboard.obj0.answer1,"Sorry, I can't help you right now.",ごめん、今は力になれない。,verified
minecolonies.quests.guides.clipboard.obj0.answer2,I already know what it does!,何をするかはもうわかっている！,verified
minecolonies.quests.guides.clipboard.obj2,"Great, you found a clipboard! To use it, simply shift-right click it on any hut block. This will give you an overview of all the requests in the colony. It's super handy, and I am so grateful that you were able to get one for me. Thank you!",クリップボードを見つけたね！これを使うには小屋ブロックの上でスニークしながら右クリックするだけだ。これでコロニー内の全リクエストの概要がわかる。超便利だし買ってきてくれて本当にありがとう。ありがとう！,verified
minecolonies.quests.guides.clipboard.obj2.answer0,You're welcome!,どういたしまして！,verified
minecolonies.quests.guides.rallybanner,Rally the Troops,部隊の結集,verified
minecolonies.quests.guides.rallybanner.obj0,"Lately, we've been seeing a lot of skeletons wandering around at night. If you could help us out by taking care of ten of them, we'd be very grateful!",最近夜になるとスケルトンがたくさん徘徊しているんだ。10体ほど始末していただけると助かります！,verified
minecolonies.quests.guides.rallybanner.obj0.answer0,"No problem, I'll take care of it!",大丈夫です、任せてください！,verified
minecolonies.quests.guides.rallybanner.obj0.answer1,"Sorry, I'm too busy right now.",ごめんね、今は忙しくて。,verified
minecolonies.quests.guides.rallybanner.obj0.answer2,"Skeletons? Pfft, no problem.",スケルトン？プッ、問題ない。,verified
minecolonies.quests.guides.rallybanner.obj0.answer3,"Sorry, I don't think I can help you with that.",ごめん、それについては力になれないと思う。,verified
