key,source_text,target_text
item.sophisticatedbackpacks.stack_upgrade_tier_2,Stack Upgrade Tier 2,スタック数増加x4
item.sophisticatedbackpacks.stack_upgrade_tier_2.tooltip,Multiplies the number of stacks that can fit in a slot by 4,1スロットあたりのスタック数を4倍にします。
item.sophisticatedbackpacks.stack_upgrade_tier_3,Stack Upgrade Tier 3,スタック数増加x8
item.sophisticatedbackpacks.stack_upgrade_tier_3.tooltip,Multiplies the number of stacks that can fit in a slot by 8,1スロットあたりのスタック数を8倍にします。
item.sophisticatedbackpacks.stack_upgrade_tier_4,Stack Upgrade Tier 4,スタック数増加x16
item.sophisticatedbackpacks.stack_upgrade_tier_4.tooltip,Multiplies the number of stacks that can fit in a slot by 16,1スロットあたりのスタック数を16倍にします。
item.sophisticatedbackpacks.stonecutter_upgrade,Stonecutter Upgrade,石切台機能
item.sophisticatedbackpacks.stonecutter_upgrade.tooltip,Stonecutter in an upgrade tab,リュック内で手動で石切台が使えるようになります。
item.sophisticatedbackpacks.survival_infinity_upgrade,Survival Infinity Upgrade,無限スタック数
item.sophisticatedbackpacks.survival_infinity_upgrade.tooltip,"Makes all items in backpack infinite
All players can set infinite items and break or pickup backpack","リュック内のアイテム個数を無限にします。
利用に制限はありません。"
item.sophisticatedbackpacks.tank_upgrade,Tank Upgrade,タンク機能
item.sophisticatedbackpacks.tank_upgrade.tooltip,Replaces part of backpack's inventory with fluid storage,リュック内のインベントリを2列使用して液体を蓄積します。
item.sophisticatedbackpacks.tool_swapper_upgrade,Tool Swapper Upgrade,ツール交換機能
item.sophisticatedbackpacks.tool_swapper_upgrade.tooltip,Automatically swaps item in player's hand for the one effective on the block/entity when these are left clicked.,ブロックを破壊するとき、適切なツールに自動で切り替わります。
item.sophisticatedbackpacks.upgrade_base,Upgrade Base,リュックの強化素材
item.sophisticatedbackpacks.void_upgrade,Void Upgrade,ごみ箱機能
item.sophisticatedbackpacks.void_upgrade.tooltip,Voids items selected in filter,フィルタで指定したアイテムを消滅させます。
item.sophisticatedbackpacks.xp_pump_upgrade,Experience Pump Upgrade,経験値ポンプ機能
item.sophisticatedbackpacks.xp_pump_upgrade.tooltip,Pumps experience between Tank upgrade and player,タンク機能と併用し、プレイヤの経験値を液体経験値に変換します。
itemGroup.sophisticatedbackpacks,Sophisticated Backpacks,スマートなバックパック
keybind.sophisticatedbackpacks.category,Sophisticated Backpacks,バックパック
keybind.sophisticatedbackpacks.inventory_interaction,Run Inventory Interaction Upgrades,インベントリ連動機能を実行
keybind.sophisticatedbackpacks.open_backpack,Open Backpack,リュックを開く
keybind.sophisticatedbackpacks.toggle_upgrade_1,Switch Upgrade in the 1st Slot On/Off,1つ目の追加機能のON/OFF
keybind.sophisticatedbackpacks.toggle_upgrade_2,Switch Upgrade in the 2nd Slot On/Off,2つ目の追加機能のON/OFF
keybind.sophisticatedbackpacks.toggle_upgrade_3,Switch Upgrade in the 3rd Slot On/Off,3つ目の追加機能のON/OFF
keybind.sophisticatedbackpacks.toggle_upgrade_4,Switch Upgrade in the 4th Slot On/Off,4つ目の追加機能のON/OFF
keybind.sophisticatedbackpacks.toggle_upgrade_5,Switch Upgrade in the 5th Slot On/Off,5つ目の追加機能のON/OFF
keybind.sophisticatedbackpacks.tool_swap,Swap tool based on current block/entity,壊すブロックに応じてツールを交換
keybind.sophisticatedbackpacks.sort,Sort Backpack,並び替え
item.sophisticatedbackpacks.stack_upgrade_omega_tier.tooltip,"Raises the stack size limit to 2,147,483,647","スタックサイズ上限を2,147,483,647に引き上げます"
