key,source_text,target_text,status
gui.waystones.waystone_selection.click_to_delete,Click to delete,ブロック使用で非活性化,verified
gui.waystones.waystone_selection.current_location,Current Location: %s,現在地:,translated
gui.waystones.waystone_selection.deleting_global_for_all,This will remove the waystone for everyone.,これはすべてのプレイヤーに対してグローバルウェイストーンを削除します。,translated
gui.waystones.waystone_selection.hold_shift_to_delete,Hold shift and click to delete,シフトを押しながらブロック使用で非活性化,verified
gui.waystones.waystone_selection.item_requirement,Item Cost: %d %s,アイテム コスト: %d %s,translated
gui.waystones.waystone_selection.level_requirement,Level Cost: %d,レベル要件: %d,translated
gui.waystones.waystone_selection.next_page,Next,次ページ,verified
gui.waystones.waystone_selection.no_waystones_activated,You have not activated any waystones yet.,活性化している転移ポイントがありません,verified
gui.waystones.waystone_selection.no_xp_requirement,Experience Cost: Free,経験値 コスト: 無料,translated
gui.waystones.waystone_selection.previous_page,Previous,前ページ,verified
gui.waystones.waystone_selection.unnamed_waystone,<unnamed>,<未設定>,verified
gui.waystones.waystone_selection.xp_requirement,Experience Cost: %d,経験値 コスト: %d,translated
gui.waystones.waystone_settings.close,Close,閉じる,translated
gui.waystones.waystone_settings.manage_modifiers,Manage Modifiers,モディファイアを管理する,translated
gui.waystones.waystone_settings.modifiers_active,%d modifiers active,%d 個のモディファイアがアクティブです,translated
gui.waystones.waystone_settings.no_modifiers_active,No modifiers active,アクティブなモディファイアはありません,translated
gui.waystones.waystone_settings.save,Save,保存,translated
gui.waystones.waystone_settings.visibility.activation,Visible upon Activation,アクティベーション時に表示,translated
gui.waystones.waystone_settings.visibility.black_sharestone,Visible to Black Sharestones,黒いシェアストーンに表示,translated
gui.waystones.waystone_settings.visibility.blue_sharestone,Visible to Blue Sharestones,青いシェアストーンに表示,translated
gui.waystones.waystone_settings.visibility.brown_sharestone,Visible to Brown Sharestones,茶色いシェアストーンに表示,translated
gui.waystones.waystone_settings.visibility.cyan_sharestone,Visible to Cyan Sharestones,シアンのシェアストーンに表示,translated
gui.waystones.waystone_settings.visibility.global,Visible to Everyone,全員に表示,translated
gui.waystones.waystone_settings.visibility.gray_sharestone,Visible to Gray Sharestones,灰色のシェアストーンに表示,translated
gui.waystones.waystone_settings.visibility.green_sharestone,Visible to Green Sharestones,緑のシェアストーンに表示,translated
gui.waystones.waystone_settings.visibility.light_blue_sharestone,Visible to Light Blue Sharestones,薄い青のシェアストーンに表示,translated
gui.waystones.waystone_settings.visibility.light_gray_sharestone,Visible to Light Gray Sharestones,薄い灰色のシェアストーンに表示,translated
gui.waystones.waystone_settings.visibility.lime_sharestone,Visible to Lime Sharestones,黄緑のシェアストーンに表示,translated
gui.waystones.waystone_settings.visibility.magenta_sharestone,Visible to Magenta Sharestones,マゼンタのシェアストーンに表示,translated
gui.waystones.waystone_settings.visibility.orange_sharestone,Visible to Orange Sharestones,オレンジ色のシェアストーンに表示,translated
gui.waystones.waystone_settings.visibility.pink_sharestone,Visible to Pink Sharestones,ピンク色のシェアストーンに表示,translated
gui.waystones.waystone_settings.visibility.purple_sharestone,Visible to Purple Sharestones,紫のシェアストーンに表示,translated
gui.waystones.waystone_settings.visibility.red_sharestone,Visible to Red Sharestones,赤いシェアストーンに表示,translated
gui.waystones.waystone_settings.visibility.shard_only,Teleports via Attuned Shard,調整されたシャード経由のテレポートのみ,translated
gui.waystones.waystone_settings.visibility.yellow_sharestone,Visible to Yellow Sharestones,黄色のシェアストーンに表示,translated
item.waystones.attuned_shard,Attuned Shard,ワーププレートの欠片,verified
item.waystones.blank_scroll,Blank Scroll,空白スクロール,translated
item.waystones.bound_scroll,Bound Scroll,固定転移の巻物,verified
item.waystones.crumbling_attuned_shard,Crumbling Attuned Shard,ボロボロの調整されたシャード,translated
item.waystones.deepslate_shard,Deepslate Shard,深層岩シャード,translated
item.waystones.dormant_shard,Dormant Shard,休止中のシャード,translated
item.waystones.return_scroll,Return Scroll,帰還の巻物,verified
item.waystones.warp_dust,Warp Dust,ワープダスト,verified
item.waystones.warp_scroll,Warp Scroll,転移の巻物,verified
item.waystones.warp_scroll_bound,Warp Scroll (Bound),転移の巻物(行先固定),verified
item.waystones.warp_stone,Warp Stone,ワープストーン,verified
itemGroup.waystones.waystones,Waystones,転移ポイント,verified
stat.waystones.waystone_activated,Waystones Activated,転移ポイントを活性化しました,verified
tooltip.waystones.attuned_shard.attunement_crumbling,It will be consumed on next teleport.,次のテレポート時に消費されます。,translated
tooltip.waystones.attuned_shard.attunement_lost,This shard has lost its attunement.,この欠片は転移先の設定が破損しています,verified
tooltip.waystones.attuned_shard.move_to_other_warp_plate,Bring this shard to another warp plate.,この欠片を、他のワーププレートに入れてください,verified
tooltip.waystones.attuned_shard.plug_into_warp_plate,Insert this shard into a warp plate.,この欠片をワーププレートに入れてください,verified
tooltip.waystones.black_sharestone,Teleport to any other Black Sharestone,任意の黒色の共有転移ポイントに移動できる,verified
tooltip.waystones.blank_scroll,Use this scroll on a waystone to bind it.,このスクロールをウェイストーンで使用してバインドしてください。,translated
tooltip.waystones.blue_sharestone,Teleport to any other Blue Sharestone,任意の青色の共有転移ポイントに移動できる,verified
tooltip.waystones.bound_to,Bound to: %s,転移先: %s,verified
tooltip.waystones.bound_to_none,None,未設定,verified
tooltip.waystones.brown_sharestone,Teleport to any other Brown Sharestone,任意の茶色の共有転移ポイントに移動できる,verified
tooltip.waystones.cooldown_left,Cooldown: %d seconds,あと%d秒で使用可能,verified
tooltip.waystones.cyan_sharestone,Teleport to any other Cyan Sharestone,任意の青紫色の共有転移ポイントに移動できる,verified
tooltip.waystones.deepslate_shard.plug_into_warp_plate,Insert this shard into a warp plate to lock it.,このシャードをワーププレートに挿入してロックしてください。,translated
tooltip.waystones.dormant_shard.plug_into_warp_plate,Insert this shard into a warp plate to attune it.,このシャードをワーププレートに挿入して調整してください。,translated
tooltip.waystones.edit_restricted,This waystone cannot be edited.,このウェイストーンは編集できません。,translated
tooltip.waystones.gray_sharestone,Teleport to any other Gray Sharestone,任意の灰色の共有転移ポイントに移動できる,verified
tooltip.waystones.green_sharestone,Teleport to any other Green Sharestone,任意の緑色の共有転移ポイントに移動できる,verified
tooltip.waystones.light_blue_sharestone,Teleport to any other Light Blue Sharestone,任意の空色の共有転移ポイントに移動できる,verified
tooltip.waystones.light_gray_sharestone,Teleport to any other Light Gray Sharestone,任意の薄灰色の共有転移ポイントに移動できる,verified
tooltip.waystones.lime_sharestone,Teleport to any other Lime Sharestone,任意の黄緑色の共有転移ポイントに移動できる,verified
tooltip.waystones.magenta_sharestone,Teleport to any other Magenta Sharestone,任意の赤紫色の共有転移ポイントに移動できる,verified
tooltip.waystones.not_enough_xp,Not enough experience! (%d levels needed),転移に必要なレベルが足りません！(%dレベル必要です),verified
tooltip.waystones.orange_sharestone,Teleport to any other Orange Sharestone,任意の橙色の共有転移ポイントに移動できる,verified
tooltip.waystones.pink_sharestone,Teleport to any other Pink Sharestone,任意の桃色の共有転移ポイントに移動できる,verified
tooltip.waystones.portstone,Can not be teleported to.,設置場所からの転移だけが可能,verified
tooltip.waystones.purple_sharestone,Teleport to any other Purple Sharestone,任意の紫色の共有転移ポイントに移動できる,verified
tooltip.waystones.red_sharestone,Teleport to any other Red Sharestone,任意の赤色の共有転移ポイントに移動できる,verified
tooltip.waystones.undiscovered,Undiscovered,未発見,verified
tooltip.waystones.yellow_sharestone,Teleport to any other Yellow Sharestone,任意の黄色の共有転移ポイントに移動できる,verified
waystones.configuration.client,Client Options,クライアント オプション,translated
waystones.configuration.compatibility,Mod Integrations,Mod 統合,translated
waystones.configuration.general,General,一般,translated
waystones.configuration.inventoryButton,Inventory Button,インベントリ ボタン,translated
waystones.configuration.teleports,Teleports,テレポート,translated
waystones.configuration.worldGen,World Generation,ワールド ジェネレーション,translated
waystones.iconCredits,Icons by JoeCreates (CC-BY-SA 3.0),アイコンはJoeCreates (CC-BY-SA 3.0)により作成,translated
waystones.map.untitled_waystone,Untitled Waystone,転移ポイント(名称未設定),verified
waystones.untitled_waystone,Untitled Waystone,タイトルなしウェイストーン,translated
waystones:warp_plate,Warp Plate,ワーププレート,verified
block.waystones.portstone,Portstone,ポートストーン,translated
block.waystones.sharestone,Sharestone,シェアストーン,translated
block.waystones.white_sharestone,White Sharestone,白いシェアストーン,translated
chat.waystones.warpstone_not_charged,The Warp Stone is not fully charged yet.,ワープストーンはまだ完全にチャージされていません。,translated
gui.waystones.waystone_settings.is_global,is Global,グローバルです,translated
text.autoconfig.waystones.option.client,Client Options,クライアントオプション,translated
text.autoconfig.waystones.option.client.disableParticles,Disable Particles,パーティクルを無効化,translated
text.autoconfig.waystones.option.client.disableTextGlow,Disable Text Glow,テキストグローを無効化,translated
text.autoconfig.waystones.option.compatibility,Mod Integrations,Modの統合,translated
text.autoconfig.waystones.option.compatibility.displayWaystonesOnJourneyMap,Display Waystones on JourneyMap,JourneyMapにウェイストーンを表示,translated
text.autoconfig.waystones.option.cooldowns,Cooldowns,クールダウン,translated
text.autoconfig.waystones.option.cooldowns.globalWaystoneCooldownMultiplier,Global Waystone Cooldown Multiplier,グローバルウェイストーンクールダウン倍率,translated
text.autoconfig.waystones.option.cooldowns.inventoryButtonCooldown,Inventory Button Cooldown,インベントリボタンクールダウン,translated
text.autoconfig.waystones.option.cooldowns.scrollUseTime,Scroll Charge Time,スクロール充電時間,translated
text.autoconfig.waystones.option.cooldowns.warpPlateUseTime,Warp Plate Charge Time,ワーププレート充電時間,translated
text.autoconfig.waystones.option.cooldowns.warpStoneCooldown,Warp Stone Cooldown,ワープストーンクールダウン,translated
text.autoconfig.waystones.option.cooldowns.warpStoneUseTime,Warp Stone Charge Time,ワープストーン充電時間,translated
text.autoconfig.waystones.option.inventoryButton,Inventory Button,インベントリボタン,translated
text.autoconfig.waystones.option.inventoryButton.creativeWarpButtonX,Creative Mode Warp Button X Position,クリエイティブモードワープボタンX位置,translated
text.autoconfig.waystones.option.inventoryButton.creativeWarpButtonY,Creative Mode Warp Button Y Position,クリエイティブモードワープボタンY位置,translated
text.autoconfig.waystones.option.inventoryButton.inventoryButton,Inventory Button Mode,インベントリボタンモード,translated
text.autoconfig.waystones.option.inventoryButton.warpButtonX,Warp Button X Position,ワープボタンX位置,translated
text.autoconfig.waystones.option.inventoryButton.warpButtonY,Warp Button Y Position,ワープボタンY位置,translated
text.autoconfig.waystones.option.restrictions,Restrictions,制限,translated
text.autoconfig.waystones.option.restrictions.allowWaystoneToWaystoneTeleport,Allow Waystone to Waystone Teleport,ウェイストーンからウェイストーンへのテレポート許可,translated
text.autoconfig.waystones.option.restrictions.dimensionalWarp,Dimensional Warp,次元ワープ,translated
text.autoconfig.waystones.option.restrictions.dimensionalWarpAllowList,Dimensional Warp Allow List,次元ワープ許可リスト,translated
text.autoconfig.waystones.option.restrictions.dimensionalWarpDenyList,Dimensional Warp Deny List,次元ワープ拒否リスト,translated
text.autoconfig.waystones.option.restrictions.generatedWaystonesUnbreakable,Generated Waystones Unbreakable,生成されたウェイストーン破壊不可,translated
text.autoconfig.waystones.option.restrictions.globalWaystoneSetupRequiresCreativeMode,Global Waystone Setup Requires Creative Mode,グローバルウェイストーン設定にクリエイティブモード必須,translated
text.autoconfig.waystones.option.restrictions.leashedDenyList,Leashed Deny List,牧場動物移送拒否リスト,translated
text.autoconfig.waystones.option.restrictions.restrictRenameToOwner,Restrict Rename to Owner,名前変更を所有者に制限,translated
text.autoconfig.waystones.option.restrictions.restrictToCreative,Restrict to Creative Mode,クリエイティブモードに制限,translated
text.autoconfig.waystones.option.restrictions.transportLeashed,Transport Leashed,牧場動物を移送,translated
text.autoconfig.waystones.option.restrictions.transportLeashedDimensional,Transport Leashed Dimensional,牧場動物の次元間移送,translated
text.autoconfig.waystones.option.worldGen,World Generation,ワールド生成,translated
text.autoconfig.waystones.option.worldGen.customWaystoneNames,Custom Waystone Names,カスタムウェイストーン名,translated
text.autoconfig.waystones.option.worldGen.dimensionAllowList,Dimension Allow List,ディメンション許可リスト,translated
text.autoconfig.waystones.option.worldGen.dimensionDenyList,Dimension Deny List,ディメンション拒否リスト,translated
text.autoconfig.waystones.option.worldGen.forceSpawnInVillages,Force Spawn in Villages,村での強制スポーン,translated
text.autoconfig.waystones.option.worldGen.frequency,World Generation Frequency,ワールド生成の頻度,translated
text.autoconfig.waystones.option.worldGen.nameGenerationMode,Name Generation Mode,名前生成モード,translated
text.autoconfig.waystones.option.worldGen.spawnInVillages,Spawn in Villages,村でスポーン,translated
text.autoconfig.waystones.option.worldGen.worldGenStyle,World Generation Style,ワールド生成スタイル,translated
text.autoconfig.waystones.option.xpCost,XP Cost Options,XPコストオプション,translated
text.autoconfig.waystones.option.xpCost.blocksPerXpLevel,Blocks per XP Level,1XPレベルあたりのブロック数,translated
text.autoconfig.waystones.option.xpCost.dimensionalWarpXpCost,Dimensional Warp XP Cost,次元ワープXPコスト,translated
text.autoconfig.waystones.option.xpCost.globalWaystoneXpCostMultiplier,Global Waystone XP Cost Multiplier,グローバルウェイストーンXPコスト倍率,translated
text.autoconfig.waystones.option.xpCost.inventoryButtonXpCostMultiplier,Inventory Button XP Cost Multiplier,インベントリボタンXPコスト倍率,translated
text.autoconfig.waystones.option.xpCost.inverseXpCost,Inverse XP Cost,逆XPコスト,translated
text.autoconfig.waystones.option.xpCost.maximumBaseXpCost,Maximum Base XP Cost,最大基本XPコスト,translated
text.autoconfig.waystones.option.xpCost.minimumBaseXpCost,Minimum Base XP Cost,最小基本XPコスト,translated
text.autoconfig.waystones.option.xpCost.portstoneXpCostMultiplier,Portstone XP Cost Multiplier,ポートストーンXPコスト倍率,translated
text.autoconfig.waystones.option.xpCost.sharestoneXpCostMultiplier,Sharestone XP Cost Multiplier,シェアストーンXPコスト倍率,translated
text.autoconfig.waystones.option.xpCost.warpPlateXpCostMultiplier,Warp Plate XP Cost Multiplier,ワーププレートXPコスト倍率,translated
text.autoconfig.waystones.option.xpCost.warpStoneXpCostMultiplier,Warp Stone XP Cost Multiplier,ワープストーンXPコスト倍率,translated
text.autoconfig.waystones.option.xpCost.waystoneXpCostMultiplier,Waystone XP Cost Multiplier,ウェイストーンXPコスト倍率,translated
text.autoconfig.waystones.option.xpCost.xpCostPerLeashed,XP Cost per Leashed,牧場動物あたりのXPコスト,translated
text.autoconfig.waystones.title,Waystones,ウェイストーン,translated
tooltip.waystones.sharestone,Teleport to any other colorless Sharestone,他のカラーレスシェアストーンにテレポート,translated
tooltip.waystones.white_sharestone,Teleport to any other White Sharestone,他の白いシェアストーンにテレポート,translated
