key,source_text,target_text
config.waystones.xpCost.globalWaystoneXpCostMultiplier.tooltip,The multiplier applied to the cooldown when teleporting to a global waystone via inventory button or warp stone.,インベントリボタンまたはワープストーン経由でグローバルウェイストーンにテレポート時に適用されるXP費用倍率。
config.waystones.xpCost.inventoryButtonXpCostMultiplier,Inventory Button XP Cost Multiplier,インベントリボタンXP費用倍率
config.waystones.xpCost.inventoryButtonXpCostMultiplier.tooltip,The multiplier applied to the base xp cost when teleporting via the inventory button.,インベントリボタン経由でテレポート時に適用される基本XP費用倍率。
config.waystones.xpCost.inverseXpCost,Inverse XP Cost,逆XP費用
config.waystones.xpCost.inverseXpCost.tooltip,"Set to true if experience cost should be inverted, meaning the shorter the distance, the more expensive. Can be used to encourage other methods for short-distance travel.",有効にすると距離が短いほどXP費用が高くなります。短距離移動の別方法利用を促進するために使用できます。
config.waystones.xpCost.maximumBaseXpCost,Maximum Base XP Cost,最大基本XP費用
config.waystones.xpCost.maximumBaseXpCost.tooltip,"The maximum base xp cost (may be exceeded by multipliers defined below), set to 0 to disable all distance-based XP costs.",最大基本XP費用（以下の倍率で超過する場合あり）。0に設定すると距離ベースのXP費用をすべて無効化。
config.waystones.xpCost.minimumBaseXpCost,Minimum Base XP Cost,最小基本XP費用
config.waystones.xpCost.minimumBaseXpCost.tooltip,The minimum base xp cost (may be subceeded by multipliers defined below).,最小基本XP費用（以下の倍率で低下する場合あり）。
config.waystones.xpCost.portstoneXpCostMultiplier,Portstone XP Cost Multiplier,ポートストーンXP費用倍率
config.waystones.xpCost.portstoneXpCostMultiplier.tooltip,The multiplier applied to the base xp cost when teleporting from a portstone.,ポートストーンからのテレポート時に適用される基本XP費用倍率。
config.waystones.xpCost.sharestoneXpCostMultiplier,Sharestone XP Cost Multiplier,シェアストーン間XP費用倍率
config.waystones.xpCost.sharestoneXpCostMultiplier.tooltip,The multiplier applied to the base xp cost when teleporting from one sharestone to another.,シェアストーン間のテレポート時に適用される基本XP費用倍率。
config.waystones.xpCost.warpPlateXpCostMultiplier,Warp Plate XP Cost Multiplier,ワーププレートXP費用倍率
config.waystones.xpCost.warpPlateXpCostMultiplier.tooltip,The multiplier applied to the base xp cost when teleporting from one warp plate to another.,ワーププレート間のテレポート時に適用される基本XP費用倍率。
config.waystones.xpCost.warpStoneXpCostMultiplier,Warp Stone XP Cost Multiplier,ワープストーンXP費用倍率
config.waystones.xpCost.warpStoneXpCostMultiplier.tooltip,"The multiplier applied to the base xp cost when teleporting using a Warp Stone item (not the Waystone block, Konstantin)",ワープストーンアイテム（ウェイストーンブロックではなくKonstantinの場合）を使用したテレポート時に適用される基本XP費用倍率。
config.waystones.xpCost.waystoneXpCostMultiplier,Waystone XP Cost Multiplier,ウェイストーンXP費用倍率
config.waystones.xpCost.waystoneXpCostMultiplier.tooltip,The multiplier applied to the base xp cost when teleporting from one waystone to another.,ウェイストーン間のテレポート時に適用される基本XP費用倍率。
config.waystones.xpCost.xpCostPerLeashed,XP Cost per Leashed,紐付き生物あたりのXP費用
config.waystones.xpCost.xpCostPerLeashed.tooltip,How much xp is needed per leashed animal to travel with you.,紐付き生物と一緒に移動するのに必要なXP量。
container.waystones.waystone_settings,Enter waystone name:,ウェイストーン名を入力:
gui.waystones.waystone_selection.current_location,Current Location:,現在地:
gui.waystones.waystone_selection.deleting_global_for_all,This will remove the global waystone for everyone.,これはすべてのプレイヤーに対してグローバルウェイストーンを削除します。
gui.waystones.waystone_selection.level_requirement,Level Requirement: %d,レベル要件: %d
