key,source_text,target_text
block.waystones.black_sharestone,Black Sharestone,黒色の共有転移ポイント
block.waystones.blue_sharestone,Blue Sharestone,青色の共有転移ポイント
block.waystones.brown_sharestone,Brown Sharestone,茶色の共有転移ポイント
block.waystones.cyan_sharestone,Cyan Sharestone,青緑色の共有転移ポイント
block.waystones.gray_sharestone,Gray Sharestone,灰色の共有転移ポイント
block.waystones.green_sharestone,Green Sharestone,緑色の共有転移ポイント
block.waystones.light_blue_sharestone,Light Blue Sharestone,空色の共有転移ポイント
block.waystones.light_gray_sharestone,Light Gray Sharestone,薄灰色の共有転移ポイント
block.waystones.lime_sharestone,Lime Sharestone,黄緑色の共有転移ポイント
block.waystones.magenta_sharestone,Magenta Sharestone,赤紫色の共有転移ポイント
block.waystones.mossy_waystone,Mossy Waystone,苔むした転移ポイント
block.waystones.orange_sharestone,Orange Sharestone,橙色の共有転移ポイント
block.waystones.pink_sharestone,Pink Sharestone,桃色の共有転移ポイント
block.waystones.purple_sharestone,Purple Sharestone,紫色の共有転移ポイント
block.waystones.red_sharestone,Red Sharestone,赤色の共有転移ポイント
block.waystones.sandy_waystone,Sandy Waystone,砂岩の転移ポイント
block.waystones.warp_plate,Warp Plate,ワーププレート
block.waystones.waystone,Waystone,転移ポイント
block.waystones.yellow_sharestone,Yellow Sharestone,黄色の共有転移ポイント
chat.waystones.cannot_dimension_warp,You cannot warp between these worlds.,異なるディメンジョンには転移できません
chat.waystones.cannot_transport_leashed,You cannot take leashed mobs with you,Mobを連れたままでは転移できません
chat.waystones.cannot_transport_leashed_dimensional,You cannot take leashed mobs with you between worlds,Mobを連れて異なるディメンジョンには転移できません
chat.waystones.cannot_transport_this_leashed,You cannot take this mob with you,このMobを連れたまま転移することはできません
chat.waystones.scroll_bound,Scroll bound: %s,転移先を%sに設定しました
chat.waystones.scroll_not_yet_bound,This scroll is not bound to a waystone.,この巻物は転移先が設定されていません
chat.waystones.warp_plate_has_invalid_target,The shard inside this warp plate has lost its attunement.,このワーププレートは転移先設定が破損した欠片があります
chat.waystones.warp_plate_has_no_target,This warp plate is not bound to another warp plate yet.,このワーププレートは転移先が設定されていません
chat.waystones.waystone_activated,Activated Waystone: %s,転移ポイント%sを活性化しました
chat.waystones.waystone_missing,The waystone you tried to teleport to is currently being moved or has gone missing.,転移先の転移ポイントが移動したか破壊されています
chat.waystones.waystone_to_waystone_disabled,"You touch the waystone, but nothing happens.",転移ポイントに触ったが、何も起こらなかった
config.jade.plugin_waystones.waystone,Waystones,ウェイストーン
config.waystones.client,Client Options,クライアント設定
config.waystones.client.disableTextGlow,Disable Text Glow,テキストを発光させない
config.waystones.client.disableTextGlow.tooltip,"If enabled, the text overlay on waystones will no longer always render at full brightness.",enabledにすると、転移ポイント上の文字を発光させません
config.waystones.compatibility,Mod Integrations,他MODとの相互運用
config.waystones.inventoryButton,Inventory Button,インベントリのワープボタン設定
config.waystones.inventoryButton.inventoryButton,Inventory Button Mode,インベントリのワープボタン使用
config.waystones.inventoryButton.inventoryButton.tooltip,Set to 'NONE' for no inventory button. Set to 'NEAREST' for an inventory button that teleports to the nearest waystone. Set to 'ANY' for an inventory button that opens the waystone selection menu. Set to a waystone name for an inventory button that teleports to a specifically named waystone.,NONEにするとワープボタンを表示しません。'NEAREST'にするともっとも近い転移ポイントにのみ移動可能。'ANY'にすると、転移ポイントの一覧から選択可能。転移ポイント名を設定すると、特定の転移ポイントにのみ移動可能です
config.waystones.title,Waystones,転移ポイント
config.waystones.worldGen,World Generation,ワールド生成設定
config.waystones.worldGen.nameGenerationMode,Name Generation Mode,転移ポイント名の生成モード
config.waystones.worldGen.spawnInVillages,Spawn in Villages,村の中に生成する
container.waystones.warp_plate,Warp Plate,ワーププレート
container.waystones.waystone_selection,Select your destination:,転移先を選択してください:
gui.waystones.inventory.confirm_return,Do you really want to warp back to this waystone?,本当にこの転移ポイントに転移しますか？
gui.waystones.inventory.confirm_return_bound_to,Bound to: %s,転移先: %s
gui.waystones.inventory.no_waystones_activated,You have not activated any waystones yet.,活性化している転移ポイントがありません
gui.waystones.inventory.return_to_nearest_waystone,Return to Nearest Waystone,最も近くの転移ポイントに転移
gui.waystones.inventory.return_to_waystone,Return to Waystone ...,転移ポイントに転移
gui.waystones.waystone_selection.click_to_delete,Click to delete,ブロック使用で非活性化
gui.waystones.waystone_selection.hold_shift_to_delete,Hold shift and click to delete,シフトを押しながらブロック使用で非活性化
gui.waystones.waystone_selection.next_page,Next,次ページ
gui.waystones.waystone_selection.no_waystones_activated,You have not activated any waystones yet.,活性化している転移ポイントがありません
gui.waystones.waystone_selection.previous_page,Previous,前ページ
gui.waystones.waystone_selection.unnamed_waystone,<unnamed>,<未設定>
item.waystones.attuned_shard,Attuned Shard,ワーププレートの欠片
item.waystones.bound_scroll,Bound Scroll,固定転移の巻物
item.waystones.crumbling_attuned_shard,Crumbling Attuned Shard,ボロボロの調整されたシャード
item.waystones.return_scroll,Return Scroll,帰還の巻物
item.waystones.warp_dust,Warp Dust,ワープ粉
item.waystones.warp_scroll,Warp Scroll,転移の巻物
item.waystones.warp_scroll_bound,Warp Scroll (Bound),転移の巻物(行先固定)
item.waystones.warp_stone,Warp Stone,ワープストーン
itemGroup.waystones.waystones,Waystones,転移ポイント
stat.waystones.waystone_activated,Waystones Activated,転移ポイントを活性化しました
tooltip.waystones.attuned_shard.attunement_crumbling,It will be consumed on next teleport.,次のテレポート時に消費されます。
tooltip.waystones.attuned_shard.attunement_lost,This shard has lost its attunement.,この欠片は転移先の設定が破損しています
tooltip.waystones.attuned_shard.move_to_other_warp_plate,Bring this shard to another warp plate.,この欠片を、他のワーププレートに入れてください
tooltip.waystones.attuned_shard.plug_into_warp_plate,Insert this shard into a warp plate.,この欠片をワーププレートに入れてください
tooltip.waystones.black_sharestone,Teleport to any other Black Sharestone,任意の黒色の共有転移ポイントに移動できる
tooltip.waystones.blue_sharestone,Teleport to any other Blue Sharestone,任意の青色の共有転移ポイントに移動できる
tooltip.waystones.bound_to,Bound to: %s,転移先: %s
tooltip.waystones.bound_to_none,None,未設定
tooltip.waystones.brown_sharestone,Teleport to any other Brown Sharestone,任意の茶色の共有転移ポイントに移動できる
tooltip.waystones.cooldown_left,Cooldown: %d seconds,あと%d秒で使用可能
tooltip.waystones.cyan_sharestone,Teleport to any other Cyan Sharestone,任意の青紫色の共有転移ポイントに移動できる
tooltip.waystones.gray_sharestone,Teleport to any other Gray Sharestone,任意の灰色の共有転移ポイントに移動できる
tooltip.waystones.green_sharestone,Teleport to any other Green Sharestone,任意の緑色の共有転移ポイントに移動できる
tooltip.waystones.light_blue_sharestone,Teleport to any other Light Blue Sharestone,任意の空色の共有転移ポイントに移動できる
tooltip.waystones.light_gray_sharestone,Teleport to any other Light Gray Sharestone,任意の薄灰色の共有転移ポイントに移動できる
tooltip.waystones.lime_sharestone,Teleport to any other Lime Sharestone,任意の黄緑色の共有転移ポイントに移動できる
tooltip.waystones.magenta_sharestone,Teleport to any other Magenta Sharestone,任意の赤紫色の共有転移ポイントに移動できる
tooltip.waystones.not_enough_xp,Not enough experience! (%d levels needed),転移に必要なレベルが足りません！(%dレベル必要です)
tooltip.waystones.orange_sharestone,Teleport to any other Orange Sharestone,任意の橙色の共有転移ポイントに移動できる
tooltip.waystones.pink_sharestone,Teleport to any other Pink Sharestone,任意の桃色の共有転移ポイントに移動できる
tooltip.waystones.portstone,Can not be teleported to.,設置場所からの転移だけが可能
tooltip.waystones.purple_sharestone,Teleport to any other Purple Sharestone,任意の紫色の共有転移ポイントに移動できる
tooltip.waystones.red_sharestone,Teleport to any other Red Sharestone,任意の赤色の共有転移ポイントに移動できる
tooltip.waystones.undiscovered,Undiscovered,未発見
tooltip.waystones.yellow_sharestone,Teleport to any other Yellow Sharestone,任意の黄色の共有転移ポイントに移動できる
waystones.iconCredits,Icons by JoeCreates (CC-BY-SA 3.0),アイコンはJoeCreates (CC-BY-SA 3.0)により作成
waystones.map.untitled_waystone,Untitled Waystone,転移ポイント(名称未設定)
waystones:warp_plate,Warp Plate,ワーププレート
block.waystones.portstone,Portstone,ポートストーン
block.waystones.sharestone,Sharestone,シェアストーン
block.waystones.white_sharestone,White Sharestone,白いシェアストーン
chat.waystones.warpstone_not_charged,The Warp Stone is not fully charged yet.,ワープストーンはまだ完全にチャージされていません。
gui.waystones.waystone_settings.is_global,is Global,グローバルです
tooltip.waystones.sharestone,Teleport to any other colorless Sharestone,他のカラーレスシェアストーンにテレポート
tooltip.waystones.white_sharestone,Teleport to any other White Sharestone,他の白いシェアストーンにテレポート
chat.waystones.only_creative_can_edit,You have to be in creative mode to edit a global waystone.,グローバルウェイストーンを編集するにはクリエイティブモードである必要があります。
chat.waystones.only_owner_can_edit,Waystones can only be renamed by whoever placed them.,ウェイストーンは置いた人のみが名前を変更できます。
config.waystones.compatibility.displayWaystonesOnJourneyMap,Display Waystones on JourneyMap,JourneyMapにウェイストーンを表示
config.waystones.compatibility.displayWaystonesOnJourneyMap.tooltip,"If enabled, JourneyMap waypoints will be created for each activated waystone.",有効にすると、アクティブ化されたウェイストーンごとにJourneyMapウェイポイントが作成されます。
config.waystones.compatibility.preferJourneyMapIntegration,Prefer 'JourneyMap Integration' mod,'JourneyMap Integration'モッドを優先
config.waystones.compatibility.preferJourneyMapIntegration.tooltip,"If enabled, JourneyMap waypoints will only be created if the mod 'JourneyMap Integration' is not installed.",有効にすると、'JourneyMap Integration'モッドがインストールされていない場合にのみJourneyMapウェイポイントが作成されます。
config.waystones.cooldowns,Cooldowns,クールダウン
config.waystones.cooldowns.globalWaystoneCooldownMultiplier,Global Waystone Cooldown Multiplier,グローバルウェイストーンクールダウン倍率
config.waystones.cooldowns.globalWaystoneCooldownMultiplier.tooltip,The multiplier applied to the cooldown when teleporting to a global waystone via inventory button or warp stone.,インベントリボタンまたはワープストーン経由でグローバルウェイストーンにテレポート時に適用されるクールダウン倍率。
config.waystones.cooldowns.inventoryButtonCooldown,Inventory Button Cooldown,インベントリボタンクールダウン
config.waystones.cooldowns.inventoryButtonCooldown.tooltip,The cooldown between usages of the inventory button in seconds.,インベントリボタンの使用間隔（秒単位）。
config.waystones.cooldowns.scrollUseTime,Scroll Charge Time,スクロール充電時間
config.waystones.cooldowns.scrollUseTime.tooltip,The time in ticks it takes to use a scroll. This is the charge-up time when holding right-click.,スクロールを使用するのにかかる時間（ティック単位）。右クリック押し続けの充電時間です。
config.waystones.cooldowns.warpPlateUseTime,Warp Plate Charge Time,ワーププレート充電時間
config.waystones.cooldowns.warpPlateUseTime.tooltip,The time in ticks that it takes to use a warp plate. This is the time the player has to stand on top for.,ワーププレートを使用するのにかかる時間（ティック単位）。プレイヤーが上に立っている必要がある時間です。
config.waystones.cooldowns.warpStoneCooldown,Warp Stone Cooldown,ワープストーンクールダウン
config.waystones.cooldowns.warpStoneCooldown.tooltip,"The cooldown between usages of the warp stone in seconds. This is bound to the player, not the item, so multiple warp stones share the same cooldown.",ワープストーン使用間隔（秒単位）。プレイヤーごとにバインドされるため、複数のワープストーンで同じクールダウンが共有されます。
config.waystones.cooldowns.warpStoneUseTime,Warp Stone Charge Time,ワープストーン充電時間
config.waystones.cooldowns.warpStoneUseTime.tooltip,The time in ticks that it takes to use a warp stone. This is the charge-up time when holding right-click.,ワープストーンを使用するのにかかる時間（ティック単位）。右クリック押し続けの充電時間です。
config.waystones.inventoryButton.creativeWarpButtonX,Creative Mode Warp Button X Position,クリエイティブモードワープボタンX位置
config.waystones.inventoryButton.creativeWarpButtonX.tooltip,The x position of the warp button in the creative menu.,クリエイティブメニュー内のワープボタンのX座標。
config.waystones.inventoryButton.creativeWarpButtonY,Creative Mode Warp Button Y Position,クリエイティブモードワープボタンY位置
config.waystones.inventoryButton.creativeWarpButtonY.tooltip,The y position of the warp button in the creative menu.,クリエイティブメニュー内のワープボタンのY座標。
config.waystones.inventoryButton.warpButtonX,Warp Button X Position,ワープボタンX位置
config.waystones.inventoryButton.warpButtonX.tooltip,The x position of the warp button in the inventory.,インベントリ内のワープボタンのX座標。
config.waystones.inventoryButton.warpButtonY,Warp Button Y Position,ワープボタンY位置
config.waystones.inventoryButton.warpButtonY.tooltip,The y position of the warp button in the inventory.,インベントリ内のワープボタンのY座標。
config.waystones.restrictions,Restrictions,制限
config.waystones.restrictions.allowWaystoneToWaystoneTeleport,Allow Waystone to Waystone Teleport,ウェイストーン間テレポート許可
config.waystones.restrictions.allowWaystoneToWaystoneTeleport.tooltip,Set to true if players should be able to teleport between waystones by simply right-clicking a waystone.,有効にすると、プレイヤーはウェイストーンを右クリックするだけでウェイストーン間をテレポートできます。
config.waystones.restrictions.dimensionalWarp,Dimensional Warp,ディメンション間ワープ
config.waystones.restrictions.dimensionalWarp.tooltip,Set to 'ALLOW' to allow dimensional warp in general. Set to 'GLOBAL_ONLY' to restrict dimensional warp to global waystones. Set to 'DENY' to disallow all dimensional warps.,'ALLOW'に設定するとディメンション間ワープ一般を許可。'GLOBAL_ONLY'に設定するとディメンション間ワープをグローバルウェイストーンのみに制限。'DENY'に設定するとすべてのディメンション間ワープを禁止。
config.waystones.restrictions.dimensionalWarpAllowList,Dimensional Warp Allow List,ディメンション間ワープホワイトリスト
config.waystones.restrictions.dimensionalWarpAllowList.tooltip,"List of dimensions that players are allowed to warp cross-dimension from and to. If left empty, all dimensions except those in dimensionalWarpDenyList are allowed.",プレイヤーがディメンション間でワープできるディメンションのリスト。空のままにするとdimensionalWarpDenyList以外のすべてのディメンションが許可されます。
config.waystones.restrictions.dimensionalWarpDenyList,Dimensional Warp Deny List,ディメンション間ワープブラックリスト
config.waystones.restrictions.dimensionalWarpDenyList.tooltip,List of dimensions that players are not allowed to warp cross-dimension from and to. Only used if dimensionalWarpAllowList is empty.,プレイヤーがディメンション間でワープできないディメンションのリスト。dimensionalWarpAllowListが空の場合にのみ使用されます。
config.waystones.restrictions.generatedWaystonesUnbreakable,Generated Waystones Unbreakable,生成されたウェイストーン破壊不可
config.waystones.restrictions.generatedWaystonesUnbreakable.tooltip,"If enabled, waystones generated in worldgen are unbreakable.",有効にすると、ワールド生成で生成されたウェイストーンは破壊不可になります。
config.waystones.restrictions.globalWaystoneSetupRequiresCreativeMode,Global Waystone Setup Requires Creative Mode,グローバルウェイストーン設定にクリエイティブモード必須
config.waystones.restrictions.globalWaystoneSetupRequiresCreativeMode.tooltip,Set to false to allow non-creative players to make waystones globally activated for all players.,無効にするとクリエイティブモードでないプレイヤーもウェイストーンをすべてのプレイヤーに対してグローバル化できます。
config.waystones.restrictions.leashedDenyList,Leashed Deny List,紐付き生物ブラックリスト
config.waystones.restrictions.leashedDenyList.tooltip,List of leashed mobs that cannot be taken with you when teleporting.,テレポート時に一緒に連れて行くことができない紐付き生物のリスト。
config.waystones.restrictions.restrictRenameToOwner,Restrict Rename to Owner,名前変更をオーナーのみに制限
config.waystones.restrictions.restrictRenameToOwner.tooltip,"If enabled, only the owner of a waystone (the one who placed it) can rename it.",有効にすると、ウェイストーンのオーナー（置いた人）のみが名前を変更できます。
config.waystones.restrictions.restrictToCreative,Restrict to Creative Mode,クリエイティブモードのみに制限
config.waystones.restrictions.restrictToCreative.tooltip,"If enabled, only creative players can place, edit or break waystones. This does NOT disable the crafting recipe.",有効にすると、クリエイティブプレイヤーのみがウェイストーンを置く、編集、破壊できます。クラフトレシピは無効化されません。
config.waystones.restrictions.transportLeashed,Transport Leashed,紐付き生物をテレポート
config.waystones.restrictions.transportLeashed.tooltip,"If enabled, leashed mobs will be teleported with you.",有効にすると、紐付き生物もあなたと一緒にテレポートします。
config.waystones.restrictions.transportLeashedDimensional,Transport Leashed Dimensional,ディメンション間での紐付き生物テレポート
config.waystones.restrictions.transportLeashedDimensional.tooltip,Whether to take leashed mobs with you when teleporting between dimensions.,ディメンション間をテレポート時に紐付き生物を連れて行くかどうか。
config.waystones.worldGen.customWaystoneNames,Custom Waystone Names,カスタムウェイストーン名
config.waystones.worldGen.customWaystoneNames.tooltip,These names will be used for the PRESET name generation mode. See the nameGenerationMode option for more info.,これらの名前はPRESETネーム生成モードで使用されます。nameGenerationModeオプションを参照してください。
config.waystones.worldGen.dimensionAllowList,Dimension Allow List,ディメンションホワイトリスト
config.waystones.worldGen.dimensionAllowList.tooltip,"List of dimensions that waystones are allowed to spawn in through world gen. If left empty, all dimensions except those in worldGenDimensionDenyList are used.",ワールド生成でウェイストーンがスポーンすることが許可されるディメンションのリスト。空のままにするとworldGenDimensionDenyList以外のすべてのディメンションが使用されます。
config.waystones.worldGen.dimensionDenyList,Dimension Deny List,ディメンションブラックリスト
config.waystones.worldGen.dimensionDenyList.tooltip,List of dimensions that waystones are not allowed to spawn in through world gen. Only used if worldGenDimensionAllowList is empty.,ワールド生成でウェイストーンがスポーンすることが禁止されるディメンションのリスト。worldGenDimensionAllowListが空の場合にのみ使用されます。
config.waystones.worldGen.forceSpawnInVillages,Force Spawn in Villages,村への強制スポーン
config.waystones.worldGen.forceSpawnInVillages.tooltip,"Ensures that pretty much every village will have a waystone, by spawning it as early as possible. In addition, this means waystones will generally be located in the center of the village.",ほぼすべての村にウェイストーンを必ずスポーンさせ、可能な限り早期にスポーンさせます。さらに、ウェイストーンは一般的に村の中心に位置するようになります。
config.waystones.worldGen.frequency,World Generation Frequency,ワールド生成頻度
config.waystones.worldGen.frequency.tooltip,Approximate chunk distance between waystones generated freely in world generation. Set to 0 to disable generation.,ワールド生成で自由に生成されるウェイストーン間のおおよそのチャンク距離。0に設定するとスポーンが無効になります。
config.waystones.worldGen.nameGenerationMode.tooltip,"Set to 'PRESET_FIRST' to first use names from the custom names list. Set to 'PRESET_ONLY' to use only those custom names. Set to 'MIXED' to have some waystones use custom names, and others random names.",'PRESET_FIRST'に設定するとカスタム名リストの名前を優先的に使用。'PRESET_ONLY'に設定するとそのカスタム名のみを使用。'MIXED'に設定するとカスタム名とランダムな名前が混在。
config.waystones.worldGen.spawnInVillages.tooltip,Set to true if waystones should be added to the generation of villages. Some villages may still spawn without a waystone.,村の生成にウェイストーンを追加するかどうか。一部の村はウェイストーンなしでスポーンする場合があります。
config.waystones.worldGen.worldGenStyle,World Generation Style,ワールド生成スタイル
config.waystones.worldGen.worldGenStyle.tooltip,Set to 'DEFAULT' to only generate the normally textured waystones. Set to 'MOSSY' or 'SANDY' to generate all as that variant. Set to 'BIOME' to make the style depend on the biome it is generated in.,'DEFAULT'に設定するとデフォルトテクスチャのウェイストーンのみを生成。'MOSSY'または'SANDY'に設定するとそのバリアント全てを生成。'BIOME'に設定するとバイオームに応じたスタイルに。
config.waystones.xpCost,XP Cost Options,XP費用オプション
config.waystones.xpCost.blocksPerXpLevel,Blocks per XP Level,ブロックあたりのXPレベル
config.waystones.xpCost.blocksPerXpLevel.tooltip,"The amount of blocks per xp level requirement. If set to 500, the base xp cost for travelling 1000 blocks will be 2 levels.",XPレベル要件あたりのブロック数。500に設定すると1000ブロック移動の基本XP費用は2レベルになります。
config.waystones.xpCost.dimensionalWarpXpCost,Dimensional Warp XP Cost,ディメンション間ワープXP費用
config.waystones.xpCost.dimensionalWarpXpCost.tooltip,The base xp level cost when travelling between dimensions. Ignores block distance.,ディメンション間を移動するときの基本XPレベル費用。ブロック距離は無視されます。
config.waystones.xpCost.globalWaystoneXpCostMultiplier,Global Waystone XP Cost Multiplier,グローバルウェイストーンXP費用倍率
