key,source_text,target_text,status
block.waystones.black_portstone,Black Portstone,黒いポートストーン,translated
block.waystones.black_sharestone,Black Sharestone,黒色の共有転移ポイント,verified
block.waystones.blackstone_waystone,Black Waystone,黒石のウェイストーン,translated
block.waystones.blue_portstone,Blue Portstone,青いポートストーン,translated
block.waystones.blue_sharestone,Blue Sharestone,青色の共有転移ポイント,verified
block.waystones.brown_portstone,Brown Portstone,茶色いポートストーン,translated
block.waystones.brown_sharestone,Brown Sharestone,茶色の共有転移ポイント,verified
block.waystones.cyan_portstone,Cyan Portstone,シアンのポートストーン,translated
block.waystones.cyan_sharestone,Cyan Sharestone,青緑色の共有転移ポイント,verified
block.waystones.deepslate_waystone,Deepslate Waystone,深層岩のウェイストーン,translated
block.waystones.end_stone_waystone,Ender Waystone,エンドストーンのウェイストーン,translated
block.waystones.gray_portstone,Gray Portstone,灰色のポートストーン,translated
block.waystones.gray_sharestone,Gray Sharestone,灰色の共有転移ポイント,verified
block.waystones.green_portstone,Green Portstone,緑のポートストーン,translated
block.waystones.green_sharestone,Green Sharestone,緑色の共有転移ポイント,verified
block.waystones.light_blue_portstone,Light Blue Portstone,薄い青のポートストーン,translated
block.waystones.light_blue_sharestone,Light Blue Sharestone,空色の共有転移ポイント,verified
block.waystones.light_gray_portstone,Light Gray Portstone,薄い灰色のポートストーン,translated
block.waystones.light_gray_sharestone,Light Gray Sharestone,薄灰色の共有転移ポイント,verified
block.waystones.lime_portstone,Lime Portstone,黄緑のポートストーン,translated
block.waystones.lime_sharestone,Lime Sharestone,黄緑色の共有転移ポイント,verified
block.waystones.magenta_portstone,Magenta Portstone,マゼンタのポートストーン,translated
block.waystones.magenta_sharestone,Magenta Sharestone,赤紫色の共有転移ポイント,verified
block.waystones.mossy_waystone,Mossy Waystone,苔むした転移ポイント,verified
block.waystones.orange_portstone,Orange Portstone,オレンジ色のポートストーン,translated
block.waystones.orange_sharestone,Orange Sharestone,橙色の共有転移ポイント,verified
block.waystones.pink_portstone,Pink Portstone,ピンク色のポートストーン,translated
block.waystones.pink_sharestone,Pink Sharestone,桃色の共有転移ポイント,verified
block.waystones.purple_portstone,Purple Portstone,紫のポートストーン,translated
block.waystones.purple_sharestone,Purple Sharestone,紫色の共有転移ポイント,verified
block.waystones.red_portstone,Red Portstone,赤いポートストーン,translated
block.waystones.red_sharestone,Red Sharestone,赤色の共有転移ポイント,verified
block.waystones.sandy_waystone,Sandy Waystone,砂岩の転移ポイント,verified
block.waystones.warp_plate,Warp Plate,ワーププレート,verified
block.waystones.waystone,Waystone,転移ポイント,verified
block.waystones.white_portstone,Portstone,白いポートストーン,translated
block.waystones.yellow_portstone,Yellow Portstone,黄色のポートストーン,translated
block.waystones.yellow_sharestone,Yellow Sharestone,黄色の共有転移ポイント,verified
chat.waystones.cannot_break_waystone,You cannot break this waystone.,このウェイストーンを破壊することはできません。,translated
chat.waystones.cannot_dimension_warp,You cannot warp between these worlds.,異なるディメンジョンには転移できません,verified
chat.waystones.cannot_transport_leashed,You cannot take leashed mobs with you,Mobを連れたままでは転移できません,verified
chat.waystones.cannot_transport_leashed_dimensional,You cannot take leashed mobs with you between worlds,Mobを連れて異なるディメンジョンには転移できません,verified
chat.waystones.cannot_transport_this_leashed,You cannot take this mob with you,このMobを連れたまま転移することはできません,verified
chat.waystones.not_enough_xp,You do not have enough experience to teleport.,テレポートするのに十分な経験値がありません。,translated
chat.waystones.only_creative_can_edit,Only creative users may edit this waystone.,グローバルウェイストーンを編集するにはクリエイティブモードである必要があります。,translated
chat.waystones.only_owner_can_edit,Only the owner may edit this waystone.,ウェイストーンは設置した人だけが名前変更できます。,translated
chat.waystones.scroll_bound,Scroll bound: %s,転移先を%sに設定しました,verified
chat.waystones.scroll_not_yet_bound,This scroll is not bound to a waystone.,この巻物は転移先が設定されていません,verified
chat.waystones.warp_plate_has_invalid_target,The shard inside this warp plate has lost its attunement.,このワーププレートは転移先設定が破損した欠片があります,verified
chat.waystones.warp_plate_has_no_target,This warp plate is not bound to another warp plate yet.,このワーププレートは転移先が設定されていません,verified
chat.waystones.waystone_activated,Activated Waystone: %s,転移ポイント%sを活性化しました,verified
chat.waystones.waystone_missing,The waystone you tried to teleport to is currently being moved or has gone missing.,転移先の転移ポイントが移動したか破壊されています,verified
chat.waystones.waystone_to_waystone_disabled,"You touch the waystone, but nothing happens.",転移ポイントに触ったが、何も起こらなかった,verified
commands.waystones.activate.success.multiple,Activated waystone %s for %d players,ウェイストーン %s を %d 人のプレイヤーに対して有効化しました,translated
commands.waystones.activate.success.single,Activated waystone %s for %s,ウェイストーン %s を %s に対して有効化しました,translated
commands.waystones.count,%s has %d waystones activated and owns %d of those,%s は %d 個のウェイストーンを有効化しており、そのうち %d 個を所有しています,translated
commands.waystones.forget.all.success.multiple,Deactivated all waystones for %d players,%d 人のプレイヤーのすべてのウェイストーンを無効化しました,translated
commands.waystones.forget.all.success.single,Deactivated all waystones for %s,%s のすべてのウェイストーンを無効化しました,translated
commands.waystones.forget.success.multiple,Deactivated waystone %s for %d players,ウェイストーン %s を %d 人のプレイヤーに対して無効化しました,translated
commands.waystones.forget.success.single,Deactivated waystone %s for %s,ウェイストーン %s を %s に対して無効化しました,translated
commands.waystones.list.all.footer,"%d waystones total, %d owned",合計 %d 個のウェイストーン、所有数 %d 個,translated
commands.waystones.list.all.header,"Waystones (x, y, z) by %s:","%s が所有するウェイストーン (x, y, z):",translated
commands.waystones.list.at_distance,at %d blocks away,%d ブロック先,translated
commands.waystones.list.coordinates,"%d, %d, %d","%d, %d, %d",verified
commands.waystones.list.entry.activated,- activated %s (%s): %s,- 有効化済み %s (%s): %s,translated
commands.waystones.list.entry.owned,-     owned %s (%s): %s,-     所有 %s (%s): %s,translated
commands.waystones.list.footer,%d waystones owned,所有ウェイストーン %d 個,translated
commands.waystones.list.header,"Waystones (x, y, z) by %s (owned only):","%s が所有するウェイストーン (x, y, z):",translated
commands.waystones.list.in_dimension,in %s,%s 内,translated
commands.waystones.waystone_not_found,Waystone not found at this position,この位置にウェイストーンが見つかりません,translated
config.jade.plugin_waystones.waystone,Waystones,ウェイストーン,translated
config.waystones.client,Client Options,クライアント設定,verified
config.waystones.client.disableTextGlow,Disable Text Glow,テキストを発光させない,verified
config.waystones.client.disableTextGlow.tooltip,"If enabled, the text overlay on waystones will no longer always render at full brightness.",enabledにすると、転移ポイント上の文字を発光させません,verified
config.waystones.compatibility,Mod Integrations,他MODとの相互運用,verified
config.waystones.compatibility.blueMap,Enable BlueMap Support,BlueMap サポートを有効にする,translated
config.waystones.compatibility.blueMap.tooltip,"If enabled, Waystones will add markers for waystones and sharestones to BlueMap.",有効にするとWaystonesはウェイストーンとシェアストーンのマーカーをBlueMapに追加します。,translated
config.waystones.compatibility.dynmap,Enable Dynmap Support,Dynmap サポートを有効にする,translated
config.waystones.compatibility.dynmap.tooltip,"If enabled, Waystones will add markers for waystones and sharestones to Dynmap.",有効にするとWaystonesはウェイストーンとシェアストーンのマーカーをDynmapに追加します。,translated
config.waystones.compatibility.journeyMap,Enable JourneyMap Support,JourneyMap サポートを有効にする,translated
config.waystones.compatibility.journeyMap.tooltip,"If enabled, JourneyMap waypoints will be created for each activated waystone.",有効にするとJourneyMapの各有効化されたウェイストーンに対するウェイポイントが作成されます。,translated
config.waystones.compatibility.preferJourneyMapIntegrationMod,Prefer 'JourneyMap Integration' mod,「JourneyMap Integration」Modを優先する,translated
config.waystones.compatibility.preferJourneyMapIntegrationMod.tooltip,"If enabled, JourneyMap waypoints will only be created if the mod 'JourneyMap Integration' is not installed.",有効にするとJourneyMapのウェイポイントは「JourneyMap Integration」Modがインストールされていない場合にのみ作成されます。,translated
config.waystones.general,General,一般,translated
config.waystones.general.allowedVisibilities,Allowed Visibilities,許可された表示範囲,translated
config.waystones.general.allowedVisibilities.tooltip,"Add ""GLOBAL"" to allow every player to create global waystones.","""GLOBAL"" を追加すべてのプレイヤーがグローバルウェイストーンを作成できるようになります。",translated
config.waystones.general.defaultVisibility,Default Visibilities,デフォルト表示範囲,translated
config.waystones.general.defaultVisibility.tooltip,"Set to ""GLOBAL"" to have newly placed or found waystones be global by default.","""GLOBAL"" に設定すると、新しく配置または発見されたウェイストーンはデフォルトでグローバルになります。",translated
config.waystones.general.restrictedWaystones,Restricted Waystones,制限されたウェイストーン,translated
config.waystones.general.restrictedWaystones.tooltip,List of waystone origins that should prevent others from editing. PLAYER is special in that it allows only edits by the owner of the waystone.,他のプレイヤーの編集を防ぐべきウェイストーンの配信元のリスト。PLAYERは特別な意味があり、ウェイストーンの所有者による編集のみを許可します。,translated
config.waystones.general.scrollUseTime,Scroll Use Time,スクロール使用時間,translated
config.waystones.general.scrollUseTime.tooltip,The time in ticks it takes to use a scroll. This is the charge-up time when holding right-click.,スクロールを使用するのにかかる時間（ティック）。これは右クリックを押したときのチャージ時間です。,translated
config.waystones.general.warpPlateUseTime,Warp Plate Use Time,ワーププレート使用時間,translated
config.waystones.general.warpPlateUseTime.tooltip,The time in ticks that it takes to use a warp plate. This is the time the player has to stand on top for.,ワーププレートを使用するのにかかる時間（ティック）。プレイヤーが上に立つ必要がある時間です。,translated
config.waystones.general.warpStoneUseTime,Warp Stone Use Time,ワープストーン使用時間,translated
config.waystones.general.warpStoneUseTime.tooltip,The time in ticks that it takes to use a warp stone. This is the charge-up time when holding right-click.,ワープストーンを使用するのにかかる時間（ティック）。これは右クリックを押したときのチャージ時間です。,translated
config.waystones.inventoryButton,Inventory Button,インベントリのワープボタン設定,verified
config.waystones.inventoryButton.creativeInventoryButtonX,Creative Mode Warp Button X Position,クリエイティブモード ワープボタン X 位置,translated
config.waystones.inventoryButton.creativeInventoryButtonX.tooltip,The x position of the inventory button in the creative menu.,クリエイティブメニューのインベントリボタンのX位置です。,translated
config.waystones.inventoryButton.creativeInventoryButtonY,Creative Mode Warp Button Y Position,クリエイティブモード ワープボタン Y 位置,translated
config.waystones.inventoryButton.creativeInventoryButtonY.tooltip,The y position of the inventory button in the creative menu.,クリエイティブメニューのインベントリボタンのY位置です。,translated
config.waystones.inventoryButton.inventoryButton,Inventory Button Mode,インベントリのワープボタン使用,verified
config.waystones.inventoryButton.inventoryButton.tooltip,Set to 'NONE' for no inventory button. Set to 'NEAREST' for an inventory button that teleports to the nearest waystone. Set to 'ANY' for an inventory button that opens the waystone selection menu. Set to a waystone name for an inventory button that teleports to a specifically named waystone.,NONEにするとワープボタンを表示しません。'NEAREST'にするともっとも近い転移ポイントにのみ移動可能。'ANY'にすると、転移ポイントの一覧から選択可能。転移ポイント名を設定すると、特定の転移ポイントにのみ移動可能です,verified
config.waystones.inventoryButton.inventoryButtonX,Warp Button X Position,ワープボタン X 位置,translated
config.waystones.inventoryButton.inventoryButtonX.tooltip,The x position of the inventory button in the inventory.,インベントリ内のインベントリボタンのX位置です。,translated
config.waystones.inventoryButton.inventoryButtonY,Warp Button Y Position,ワープボタン Y 位置,translated
config.waystones.inventoryButton.inventoryButtonY.tooltip,The y position of the inventory button in the inventory.,インベントリ内のインベントリボタンのY位置です。,translated
config.waystones.teleports,Teleports,テレポート,translated
config.waystones.teleports.enableCooldowns,Enable Cooldowns,クールダウンを有効にする,translated
config.waystones.teleports.enableCooldowns.tooltip,Set to false to simply disable all cooldowns. See warpRequirements for more fine-grained control.,falseに設定するとすべてのクールダウンを無効にします。より詳細な制御についてはwarpRequirementsを参照してください。,translated
config.waystones.teleports.enableCosts,Enable Costs,コストを有効にする,translated
config.waystones.teleports.enableCosts.tooltip,Set to false to simply disable all xp costs. See warpRequirements for more fine-grained control.,falseに設定するとすべてのXP コストを無効にします。より詳細な制御についてはwarpRequirementsを参照してください。,translated
config.waystones.teleports.entityDenyList,Entity Deny List,エンティティ拒否リスト,translated
config.waystones.teleports.entityDenyList.tooltip,"List of entities that cannot be teleported, either as pet, leashed, or on warp plates.",テレポートできないエンティティのリスト。ペット、リーシュ、またはワーププレート上の場合があります。,translated
config.waystones.teleports.transportLeashed,Transport Leashed,リーシュされたモブを輸送する,translated
config.waystones.teleports.transportLeashed.tooltip,Set to ENABLED to have leashed mobs teleport with you. Set to SAME_DIMENSION to have leashed mobs teleport with you only if you're not changing dimensions. Set to DISABLED to disable.,ENABLEDに設定するとリーシュされたモブはあなたと一緒にテレポートします。SAME_DIMENSIONに設定するとディメンションを変更していない場合のみリーシュされたモブはあなたと一緒にテレポートします。DISABLEDに設定して無効にします。,translated
config.waystones.teleports.transportPets,Transport Pets,ペットを輸送する,translated
config.waystones.teleports.transportPets.tooltip,Set to ENABLED to have nearby pets teleport with you. Set to SAME_DIMENSION to have nearby pets teleport with you only if you're not changing dimensions. Set to DISABLED to disable.,ENABLEDに設定するとあなたの近くのペットはあなたと一緒にテレポートします。SAME_DIMENSIONに設定するとディメンションを変更していない場合のみあなたの近くのペットはあなたと一緒にテレポートします。DISABLEDに設定して無効にします。,translated
config.waystones.teleports.warpRequirements,Warp Requirements,ワープ要件,translated
config.waystones.teleports.warpRequirements.tooltip,List of warp requirements with comma-separated parameters in parentheses. Conditions can be defined as comma-separated list in square brackets. Will be applied in order.,括弧内にカンマ区切りのパラメータを持つワープ要件のリスト。条件は角括弧内のカンマ区切りリストとして定義できます。順番に適用されます。,translated
config.waystones.title,Waystones,転移ポイント,verified
config.waystones.worldGen,World Generation,ワールド生成設定,verified
config.waystones.worldGen.chunksBetweenWildWaystones,Chunks Between Wild Waystones,野生ウェイストーン間のチャンク数,translated
config.waystones.worldGen.chunksBetweenWildWaystones.tooltip,Approximate chunk distance between wild waystones being generated. Set to 0 to disable generation.,生成される野生ウェイストーン間のおおよそのチャンク距離。0に設定すると生成が無効になります。,translated
config.waystones.worldGen.nameGenerationMode,Name Generation Mode,転移ポイント名の生成モード,verified
config.waystones.worldGen.nameGenerationMode.tooltip,"Set to 'PRESET_FIRST' to first use names from the nameGenerationPresets. Set to 'PRESET_ONLY' to use only those custom names. Set to 'MIXED' to have some waystones use custom names, and others random names.",PRESET_FIRSTにすると、カスタム転移ポイント名リストから取得した名前を優先します。PRESET_ONLYにすると、カスタム転移ポイント名リストから取得した名前のみを使用します。MIXEDを使用すると、カスタム転移ポイント名リストから取得した名前とランダム生成した名前を混ぜて使用します,verified
config.waystones.worldGen.nameGenerationPresets,Name Generation Presets,名前生成プリセット,translated
config.waystones.worldGen.nameGenerationPresets.tooltip,These names will be used for the PRESET name generation mode. See the nameGenerationMode option for more info.,これらの名前はPRESET名前生成モードで使用されます。nameGenerationModeオプションを参照してください。,translated
config.waystones.worldGen.nameGenerationTemplate,Name Generation Template,名前生成テンプレート,translated
config.waystones.worldGen.nameGenerationTemplate.tooltip,The template to use when generating new names. Supported placeholders are {Biome} (english biome name) and {MrPork} (the default name generator).,新しい名前を生成するときに使用するテンプレート。サポートされているプレースホルダーは {Biome}（英語のバイオーム名）と {MrPork}（デフォルト名生成ツール）です。,translated
config.waystones.worldGen.spawnInVillages,Spawn in Villages,村の中に生成する,verified
config.waystones.worldGen.spawnInVillages.tooltip,Set to REGULAR to have waystones spawn in some villages. Set to FREQUENT to have waystones spawn in most villages. Set to DISABLED to disable waystone generation in villages. Waystones will only spawn in vanilla or supported villages.,trueにすると、村の生成時に転移ポイントが追加で生成されるようになります。一部の村は依然として転移ポイントなしで生成されます,verified
config.waystones.worldGen.wildWaystoneStyle,Wild Waystone Style,野生ウェイストーン スタイル,translated
config.waystones.worldGen.wildWaystoneStyle.tooltip,Set to 'DEFAULT' to only generate the normally textured waystones. Set to 'MOSSY' or 'SANDY' to generate all as that variant. Set to 'BIOME' to make the style depend on the biome it is generated in.,通常のテクスチャのウェイストーンのみを生成する場合は「DEFAULT」に設定します。すべてをそのバリアントとして生成する場合は「MOSSY」または「SANDY」に設定します。生成されるバイオームに基づいてスタイルを変更する場合は「BIOME」に設定します。,translated
config.waystones.worldGen.wildWaystonesDimensionAllowList,Dimension Allow List,ディメンション許可リスト,translated
config.waystones.worldGen.wildWaystonesDimensionAllowList.tooltip,"List of dimensions that wild waystones are allowed to spawn in. If left empty, all dimensions except those in wildWaystonesDimensionDenyList are used.",野生ウェイストーンがスポーンできるディメンションのリスト。空の場合はwildWaystonesDimensionDenyListにあるものを除くすべてのディメンションが使用されます。,translated
config.waystones.worldGen.wildWaystonesDimensionDenyList,Dimension Deny List,ディメンション拒否リスト,translated
config.waystones.worldGen.wildWaystonesDimensionDenyList.tooltip,List of dimensions that wild waystones are not allowed to spawn in. Only used if wildWaystonesDimensionAllowList is empty.,野生ウェイストーンがスポーンできないディメンションのリスト。wildWaystonesDimensionAllowListが空の場合のみ使用されます。,translated
container.waystones.black_portstone,Black Portstone,黒いポートストーン,translated
container.waystones.blue_portstone,Blue Portstone,青いポートストーン,translated
container.waystones.brown_portstone,Brown Portstone,茶色いポートストーン,translated
container.waystones.cyan_portstone,Cyan Portstone,シアンのポートストーン,translated
container.waystones.gray_portstone,Gray Portstone,灰色のポートストーン,translated
container.waystones.green_portstone,Green Portstone,緑のポートストーン,translated
container.waystones.light_blue_portstone,Light Blue Portstone,薄い青のポートストーン,translated
container.waystones.light_gray_portstone,Light Gray Portstone,薄い灰色のポートストーン,translated
container.waystones.lime_portstone,Lime Portstone,黄緑のポートストーン,translated
container.waystones.magenta_portstone,Magenta Portstone,マゼンタのポートストーン,translated
container.waystones.orange_portstone,Orange Portstone,オレンジ色のポートストーン,translated
container.waystones.pink_portstone,Pink Portstone,ピンク色のポートストーン,translated
container.waystones.purple_portstone,Purple Portstone,紫のポートストーン,translated
container.waystones.red_portstone,Red Portstone,赤いポートストーン,translated
container.waystones.sharestone,Sharestone,シェアストーン,translated
container.waystones.warp_plate,Warp Plate,ワーププレート,verified
container.waystones.waystone,Waystone,ウェイストーン,translated
container.waystones.waystone_admin_selection,Select which waystone of <%s> you would like to visit:,訪問したい <%s> のウェイストーンを選択してください:,translated
container.waystones.waystone_modifiers,Warp Modifiers,ワープ モディファイア,translated
container.waystones.waystone_selection,Select your destination:,転移先を選択してください:,verified
container.waystones.waystone_settings,Edit %s,ウェイストーン名を入力:,translated
container.waystones.white_portstone,Portstone,白いポートストーン,translated
container.waystones.yellow_portstone,Yellow Portstone,黄色のポートストーン,translated
gui.waystones.inventory.confirm_return,Do you really want to warp back to this waystone?,本当にこの転移ポイントに転移しますか？,verified
gui.waystones.inventory.confirm_return_bound_to,Bound to: %s,転移先: %s,verified
gui.waystones.inventory.no_waystones_activated,You have not activated any waystones yet.,活性化している転移ポイントがありません,verified
gui.waystones.inventory.return_to_nearest_waystone,Return to Nearest Waystone,最も近くの転移ポイントに転移,verified
gui.waystones.inventory.return_to_waystone,Return to Waystone ...,転移ポイントに転移,verified
